Title,Accession number,Title of translation,Author,Author affiliation,Corresponding author,Source,Abbreviated source title,Sponsor,Publisher,Volume,Issue,Pages,Issue date,Monograph title,Volume title,Part number,Publication year,Language,ISSN,E-ISSN,ISBN,ISBN13,DOI,Article number,Conference name,Conference date,Conference location,Conference code,CODEN,Document type,Abstract,Number of references,Main heading,Controlled/Subject terms,Uncontrolled terms,Classification code,Treatment,Funding details,Funding text,Access type,Database,Copyright,Data Provider
"Chu da highway accidents analysis and prevention suggestion","20080211016188","","Liu, Benyu (1); Ye, Liaoyuan (1) ","(1) Institute of Public Safety and Disaster Prevention, Yunnan University, Kunming, Yunnan 650091, China ","Liu, B.(liubenyu@ynu.edu.cn) ","International Conference on Transportation Engineering 2007, ICTE 2007","Int. Conf. Transport. Eng.","","American Society of Civil Engineers, 1801 Alexander Graham Bell Drive, Reston, VA 20191-4400, United States","","","1111-1116","2007","International Conference on Transportation Engineering 2007, ICTE 2007","","","2007","English","","","","9780784409329","10.1061/40932(246)183","","International Conference on Transportation Engineering 2007, ICTE 2007","July 22, 2007 - July 24, 2007","Chengdu, China","70898","","Conference article (CA)","On 2nd and 19th, May, 2005, 11 peoples died in traffic accidents respectively. These two things arouse many reports and discusses in the Internet, which mainly focused on the reasons of the accidents. This paper examined the accidents again, from the aspects of drivers, communication bureau, highway police, and safety watchdog bureau etc. Especially, the reason for the long distance maintenance for Chu Da Highway in Yunnan Province was scrutinized, which demonstrated the Chinese trait again. The worse communication markets, rather unconsciousness of safety for the drivers, road merging caused by long distance highway maintenance, loose road administration etc. are the realities for road tragedies. To eliminate such tragedies, the highway related bureaus should act properly in their roles. The local government should take the communication safety as its important administration target, and the education of people, enforcement of communication act, engineering for safety control and emergency rescue should take as the synthetically measures to reach the target. Copyright ASCE 2007.","5","Highway accidents","Accident prevention - Collision avoidance - Safety factor","Highway repair - Temporary merged roads - Traffic accident","432.1 Highway Transportation, General - 914.1 Accidents and Accident Prevention","Theoretical (THR)",,,,"Compendex","Compilation and indexing terms, Copyright 2019 Elsevier Inc.","Engineering Village"
"Tracking non-rigid object using discriminative features","20150800546366","","Wang, Qian (1); Shi, Qingxuan (2); Tian, Xuedong (2) ","(1) Academic Administration, Hebei University, Baoding, China (2) College of Mathematics and Computer Science, Hebei University, Baoding, China ","","Proceedings - 2014 10th International Conference on Computational Intelligence and Security, CIS 2014","Proc. - Int. Conf. Comput. Intell. Secur., CIS","Aviation Key Laboratory of Science and Technology on Airborne and Missileborne Computer; Beijing Normal University; Guangdong University of Technology; IEEE CPS; Shenzhen University; Xidian University","Institute of Electrical and Electronics Engineers Inc.","","","260-263","January 20, 2015","","","1of1","2015","English","","","","9781479974344","10.1109/CIS.2014.121","7016896","10th International Conference on Computational Intelligence and Security, CIS 2014","November 15, 2014 - November 16, 2014","Kunming, Yunnan, China","110202","","Conference article (CA)","We propose a simple but effective tracking algorithm for non-rigid objects with geometric appearance changes. The discriminative features of the object are adaptively selected according to their descriptive ability. To adapt to the geometric changes, we use a deformable rectangle to represent the object, and use Markov Chain Monte Carlo-based Particle Filter (MCMC-PF)to estimate the state of the object in a restricted four dimensional space. Experimental results show that the proposed tracking algorithm has ideal performance. © 2014 IEEE.","17","Tracking (position)","Markov processes - Monte Carlo methods","Discriminative features - Four-dimensional space - Geometric changes - Ideal performance - Markov chain Monte Carlo-based particle filters - MCMC-PF - Non-rigid object tracking - Tracking algorithm","922.1 Probability Theory - 922.2 Mathematical Statistics",,,,,"Compendex","Compilation and indexing terms, Copyright 2019 Elsevier Inc.","Engineering Village"
"Tudy on the Scale Effect of Nan scale Indentation on Yield Strength and Modulus of Elasticity","20183505761242","","Wang, Chao (1); Yu, Xinhai (1); Zhang, Jian (1) ","(1) School of ECSUT University, Shanghai; 200000, China ","","IOP Conference Series: Materials Science and Engineering","IOP Conf. Ser. Mater. Sci. Eng.","","Institute of Physics Publishing","394","2","","August 8, 2018","2018 5th International Conference on Advanced Composite Materials and Manufacturing Engineering - 1. Chemical Composed Materials and Biomaterials","","2 of 5","2018","English","17578981","1757899X","","","10.1088/1757-899X/394/2/022066","022066","2018 5th International Conference on Advanced Composite Materials and Manufacturing Engineering, ACMME 2018","June 16, 2018 - June 17, 2018","Xishuangbanna, Yunnan, China","138696","","Conference article (CA)","In recent decades, many micromechanics experiments have proved that the mechanical behavior of metal materials at the scale of micron or submicron scale is quite different from that of materials under macroscopic scale (above millimeter order). When the characteristic length of the no uniform plastic deformation reaches the magnitude of micrometer or submicron, the material will show a very strong scale effect. In this paper, we mainly study the scale effect of the two parameters, the yield strength and the modulus of elasticity, which are very important in the mechanical constitutive equation. The scale effect of yield strength can be studied by using the H-P formula. With the further research, it is found that the modulus of elasticity have obvious scale effect. © Published under licence by IOP Publishing Ltd.","12","Biomaterials","Bridge decks - Composite materials - Elastic moduli - Manufacture - Yield stress","Characteristic length - Macroscopic scale - Mechanical behavior - Metal materials - Scale effects - Submicron - Submicron scale - Two parameter","401.1 Bridges - 462.5 Biomaterials (including synthetics) - 537.1 Heat Treatment Processes - 951 Materials Science",,,,"Open Access","Compendex","Compilation and indexing terms, Copyright 2019 Elsevier Inc.","Engineering Village"
"A novel multi-focus image capture and fusion system for macro photography","20144600183574","","Zhao, Yili (1, 3); Zhou, Yi (2, 3); Xu, Dan (3) ","(1) Southwest Forestry University, Kunming Yunnan; 650224, China (2) Yunnan Normal University, Kunming Yunnan; 650091, China (3) Yunnan University, Kunming Yunnan; 650091, China ","Zhao, Yili ","Communications in Computer and Information Science","Commun. Comput. Info. Sci.","","Springer Verlag","437","","19-28","2014","","Advances in Image and Graphics Technologies - Chinese Conference, IGTA 2014, Proceedings","1 of 1","2014","English","18650929","","","9783662454978","","","8th Conference on Image and Graphics Technologies and Applications, IGTA 2014","June 19, 2014 - June 20, 2014","Beijing, China","109069","","Journal article (JA)","This paper proposes a novel multi-focus image capture and fusion system for macro photography. The system consists of three components. The first component is a novel multi-focus image capture device which can capture multiple macro images taken at different focus distances from a photographic subject, with high precision. The second component is a feature based method which can align multiple in-focus images automatically. The third component is a new multi-focus image fusion method which can combine multiple macro images to a fused image with a greater depth of field. The proposed image fusion method is based on Gaussian and Laplacian pyramids with a novel weight map selection strategy. Several data sets are captured and fused by the proposed system to verify the hardware and software design. Subjective and objective methods are also used to evaluate the proposed system. By analyzing the experimental results, it shows that this system is flexible and efficient, and the quality of the fused image is comparable to the results of other methods. © Springer-Verlag Berlin Heidelberg 2014.","19","Image fusion","Laplace transforms - Macros - Photography - Software design","Feature-based method - Hardware and software designs - Image alignment - Image fusion methods - Laplacian Pyramid - Multifocus image fusion - Multifocus images - Objective methods","723.1 Computer Programming - 723.2 Data Processing and Image Processing - 746 Imaging Techniques - 921.3 Mathematical Transformations",,,,,"Compendex","Compilation and indexing terms, Copyright 2019 Elsevier Inc.","Engineering Village"
"The Comparison of Negative Linear Compressibility of Hexagonal Honeycomb under Different Layouts","20183505756578","","Zhou, Xiaoqin (1); Li, Jinrui (1); Ma, Meng (1); Yang, Lu (1) ","(1) School of Jilin University, Changchun, China ","Zhou, Xiaoqin(xqzhou@jlu.edu.cn) ","IOP Conference Series: Materials Science and Engineering","IOP Conf. Ser. Mater. Sci. Eng.","","Institute of Physics Publishing","394","3","","August 8, 2018","2018 5th International Conference on Advanced Composite Materials and Manufacturing Engineering - 2. Engineering Materials and Manufacturing Engineering","","3 of 5","2018","English","17578981","1757899X","","","10.1088/1757-899X/394/3/032076","032076","2018 5th International Conference on Advanced Composite Materials and Manufacturing Engineering, ACMME 2018","June 16, 2018 - June 17, 2018","Xishuangbanna, Yunnan, China","138696","","Conference article (CA)","Hexagonal honeycomb as a structure with a nice negative linear compressibility (NLC) is analyzed here from the aspect of its two layouts to be full of space, these two layouts are compared in terms of minimal negative value of linear compressibility and the angle range of NLC to obtain a better way of layout. © Published under licence by IOP Publishing Ltd.","4","Compressibility","Bridge decks - Composite materials - Honeycomb structures - Manufacture","Hexagonal honeycomb - Linear compressibilities - Negative values","401.1 Bridges - 408.2 Structural Members and Shapes - 537.1 Heat Treatment Processes - 951 Materials Science",,"Number: 51475208, Acronym: NSFC, Sponsor: National Natural Science Foundation of China; Number: -, Acronym: NSFC, Sponsor: National Natural Science Foundation of China; ","This work was financially supported by the National Science Foundation of China (NSFC) (51475208).","Open Access","Compendex","Compilation and indexing terms, Copyright 2019 Elsevier Inc.","Engineering Village"
"Almost Periodic Synchronization for Quaternion-Valued Neural Networks with Time-Varying Delays","20182405300174","","Li, Yongkun (1); Meng, Xiaofang (1); Ye, Yuan (2) ","(1) Department of Mathematics, Yunnan University, Kunming, Yunnan; 650091, China (2) Graduate School, Yunnan University, Kunming, Yunnan; 650091, China ","Ye, Yuan(yye_yd@aliyun.com) ","Complexity","Complexity","","Hindawi Limited, 410 Park Avenue, 15th Floor, 287 pmb, New York, NY 10022, United States","2018","","","2018","","","","2018","English","10762787","10990526","","","10.1155/2018/6504590","6504590","","","","","","Journal article (JA)","This paper focuses on the global exponential almost periodic synchronization of quaternion-valued neural networks with time-varying delays. By virtue of the exponential dichotomy of linear differential equations, Banach's fixed point theorem, Lyapunov functional method, and differential inequality technique, some sufficient conditions are established for assuring the existence and global exponential synchronization of almost periodic solutions of the delayed quaternion-valued neural networks, which are completely new. Finally, we give one example with simulation to show the applicability and effectiveness of our main results. © 2018 Yongkun Li et al.","46","Time varying networks","Differential equations - Fixed point arithmetic - Lyapunov functions - Synchronization - Time delay - Time varying control systems","Almost periodic - Almost periodic solutions - Differential inequality techniques - Fixed point theorems - Global exponential synchronizations - Linear differential equation - Lyapunov functional method - Time varying- delays","703.1 Electric Networks - 713 Electronic Circuits - 731.1 Control Systems - 921 Mathematics - 961 Systems Science",,"","by the National Natural Sciences Republic of China under Grant","Open Access","Compendex","Compilation and indexing terms, Copyright 2019 Elsevier Inc.","Engineering Village"
"An Effective Feature Fusion Method for Protein Subnuclear Localization","20191106636122","","Wu, Liwen (1); Xiang, Yi (1); Yang, Yikun (1); Yao, Shaowen (1); Xue, Gang (1); Jiang, Oian (2); Jin, Xin (2) ","(1) School of Software, Yunnan University, Kunming; 650504, China (2) School of Information, Yunnan University, Kunming; 650504, China ","Xue, Gang(mess@ynu.edu.cn) ","Proceedings - 2018 11th International Congress on Image and Signal Processing, BioMedical Engineering and Informatics, CISP-BMEI 2018","Proc. - Int. Congr. Image Signal Process., BioMed. Eng. Inf., CISP-BMEI","","Institute of Electrical and Electronics Engineers Inc.","","","","July 2, 2018","Proceedings - 2018 11th International Congress on Image and Signal Processing, BioMedical Engineering and Informatics, CISP-BMEI 2018","","1 of 1","2018","English","","","","9781538676042","10.1109/CISP-BMEI.2018.8633262","8633262","11th International Congress on Image and Signal Processing, BioMedical Engineering and Informatics, CISP-BMEI 2018","October 13, 2018 - October 15, 2018","Beijing, China","144766","","Conference article (CA)","Protein sub-nuclear localization plays a significant role in life science research. Feature extraction is the key step in the processes of protein sub-nuclear localization, it should include useful and sufficient protein information as possible. However, the single feature extraction method often can't extract sufficient information. Thus, we propose a novel method by combining PseAAC with PSSM to solve this problem. First, PseAAC and PSSM are used to extract the information, respectively. Secondly, the KPCA is used to reduce the dimensionality of PseAAC and PSSM. Thirdly, the useful information of PseAAC and PSSM will be integrated by proposed method. At last, the integrated feature vectors are classified by Random Forest. The classification performance will be evaluated with four evaluation indexes by jackknife test. According to the experiments results, the proposed feature fusion method is effective for protein sub-nuclear localization. © 2018 IEEE.","23","Image processing","Biomedical engineering - Biomedical signal processing - Decision trees - Extraction - Feature extraction - Principal component analysis - Proteins","Classification performance - Feature extraction methods - Kernel principal component - Life science research - Nuclear localization - PseAAC - PSSM - Subnuclear localization","461.1 Biomedical Engineering - 716.1 Information Theory and Signal Processing - 802.3 Chemical Operations - 804.1 Organic Compounds - 922.2 Mathematical Statistics - 961 Systems Science",,"Number: 61863036, Acronym: -, Sponsor: National Youth Foundation of China; ","ACKNOWLEDGMENT This work is supported by the National Foundation of China (No. 61863036).",,"Compendex","Compilation and indexing terms, Copyright 2019 Elsevier Inc.","Engineering Village"
"A diploma anti-forgery system based on lightweight digital signatures","20150800546680","","Dai, Yue (1); Su, Shenghui (1, 2) ","(1) School of Information Engineering, Yangzhou University, Yang Zhou, China (2) College of Computer Sciences, Beijing University of Technique, Beijing, China ","","Proceedings - 2014 10th International Conference on Computational Intelligence and Security, CIS 2014","Proc. - Int. Conf. Comput. Intell. Secur., CIS","Aviation Key Laboratory of Science and Technology on Airborne and Missileborne Computer; Beijing Normal University; Guangdong University of Technology; IEEE CPS; Shenzhen University; Xidian University","Institute of Electrical and Electronics Engineers Inc.","","","647-651","January 20, 2015","","","1of1","2015","English","","","","9781479974344","10.1109/CIS.2014.44","7016976","10th International Conference on Computational Intelligence and Security, CIS 2014","November 15, 2014 - November 16, 2014","Kunming, Yunnan, China","110202","","Conference article (CA)","In this paper the authors analyze the problems and shortcomings of the existing diploma anti-forgery systems, and propose a new diploma anti-forgery system based on digital identities. A digital identity is produced through the JUNA lightweight digital signature scheme. It hide the private key of a university, the ID number of a student, the graduating date etc, consists of only 16 alphanumeric characters, and can be printed directly on a diploma page. When a digital identity is verified, it is inputted into a mobile phone by a checker, and then is sent to a unified verification platform which stores public keys of all universities and the informaton of students, and returns the result of 'True / False' to the mobile phone. Besides, the new system adds a resident ID number as the security trusted root to a digital identity, which effectively and thoroughly solves the diploma anti-forgery problem with low cost and low environmental pollution. © 2014 IEEE.","16","Electronic document identification systems","Authentication - Cellular telephones - Computer crime - Mobile phones - Mobile security - Network security - Telephone sets","Alphanumeric characters - Digital identity - Digital signature schemes - Diploma anti-forgery - Environmental pollutions - ID number - Security - Verification platforms","718.1 Telephone Systems and Equipment - 723 Computer Software, Data Handling and Applications",,,,,"Compendex","Compilation and indexing terms, Copyright 2019 Elsevier Inc.","Engineering Village"
"Decision support system for good quality flue-cured tobacco based on knowledge model","20113514275406","","Li, Fo-Lin (1); Yang, Huan-Wen (1); Zhang, Xi (2); Hu, Xiao-Man (1); Zou, Wei (1); Liu, Yang-Zhong (1) ","(1) Tobacco College, Yunnan Agricultural University, Kunming, 650201, China (2) Electrons and Computer Center of Yunnan Province, Yunnan University, Kunming, 650223, China ","Li, F.-L.(Fordmail@163.com) ","Advanced Materials Research","Adv. Mater. Res.","","Trans Tech Publications, P.O. Box 1254, Clausthal-Zellerfeld, D-38670, Germany","304","","279-283","2011","Multi-Functional Materials and Structures Engineering","","","2011","English","10226680","","","9783037852002","10.4028/www.scientific.net/AMR.304.279","","2011 International Conference on Multi-functional Materials and Structures Engineering, ICMMSE 2011","June 11, 2011 - June 12, 2011","Suzhou, China","86214","","Conference article (CA)","In order to improve the mathematical description quantitatively, and support decision in tobacco crop knowledge. A Good quality flue-cured tobacco production and management decision support system (GQFKMTDSS) has been designed and developed applying JSP under the Windows Server environment, based on good quality flue-cured tobacco knowledge model with system analysis methods and mathematical modeling techniques. The system helps for forecasting function and guiding decision-making to good quality flue-cured tobacco. © (2011) Trans Tech Publications.","6","Decision support systems","Artificial intelligence - Curing - Decision making - Flues - Functional materials - Mathematical techniques - Systems analysis - Tobacco - Windows operating system","Flue-cured tobacco - Knowledge model - Management decisions - Mathematical descriptions - Mathematical modeling - System analysis method - Windows Servers","961 Systems Science - 951 Materials Science - 921 Mathematics - 912.2 Management - 821.4 Agricultural Products - 815.1 Polymeric Materials - 723.4 Artificial Intelligence - 723 Computer Software, Data Handling and Applications - 521 Fuel Combustion and Flame Research",,,,,"Compendex","Compilation and indexing terms, Copyright 2019 Elsevier Inc.","Engineering Village"
"A decision-making method for selecting cloud computing service based on information entropy","20153701267295","","Jiang, Rong (1, 2); Liao, Hongzhi (2); Yang, Ming (1); Li, Chunhong (1) ","(1) School of Information, Yunnan University of Finance and Economics, China (2) School of Software, Yunnan University, China ","","International Journal of Grid and Distributed Computing","Int. J. Grid Distrib. Comput.","","Science and Engineering Research Support Society","8","4","225-232","September 11, 2015","","","","2015","English","20054262","","","","10.14257/ijgdc.2015.8.4.21","","","","","","","Journal article (JA)","This paper proposes an information-entropy-based decision-making method for selecting cloud computing service. Firstly, an evaluation index system (EIS-DMSCS) is developed. Secondly, a decision-making method is constructed. Finally, the application example proves the scientificity, effectiveness and feasibility of this method. © 2015 SERSC.","13","Decision making","Cloud computing","Application examples - Cloud computing services - Cloud services - Decision-making method - Evaluation index system - Information entropy","722.4 Digital Computers and Systems - 912.2 Management",,,,,"Compendex","Compilation and indexing terms, Copyright 2019 Elsevier Inc.","Engineering Village"
"A method of backward probabilistic logic reasoning of decision problems","20084011616047","","Li, Yong (1, 2); Liu, Weiyi (2) ","(1) Faculty of Information Engineering and Automation, Kunming University of Science and Technology, Kunming 650051, China (2) School of Information Science and Engineering, Yunnan University, Kunming 650091, China ","Li, Y.(leon@people.com.cn) ","Proceedings of the 27th Chinese Control Conference, CCC","Proc. Chin. Control. Conf., CCC","Chinese Association of Automation; Chinese Association of Automation Kunming Univ. Sci. Technol.; Technical Committee on Control Theory; Yunnan Division","IEEE Computer Society","","","657-662","2008","Proceedings of the 27th Chinese Control Conference, CCC","","","2008","English","","","","9787900719706","10.1109/CHICC.2008.4605124","4605124","27th Chinese Control Conference, CCC","July 16, 2008 - July 18, 2008","Kunming, Yunnan, China","73759","","Conference article (CA)","There are critical problems in reasoning of decision problems with casual relations. One is how to process backward reasoning. Another is the discrepancy between logic and probability in denoting casual relations. We propose and implement a backward probabilistic logic reasoning approach, which combings Conditional Event Algebra and Markov Monte Carlo simulating algorithm. By partly changing casual relations in a decision problem, we first make the problem of backward reasoning possible, and then bring the logic consistent with the probability in denoting casual relation by extending normal measurable space with conditional event. We transform the conditional event to normal events and corresponding logical combination events via Conditional Event Algebra, and use Gibbs simulation to sample the normal events to be a stationary state. By computing the quantitative values of the stationary events, we can evaluate the quantitative value of conjunction and disjunction operations of conditional event at last and finish backward reasoning. An application of our method shows how we process a backward reasoning in a sequential decision.","12","Probabilistic logics","Algebra - Computer circuits - Electric breakdown","Backward probabilistic logic reasoning - Casual relation - Conditional events - Decision problems - Logic and probability - Logical combination - Quantitative values - Sequential decisions","701.1 Electricity: Basic Concepts and Phenomena - 721.1 Computer Theory, Includes Formal Logic, Automata Theory, Switching Theory, Programming Theory - 721.3 Computer Circuits - 921.1 Algebra",,,,,"Compendex","Compilation and indexing terms, Copyright 2019 Elsevier Inc.","Engineering Village"
