Title,Accession number,Title of translation,Author,Author affiliation,Corresponding author,Source,Abbreviated source title,Sponsor,Publisher,Volume,Issue,Pages,Issue date,Monograph title,Volume title,Part number,Publication year,Language,ISSN,E-ISSN,ISBN13,DOI,Article number,Conference name,Conference date,Conference location,Conference code,CODEN,Document type,Abstract,Number of references,Main heading,Controlled/Subject terms,Uncontrolled terms,Classification code,Treatment,Funding details,Funding text,Access type,Database,Copyright,Data Provider
"RETRACTED ARTICLE: RMB settlement of frontier trade in Yunnan","20112914160822","","Niansong, Tu (1); Meiling, Chen (2) ","(1) Dept. of Economics and Management, Kunming University of Science and Technology, Kunming, China (2) Politic and Public Administration Department, Chuxiong Normal College, Chuxiong, China ","Niansong, T.(nelsontu1@yahoo.com.cn) ","2011 International Conference on E-Business and E-Government, ICEE2011 - Proceedings","Int. Conf. E-Bus. E-Gov., ICEE - Proc.","","IEEE Computer Society","","","4466-4469","2011","2011 International Conference on E-Business and E-Government, ICEE2011 - Proceedings","","","2011","Chinese","","","9781424486946","10.1109/ICEBEG.2011.5882444","5882444","","","","","","","With China's sustained and rapid economic development, the rapid growth of the overall national strength, the RMB internationalization faces the important opportunities. As an example, RMB has become the main settlement currency in Yunnan frontier trade. This study discusses the conditions of RMB settlement of frontier trade in Yunnan, and presents some analyses about the main characteristics of RMB settlement of frontier trade in Yunnan. Furthermore, it points out the main problems of RMB settlement of frontier trade in Yunnan. We discover the countermeasures to the problems. Finally, we draw the conclusions. © 2011 IEEE.","5","Commerce","Government data processing","Economic development - Rapid growth - RMB Settlement - Yunnan","723.2 Data Processing and Image Processing",,,,,"Compendex","Compilation and indexing terms, Copyright 2019 Elsevier Inc.","Engineering Village"
"Frequencies distribution of GSTT1 and GSTM1 null genotypes in 24 Yunnan populations","2003107389601","","Yang, Jie (1); Shi, Hong (1); Dong, Yong-li (1); Li, Wei-xiang (1); Zeng, Wei-min (1); Lu, Jin (1); Hao, Zhao-qin (1); Xiao, Chun-jie (1) ","(1) Human Genetics Center, Yunnan University, Kunming, Yunnan 650091, China ","Yang, J.(cjxiao@public.km.yn.cn) ","Chinese Journal of Medical Genetics","Chin. J. Med. Genet.","","West China University of Medical Sciences","20","1","9-11","February 2003","","","","2003","Chinese","10039406","","","","","","","","","ZYXZER","Journal article (JA)","Objective: To investigate the frequencies distribution of GSTT1 and GSTM1 null genotypes in 24 Yunnan populations. Methods: GSTT1 and GSTM1 genotypes were analyzed by PCR procedure. Results: The range of frequencies for GSTT1 and GSTM1 null genotypes in the populations were 0. 188-0. 633 and 0. 400-0. 745, respectively, and in the districts were 0. 286-0. 583, 0. 433-0. 745 respectively. There was significant relationship between GSTT1 frequencies and populations. Conclusion: The frequencies of GSTT1 and GSTM1 null genotypes in 24 Yunnan populations were different, but they were almost the same in different districts of Yunnan.","10","Genetic engineering","Frequencies - Population statistics","Null genotypes","461.2 Biological Materials and Tissue Engineering - 461.8.1 Genetic Engineering","Theoretical (THR)",,,,"Compendex","Compilation and indexing terms, Copyright 2019 Elsevier Inc.","Engineering Village"
"Development a detailed inventory framework for estimating major pollutants emissions inventory for Yunnan Province, China","20122615186002","","Tang, Xiaolong (1); Zhang, Yan (1); Yi, Honghong (1); Ma, Jieyun (1); Pu, Li (1) ","(1) College of Environmental Science and Engineering, Kunming University of Science and Technology, Kunming 650500, China ","Yi, H.(yihonghong@tsinghua.org.cn) ","Atmospheric Environment","Atmos. Environ.","","Elsevier Ltd","57","","116-125","September 2012","","","","2012","English","13522310","18732844","","10.1016/j.atmosenv.2012.04.018","","","","","","AENVEQ","Journal article (JA)","A Yunnan Province regional emission inventory for the year 2009 was developed, using the best available domestic emission factors and activity level data for the first time. The inventory covers major emission sources in the region and both bottom-up and top-down approaches were adopted to compile the inventory for those sources where possible. The results show that the estimated emissions for SO2, NOX, CO2and PM10in Yunnan Province for the year 2009 were 446.75kt, 486.91kt, 20553.91wt (104t) and 467.83kt, respectively. Coal-fired power plants and industrial sources were major contributors of SO2, NOXand CO2emissions, accounting for 84.49%, 73.27% and 68.34% of the total emissions. Biomass burning accounted for 71.62% of total PM10emissions. Qujing predominate the total emissions of each species, 33.58% for SO2, 31.04% for NOX, 24.19% for CO2, and 15.79% for PM10. The highest emission density value was up to 5024kg SO2km-2and 5063kg NOX·km-2in Qujing, 2076 t CO2·km-2and 3032kg PM10·km-2in Kunming. Furthermore, a qualitative approach was used to characterize the uncertainty of emission inventories, with low uncertainty in SO2emission estimates from coal-fired power plant sources, medium to high uncertainties for NOXemissions and CO2emissions, and high uncertainty in PM10. © 2012.","46","Industrial emissions","Carbon dioxide - Coal - Coal fired boilers - Coal fueled furnaces - Fire tube boilers - Fossil fuel power plants - Industrial plants - Uncertainty analysis","Bottom-up and top-down - Coal-fired power plant - Emission inventories - Pollutants emissions - Qualitative approach - Spatial - Uncertainty - Yunnan province","451.1 Air Pollution Sources - 524 Solid Fuels - 614.2 Steam Power Plant Equipment and Operation - 804.2 Inorganic Compounds - 922.1 Probability Theory",,"Number: KKK0201022137, Acronym: -, Sponsor: Sichuan Provincial Bureau of Environmental Protection; Number: KKK0201122183, Acronym: -, Sponsor: Sichuan Provincial Bureau of Environmental Protection; ","This research was supported by the special research projects of Yunnan Provincial Environmental Protection Bureau ( KKK0201022137 ) and ( KKK0201122183 ). The authors acknowledge the generosity of those funds.",,"Compendex","Compilation and indexing terms, Copyright 2019 Elsevier Inc.","Engineering Village"
"Analysis of Frequency Oscillation Caused by AGC Control in Yunnan Power Grid","20190806533791","","Yang, Rongzhao (1); Chen, Yiping (2); Xia, Chengjun (1) ","(1) School of Electric Power, South China University of Technology, Guangzhou, Guangdong Province, China (2) CSG Power Dispatching and Control Center, Guangzhou, Guangdong Province, China ","","2018 International Conference on Power System Technology, POWERCON 2018 - Proceedings","Int. Conf. Power Syst. Technol., POWERCON - Proc.","China Southern Power Grid Co., Ltd. (CSG); Chinese Society for Electrical Engineering (CSEE); IEEE Power and Energy Society (PES)","Institute of Electrical and Electronics Engineers Inc.","","","441-446","July 2, 2018","2018 International Conference on Power System Technology, POWERCON 2018 - Proceedings","","1 of 1","2018","English","","","9781538664612","10.1109/POWERCON.2018.8602090","8602090","2018 International Conference on Power System Technology, POWERCON 2018","November 6, 2018 - November 9, 2018","Guangzhou, China","144255","","Conference article (CA)","Yunnan power grid is a large-scale HVDC sending system with high-proportion hydropower. Frequency oscillation events caused by the instability of the automatic generation control (AGC) occured repeatedly in Yunnan power grid. Combined with the reality of Yunnan power grid, a hydropower system model including AGC control is established to explain that the high-proportion hydropower and reduction in AC loads will lead to system frequency instability. Further study of the influence of governor deadband on frequency oscillation based on description function, and propose the setting method of frequency bias coefficient B to ensure frequency stability. © 2018 IEEE.","15","Electric power system control","Electric power transmission networks - Frequency stability - Governors - Hydroelectric power - Stability","Asynchronous interconnections - Automatic generation control - Deadbands - Frequency bias coefficient - Frequency oscillations - Hydropower system - System frequency - Yunnan power grid","602.1 Mechanical Drives - 611.1 Hydroelectric Power Plants - 706.1 Electric Power Systems - 706.1.1 Electric Power Transmission - 961 Systems Science",,"Number: 237724702@qq.com,, Acronym: -, Sponsor: South China University of Technology; ","Manuscript received July 31, 2018. This work was supported in part by Simulation Analysis and Optimization on Frequency Modulation Strategy of Multi-zone Asynchronous Interconnected Power Grid˄ZDKJXM20160001˅ Rongzhao Yang, Chengjun Xia are with the the School of Electric Power, South China University of Technology, Guangzhou, Guangdong, P.R. China (e-mail: 237724702@qq.com, cjxia@scut.edu.cn)",,"Compendex","Compilation and indexing terms, Copyright 2019 Elsevier Inc.","Engineering Village"
"Genesis of nanwenhe tungsten deposit in Yunnan province: Evidence from characteristics of ore geology and ore-controlling structures","20191106631147","","Xue, Wei (1) ","(1) School of Earth Sciences and Resources, China University of Geosciences, Beijing; 100083, China ","Xue, Wei(xueweiwd@163.com) ","Proceedings of the 6th Academic Conference of Geology Resource Management and Sustainable Development","Proc. Acad. Conf. Geol. Resour. Manag. Sustain. Dev.","Hubei Zhongke Geology and Environment Technology Institute; School of Energy Resources, China University of Geosciences","Aussino Academic Publishing House","","","242-246","February 10, 2019","Proceedings of the 6th Academic Conference of Geology Resource Management and Sustainable Development","","1 of 1","2019","English","","","9781921712678","","","6th Academic Conference of Geology Resource Management and Sustainable Development, GRMSD 2018","December 27, 2018 - December 28, 2018","Beijing, China","145283","","Conference article (CA)","As the largest tungsten polymetallic deposit in the southeastern Yunnan province, Nanwenhe tungsten deposit occupy an important position of the Laojunshan tungsten-tin polymetallic ore concentration area. In order to further clarify the genesis of the deposit, combined with the regional metallogenic geological background and previous research results, the geological characteristics of the deposit, the spatial distribution of the ore body and its ore-controlling structure characteristics were systematically summarized. The study shows that the Nanyangtian formation (Pt1n) is the single host rock for the deposit, and the ore-bodies are mainly composed of layered skarn and feldspar quartz vein type. The distribution and formation of layered ore bodies are controlled by the interface of the Middle Jurassic nappe structure before mineralization, while the feldspar quartz vein type ore-bodies are controlled by the right-row shear under the background of the regional extension in Late Yanshanian. The formation of different types of ore bodies is closely related to the Yanshanian magmatic hydrothermal activities. The Nanwenhe tungsten deposit is a skarn deposit that controlled by the multi-stage magmatic hydrothermal action and structural of the Yanshanian period. 2019 Aussino Academic Publishing House.","12","Ore deposit geology","Deposits - Feldspar - Feldspar deposits - Ores - Planning - Quartz - Resource allocation - Structural geology - Sustainable development - Tungsten deposits","Academic publishing - Genesis - Geological background - Geological characteristics - Hydrothermal activity - Nanwenhe - Ore-controlling structures - Yunnan province","481.1 Geology - 482.2 Minerals - 504.3 Heavy Metal Mines - 505.1 Nonmetallic Mines - 912.2 Management",,,,,"Compendex","Compilation and indexing terms, Copyright 2019 Elsevier Inc.","Engineering Village"
"Investigation and Analysis on the Construction Situation of 'three Links and Two Platforms' of Education for Nationalities in Yunnan Province in China","20174604388855","","Zhilin, Zhao (1); Jianhou, Gan (2) ","(1) College of Tourism and Geographical Sciences and College of Adult Education, Yunnan Normal University, Kunming, Yunnan, China (2) Key Laboratory of Educational Informatization for Nationalities, Yunnan Normal University, Kunming, Yunnan, China ","Jianhou, Gan(cjyzhaozhilin@163.com) ","MATEC Web of Conferences","MATEC Web Conf.","","EDP Sciences","128","","","October 25, 2017","2017 International Conference on Electronic Information Technology and Computer Engineering, EITCE 2017","","1 of 1","2017","English","","2261236X","","10.1051/matecconf/201712804006","04006","2017 International Conference on Electronic Information Technology and Computer Engineering, EITCE 2017","September 23, 2017 - September 24, 2017","Zhuhai, Guangdong, China","131394","","Conference article (CA)","'Three Links and Two Platforms', which refers to schools links to ICTs, high-quality resource of class links to ICTs, people links to ICTs, public service platform for educational resources and public service platform for educational management, has played a crucial role in improving the educational equality in minority areas in Yunnan province and in realizing the sharing of high-quality educational resources. This research mainly adopts method of document investigation, which has investigated the construction situation of 'Three Links and Two Platforms' in eight ethnic autonomous prefectures in Yunnan province in China including Chuxiong Yi Nationality Autonomous Prefecture, etc. The results show that the average value of the construction of 'Three Links' is 63.55%n 14.75% and 9.00% respectively. 'Two Platforms' mainly focus on public service platform for educational resources and public service platform for the construction of educational statistics, and the informatization of national education in Yunnan province should be improved greatly. © The authors, published by EDP Sciences, 2017.","10","Statistics",,"Average values - Educational management - Educational resource - High quality - Informatization - Investigation and analysis - Public service platforms - Yunnan province","922.2 Mathematical Statistics",,"Number: 2014RD029, Acronym: -, Sponsor: -; Number: 2013GXS4D149, Acronym: -, Sponsor: -; Number: 12YJCZH053, Acronym: -, Sponsor: -; ","This work was supported by the National Soft Science Project of China under Grant No. 2013GXS4D149, Education Humanities and Social Sciences Research Project of Ministry of Education in China under Grant No. 12YJCZH053 and Yunnan Science and Technology Development Strategy and Policy Research Project in China under Grant No. 2014RD029.","Open Access","Compendex","Compilation and indexing terms, Copyright 2019 Elsevier Inc.","Engineering Village"
"A study on the changes of Yunnan higher education spatial layout structure based on GIS","20140717300590","","Liu, Liusheng (1); Wen, Aihua (2) ","(1) Higher Education and Regional Development Research Institute, Yunnan Normal University, Kunming, China (2) Yunnan Vocational and Technical College, Kunming, China ","Wen, A.(361460651@qq.com) ","International Conference on Geoinformatics","Int. Conf. Geoinformatics","Henan University, Key Research Institute of; IEEE Geoscience and Remote Sensing Society (IEEE GRSS); Ministry of Education; The Geographical Society of Henan Province; Yellow River Civilization and Sustainable Development,","IEEE Computer Society","","","","2013","Proceedings - 2013 21st International Conference on Geoinformatics, Geoinformatics 2013","","","2013","English","2161024X","21610258","9781467362283","10.1109/Geoinformatics.2013.6626180","6626180","2013 21st International Conference on Geoinformatics, Geoinformatics 2013","June 20, 2013 - June 22, 2013","Kai Feng, China","102377","","Conference article (CA)","GIS system is excellent at digging out and utilizing information of space, being able to collect, store, manipulate, retrieve and display space information recognized by position. GIS not only provides decision-makers with related information concerning location and distribution of public facilities, but also provides a nice visual tool to describe the background and structure of a problem. The most important point is that an analysis of alternative programs created by GIS would optimize decision-making. GIS technology is applied here to study the layout and structure of the higher education in Yunnan Province, analyzing the changes of Yunnan higher education's spatial layout structure from several aspects, such as the layout of college, scale of higher education, the relationship between the development of colleges and economy and population, exploring the relationships between higher education resource and relevant factors including geographical environment, population, economy, and so on, in order to provide scientific supports for decision-making concerning rational planning issues of spatial resources distribution of higher education in Yunnan Province, and to provide technical support for the scientific development of higher education. © 2013 IEEE.","9","Geographic information systems","Behavioral research - Decision making","Analysis of alternatives - Geographical environment - Higher education - Information concerning - Rationality of Space - Scientific development - Technical support - Yunnan province","903.3 Information Retrieval and Use - 912.2 Management - 971 Social Sciences",,,,,"Compendex","Compilation and indexing terms, Copyright 2019 Elsevier Inc.","Engineering Village"
"Regional drought monitoring and analyzing using MODIS data - A case study in Yunnan Province","20110813679424","","Cai, Guoyin (1); Du, Mingyi (1); Liu, Yang (1) ","(1) School of Geomatics and Urban Information, Beijing University of Civil Engineering and Architecture, No. 1, Zhanlanguan Road, Xicheng District, Beijing 100044, China ","Cai, G.(cgyin@bucea.edu.cn) ","IFIP Advances in Information and Communication Technology","IFIP Advances in Information and Communication Technology","","Springer New York LLC","345 AICT","PART 2","243-251","2011","Computer and Computing Technologies in Agriculture IV - 4th IFIP TC 12 Conference, CCTA 2010, Selected Papers","","","2011","English","18684238","","","10.1007/978-3-642-18336-2_29","","","","","","","Conference article (CA)","Yunnan suffered from a severe drought from Winter, 2009 to Spring, 2010. Compared with traditional methods for drought monitoring, remote sensing (RS) based methods has the merits of almost real-time and large covering area. In this paper, vegetation water supply index (VWSI) was used to detect the drought condition utilizing Moderate Resolution Imaging Spectroradiometer (MODIS) data in Yunnan province on 7 March, 2010. Merits and pitfalls of this method were analyzed according to the comparison between the RS detected drought and the real drought status developed by the National Meteorological Bureau. Our results showed that VWSI was apt to agriculture fields with dense vegetation covered areas. This means that this method can be used to detect the drought in a regional area. © 2011 IFIP International Federation for Information Processing.","29","Drought","Agriculture - Radiometers - Remote sensing - Satellite imagery - Vegetation - Water supply","Dense vegetation - Drought conditions - Drought monitoring - Moderate resolution imaging spectroradiometer datum - MODIS - Regional areas - VWSI index - Yunnan province","444 Water Resources - 446.1 Water Supply Systems - 655.2 Satellites - 821 Agricultural Equipment and Methods; Vegetation and Pest Control - 944.7 Radiation Measuring Instruments",,,,,"Compendex","Compilation and indexing terms, Copyright 2019 Elsevier Inc.","Engineering Village"
"Parameterization of Ångström-prescott radiation model in Yunnan province","20121314899947","","Li, Manman (1, 2); Mei, Xurong (1); Zhong, Xiuli (1); Liu, Xiaoying (1); Hao, Weiping (1); Han, Huiling (2); Liu, Wenli (1) ","(1) Key Laboratory of Dry Land Agriculture, Ministry of Agriculture, Institute of Environment and Sustainable Development in Agriculture, Chinese Academy of Agricultural Sciences, Beijing 100081, China (2) Institute of Urban and Rural Construction, Agricultural University of Baoding, Baoding 071000, China ","Liu, X.(liuxy@ieda.org.cn) ","Nongye Gongcheng Xuebao/Transactions of the Chinese Society of Agricultural Engineering","Nongye Gongcheng Xuebao","","Chinese Society of Agricultural Engineering","28","6","100-105","March 15, 2012","","","","2012","Chinese","10026819","","","10.3969/j.issn.1002-6819.2012.06.017","","","","","","NGOXEO","Journal article (JA)","Solar radiation is often needed to be estimated by ordinary data in the current applications now, in which the sunshine-based Angstrom-prescott formula is widely used with highest accuracy. However, the key of its application is to obtain the appropriate local parameters. In this paper, six parameterization methods, one from FAO and the other five from Liu et al., were evaluated using data from three sites in Yunnan province. The results showed that two methods of Liu et al. performed best, and their estimation accuracy was similar to the calibrated ones. In Kunming and Lijiang, the mean bias error (MBE), the root mean square error (RMSE) and the relative root mean square error (PRMSE) was -0.28-0.50 MJ/(m2·d), 2.09-2.39 MJ/(m2·d) and 12.4%-15.8%, respectively. In contrast, the MBE, RMSE and PRMSE obtained by the FAO scheme at these two sites were -0.43-0.84 MJ/(m2·d), 2.61-5.37 MJ/(m2·d) and 17.2%-31.7%, which showed a much lower accuracy than two methods of Liu et al. Considering the fact that it is still a common practice to directly use the FAO method, this research contributed to understand the importance of parameter choice for the Angstrom-prescott model and suggested the calibrated or parameterized parameter can be used as much as possible in practice.","21","Parameterization","Errors - Mean square error - Models - Solar radiation","Common practices - ITS applications - Mean bias errors - Parameter choice - Parameterization method - Radiation modeling - Root mean square errors - Yunnan province","657.1 Solar Energy and Phenomena - 921 Mathematics - 922.2 Mathematical Statistics",,,,,"Compendex","Compilation and indexing terms, Copyright 2019 Elsevier Inc.","Engineering Village"
