Title,Accession number,Title of translation,Author,Author affiliation,Corresponding author,Source,Abbreviated source title,Sponsor,Publisher,Volume,Issue,Pages,Issue date,Monograph title,Volume title,Part number,Publication year,Language,ISSN,E-ISSN,ISBN,ISBN13,DOI,Article number,Conference name,Conference date,Conference location,Conference code,CODEN,Document type,Abstract,Number of references,Main heading,Controlled/Subject terms,Uncontrolled terms,Classification code,Treatment,Funding details,Funding text,Access type,Database,Copyright,Data Provider
"Remote Sensing Image Registration Based on Fuzzy Shape Context Feature and Local Space Vector Similarity Constraint","20190306385971","","Ma, Xinke (1, 2, 3); Yang, Yang (1, 2, 3); Yang, Kun (1, 2) ","(1) Yunnan Normal University, School of Information Science and Technology, China (2) Engineering Research Center of GIS Technology in Western China, Ministry of Education, China (3) Laboratory of Pattern Recognition and Artificial Intelligence, Yunnan Normal University, China ","Yang, Yang(yyang_ynu@163.com) ","International Conference on Geoinformatics","Int. Conf. Geoinformatics","","IEEE Computer Society","2018-June","","","December 3, 2018","Proceedings - 2018 26th International Conference on Geoinformatics, Geoinformatics 2018","","1 of 1","2018","English","2161024X","21610258","","9781538676196","10.1109/GEOINFORMATICS.2018.8557108","8557108","26th International Conference on Geoinformatics, Geoinformatics 2018","June 28, 2018 - June 30, 2018","Kunming, China","143470","","Conference article (CA)","Remote sensing image registration is a fundamental and challenging problem, and it is a critical prerequisite in a wide range of applications including environment monitoring, change detection, image fusion, image mosaic, and map updating. Remote sensing image registration is a key technology for dynamic monitoring of a city. In order to promote remote sensing image registration precision, we propose a remote sensing image registration method based on fuzzy shape context feature and local space vector similarity constraint. There are two main contributions: (1) Fuzzy shape context feature (2) Local spatial vector similarity constraints based on local vector feature. Meanwhile, we evaluated the performances of the proposed method and compared with four state-of-the-art methods (SIFTCPDR-SOCGLMDTPS) where our method shows the best alignments in most cases. © 2018 IEEE.","20","Remote sensing","Gaussian distribution - Image fusion - Image registration - Space optics - Vector spaces - Vectors","Gaussian Mixture Model - Local vector feature - Remote sensing images - Shape context features - Vector similarity","656.1 Space Flight - 723.2 Data Processing and Image Processing - 921 Mathematics - 921.1 Algebra - 922.1 Probability Theory",,"Number: 01000205020503065, Acronym: -, Sponsor: Doctoral Scientific Research Start-up Foundation from Henan University of Technology; Number: 0100060502006, Acronym: -, Sponsor: -; Number: 41661080, Acronym: NSFC, Sponsor: National Natural Science Foundation of China; ","Supported by National Natural Science Foundation of China (41661080); Doctoral Scientific Research Foundation of Yunnan Normal University (01000205020503065); College Students Scientific Research Training Project of Yunnan Normal University (0100060502006).",,"Compendex","Compilation and indexing terms, Copyright 2019 Elsevier Inc.","Engineering Village"
"Research on the processing methods and equipments for densified biomass fuel","20142917948229","","Zhang, Xia (1); Cai, Zong Shou (1); Chen, Li Hong (2); Chen, Ying (3) ","(1) Yunnan Agricultural University, Kunming, Yunnan 650201, China (2) Yunnan Agricultural University, Kunming 650201, China (3) The Communist Youth League Committee of Yunnan Agricultural University, Kunming 650201, China ","","Advanced Materials Research","Adv. Mater. Res.","","Trans Tech Publications Ltd","953-954","","199-202","2014","Advanced Energy Technology","","","2014","English","10226680","16628985","","9783038351344","10.4028/www.scientific.net/AMR.953-954.199","","3rd International Conference on Energy and Environmental Protection, ICEEP 2014","April 26, 2014 - April 28, 2014","Xi'an, China","106221","","Conference article (CA)","Biomass is a kind of clean energy, which is inexhaustible and renewable. Densifying biomass into solid fuel has become one of the most important ways of utilizing biomass as a source of energy, which can overcome the shortcomings of biomass, such as low heat value, small buck density and irregular shape, etc. The main processing methods and equipments for densified biomass fuel were introduced in the paper, including their main components and working principles. The performances comparison between different types of equipment were analyzed. The purpose of this paper is to provide a reference for developing equipments of densified biomass fuel to promote a further development of densified biomass fuel industry in China. © (2014) Trans Tech Publications, Switzerland.","10","Biomass","Briquetting - Equipment - Fuels","Biomass fuels - Clean energy - Heat value - Irregular shape - Pellet - Processing method - Solid fuels - Source of energy","522 Gas Fuels - 523 Liquid Fuels - 524 Solid Fuels - 525.1 Energy Resources and Renewable Energy Issues - 901 Engineering Profession",,,,,"Compendex","Compilation and indexing terms, Copyright 2019 Elsevier Inc.","Engineering Village"
"Design of DS/FH hybrid spread spectrum system based on FPGA","20170403284579","","Liu, Longjun (1); Ding, Hongwei (1); Liu, Qianlin (1); Zhang, Weifeng (1); Liu, Zhenggang (1) ","(1) School of Information, Yunnan University, Kunming; Yunnan; 650500, China ","Ding, Hongwei(dhw1964@163.com) ","Lecture Notes in Computer Science (including subseries Lecture Notes in Artificial Intelligence and Lecture Notes in Bioinformatics)","Lect. Notes Comput. Sci.","","Springer Verlag","9713 LNCS","","573-580","2016","","","","2016","English","03029743","16113349","","9783319410081","10.1007/978-3-319-41009-8_62","","","","","","","Book chapter (CH)","Anti-interference ability is an important index to evaluate the physical fitness of communication system. Compared with general wireless communication systems, the DS/FH Hybrid spread spectrum system has high security and strong ability of anti-interception. This paper presents a design of DS/TH hybrid spread spectrum system based on FPGA. In the design, direct spread spectrum and frequency hopping spread spectrum of the input data is modulated by the spreading code. In the receiver, the pseudo random sequence is used to despread spread spectrum signal after capturing the sync signal. The simulation of the system is implemented by the combination of the hardware circuit description language Verilog HDL and the principle diagram on Quar-tus II software in the design. © Springer International Publishing Switzerland 2016.","6","Spread spectrum communication","Computer hardware description languages - Computer simulation languages - Computer software - Demodulation - Field programmable gate arrays (FPGA) - Integrated circuit design - Modulation - Signal receivers - Spectroscopy - Wireless telecommunication systems","Anti-interference - Frequency hopping spread spectrum - Hardware circuits - Hybrid spread spectrums - Pseudorandom sequences - Spread spectrum signals - Spreading codes - Wireless communication system","714.2 Semiconductor Devices and Integrated Circuits - 716.3 Radio Systems and Equipment - 721.2 Logic Elements - 723 Computer Software, Data Handling and Applications - 723.1.1 Computer Programming Languages",,"Number: 2010CD023, Acronym: -, Sponsor: Natural Science Foundation of Yunnan Province; Number: XT412004, Acronym: YNU, Sponsor: Yunnan University; Number: -, Acronym: NSFC, Sponsor: National Natural Science Foundation of China; ","This thesis was supported by the National Natural Science Foundation of China (61461053,61461054,61072079); the natural science foundation of Yunnan province (2010CD023); the financial support of Yunnan University (NO. XT412004).",,"Compendex","Compilation and indexing terms, Copyright 2019 Elsevier Inc.","Engineering Village"
"Coordination of multiagent systems with time-varying delays","20084011616258","","Yu, Hongwang (1); Zheng, Yufan (1, 2); Pan, Weiyun (1) ","(1) Department of Mathematics, University of Shanghai, Shanghai 200436, China (2) Department of Mathematics, East China Normal University, Shanghai 200062, China ","Zheng, Y.(yhw05820107@graduate.shu.edu.cn) ","Proceedings of the 27th Chinese Control Conference, CCC","Proc. Chin. Control. Conf., CCC","Chinese Association of Automation; Chinese Association of Automation Kunming Univ. Sci. Technol.; Technical Committee on Control Theory; Yunnan Division","IEEE Computer Society","","","76-80","2008","Proceedings of the 27th Chinese Control Conference, CCC","","","2008","English","","","","9787900719706","10.1109/CHICC.2008.4605346","4605346","27th Chinese Control Conference, CCC","July 16, 2008 - July 18, 2008","Kunming, Yunnan, China","73759","","Conference article (CA)","This paper investigates a coordinate stability in undirected networks of dynamical agents with fixed communication topology and time-varying transmission delay. Neighbor-based rules are adopted to realize local control strategies for these continuous-time autonomous agents. A sufficient condition in terms of linear matrix inequalities (LMIs) is given to guarantee the coordination of dynamical agents. Numerical simulations are given and demonstrate that our theoretical results are effective.","15","Autonomous agents","Continuous time systems - Linear matrix inequalities - Multi agent systems - Time delay - Time varying control systems","Communication topologies - Consensus protocols - Continuous-time - Laplacians - Local control strategies - Time varying- delays - Transmission delays - Undirected network","713 Electronic Circuits - 731.1 Control Systems - 921.1 Algebra - 961 Systems Science",,,,,"Compendex","Compilation and indexing terms, Copyright 2019 Elsevier Inc.","Engineering Village"
"New heuristic attribute reduction algorithm based on rough set","20084011616307","","Fang, Weiwei (1, 2); Yang, Bingru (1); Peng, Zheng (1) ","(1) Information Engineering School, University of Science and Technology Beijing, Beijing 100083, China (2) Beijing Information Science and Technology University, Beijing 100192, China ","Fang, W. ","Proceedings of the 27th Chinese Control Conference, CCC","Proc. Chin. Control. Conf., CCC","Chinese Association of Automation; Chinese Association of Automation Kunming Univ. Sci. Technol.; Technical Committee on Control Theory; Yunnan Division","IEEE Computer Society","","","285-287","2008","Proceedings of the 27th Chinese Control Conference, CCC","","","2008","Chinese","","","","9787900719706","10.1109/CHICC.2008.4605398","4605398","27th Chinese Control Conference, CCC","July 16, 2008 - July 18, 2008","Kunming, Yunnan, China","73759","","Conference article (CA)","This paper summarized advantages and disadvantages of recent attribute reduction algorithms, and proposed a new attribute reduction method which is taken attribute correlation as heuristic information, this method can not only remove irrelevant features, but also delete redundant features from the candidate attribute set. Theoretical analysis and experiment results demonstrate that on the premise of unchanged classification precision, the algorithm can obtain the best attribute reduce set and has good feasibility.","11","Heuristic methods","Data mining - Heuristic algorithms - Rough set theory","Attribute reduction - Attribute reduction algorithm - Attribute reduction method - Attribute sets - Classification precision - Heuristic information - Redundant features","723.1 Computer Programming - 723.2 Data Processing and Image Processing - 921.4 Combinatorial Mathematics, Includes Graph Theory, Set Theory",,,,,"Compendex","Compilation and indexing terms, Copyright 2019 Elsevier Inc.","Engineering Village"
"The contour extraction of neck lymph node ultrasound image based on multi-scale wavelet transform and GVF snake model","20140417228937","","Fei, Qinshui (1); Lu, Yujing (1); Zhang, Yufeng (1) ","(1) School of Information Science and Engineering, Yunnan University, Kunming, China ","Zhang, Y.(ynu_fei@yeah.net) ","2013 IEEE International Conference on Signal Processing, Communications and Computing, ICSPCC 2013","IEEE Int. Conf. Signal Process., Commun. Comput., ICSPCC","'IEEE Xi'an'; IEEE Hong Kong Section","IEEE Computer Society","","","","2013","2013 IEEE International Conference on Signal Processing, Communications and Computing, ICSPCC 2013","","","2013","English","","","","9781479910274","10.1109/ICSPCC.2013.6664063","6664063","2013 IEEE International Conference on Signal Processing, Communications and Computing, ICSPCC 2013","August 5, 2013 - August 8, 2013","Kunming, Yunnan, China","101981","","Conference article (CA)","It is of positive significance to extract the contour of ultrasound images for medical diagnosis. The paper proposes a method which combines with multi-scale wavelet transform modulus maxima and GVF snake algorithm to extract the contour of cervical lymph node. Firstly, the proposed method obtains the initial contour of the ultrasound image with using an algorithm of edge detection called wavelet transform modulus maxima, and then using GVF snake model can extract the accurate contour of the image. Experiments show that the method overcomes the disadvantages of the wavelet analysis getting the discontinuous edge; it is better in noise immunity and anti-artifact interference compared with the traditional GVF snake model. In addition, the initial contour is close to the real edge of the given image, thus it reduces the iteration number of gradient vector flow (GVF) field and improves the convergence speed of the contour. © 2013 IEEE.","12","Wavelet transforms","Body fluids - Diagnosis - Edge detection - Extraction - Image compression - Image enhancement - Image segmentation - Iterative methods - Medical imaging - Ultrasonic applications","Active contour model - Contour Extraction - Gradient vector flow - Multi scale analysis - Ultrasound images","461.2 Biological Materials and Tissue Engineering - 461.6 Medicine and Pharmacology - 746 Imaging Techniques - 753.3 Ultrasonic Applications - 802.3 Chemical Operations - 921.3 Mathematical Transformations - 921.6 Numerical Methods",,,,,"Compendex","Compilation and indexing terms, Copyright 2019 Elsevier Inc.","Engineering Village"
"Causes analysis on the failure of government environmental responsibility - Based on the perspective of law and economics","20174804462858","","Fa, L.N. (1) ","(1) Shanghai University of Political Science and Law (SHUPL), Post-doctor in Law, Fudan University, Shanghai, China ","Fa, L.N.(falinal2@163.com) ","IOP Conference Series: Earth and Environmental Science","IOP Conf. Ser. Earth Environ. Sci.","Yunnan Normal University","Institute of Physics Publishing","93","1","","November 9, 2017","2017 International Conference on New Energy and Future Energy System, NEFES 2017","","1 of 1","2017","English","17551307","17551315","","","10.1088/1755-1315/93/1/012026","012026","2nd International Conference on New Energy and Future Energy System, NEFES 2017","September 22, 2017 - September 25, 2017","Kunming, China","131774","","Conference article (CA)","As the important Environmental Interests of Subjects, government behooves to undertake the corresponding responsibility of Pollution Control and Environmental Protection. The current situations in our country, however, appear as government environmental responsibility failure. Based on the analysis of law and economics, this article reaches the conclusion through game analysis, principle-agency relationship and utility theory that the prisoners dilemma of environmental interest game between government and enterprise, and the inherent defect of the principal-agency relationship between central government and local government are the inherent causes of government environmental responsibility failure. Many officials tends to graft and corrupt to maximum their own benefit, thus leading to the government failure among environmental pollution treatment and the environmental responsibility to undertake. © Published under licence by IOP Publishing Ltd.","5","Environmental regulations","Economic analysis - Game theory - Pollution control","Central government - Current situation - Environmental pollutions - Environmental responsibility - Government failures - Local government - Principal agencies - Prisoners dilemma","454.2 Environmental Impact and Protection - 911.2 Industrial Economics - 922.1 Probability Theory",,"Number: 2017XQN21, Acronym: SUES, Sponsor: Shanghai University of Engineering and Science; ","This article is funded by "China National Institute for SCO International Exchange and Judicial Cooperation Research Fund Project" and "2017 Shanghai University of Political Science and Law (SHUPL) Youth Science Fund Program" (2017XQN21).","Open Access","Compendex","Compilation and indexing terms, Copyright 2019 Elsevier Inc.","Engineering Village"
"Measures to reinforce the legal liability of the environmental interest subject - Based on the perspective of law and economics","20174804462861","","Fa, L.N. (1) ","(1) Shanghai University of Political Science and Law (SHUPL), Post-doctor in Law, Fudan University, Shanghai, China ","Fa, L.N.(falinal2@163.com) ","IOP Conference Series: Earth and Environmental Science","IOP Conf. Ser. Earth Environ. Sci.","Yunnan Normal University","Institute of Physics Publishing","93","1","","November 9, 2017","2017 International Conference on New Energy and Future Energy System, NEFES 2017","","1 of 1","2017","English","17551307","17551315","","","10.1088/1755-1315/93/1/012029","012029","2nd International Conference on New Energy and Future Energy System, NEFES 2017","September 22, 2017 - September 25, 2017","Kunming, China","131774","","Conference article (CA)","Local government should be regarded as the main subject to be stipulated by environmental law, thus to avoid local government's alignment with commercial interests. Such a shift would, furthermore, discourage collusion against environment law or speculative behaviors motivated by maximizing production at the expense of environment pollution. Moreover, whether companies make proactive decisions to prevent pollution or not depends on the severity of appropriate environment legal system's sanctions for their action. It would encourage enterprises to undertake their own environmental responsibility if environmental law could further enhance their environmental liability. In addition, public environmental rights should be embedded into environmental law. In this way, the public may become more aware of their environmental rights as well as the positivity of total environmental interests. © Published under licence by IOP Publishing Ltd.","6","Environmental regulations","Environmental protection - Laws and legislation - Pollution","Environment pollution - Environmental law - Environmental liabilities - Environmental responsibility - Environmental rights - Legal liability - Legal system - Local government","454.2 Environmental Impact and Protection - 971 Social Sciences",,"Number: 2017XQN21, Acronym: SUES, Sponsor: Shanghai University of Engineering and Science; ","This article is funded by "China National Institute for SCO International Exchange and Judicial Cooperation Research Fund Project" and "2017 Shanghai University of Political Science and Law (SHUPL) Youth Science Fund Program" (2017XQN21).","Open Access","Compendex","Compilation and indexing terms, Copyright 2019 Elsevier Inc.","Engineering Village"
"The realistic dilemma of environmental interest subject of legal responsibility - Based on the perspective of law and economics","20174804462860","","Fa, L.N. (1) ","(1) Shanghai University of Political Science and Law (SHUPL), Post-doctor in Law, Fudan University, Shanghai, China ","Fa, L.N.(falina12@163.com) ","IOP Conference Series: Earth and Environmental Science","IOP Conf. Ser. Earth Environ. Sci.","Yunnan Normal University","Institute of Physics Publishing","93","1","","November 9, 2017","2017 International Conference on New Energy and Future Energy System, NEFES 2017","","1 of 1","2017","English","17551307","17551315","","","10.1088/1755-1315/93/1/012028","012028","2nd International Conference on New Energy and Future Energy System, NEFES 2017","September 22, 2017 - September 25, 2017","Kunming, China","131774","","Conference article (CA)","As the important environmental interests subject, enterprises, public and government should assume the corresponding responsibility of pollution control and environmental protection. However, in the aspect of environment, there are failure existing in performing government responsibility, the financial expense and investment our government has participated in the aspects of pollution control and environmental protection are serious insufficient. In the meantime, in spite of the clear definition of the range and principles of enterprises' environmental responsibility according to some corresponding law documents, in view of our country's condition, enterprises always fail to assume their own environmental responsibility, and there are cases existing in pollution control and environmental protection that the investment is insufficient and the treatment effect is not obvious. In addition, it is especially outstanding in our country that the awareness of public environmental rights is pretty weak. The issues of ecological damage and environmental pollution get worse and worse and the total environmental interests get injured seriously because of the failure and vacancy of environmental responsibility of different subjects of right. © Published under licence by IOP Publishing Ltd.","7","Environmental regulations","Economics - Environmental protection - Investments - Pollution control","Ecological damage - Environmental pollutions - Environmental responsibility - Environmental rights - Treatment effects","454.2 Environmental Impact and Protection - 971 Social Sciences",,"Number: 2017XQN21, Acronym: SUES, Sponsor: Shanghai University of Engineering and Science; ","This article is funded by "China National Institute for SCO International Exchange and Judicial Cooperation Research Fund Project" and "2017 Shanghai University of Political Science and Law (SHUPL) Youth Science Fund Program" (2017XQN21).","Open Access","Compendex","Compilation and indexing terms, Copyright 2019 Elsevier Inc.","Engineering Village"
"Antibacterial activity of Pu'er tea extracts in vitro","20134216860872","","Hu, Yong-Jin (1); Han, Xiao-Xi (1); Xue, Qiao-Li (2); Yang, Hua-Song (3) ","(1) College of Food Science and Technology, Yunnan Agricultural University, Kunming 650201, China (2) Library, Yunnan Agricultural University, Kunming 650201, China (3) Personal Office, Yunnan Agricultural University, Kunming 650201, China ","Yang, H.-S. ","Modern Food Science and Technology","Mod. Food Sci. Technol.","","South China University of Technology, Guangzhou, 510640, China","29","8","1770-1773+1765","August 2013","","","","2013","Chinese","16739078","","","","","","","","","","","Journal article (JA)","The antibacterial activity of the solvent extracts from Pu'er tea in vitro was studied in this paper. Filter paper disc diffusion method and minimal inhibition concentrations (MIC) were employed to determine the antibacterial activities of Pu'er tea extracts by water, 75% and 95% ethanol on S. aureus, E. coli, P. aeruginosa and B. subtili s. The 95% ethanol extracts showed the highest antibacterial effect, especially to S. aureus and E. coli.with the inhibition radius being of 19.58 ± 0.24 mm and 14.58 ± 0.24 mm, respectively. The MIC was 0.63 mg/mL, 0.39 mg/mL. But 95% ethanol extracts showed little inhibitory effect on the growth of B. subtilis. The extracts obtained using different solvent showed different antibacterial effects, amont which the ethyl acetate extracts showed the strongest antibacterial activities, followed with the extracts of n-butyl alcohol, petroleum ether and chloroform. For different bacteria tested, the ethyl acetate extracts showed the strongest effects on the growth of S. aureus with the inhibition zone diameter being of 31.88 ± 0.24 mm and the MIC being of 0.473 mg/mL. The ethyl acetate extract of Pu'er tea could significantly inhibit the growth of gram-positive and gram-negative bacteria. This study provided the references for the development and utilization of antibacterial active ingredients from Pu'er tea.","12","Solvent extraction","Bacteria - Escherichia coli - Ethanol - Organic solvents","Anti-bacterial activity - Antibacterial effects - Development and utilizations - Different solvents - Disc diffusion methods - Extract - Gram-negative bacteria - Inhibition concentrations","461.9 Biology - 523 Liquid Fuels - 802.3 Chemical Operations - 803 Chemical Agents and Basic Industrial Chemicals",,,,,"Compendex","Compilation and indexing terms, Copyright 2019 Elsevier Inc.","Engineering Village"
