Title,Accession number,Title of translation,Author,Author affiliation,Corresponding author,Source,Abbreviated source title,Sponsor,Publisher,Volume,Issue,Pages,Issue date,Monograph title,Volume title,Part number,Publication year,Language,ISSN,E-ISSN,ISBN,ISBN13,DOI,Article number,Conference name,Conference date,Conference location,Conference code,CODEN,Document type,Abstract,Number of references,Main heading,Controlled/Subject terms,Uncontrolled terms,Classification code,Treatment,Funding details,Funding text,Access type,Database,Copyright,Data Provider
"Study on the Temporal and Spatial Variation of PM2.5 in Eight Main Cities of Yunnan Province","20190306385856","","Teng, Mengfan (1, 2); Yang, Kun (1, 2); Shi, Yan (1, 2); Luo, Yi (1, 2) ","(1) Yunnan Normal University, School of Information Science and Technology, Yunnan; 650500, China (2) GIS Technology Research Center of Resource and Environment in Western China, Yunnan Normal University, Yunnan; 650500, China ","Luo, Yi(lysist@ynnu.edu.cn) ","International Conference on Geoinformatics","Int. Conf. Geoinformatics","","IEEE Computer Society","2018-June","","","December 3, 2018","Proceedings - 2018 26th International Conference on Geoinformatics, Geoinformatics 2018","","1 of 1","2018","English","2161024X","21610258","","9781538676196","10.1109/GEOINFORMATICS.2018.8557198","8557198","26th International Conference on Geoinformatics, Geoinformatics 2018","June 28, 2018 - June 30, 2018","Kunming, China","143470","","Conference article (CA)","Air haze pollution has a serious impact on human health, ecological environment and climate change. In recent years, with the introduction of new national policies and people's increasing awareness of environmental protection, haze has received widespread social attention. Haze pollution in China has always been a prominent environmental problem. The main reason for the frequent occurrence of haze pollution is PM2.5, which not only occurs in cities with high degree of industrialization or urbanization, but also often appear in regions with good air quality. This paper selects eight main cities in Yunnan Province as the research area, and uses the measured PM2.5 data from eight main cities in January 2015 to February 2018 in Yunnan Province as the basic data, using the eight urban meteorological data as the basic data, using the MK trend test and Correlation coefficient method to carry out research on the spatial-temporal variation and correlation of PM2.5 in the last three years in Yunnan Province. The space-time analysis shows that the average annual PM2.5 concentration in Lijiang City is the lowest, the monthly average concentration in Baoshan City is the highest, and the daily average concentration in Puer City is in a gentle trend; Except for Lijiang, the other seven cities all experienced different levels of pollution from March 17 to March 26, 2015; The concentration of PM2.5 in each city showed a seasonal pattern of 'U' and a pulse-like diurnal variation pattern in winter and spring, summer and autumn; cities with higher annual average concentrations in the province are concentrated in the northeast and southwest. Correlation analysis showed that PM2.5 concentration was significantly negatively correlated with precipitation and wind speed, and negatively correlated with daily average humidity and temperature. © 2018 IEEE.","22","Environmental protection","Air quality - Climate change - Correlation methods - Wind","Annual average concentration - Correlation coefficient method - Ecological environments - Haze pollutions - Humidity and temperatures - PM2.5 - Temporal and spatial variation - Trend tests","443.1 Atmospheric Properties - 451.2 Air Pollution Control - 454.2 Environmental Impact and Protection - 922.2 Mathematical Statistics",,"Number: 2012AA121402, Acronym: -, Sponsor: -; Number: 2016FD020, Acronym: -, Sponsor: Natural Science Foundation of Yunnan Province; Number: 41761084, Acronym: NSFC, Sponsor: National Natural Science Foundation of China; Number: 2012AA121402, Acronym: -, Sponsor: -; Number: 2016FD020, Acronym: -, Sponsor: Natural Science Foundation of Yunnan Province; Number: 41761084, Acronym: NSFC, Sponsor: National Natural Science Foundation of China; ","supported by the National Natural Science Foundation of China (41761084), China High Technology Research and Development Program 863 (2012AA121402), and Yunnan Natural Science Foundation of China (2016FD020).",,"Compendex","Compilation and indexing terms, Copyright 2019 Elsevier Inc.","Engineering Village"
"Global detection and identification of components from Yunnan Baiyao based on liquid chromatography hybrid ion trap time-of-flight mass spectrometry","20132616451852","","Dai, Chen (1); Liang, Yan (1); Hao, Haiping (1); Zheng, Xiao (1); Xie, Lin (1); Guan, Tianye (1); Zhou, Yuanyuan (1); Wang, Guangji (1) ","(1) State Key Lab of Natural Medicines, Key Lab of Drug Metabolism and Pharmacokinetics, China Pharmaceutical University, No. 24, Tongjia Lane, Nanjing 210009, China ","Wang, G.(guangjiwang@hotmail.com) ","Journal of Separation Science","J. Sep. Sci.","","Wiley-VCH Verlag","36","12","1935-1944","June 2013","","","","2013","English","16159306","16159314","","","10.1002/jssc.201300244","","","","","","JSSCCJ","Journal article (JA)","Yunnan Baiyao is a widely used herbal prescription in traditional medicine for the treatment of bleeding and hematological diseases, while its chemical profile remains elusive. In this work, a novel methodology combining polarity-directed extraction technique with a diagnostic ion filtering strategy based on LC hybrid ion trap TOF-MS analysis was developed for global, efficient, and rapid characterization of components in Yunnan Baiyao. Di-ethyl ether, n-butanol, and ethanol/water (70:30, v/v) covering low-to-high polarity ranges were chosen as the extraction solvent, respectively. The results clearly showed that, compared with conventional single extraction solvent, collaboratively using extraction solvents with different polarities can effectively increase the number of detected peaks and enrich the product ions information in multistage mass spectra analysis. By further matching diagnostic ions and fragmental pathways, a total of 34 components were successfully identified. Our work clearly demonstrates that integrating polarity-directed extraction and diagnostic ion filtering techniques is a powerful and reliable strategy for global detection and identification of complex chemicalome from herbal prescriptions, and may open new avenues for chemical analysis in other complex mixtures. © 2013 WILEY-VCH Verlag GmbH & Co. KGaA, Weinheim.","22","Solvent extraction","Chemical detection - Diagnosis - Ion chromatography - Ions - Mass spectrometry - Organic solvents","Detection and identifications - Diagnostic ion filtering - Extraction solvents - Extraction techniques - Hematological disease - Structural characterization - Traditional medicines - Yunnan Baiyao","461.6 Medicine and Pharmacology - 801 Chemistry - 802.3 Chemical Operations - 803 Chemical Agents and Basic Industrial Chemicals",,,,,"Compendex","Compilation and indexing terms, Copyright 2019 Elsevier Inc.","Engineering Village"
"Source of tinny granite in gejiu tin ore deposit in Yunnan Province, China","20130616001104","","Li, Yingshu (1); Cai, Yan (2); Chen, Nan (1); Chen, Jiaojiao (1); Wang, Lun (1); Zhang, Yike (1); He, Daqing (1) ","(1) Faculty of Land Resource Engineering, Kunming University of Science and Technology, Kunming, 650093, China (2) Faculty of City, Kunming University of Science and Technology, Kunming, 650093, China ","Li, Y.(gzsgjhclys@126.com) ","Advanced Materials Research","Adv. Mater. Res.","","Trans Tech Publications, P.O. Box 1254, Clausthal-Zellerfeld, D-38670, Germany","634-638","1","3493-3497","2013","Advances in Chemical, Material and Metallurgical Engineering","","","2013","English","10226680","","","9783037855898","10.4028/www.scientific.net/AMR.634-638.3493","","2012 2nd International Conference on Chemical, Material and Metallurgical Engineering, ICCMME 2012","December 15, 2012 - December 16, 2012","Kunming, China","95231","","Conference article (CA)","It had been believed that the genesis of tinny granite in Gejiu tin ore deposits were hydrothermal mineralization in granite of Yanshanian epoch by most researchers for a long time. However, according to the form, attitude and sulphur isotope in the ore of the oreboby, the authors believe the genesis of the tin ore deposit is relict body of granitic superimposed ore-forming of the Yanshanian epoch after the basic volcano ore-forming of the Indo-Chinese epoch. It's proved that the form and attitude of the oreboby is basically consistent with the form and attitude of the basalt of the Indo-Chinese epoch. Because sulphur isotope in pyrite of the ore is from 0.21 per thousand to 4.4 per thousand, feature of source of the mantle sulphur isotope is reflected. © (2013) Trans Tech Publications, Switzerland.","12","Ores","Basalt - Granite - Isotopes - Metallurgical engineering - Ore deposits - Sulfur - Tin","China - Hydrothermal mineralization - Ore-forming - Sulphur isotope - Yunnan province","804 Chemical Products Generally - 546.2 Tin and Alloys - 531 Metallurgy and Metallography - 505 Mines and Mining, Nonmetallic - 504 Mines and Mining, Metal - 502 Mines and Quarry Equipment and Operations - 481.1.2 Petrology (Before 1993, use code 482)",,,,,"Compendex","Compilation and indexing terms, Copyright 2019 Elsevier Inc.","Engineering Village"
"Analysis on Impact of Enhanced Governor on Ultra-low Frequency Oscillation in Yunnan Power Grid of China","20193107246397","","He, Yue (1); Zhang, Yong (1); Chen, Yiping (1); Mo, Weike (2) ","(1) China Southern Power Grid Dispatching and Control Center, Guangzhou; 510623, China (2) School of Electric Power, South China University of Technology, Guangzhou; 510641, China ","He, Yue(heyue@csg.cn) ","Dianli Xitong Zidonghua/Automation of Electric Power Systems","Dianli Xitong Zidonghue","","Automation of Electric Power Systems Press","43","13","185-190","July 10, 2019","","","","2019","Chinese","10001026","","","","10.7500/AEPS20190123001","","","","","","DXZIE9","Journal article (JA)","Enhanced governors are adopted in some hydroelectric units in Yunnan power grid, which causes the ultra-low frequency oscillation and threatens the frequency stability of power grid seriously. In order to reveal why the enhanced governors of hydroelectric units affect the frequency of Yunnan power grid of China, the theoretic calculation and time-domain simulation are conducted on dynamic behaviors when the system frequency difference across the dead zone of primary frequency regulation from different directions. It is demonstrated that the enhanced governor does not have a stable equilibrium point near the dead zone of primary frequency regulation of hydroelectric generator, and when the system frequency difference slowly passes back to the dead zone, a phase lag of about 90 degrees is introduced in ultra-low frequency band, thus reducing the safe and stable margin of the system frequency. Finally, the eigenvalues of a single-machine system including hydro turbine, governor and generator models are calculated with the aid of small disturbance analysis tools. Through the comparative simulation, it is shown that the enhanced governor not only has similar negative damping effect with the water hammer in ultra-low band, but also is the one of the disturbance sources of ultra-low frequency oscillation, which keeps ultra-low frequency oscillation continuous and unable to attenuate. © 2019 Automation of Electric Power Systems Press.","25","Electric power transmission networks","Eigenvalues and eigenfunctions - Frequency stability - Governors - Hydroelectric generators - Time domain analysis","Asynchronous interconnections - Comparative simulation - Hydroelectric units - Primary frequency regulation - Small disturbance analysis - Time-domain simulations - Ultra low frequencies - Yunnan power grid","602.1 Mechanical Drives - 611.1 Hydroelectric Power Plants - 706.1.1 Electric Power Transmission - 921 Mathematics - 961 Systems Science",,,,,"Compendex","Compilation and indexing terms, Copyright 2019 Elsevier Inc.","Engineering Village"
"Study on the association between the surface latent heat flux(SLHF)in Tengchong region with the earthquakes in Sichuan-Yunnan region","20143118006308","","Chen, Mei-Hua (1); Deng, Zhi-Hui (2, 3); Liang, Qi-Zhen (1); Ding, Liu-Wei (3); Tao, Jing-Ling (3) ","(1) Zhejiang Normal University, Jinhua 321004, China (2) Earthquake Administration of Guangdong Province, Guangzhou 510070, China (3) Institute of Geology, China Earthquake Administration, Beijing 100029, China ","Deng, Z.-H.(deng6789@163.com) ","Dizhen Dizhi","Dizhen Dizhi","","State Seismology Administration","36","2","422-433","June 2014","","","","2014","Chinese","02534967","","","","10.3969/j.issn.0253-4967.2014.02.012","","","","","","","Journal article (JA)","Domestic and foreign scholars found that SLHF anomaly occurred before some strong earthquakes in coastal area or in inland region with abundant water. The author noted that SLHF anomaly in some special tectonic position is not only associated with the strong earthquakes nearby but also with the strong earthquakes far away in the same tectonic belt. The dynamic variation rule of SLHF anomaly in the special tectonic position prior to earthquakes might reveal some trend of regional seismic activity and contribute to the research of mechanism of SLHF anomaly prior to earthquakes. Tengchong area in Yunnan Province is such a special tectonic position located in the south of the eastern Himalayan syntaxis and is one of the youngest volcanic regions on the Chinese mainland with frequent magmatic activity and strong hydrothermal activity. The earthquakes (MS≥6.4) since 2000 in Sichuan-Yunnan region(including the Yao'an MS6.5 earthquake in 2000, the Ning'er MS6.4 earthquake in 2007, the Wenchuan MS8.0 earthquake in 2008, the MS7.0 Myanmar earthquake in 2011 and the Lushan MS7.0 earthquake in 2013)are selected as cases to study the variation characteristics of the SLHF in Tengchong region before and after the above earthquakes. It is found that significant SLHF anomalies occurred in Tengchong area not only before earthquakes happening in the vicinity but also earthquakes far away in the surroundings. The SLHF anomalies occurred mostly within one and half months before the earthquakes, except Wenchuan MS8.0 earthquake. The SLHF anomalies occurred two months before Wenchuan earthquake, the earlier occurrence of the anomalies might be due to the relatively long distance between Wenchuan earthquake and Tengchong area. It is also found that the amplitude of anomaly is related to earthquake magnitude, the larger the magnitude of earthquake, the larger the amplitude of the anomalies. For example, the SLHF anomalies in Tengchong region prior to Burma MS7 earthquake and Wenchuan MS8.0 earthquake are very strong, far more than the reference maximum values, but the SLHF anomalies prior to Yao'an MS6.5 earthquake and Ning'er MS6.4 earthquake are relatively small. The sensitive response of SLHF in Tengchong region to the surrounding earthquakes on the one hand is related to the development of active faults and the present-day intensive crustal deformation; on the other hand, there are strong volcanic activities in Tengchong area, with springs widely developed and water heat exchanging quickly. So as a result, the SLHF of this region is sensitive to surrounding tectonic movement.","20","Earthquakes","Faulting - Heat flux - Latent heat - Remote sensing - Volcanoes","Crustal deformations - Earthquake magnitudes - Hydrothermal activity - Sichuan-Yunnan region - Surface latent heat fluxes - Thermal anomalies - Variation characteristics - Volcanic activities","484 Seismology - 484.1 Earthquake Measurements and Analysis - 641.1 Thermodynamics - 641.2 Heat Transfer",,,,,"Compendex","Compilation and indexing terms, Copyright 2019 Elsevier Inc.","Engineering Village"
"Discussion on metallogenic environment, mineralization and genesis of Dahongshan iron-copper deposit, Yunnan","20163802829631","","Deng, Ming Guo (1); Xu, R. (1); Wang, P. (1); Cang, F.B. (1); Zeng, L. (1); Lv, C.L. (1); Liu, W. (1) ","(1) Faculty of Land Resource Engineering, Kunming University of Science and Technology, Kunming; Yunnan, China ","Deng, Ming Guo ","Computer, Intelligent Computing and Education Technology - Selected Peer Reviewed Papers From 2014 International Conference on Computer, Intelligent Computing and Education Technology, CICET 2014","Comput., Intell. Comput. Educ. Technol. - Sel. Peer Rev. Pap. Int. Conf. Comput., Intell. Comput. Educ. Technol., CICET","","CRC Press/Balkema","2","","1127-1132","2014","","Selected Peer Reviewed Papers from 2014 International Conference on Computer, Intelligent Computing and Education Technology, CICET 2014","2 of 2","2014","English","","","","9781138026407","","","International Conference on Computer, Intelligent Computing and Education Technology, CICET 2014","March 27, 2014 - March 28, 2014","Hong Kong, China","160029","","Conference article (CA)","Dahongshan Iron-Copper Deposit (Hereafter to be shorted as DICD) is located to the northeast of the Honghe fault at the western margin of the Yangtze Paraplatform, and at the southern end of the Kangdian Axis. DICD is composed of a large-scale high-grade iron deposit and a large-scale high-grade copper deposit, hosted in the Pre-Sinian palaeomarine volcanic rocks. DICD is a combination of various deposits, which are interactive in genesis, approximately centered around a volcanic intrusion activity center. These deposits constitute a typical plaeosubmarine volcanic eruption-sedimentation metallogenic series. The study on the Early Proterozoic Dahongshan Group meta-volcanic rocks indicates that the volcanic rocks have typical nature of ocean-ridge tholeiite and that the magma sources have the features of little enriched transitional mantle (T-type MORB). Combined with the palaeotectonic study, we consider that the volcanic rocks are the product of marginal basins during the process of extension. Rifting caused the relatively enclosed reducing marine basins, in which the well-known “Dahongshan” iron-copper deposit was formed under the volcanic eruption-sedimentation-superimposition. © 2014 Taylor & Francis Group, London.",,"Volcanic rocks","Copper deposits - Deposits - Intelligent computing - Iron deposits - Volcanoes","Deposit genesis - Iron-copper - Proterozoic - Tholeiitic magmas - Volcanic eruptionsedimentation - Yunnan","482.2 Minerals - 484 Seismology - 504.3 Heavy Metal Mines - 723.4 Artificial Intelligence",,,,,"Compendex","Compilation and indexing terms, Copyright 2019 Elsevier Inc.","Engineering Village"
"Discussion on metallogenic environment, mineralization and genesis of Dahongshan Iron-Copper Deposit, Yunnan","20141317521173","","Deng, M.G. (1); Xu, R. (1); Wang, P. (1); Cang, F.B. (1); Zeng, L. (1); Lv, C.L. (1); Liu, W. (1) ","(1) Faculty of Land Resource Engineering, Kunming University of Science and Technology, Kunming, Yunnan, China ","Deng, M.G. ","Computer, Intelligent Computing and Education Technology - Selected Peer Reviewed Papers From 2014 International Conference on Computer, Intelligent Computing and Education Technology, CICET 2014","Comput., Intell. Comput. Educ. Technol. - Sel. Peer Rev. Pap. Int. Conf. Comput., Intell. Comput. Educ. Technol., CICET","Control Engineering and Information Science; International Frontiers of Science and; Research Association; Technology Research Association","","2","","1127-1131","2014","Advanced Engineering and Technology - Proceedings of the 2014 Annual Congress on Advanced Engineering and Technology, CAET 2014","","","2014","English","","","","9781138026407","","","2014 International Conference on Computer, Intelligent Computing and Education Technology, CICET 2014","March 27, 2014 - March 28, 2014","Hong Kong, Hong kong","103312","","Conference article (CA)","Dahongshan Iron-Copper Deposit (Hereafter to be shorted as DICD) is located to the northeast of the Honghe fault at the western margin of the Yangtze Paraplatform, and at the southern end of the Kangdian Axis. DICD is composed of a large-scale high-grade iron deposit and a large-scale high-grade copper deposit, hosted in the Pre-Sinian palaeomarine volcanic rocks. DICD is a combination of various deposits, which are interactive in genesis, approximately centered around a volcanic intrusion activity center. These deposits constitute a typical plaeosubmarine volcanic eruption-sedimentation met-allogenic series. The study on the Early Proterozoic Dahongshan Group meta-volcanic rocks indicates that the volcanic rocks have typical nature of ocean-ridge tholeiite and that the magma sources have the features of little enriched transitional mantle (T-type MORB). Combined with the palaeotectonic study, we consider that the volcanic rocks are the product of marginal basins during the process of extension. Rifting caused the relatively enclosed reducing marine basins, in which the well-known 'Dahongshan' iron-copper deposit was formed under the volcanic eruption-sedimentation-superimposition. © 2014 Taylor & Francis Group.",,"Volcanic rocks","Copper deposits - Deposits - Engineering education - Intelligent computing - Iron deposits - Sedimentation - Volcanoes","Deposit genesis - Iron-copper - Proterozoic - Tholeiitic magmas - Volcanic eruptions - Yunnan","482.2 Minerals - 484 Seismology - 504.3 Heavy Metal Mines - 723.4 Artificial Intelligence - 802.3 Chemical Operations - 901.2 Education",,,,,"Compendex","Compilation and indexing terms, Copyright 2019 Elsevier Inc.","Engineering Village"
"A study on digital isoseisms fast drawing method based on GIS - Take an example of Yunnan Province","20140717300561","","Zhang, Shaohua (1, 2); Yang, Kun (1, 3); Peng, Shuangyun (1, 2); Xu, Quanli (1, 2); Hong, Liang (1, 2); Li, Jinping (1, 2); Li, Yongqiang (4); Zhang, Fanghao (4) ","(1) Engineering Research Center of GIS Technology in Western China, Ministry of Education, Kunming, China (2) School of Tourism and Geographic Sciences, Yunnan Normal University, Kunming, China (3) School of Information Science and Technology, Yunnan Normal University, Kunming, China (4) Earthquake Administration of Yunnan Province, Kunming, China ","Yang, K.(kmdcynu@163.com) ","International Conference on Geoinformatics","Int. Conf. Geoinformatics","Henan University, Key Research Institute of; IEEE Geoscience and Remote Sensing Society (IEEE GRSS); Ministry of Education; The Geographical Society of Henan Province; Yellow River Civilization and Sustainable Development,","IEEE Computer Society","","","","2013","Proceedings - 2013 21st International Conference on Geoinformatics, Geoinformatics 2013","","","2013","English","2161024X","21610258","","9781467362283","10.1109/Geoinformatics.2013.6626151","6626151","2013 21st International Conference on Geoinformatics, Geoinformatics 2013","June 20, 2013 - June 22, 2013","Kai Feng, China","102377","","Conference article (CA)","This paper discusses how to use the ArcEngine components and Orcale database to quickly draw the Yunnan Province digital isoseisms. Besides the current general ellipse model, the paper was the first time to complete the line source model of isoseisms drawing. At the same time, it improved the Binary search algorithm in order to quickly find closest active fault. Then the existing isoseisms file provided three correction methods: parameter correction, aftershocks correction and manual correction, which were respectively applied for the different data and purpose of the correction. Finally, taking an example of the simulation for Ning'er 6.4 and Lijiang 7.0 earthquake to demonstrate the method of fast drawing Yunnan digital isoseisms, and the method turned out to be feasible and practicable. © 2013 IEEE.","12","Geographic information systems","Earthquakes - Faulting","Binary search - Binary search algorithm - Correction method - Ellipse model - Key words - Line source models - Parameter correction - Yunnan province","484 Seismology - 484.1 Earthquake Measurements and Analysis - 903.3 Information Retrieval and Use",,,,,"Compendex","Compilation and indexing terms, Copyright 2019 Elsevier Inc.","Engineering Village"
