Title,Accession number,Title of translation,Author,Author affiliation,Corresponding author,Source,Abbreviated source title,Sponsor,Publisher,Volume,Issue,Pages,Issue date,Monograph title,Volume title,Part number,Publication year,Language,ISSN,E-ISSN,ISBN,ISBN13,DOI,Article number,Conference name,Conference date,Conference location,Conference code,CODEN,Document type,Abstract,Number of references,Main heading,Controlled/Subject terms,Uncontrolled terms,Classification code,Treatment,Funding details,Funding text,Access type,Database,Copyright,Data Provider
"The restrictions of fo2and fs2for lead-zinc paragenesis and separation of the zhaotong huize-type Pb-Zn deposit in Northeast Yunnan, China","20145000326382","","Zhang, Yan (1); Han, Runsheng (1); Wu, Peng (1); Zhou, Gaoming (2); Wei, Pingtang (3); Qiu, Wenlong (1) ","(1) Faculty of Land Resources Engineering/Southwest of Geological Survey, Geological Survey Center for Non-ferrous Metals Resources, Kunming University of Science and Technology, Kunming; Yunnan; 650093, China (2) Zhaotong Lead-zinc Mine, Yiliang; Yunnan; 657602, China (3) Kunming Geological Prospecting Institute, China Metallurgical Geological Bureau, Kunming; Yunnan; 650024, China ","Han, Runsheng ","Geotectonica et Metallogenia","Geotecton. Metallog.","","Science Press","38","4","898-907","November 1, 2014","","","","2014","Chinese","10011552","20959508","","","","","","","","","","Journal article (JA)","The Huize-type Pb-Zn deposits in Northeast Yunnan, located in the north side of the Sichuan-Yunnan-Guizhou lead-zinc polymetallic mineralization domain and tectonically on the southwestern margin of the Yangtze block, are controlled by thrust-fold structures directly. The Zhaotong large-size Pb-Zn deposit is one of the representatives of these deposits. The major minerals of the Huize-type lead-zinc deposits are commonly characterized by zonation, i.e., coarse-grained pyrite+a little puce sphalerite→brown sphalerite+galena+ferrodol¬omite→galena+sandy beige and faint yellow sphalerite+quartz+calcite → fine-grained pyrite+dolomite+calcite from the floor to the roof of the ore bodies. The ore-forming mechanism of the pattern is one of the key scientific issues in the study of the evolution process of the ore-forming fluid driven by structure. This paper, demonstrating the Zhaotong Pb-Zn deposit as a case study, has studied the controlling mechanism of oxygen-sulfur fugacity for the main metal sulfide assemblages and mineral zoning. It will contribute to understand the forming mechanism of paragenesis and separation of lead and zinc. logfo2-logfs2phase diagrams for the lead, zinc, iron sulfides and oxides under equilibrium in the relevant hydrothermal system have been re-constructed on the basis of the test results of fluid inclusions and the results of rock and ore appraisal. The calculated results and the phase diagrams indicated that the fo2and fs2conditions of the transport and precipitation in which the various kinds of minerals and their assemblages formed, and the processes and mechanism of the metallic mineral zoning have been discussed. Taking the 473 K phase diagram as example, the stable logfo2-logfs2ranges of the 16 kinds of minerals and their assemblages and the block distribution are analyzed. It is shown that metallic mineral zoning and the lead-zinc paragenesis and separation of the deposit was resulted from the variation of fo2and fs2. With the decrease of the temperature, the values of fo2and fs2required for mineral precipitation also decreased. The results of the theoretic calculation and the phase diagrams are consistent with both macro-geological and micro-geological characteristics of the lead-zinc mineralization. ©, 2014, Science Press. All right reserved.","10","Lead zinc deposits","Binary alloys - Calcite - Deposits - Geology - Iron oxides - Lead alloys - Mineralogy - Phase diagrams - Pyrites - Separation - Sulfur compounds - Zinc alloys - Zinc sulfide - Zoning","Controlling mechanism - Fo2 and fs2 - Geological characteristics - Mineral precipitation - Mineral zoning - Northeast Yunnan - Zhaotong - Zinc mineralization","481.1 Geology - 482 Mineralogy - 546.1 Lead and Alloys - 546.3 Zinc and Alloys - 802.3 Chemical Operations - 804.2 Inorganic Compounds",,,,,"Compendex","Compilation and indexing terms, Copyright 2019 Elsevier Inc.","Engineering Village"
"Geological conditions evaluation and favorable areas selection of the shale gas from Longmaxi Formation in the Northeast of Yunnan","20153301178137","","Zhang, Xu (1, 2); Liu, Cheng-Lin (1, 2); Zhu, Yan-Ming (3, 4); Wang, Yang (3, 4); Fu, Chang-Qing (3, 4) ","(1) Key Laboratory of Shale Oil and Gas Survey and Evaluation, Chinese Academy of Geological Sciences, Beijing, China (2) Institute of Geomechanics, Chinese Academy of Geological Sciences, Beijing, China (3) School of Resources and Geosciences, China University of Mining and Technology, Xuzhou, China (4) Key Laboratory of Coalbed Methane Resources and Reservoir Formation Process, The Ministry of Education, China University of Mining and Technology, Xuzhou, China ","","Natural Gas Geoscience","Nat. Gas Geosci.","","Science Press","26","6","1190-1199","June 10, 2015","","","","2015","Chinese","16721926","","","","10.11764/j.issn.1672-1926.2015.06.1190","","","","","","","Journal article (JA)","According to measured profiles and lab tests in the Longmaxi Formation of the northeast of Yunnan, TOC and maturity of the samples were determined. And also, the shale gas reservoirs were investigated by XRD, high pressure mercury intrusion, gas absorption and scanning electron microscope. Besides the above methods, isothermal absorption is also used to evaluate the favorable area in the study area. The results show that: (1)the black shales are distributed in the lower segment of Longmaxi Formation, and the average thickness is more than 30 m and it gradually increases from southeast to northwest in the study area. With Yanjin and Daguan counties as the center, the burial depth of strata increases outward. (2)Regionally, TOC of shale increases from south to north, and it is more than 2% in the northwest of Yanjin and the north of Weixin. Vertically, TOC of shale is more than 2% in lower segment of Longmaxi Formation, but less than 1% in the upper segment of Longmaxi Formation. The measured average vitrinite reflectance of shales is 3.6%, showing that the shales are at the over-mature stage. (3)The shales have more brittle minerals in the study area, so the reservoirs are easy to be artificially fractured. Compared with the major gas shales in the north American, clay mineral contents are higher but brittle minerals (quartz, et al.) and carbonate minerals (calcite, et al.) are less in the study area. (4)Mercury injection experiments show that the pores are mainly transition pores and micro pores, but the pore opening degree decreases from the bottom to top in the Longmaxi Formation. Liquid nitrogen adsorption experiments indicate that pores with diameters less than 20nm are better developed in the transition pores and micro pores. Moreover, the two ends of pores are open, with the shapes of cylinders, cones, parallel plates, and a certain amount of flask pores. Measured pore specific surface area is 6.479-17.329cm2/g, with the mean of 11. 425cm2/g. The pore volume is 0.006-0.016cm3/g. The pore average size is 3.256-4.367nm. (5)Isothermal adsorption experiments show that maximum absorbed gas content of the shales in Longmaxi Formation can attain 3.21cm3/g. Comprehensively, this paper has selected three favorable areas for shale gas, including the area between Yanjin and Suijiang county, the northeast of Daguan and the southwest of Weixin. ©, 2015, Science Press. All right reserved.","35","Shale","Gas absorption - Gas adsorption - Gases - Ionization of gases - Isotherms - Mercury (metal) - Minerals - Scanning electron microscopy - Shale gas","Favorable area - Geological conditions - High pressure mercury - Isothermal adsorption - Longmaxi Formation - Northeast of Yunnan - Shale gas reservoirs - Vitrinite reflectance","482.2 Minerals - 549.3 Nonferrous Metals and Alloys excluding Alkali and Alkaline Earth Metals - 931.2 Physical Properties of Gases, Liquids and Solids",,,,,"Compendex","Compilation and indexing terms, Copyright 2019 Elsevier Inc.","Engineering Village"
"Late Cretaceous metallogeny in the Zhongdian area: Constraints from Re-Os dating of molybdenite and pyrrhotite from the Hongshan Cu deposit, Yunnan, China","20161902344423","","Zu, Bo (1); Xue, Chunji (1); Zhao, Yi (1); Qu, Wenjun (2); Li, Chao (2); Symons, David T.A. (3); Du, Andao (2) ","(1) State Key Laboratory of Geological Processes and Mineral Resources, Faculty of Earth Sciences and Resources, China University of Geosciences, Beijing; 100083, China (2) National Research Center for Geoanalysis, Beijing; 100037, China (3) Department of Earth Sciences, University of Windsor, N9B 3P4, Windsor; ON, Canada ","Xue, Chunji(chuji.xue@cugb.edu.cn) ","Ore Geology Reviews","Ore Geol. Rev.","","Elsevier B.V.","64","","1-12","January 1, 2015","","","","2015","English","01691368","","","","10.1016/j.oregeorev.2014.06.009","","","","","","","Journal article (JA)","The Zhongdian area in Yunnan, southwestern China, located at the southern end of the Yidun volcano-magmatic arc that was formed during the Triassic westward subduction of the Gaze-Litang Ocean, hosts numerous Triassic large porphyry and skarn deposits. The arc suffered Jurassic to Cretaceous arc-continental orogenic collision and Cenozoic intracontinental strike-slip shearing. The Hongshan Cu (-Mo-Pb-Zn) deposit is potentially a large deposit and contains two ore types: 1) predominant layered skarn Cu-(Pb-Zn) ores along marble-hornfels contacts; and 2) minor crosscutting vein-type Cu-Mo mineralization. Previous research forwards a two-stage genetic model without sufficient dating evidence, supposing the skarn mineralization is related to the Triassic calc-alkalic intrusions and the vein-type mineralization related to Cretaceous quartz monzonite porphyries. Re-Os dating of molybdenite from vein-type ores and quartz monzonite porphyries and that of pyrrhotite from skarn ores are presented here to constrain the mineralization age and rebuild the genetic model. Analyses of eight molybdenite samples yield an isochron age of 79.7±3.1Ma (MSWD=9.2) for the vein-type mineralization and a model age of 81.9±1.1Ma for the quartz monzonite porphyries. Isotope data on seven pyrrhotite samples from the skarn ores yield an isochron age of 79±16Ma z(MSWD=8.4). The Re-Os ages for the two ore types are concordant within analytical errors, indicating that the Hongshan deposit was formed in the Late Cretaceous. Elevated Re contents in molybdenite (13.65 to 63.91μg/g) and extremely radiogenic initial187Os/188Os ratios in pyrrhotite (0.7673 to 0.8184; weighted average 0.796±0.038), together with elevated γOsvalues in pyrrhotite (507 to 547; average 528) imply a significant crustal component in the ore-forming materials that was likely derived from a lower crustal reservoir. Combined with the tectonic evolution of the Zhongdian area and geochemical characteristics of corresponding intrusions, the ages of mineralization obtained in this study indicate that the Hongshan deposit was formed in a post-collision setting with a genetic relationship to the emplacement of the quartz monzonite porphyry. These results provide significant new information for the study and exploration of the Late Cretaceous metallogeny in the Zhongdian area. © 2014 Elsevier B.V.","80","Mineralogy","Binary alloys - Copper - Copper alloys - Copper deposits - Deposits - Iron ores - Molybdenum alloys - Osmium alloys - Quartz - Rhenium alloys - Tungsten alloys","Collisional - Genetic relationships - Geochemical characteristic - Metallogeny - Ore forming material - Polymetallic - Tectonic evolution - Yunnan , China","482 Mineralogy - 482.2 Minerals - 504.3 Heavy Metal Mines - 543.3 Molybdenum and Alloys - 543.5 Tungsten and Alloys - 544.1 Copper - 544.2 Copper Alloys - 547.1 Precious Metals - 549.3 Nonferrous Metals and Alloys excluding Alkali and Alkaline Earth Metals",,"Number: 40772061, Acronym: NSFC, Sponsor: National Natural Science Foundation of China; Number: 40930423, Acronym: NSFC, Sponsor: National Natural Science Foundation of China; Number: 41072069, Acronym: NSFC, Sponsor: National Natural Science Foundation of China; ","This research is jointly funded by the Chinese National Natural Science Fund (41072069, 40930423 and 40772061) and the National Key Basic Research Development Program (973 Program) (2009CB421005)",,"Compendex","Compilation and indexing terms, Copyright 2019 Elsevier Inc.","Engineering Village"
"A new type of Nb (Ta)-Zr(Hf)-REE-Ga polymetallic deposit in the late Permian coal-bearing strata, eastern Yunnan, southwestern China: Possible economic significance and genetic implications","20102513019034","","Dai, Shifeng (1); Zhou, Yiping (2); Zhang, Mingquan (2); Wang, Xibo (1); Wang, Jumin (2); Song, Xiaolin (2); Jiang, Yaofa (3); Luo, Yangbing (1); Song, Zhentao (1); Yang, Zong (2); Ren, Deyi (1) ","(1) State Key Laboratory of Coal Resources and Safe Mining, China University of Mining and Technology, Beijing 100083, China (2) Yunnan Institute of Coal Geology Prospection, Kunming 650218, China (3) Xuzhou Institute of Architectural Technology, Xuzhou 221116, China ","Dai, S.(daishifeng@gmail.com) ","International Journal of Coal Geology","Int. J. Coal Geol.","","Elsevier B.V.","83","1","55-63","July 2010","","","","2010","English","01665162","","","","10.1016/j.coal.2010.04.002","","","","","","IJCGDE","Journal article (JA)","This paper describes a new type of Nb(Ta)-Zr(Hf)-REE-Ga polymetallic deposit of volcanic origin in the late Permian coal-bearing strata of eastern Yunnan, southwestern China. Well logging data (especially natural gamma-ray), geochemical data (high concentrations of Nb, Ta, Zr, Hf, REE, and Ga) and mineralogical compositions (Nb(Ta)-, Zr(Hf)-, or REE-bearing minerals rarely observed), together with the volcanic lithological characteristics indicate that there are thick (1-10m, mostly 2-5m) ore beds in the lower Xuanwei Formation (late Permian) in eastern Yunann of southwestern China. The ore beds are highly enriched in (Nb,Ta)2O5(302-627ppm), (Zr,Hf)O2(3805-8468ppm), REE (oxides of La-Lu+Y) (1216-1358ppm), and Ga (52.4-81.3ppm). The ore beds are mainly composed of quartz, mixed-layer illite-smectite, kaolinite, berthierine, and albite. Four types of ore beds in the study area were identified, namely, clay altered volcanic ash, tuffaceous clay, tuff, and volcanic breccia. Preliminary studies suggest that the high concentrations of otherwise rare metals were mainly derived from the alkalic pyroclastic rocks. The modes of occurrence, spatial distribution, and enrichment mechanism of the rare metals, however, require further study. © 2010 Elsevier B.V.","34","Coal deposits","Coal - Deposits - Feldspar - Gamma rays - Kaolinite - Lithology - Niobium - Ores - Volcanoes - Well logging","Coal-bearing stratum - Eastern Yunnan - Late Permian - Mineralogical compositions - Mixed-layer illite-smectite - Modes of occurrences - Pyroclastic origin - Pyroclastic rocks","481.1 Geology - 482.2 Minerals - 484 Seismology - 503 Mines and Mining, Coal - 524 Solid Fuels - 549.3 Nonferrous Metals and Alloys excluding Alkali and Alkaline Earth Metals - 931.3 Atomic and Molecular Physics",,"Number: 40725008, Acronym: -, Sponsor: China National Funds for Distinguished Young Scientists; Number: 40831160520, Acronym: NSFC, Sponsor: National Natural Science Foundation of China; ","This research was supported by the National Science Fund for Distinguished Young Scholars (no. 40725008 ) and the National Natural Science Foundation of China (no. 40725008 , 40831160520 ). Special thanks were given to a group of young men and young women in Yunnan Institute of Coal Geology Prospection for their help in sample collection.",,"Compendex","Compilation and indexing terms, Copyright 2019 Elsevier Inc.","Engineering Village"
"Forest aboveground biomass estimation using ICESat/GLAS and imagery remote sensing data in the Greater Mekong Subregion: 1stresult from Yunnan Province, China","20132916506994","","Pang, Yong (1); Li, Zengyuan (1); Huang, Kebiao (2); Zhao, Kairui (1, 3); Bun, Guoqing (4); Snu, Qingtai (3); Yue, Cairong (3) ","(1) Institute of Forest Resource Information Technique, Chinese Academy of Forestry, Beijing 100091, China (2) Asia-Pacific Network for Sustainable Forest Management and Rehabilitation, Beijing 100013, China (3) Forestry Institute, Southwest Forestry University, Kunming 650224, China (4) Department of Geography, University of Maryland, College Park, MD 20742, United States ","","33rd Asian Conference on Remote Sensing 2012, ACRS 2012","Asian Conf. Remote Sens., ACRS","ATHI TELECOM; e-geos; et al.; SPACEALLIANCE; TELESPAZIO; Thales Alenia Space","Asian Association on Remote Sensing","1","","9-16","2012","33rd Asian Conference on Remote Sensing 2012, ACRS 2012","","","2012","English","","","","9781622769742","","","33rd Asian Conference on Remote Sensing 2012, ACRS 2012","November 26, 2012 - November 30, 2012","Pattaya, Thailand","97670","","Conference article (CA)","This study aims to develop a forest aboveground biomass (AGB) mapping method in the Greater Mekong Subregion (GMS). Vertical structure of forest parameters of two forest farms in Yunnan province, China were derive using airborne LiDAR system (ALS). Regression models were built between field data of forest AGB and percentiles of canopy height, canopy density which derived from ALS point cloud data. The high accuracy ALS estimated forest aboveground biomass (AGB) were used as training data for building forest AGB estimation model with ICESat GLAS waveform indices. Then the forest ABG was estimated at ICESat GLAS footprint level in the whole province. The regression tree and MAXENT methods were investigated to extend the AGB estimation from GLAS footprint to continuous mapping using imagery remote sensing data of ENVISAT MERIS and EOS MODIS data. The preliminary results showed that: 1) The integrated method based on field measurements, airborne and spaceborne LiDAR data can be used to estimate forest aboveground biomass effectively. 2) The estimation agreed well with inventory based results, and the average difference was about 10%. 3) Both regression tree and MAXENT methods predicted AGB spatial distribution well. 4) These methods will be investigated further and used to the entire Greater Mekong Subregion with more reference training data.","18","Mapping","Biomass - Forestry - Optical radar - Regression analysis - Remote sensing","Above ground biomass - Airborne lidar systems - Average difference - Continuous mappings - Remote sensing data - The Greater Mekong Subregion - Vertical structures - Yunnan province","405.3 Surveying - 716.2 Radar Systems and Equipment - 922.2 Mathematical Statistics",,,,,"Compendex","Compilation and indexing terms, Copyright 2019 Elsevier Inc.","Engineering Village"
"Zircon U-Pb geochronology and Hf isotopic composition of the Xin'anzhai granite along the Ailaoshan tectonic zone in west Yunnan province","20132116359723","","Liu, Huichuan (1, 2); Wang, Yuejun (1); Cai, Yongfeng (1, 2); Ma, Liyan (1, 2); Xing, Xiaowan (1, 2); Fan, Weiming (1) ","(1) State Key Laboratory of Isotope Geochemistry, Guangzhou Institute of Geochemistry, Chinese Academy of Sciences, Guangzhou 510640, Guangdong, China (2) University of Chinese Academy of Sciences, Beijing 100049, China ","Liu, H.(liuhuichuan@gig.ac.cn) ","Geotectonica et Metallogenia","Geotecton. Metallog.","","Science Press","37","1","87-98","February 2013","","","","2013","Chinese","10011552","","","","","","","","","","","Journal article (JA)","A set of zircon U-Pb geochronogical and in-stiu Hf isotopic data was presented for the Xin'anzhai granite along the Ailaoshan tectonic zone in west Yunnan province. Our dating results show that zircon grains separated from the two samples (10HH-43B and 10HH-45B) from the Xin'anzhai granite yield weighted mean206Pb/238U ages of 251.9±1.4 Ma and 251.2±1.4 Ma, respectively, which are interpreted as the crystallization age of the Xin'anzhai pluton. This indicates that the Xin'anzhai pluton emplaced at P-T boundary rather than during the Yanshanian period or late Triassic previously perceived of. Their ΕHf(t) values range from -9.8~-6.2 for 10HH-43B and -11.1~-3.1 for 10HH-45B with mean values of -7.6 and -6.9, respectively. The corresponding two-stage Hf model ages range from 1.67~1.90 Ga and 1.47~2.00 Ga. These data together with other observations indicate that the Xin'anzhai peraluminous biotite monzonitic granite originated from the metagreywacke in the Proterozoic Ailaoshan metamorphic complex and formed in the syn-collisional setting in response to the assemblage of the Yangtze with Simao-Indochina Blocks.","61","Hafnium","Binary alloys - Geochronology - Granite - Isotopes - Lead alloys - Mica - Silicate minerals - Tectonics - Uranium alloys - Zircon","Collisional - Crystallization age - Hf isotope - Isotopic composition - Isotopic data - Late Triassic - Yunnan province - Zircon U-Pb geochronologies","481.1 Geology - 482.2 Minerals - 482.2.1 Gems - 546.1 Lead and Alloys - 547 Minor, Precious and Rare Earth Metals and Alloys - 549.3 Nonferrous Metals and Alloys excluding Alkali and Alkaline Earth Metals",,,,,"Compendex","Compilation and indexing terms, Copyright 2019 Elsevier Inc.","Engineering Village"
"Planar velocity distribution of viscous debris flow at Jiangjia Ravine, Yunnan, China - A field measurement with two radar velocimeters","20085211816281","","Fu, X.D. (1); Wang, G.Q. (1); Kang, Z.C. (2); Fei, X.J. (1) ","(1) State Key Laboratory of Hydroscience and Engineering, Tsinghua University, Beijing, China (2) Debris Flow Research Division, Institute of Mountain Hazards and Environment of Chinese Academy of Science, Chengdu, Sichuan, China ","Fu, X. D. ","International Conference on Debris-Flow Hazards Mitigation: Mechanics, Prediction, and Assessment, Proceedings","Int Conf Debriz Flow Hazards Mitigation Mech Predict Assess","American Geophysical Union; Association of Engineering Geologists; Environmental and Water Resources Institute of ASCE; Geo-Institute of the American Society of Civil Engineers; Geological Society of America","ASCE - American Society of Civil Engineers","","","531-538","2007","4th International Conference on Debris-Flow Hazards Mitigation: Mechanics, Prediction, and Assessment","","","2007","English","","","","9789059660595","","","4th International Conference on Debris-Flow Hazards Mitigation: Mechanics, Prediction, and Assessment","September 10, 2007 - September 13, 2007","Chengdu, China","74787","","Conference article (CA)","This paper presents measured data of planar velocity distribution of viscous debris flows at Jiangjia Ravine, Yunnan, China. The velocities along the ravine width were measured by using two radar velocimeters, and the cross-sectional mean velocities were then calculated. The velocity coefficient, K, defined by the ratio of the mean velocity to the maximum velocity, ranges from 0.2 to 0.6. The Kang et al. (2004) relationship, which was established for converting the flow velocity at river centerline measured by a radar velocimeter into the mean velocity, was found to being inapplicable to flows with K smaller than 0.44. © 2007 Millpress.","6","Velocity distribution","Debris - Flow velocity - Hazards - Radar - Radar measurement - Velocimeters - Velocity - Velocity measurement","Centerlines - Field measurement - Jiangjia ravine - Maximum velocity - Mean velocities - Velocity coefficients - Viscous debris flows - Yunnan , China","631 Fluid Flow - 716.2 Radar Systems and Equipment - 914.1 Accidents and Accident Prevention - 922.2 Mathematical Statistics - 943.3 Special Purpose Instruments",,,,,"Compendex","Compilation and indexing terms, Copyright 2019 Elsevier Inc.","Engineering Village"
