Title,Accession number,Title of translation,Author,Author affiliation,Corresponding author,Source,Abbreviated source title,Sponsor,Publisher,Volume,Issue,Pages,Issue date,Monograph title,Volume title,Part number,Publication year,Language,ISSN,E-ISSN,ISBN13,DOI,Article number,Conference name,Conference date,Conference location,Conference code,CODEN,Document type,Abstract,Number of references,Main heading,Controlled/Subject terms,Uncontrolled terms,Classification code,Treatment,Funding details,Funding text,Access type,Database,Copyright,Data Provider
"Latency estimation for time-sensitive applications under wireless network coding scheme","20091712050317","","Xu, Kui (1); Dai, Bin (1); Zhang, Fan (1); Huang, Benxiong (1); Zhang, Bo (1) ","(1) Huazhong University of Science and Technology, Wuhan, China ","Xu, K.(xukuei@hotmail.com) ","Proceedings - 2009 WRI International Conference on Communications and Mobile Computing, CMC 2009","Proc. - WRI Int. Conf. Commun. Mob. Comput., CMC","","IEEE Computer Society","2","","263-266","2009","Proceedings - 2009 WRI International Conference on Communications and Mobile Computing, CMC 2009","","","2009","English","","","9780769535012","10.1109/CMC.2009.42","4797129","2009 WRI International Conference on Communications and Mobile Computing, CMC 2009","January 6, 2009 - January 8, 2009","Kunming, Yunnan, China","75845","","Conference article (CA)","Network coding has been designed for wireless networks to improve the capabilities of throughput, reliability, and routing by mixing information from different flows and conveying more information in each transmission. If packets are coded by blocks with large sizes, time-sensitive applications in wireless network will suffer from high latency between blocks caused by intrasession coding scheme. In this paper, a block latency model in coding scheme is derived, and then four latency estimation algorithms are introduced which are used for choosing a proper block size to satisfy the need of time-sensitive applications. Simulations results show that Kalman filter has a better performance than the others. © 2009 IEEE.","13","Network coding","Codes (symbols) - Mobile computing - Wireless networks","Block sizes - Coding scheme - Latency estimation - Latency model - Time sensitive applications","716.1 Information Theory and Signal Processing - 716.3 Radio Systems and Equipment - 723.2 Data Processing and Image Processing",,,,,"Compendex","Compilation and indexing terms, Copyright 2019 Elsevier Inc.","Engineering Village"
"Media browsing for mobile devices based on resolution adaptive recommendation","20091712050435","","Yi, Liu (1); Zhi, Yang (1); Xiaoyu, Deng (1); Jiajun, Bu (1); Chun, Chen (1) ","(1) College of Computer Science, Zhejiang University, Hangzhou, P.R., China ","Zhi, Y.(yangzh@zju.edu.cn) ","Proceedings - 2009 WRI International Conference on Communications and Mobile Computing, CMC 2009","Proc. - WRI Int. Conf. Commun. Mob. Comput., CMC","","IEEE Computer Society","3","","285-290","2009","Proceedings - 2009 WRI International Conference on Communications and Mobile Computing, CMC 2009","","","2009","English","","","9780769535012","10.1109/CMC.2009.124","4797263","2009 WRI International Conference on Communications and Mobile Computing, CMC 2009","January 6, 2009 - January 8, 2009","Kunming, Yunnan, China","75846","","Conference article (CA)","This paper presents a system to facilitate the mobile devices to browse and retrieve video clips from a large amount of media contents. The media server in the proposed system is capable of recommending video clips to users that is adapt to their resolutions. Users are able to send feedbacks about user experiences to the server through the interactive client. Based on the user feedbacks, the media server could update the metadata for video clips such as popularity and acceptable resolution. In addition, redundant versions with lower resolution are generated for video clips by estimating their popularities, and sent to users with lower resolution directly to save the downsizing transcoding process. Experimental results demonstrate that user experiences are improved according to the increase of positive user feedbacks and the decrease of average transcoding delay. © 2009 IEEE.","10","Video cameras","Mobile computing","Large amounts - Lower resolution - Media content - Media servers - Transcoding - Transcoding process - User experience - User feedback","716.4 Television Systems and Equipment",,,,,"Compendex","Compilation and indexing terms, Copyright 2019 Elsevier Inc.","Engineering Village"
"Research on adaptive classification algorithm of remote sensing image","20114214426453","","Fang, Yuanmin (1); Chen, Jie (1); Xia, Yonghua (1); Song, Weiwei (1); Yang, Yongming (1) ","(1) Kunming University of Science and Technology, No.253 Xuefu Road, Kunming, Yunnan Province, China ","Fang, Y.(fangyuanmin@126.com) ","2011 International Symposium on Image and Data Fusion, ISIDF 2011","Int. Symp. Image Data Fusion, ISIDF","Beijing SPOT Image Co., Ltd; IEEE Geoscience and Remote Sensing Society; Int. Soc. Photogramm. Remote Sens.; Natl. Adm. Surv., Mapp. Geoinformation China; Natl. High Technol. Res. Dev. Program; Taylor and Francis Group","IEEE Computer Society","","","","2011","2011 International Symposium on Image and Data Fusion, ISIDF 2011","","","2011","English","","","9781457709692","10.1109/ISIDF.2011.6024246","6024246","2011 International Symposium on Image and Data Fusion, ISIDF 2011","August 9, 2011 - August 11, 2011","Tengchong, Yunnan, China","86876","","Conference article (CA)","With the rapid development of remote sensing technology, the information contained in an image becomes more and more comprehensive. Therefore, how to automatically extract information of interest from image data has become a hot topic. In this paper the automatic airborne remote sensing image classification algorithm is studied by the use of image pyramid. First, the airborne remote sensing image is divided into several tiles to reduce the amount of data processed at the same time; second, Gaussian smoothing is carried in the studied area in order to weaken the influence of noise; third, image pyramid is established according to the different image scale of the target area; fourth, Canny boundary recognition processing is done in the original image; in the end, a package of stable boundary information is obtained by analyzing the objects' features in different image scale based on the theory 'different objects have different performance under different resolutions'. Aerial photographs are taken for experiment, the results prove that the algorithm can classify the boundary information effectively. The final classification results can be applied to a series of operations after lined edge procession. © 2011 IEEE.","7","Classification (of information)","Aerial photography - Antennas - Data mining - Edge detection - Image classification - Image fusion - Photographic equipment - Processing - Remote sensing","Adaptive classification - Aerial Photographs - CANNY - Gaussian smoothing - Image pyramids","716.1 Information Theory and Signal Processing - 723.2 Data Processing and Image Processing - 742.1 Photography - 742.2 Photographic Equipment - 913.4 Manufacturing",,,,,"Compendex","Compilation and indexing terms, Copyright 2019 Elsevier Inc.","Engineering Village"
"From usability to adoption-a new m-commerce adoption study framework","20091712051853","","Min, Qingfei (1); Li, Shuangming (1) ","(1) Management School, Dalian University of Technology, Dalian, 116024, China ","Min, Q. ","Proceedings - 2009 WRI International Conference on Communications and Mobile Computing, CMC 2009","Proc. - WRI Int. Conf. Commun. Mob. Comput., CMC","","IEEE Computer Society","3","","309-313","2009","Proceedings - 2009 WRI International Conference on Communications and Mobile Computing, CMC 2009","","","2009","English","","","9780769535012","10.1109/CMC.2009.106","4797268","2009 WRI International Conference on Communications and Mobile Computing, CMC 2009","January 6, 2009 - January 8, 2009","Kunming, Yunnan, China","75846","","Conference article (CA)","This paper tries to explore the adoption of mcommerce from the perspective of system usability. The definition and measurement of m-commerce system usability are discussed. Four categories of factors that will affect m-commerce system usability are clarified and analyzed, namely mobile device, WAP, mobile communication networks and context factors. By proposing a new m-commerce adoption study framework, this paper hope to draw more attentions to m-commerce systems usability study, which we think is very crucial to m-commerce adoption and, in turn, mcommerce development. © 2009 IEEE.","25","Mobile commerce","Mobile computing - Usability engineering","Context factors - M-commerce - Mobile communication networks - System usability - Usability studies","723.5 Computer Applications",,,,,"Compendex","Compilation and indexing terms, Copyright 2019 Elsevier Inc.","Engineering Village"
"DOA estimation based on sparse and nonuniform COLD array","20091712046795","","Liang, Liu (1); Jian-Wu, Tao (1); Wei, Cui (1) ","(1) Department of Control Engineering, Aviation University, Changchun, 130022, China ","Liang, L.(Huliang320324@yahoo.com.cn) ","Proceedings - 2009 WRI International Conference on Communications and Mobile Computing, CMC 2009","Proc. - WRI Int. Conf. Commun. Mob. Comput., CMC","World Research Institutes","IEEE Computer Society","1","","391-395","2009","Proceedings - 2009 WRI International Conference on Communications and Mobile Computing, CMC 2009","","","2009","English","","","9780769535012","10.1109/CMC.2009.362","4797025","2009 WRI International Conference on Communications and Mobile Computing, CMC 2009","January 6, 2009 - January 8, 2009","Kunming, Yunnan, China","75844","","Conference article (CA)","This paper presents a method of direction of arrival (DOA) estimation with no ambiguity based on sparse and nonuniform concentered orthogonal loop and dipole (COLD) array, which enhances the resolution of DOA estimation in the case of less array elements. And the ambiguity of the sparse and nonuniform COLD array is analyzed and the results of the analysis indicate that the sparse and nonuniform COLD array considered can not cause spurious peaks of the DOAs under certain conditions. Some numerical simulations illustrate the validity of the proposed method. © 2009 IEEE.","10","Direction of arrival","Mobile computing - Numerical methods","Array elements - Direction of arrivalestimation(DOA) - DOA estimation","716.1 Information Theory and Signal Processing - 921.6 Numerical Methods",,,,,"Compendex","Compilation and indexing terms, Copyright 2019 Elsevier Inc.","Engineering Village"
"Analysis and modeling of learning behaviors on intelligent tutoring website","20150800546560","","Sun, Peng (1); Wu, Ziyan (2); Zhang, Yunpeng (3); Yang, Yang (3) ","(1) College of Computer Science, Northwestern Polytechnical University, Xi'an, Shaanxi Province, China (2) School of Mechanics Civil Engineering and Architecture, Northwestern Polytechnical University, Xi'an, Shaanxi Province, China (3) School of Software and Microelectronics, Northwestern Polytechnical University, Xi'an, Shaanxi Province, China ","","Proceedings - 2014 10th International Conference on Computational Intelligence and Security, CIS 2014","Proc. - Int. Conf. Comput. Intell. Secur., CIS","Aviation Key Laboratory of Science and Technology on Airborne and Missileborne Computer; Beijing Normal University; Guangdong University of Technology; IEEE CPS; Shenzhen University; Xidian University","Institute of Electrical and Electronics Engineers Inc.","","","729-731","January 20, 2015","","","1of1","2015","English","","","9781479974344","10.1109/CIS.2014.170","7016994","10th International Conference on Computational Intelligence and Security, CIS 2014","November 15, 2014 - November 16, 2014","Kunming, Yunnan, China","110202","","Conference article (CA)","This paper presents a classify model of learning behavior on an intelligent tutoring website which provides a describing method of learning behavior. MFR Model creates a conceptual model and a analysis model according to students' learning behavior on the website. By using MFR model, influences of participation and learning effects can be judged by learning behavior which can not only strengthen the ability of interaction but also improve teaching quality and efficiency by providing personalized teaching method on website. © 2014 IEEE.","4","Teaching","Websites","Analysis and modeling - Conceptual model - Intelligent tutoring - Learning behavior - Learning effects - Method of learning - Teaching methods - Teaching quality","716 Telecommunication; Radar, Radio and Television - 717 Optical Communication - 718 Telephone Systems and Related Technologies; Line Communications - 723 Computer Software, Data Handling and Applications - 723.4 Artificial Intelligence - 901.2 Education",,,,,"Compendex","Compilation and indexing terms, Copyright 2019 Elsevier Inc.","Engineering Village"
"Design and implementation of communication algorithm in NIOSII- Based RFID reader","20091712050321","","Chen, Ying (1) ","(1) College of Communication, Hangzhou Dianzi University, Hangzhou, China ","Chen, Y.(chenyinghziee@yahoo.com.cn) ","Proceedings - 2009 WRI International Conference on Communications and Mobile Computing, CMC 2009","Proc. - WRI Int. Conf. Commun. Mob. Comput., CMC","","IEEE Computer Society","2","","286-289","2009","Proceedings - 2009 WRI International Conference on Communications and Mobile Computing, CMC 2009","","","2009","English","","","9780769535012","10.1109/CMC.2009.150","4797133","2009 WRI International Conference on Communications and Mobile Computing, CMC 2009","January 6, 2009 - January 8, 2009","Kunming, Yunnan, China","75845","","Conference article (CA)","RFID is a popular automatic identification technology currently, which will have large opportunities in the future. Communication algorithm is a key step for the design of RFID system. This paper propose design and implementation communication algorithm in software. There are many research activities in RFID hardware systems, but there is few in software infrastructure. In order to the implementation of this algorithm, we propose the RFID reader baseband design based on a new structure. This new structure is implemented NIOSII soft core in reader baseband FPGA. It design and implemente communication algorithm in NIOSII soft core .In this paper, the design of reader baseband and communication algorithm are described in detail. Finally, this paper presents the experimental verification communication algorithm and analysis of algorithm parameter Q. The experiment shows that our reader can communicate with multi-tags, and it operations communication algorithm are working correctly. © 2009 IEEE.","6","Radio frequency identification (RFID)","Automation - Mobile computing","Analysis of algorithms - Automatic identification - Communication algorithms - Design and implementations - Experimental verification - Hardware system - Research activities - Software infrastructure","731 Automatic Control Principles and Applications - 731.1 Control Systems",,,,,"Compendex","Compilation and indexing terms, Copyright 2019 Elsevier Inc.","Engineering Village"
"An energy-effective link quality monitoring mechanism for event-driven wireless sensor network","20091712050287","","Shu, Jian (1); Liu, Linlan (1); Zhang, Rong (1) ","(1) School of Computing, Nanchang Hangkong University, Nanchang, China ","Shu, J.(dylan_cn@yahoo.com) ","Proceedings - 2009 WRI International Conference on Communications and Mobile Computing, CMC 2009","Proc. - WRI Int. Conf. Commun. Mob. Comput., CMC","","IEEE Computer Society","2","","111-115","2009","Proceedings - 2009 WRI International Conference on Communications and Mobile Computing, CMC 2009","","","2009","English","","","9780769535012","10.1109/CMC.2009.168","4797098","2009 WRI International Conference on Communications and Mobile Computing, CMC 2009","January 6, 2009 - January 8, 2009","Kunming, Yunnan, China","75845","","Conference article (CA)","Link quality monitoring mechanism is an indispensable means to protect network health. With ensuring certain monitoring accuracy, to reduce energy consumption as much as possible is a critical issue of wireless sensor network. Considering the feature of relatively less traffic in event-driven Wireless Sensor network during no event state, the paper proposes a link quality monitoring mechanism named DSTC, which is based on PRR. And EWMA algorithm is employed to smooth the results of monitoring. Experiments prove that compared to the normal mechanism, DSTC mechanism can reduce energy consumption dramatically and extend the lifetime of network, while ensuring certain accuracy of measurement. © 2009 IEEE.","15","Wireless sensor networks","Energy utilization - Mobile computing - Monitoring","Accuracy of measurements - Critical issues - Event-driven - Event-driven wireless sensor networks - Lifetime of networks - Monitoring accuracy - Monitoring mechanisms - Reduce energy consumption","525.3 Energy Utilization - 716.3 Radio Systems and Equipment",,,,,"Compendex","Compilation and indexing terms, Copyright 2019 Elsevier Inc.","Engineering Village"
"Channel estimation aided active codes detection algorithm in TD-SCDMA systems","20091712046763","","Rong, Zeng (1) ","(1) Institute of Telecommunication, Hangzhou Dianzi University, 310018, China ","Rong, Z. ","Proceedings - 2009 WRI International Conference on Communications and Mobile Computing, CMC 2009","Proc. - WRI Int. Conf. Commun. Mob. Comput., CMC","World Research Institutes","IEEE Computer Society","1","","229-233","2009","Proceedings - 2009 WRI International Conference on Communications and Mobile Computing, CMC 2009","","","2009","English","","","9780769535012","10.1109/CMC.2009.169","4796991","2009 WRI International Conference on Communications and Mobile Computing, CMC 2009","January 6, 2009 - January 8, 2009","Kunming, Yunnan, China","75844","","Conference article (CA)","TD-SCDMA is one of the 3G wireless communication standards accepted by ITU and 3GPP. TD-SCDMA system has employed joint detection algorithms in downlink to improve the performance. As an important part of joint detection algorithm, active codes detection algorithm has large effect on the performance. In this paper, we propose a channel estimation aided active codes detection algorithm. Theory analyses and simulation results show that the proposed algorithm has better system performance compared with conventional algorithm. © 2009 IEEE.","8","Code division multiple access","Channel estimation - Codes (symbols) - Computation theory - Mobile computing - Signal detection","3G wireless communications - Conventional algorithms - Detection algorithm - Joint detection - TD-SCDMA - TD-SCDMA systems","716.1 Information Theory and Signal Processing - 721.1 Computer Theory, Includes Formal Logic, Automata Theory, Switching Theory, Programming Theory - 723.2 Data Processing and Image Processing",,,,,"Compendex","Compilation and indexing terms, Copyright 2019 Elsevier Inc.","Engineering Village"
"A fast wavelet based low memory embedded block coding algorithm","20091712050382","","Wang, Wenda (1); Hao, Yanling (1) ","(1) College of Automation, Harbin Engineering University, Harbin, Heilongjiang, 150001, China ","Wang, W.(justforit@163.com) ","Proceedings - 2009 WRI International Conference on Communications and Mobile Computing, CMC 2009","Proc. - WRI Int. Conf. Commun. Mob. Comput., CMC","","IEEE Computer Society","2","","615-619","2009","Proceedings - 2009 WRI International Conference on Communications and Mobile Computing, CMC 2009","","","2009","English","","","9780769535012","10.1109/CMC.2009.275","4797197","2009 WRI International Conference on Communications and Mobile Computing, CMC 2009","January 6, 2009 - January 8, 2009","Kunming, Yunnan, China","75845","","Conference article (CA)","A fast wavelet based low memory embedded block coding algorithm in image compression is presented in this paper. Several new technical measures are proposed to improve coding efficiency and reduce memory occupancy during the process of coding. The new technical measures include: first, code LLn sub-band separately; second, create block bit-length chart in terms of bit-length defined by the author; third, employ bitlength chart instead of using lists in the process of fining and ranking to reduce memory occupancy; fourth, quick search key blocks according to the structure of bit-length chart to overcome repeat scan and increase coding speed. The experimental results show that the algorithm can reduce memory occupancy during the process of coding and increase the coding speed effectively. Meanwhile, it can keep high PSNR after reconstruction. It makes it possible to implement real time radar image sequences capture, compression and storage in DSP platform. © 2009 IEEE.","8","Image coding","Codes (symbols) - Image compression - Mobile computing","Bit-length chart - Block bit-length - Coding efficiency - Coding speed - DSP platforms - Embedded block coding - Radar image sequences - Technical measures","723.2 Data Processing and Image Processing",,,,,"Compendex","Compilation and indexing terms, Copyright 2019 Elsevier Inc.","Engineering Village"
"Statistical investigations of the effectiveness of using 3-db bandwidths of multimode fibres to quantify the transmission performance of AMOOFDM signals","20091712050364","","Jin, X.Q. (1); Tang, J.M. (1) ","(1) School of Electronic Engineering, Bangor University, BANGOR, GWYNEDD LL57 1UT, United Kingdom ","Jin, X. Q.(x.jin@bangor.ac.uk) ","Proceedings - 2009 WRI International Conference on Communications and Mobile Computing, CMC 2009","Proc. - WRI Int. Conf. Commun. Mob. Comput., CMC","","IEEE Computer Society","2","","521-525","2009","Proceedings - 2009 WRI International Conference on Communications and Mobile Computing, CMC 2009","","","2009","English","","","9780769535012","10.1109/CMC.2009.370","4797178","2009 WRI International Conference on Communications and Mobile Computing, CMC 2009","January 6, 2009 - January 8, 2009","Kunming, Yunnan, China","75845","","Conference article (CA)","Statistical investigations of transmission capacities of Adaptively Modulated Optical Orthogonal Frequency Division Multiplexing (AMOOFDM) signals against various Multimode Fibre (MMF) properties, are undertaken, based on 28000 statistically constructed impulse responses of optical amplification-free, MMF links using intensity modulation and direct detection. The utilization of 3-dB optical MMF bandwidths is identified to be a simple and accurate approach for estimating, without performing complicated simulations, AMOOFDM transmission capacities over any MMF links. For a link loss- (differential mode delay)- dominant performance region, the estimated signal capacities have very low relative standard deviations of ","10","Orthogonal frequency division multiplexing","Bandwidth - Mobile computing - Multimode fibers","Adaptively modulated optical orthogonal frequency division multiplexing - Differential Mode Delays - Intensity modulation and direct detections - Optical amplifications - Performance regions - Relative standard deviations - Transmission capacities - Transmission performance","716.1 Information Theory and Signal Processing - 741.1.2 Fiber Optics",,,,,"Compendex","Compilation and indexing terms, Copyright 2019 Elsevier Inc.","Engineering Village"
"A moving objects detection method based on a combination of improved local binary pattern texture and hue","20145100327429","","Yuan, Guo-Wu (1); Gao, Yun (1); Xu, Dan (1); Jiang, Mu-Rong (1) ","(1) Department of Computer Science and Engineering, Yunnan University, Kunming; 650091, China ","Yuan, Guo-wu ","Lecture Notes in Electrical Engineering","Lect. Notes Electr. Eng.","Nanchang University, China","Springer Verlag","98","","261-268","2011","","Electrical Engineering and Control - Selected Papers from the 2011 International Conference on Electric and Electronics, EEIC 2011","1 of 1","2011","English","18761100","18761119","9783642217647","","","2011 International Conference on Electric and Electronics, EEIC 2011","June 20, 2011 - June 22, 2011","Nanchang, China","111259","","Journal article (JA)","Moving objects detection is one of the key techniques in intelligent video surveillance. A new moving objects detection algorithm is proposed in this paper, which combines improved local binary pattern(LBP) texture and hue information to describe background and adopts the idea of Gaussian mixture model that uses multiple modes to describe background model. In order to reduce matching complexity and reach real-time, many kinds of LBP are cut down. Experiments show that the proposed algorithm can remove effectively the effect of shadow, reaches real-time in common resolution videos and has better performance than other ones. © Springer-Verlag Berlin Heidelberg 2011.","11","Object detection","Gaussian distribution - Image segmentation - Object recognition - Security systems","Background model - Background subtraction - Gaussian Mixture Model - Improved local binary patterns - Intelligent video surveillance - Local binary patterns - Moving objects detection - Resolution video","723.2 Data Processing and Image Processing - 914.1 Accidents and Accident Prevention - 922.1 Probability Theory",,,,,"Compendex","Compilation and indexing terms, Copyright 2019 Elsevier Inc.","Engineering Village"
