Title,Accession number,Title of translation,Author,Author affiliation,Corresponding author,Source,Abbreviated source title,Sponsor,Publisher,Volume,Issue,Pages,Issue date,Monograph title,Volume title,Part number,Publication year,Language,ISSN,E-ISSN,ISBN13,DOI,Article number,Conference name,Conference date,Conference location,Conference code,CODEN,Document type,Abstract,Number of references,Main heading,Controlled/Subject terms,Uncontrolled terms,Classification code,Treatment,Funding details,Funding text,Access type,Database,Copyright,Data Provider
"Dynamic formant extraction of wa language based on adaptive variational mode decomposition","20174104250556","","Fu, Meijun (1); Dong, Huazhen (1); Pan, Wenlin (1) ","(1) School of Mathematics and Computer Science, Yunnan Minzu University, Kunming, Yunnan; 650500, China ","Pan, Wenlin(panwenlin@sina.cn) ","Journal of Physics: Conference Series","J. Phys. Conf. Ser.","","Institute of Physics Publishing","887","1","","September 8, 2017","2nd Annual International Conference on Information System and Artificial Intelligence, ISAI 2017","","1 of 1","2017","English","17426588","17426596","","10.1088/1742-6596/887/1/012085","012085","2nd Annual International Conference on Information System and Artificial Intelligence, ISAI 2017","July 14, 2017 - July 16, 2017","Tianjin, China","130791","","Conference article (CA)","Wa language is one of Chinese minority languages spoken by the Wa nationality who lives in Yunnan Province, China. Until now, it has not been studied from the perspective of Engineering Phonetics. In this paper, for the above reason, by the adaptive variational mode decomposition (AVMD) we have investigated the dynamic formant characteristics of Wa language. Firstly, more precisely, use the synthetic dimension to split Wa language isolated words into voiceless and voiced segment, initials and finals. Secondly, use Linear Prediction Coding to estimate the first three formant frequencies and their bandwidths roughly. Thirdly, select the appropriate equilibrium constraint parameter and the number of decomposed layers so that Adaptive Variational Mode Decomposition (AVMD) can decompose the signal into some intrinsic mode functions (IMFs) without pattern aliasing. Fourthly, use the estimated formant frequencies and bandwidths to determine precisely the required IMFs. Fifthly, use the Hilbert transform to calculate the instantaneous frequency of the above determinate IMFs. Further, we implement the weight average operation on instantaneous frequencies to obtain the first three formant frequencies for each frame. Finally, comparing the first three formant frequencies obtained by the adaptive variance modal decomposition and by Praat software respectively, so we have drawn the conclusion that the relative correct rate of the former to the latter can reach 86% averagely in terms of the selected isolated words, which has shown that our method is effective on Wa language. © Published under licence by IOP Publishing Ltd.","19","Signal processing","Artificial intelligence - Bandwidth - Information systems - Information use - Mathematical transformations - Natural frequencies","Equilibrium constraint - Hilbert transform - Instantaneous frequency - Intrinsic Mode functions - Linear prediction coding - Minority languages - Modal decomposition - Mode decomposition","716.1 Information Theory and Signal Processing - 723.4 Artificial Intelligence - 903.3 Information Retrieval and Use - 921.3 Mathematical Transformations",,"Number: 2016YJS078, Acronym: -, Sponsor: Yunnan Provincial Department of Education; Number: -, Acronym: IEEE, Sponsor: IEEE Foundation; Number: -, Acronym: PKU, Sponsor: Peking University; Number: 3019901, Acronym: -, Sponsor: -; Number: -, Acronym: -, Sponsor: Royal Society; ","This work is financially supported by Yunnan Provincial Department of Education Science Research Fund Project (2016YJS078), Yunnan Minzu University Overseas Master’s Program (3019901). 8. References [1] Zhou Zhizhi, Yan Qixiang, Chen Guoqing. The wa dialect study [M]. Yunnan: Nationalities Publishing House, 2004. [2] Kong Jiangping. Experimental phonetics basic course [M]. Peking University Press, 2015. [3] Ritsema C J. Acoustic theory of speech production [M]. Mouton, 1970. [4] Teager H. Some observations on oral air flow during phonation [J]. Acoustics Speech \& Signal Processing IEEE Transactions on, 1980, 28(5):599-601. [5] Teager H M, Teager S M. Evidence for Nonlinear Sound Production Mechanisms in the Vocal Tract [M]. Speech Production and Speech Modelling. Springer Netherlands, 1990:241-261. [6] Karonen J O, Ostergaard L, Vainio P, et al. Practical numerical algorithms for chaotic systems [M]. Practical numerical algorithms for chaotic systems. Springer Verlag, 1989:125-8. [7] Thompson C, Mulpur A, Mehta V, et al. Transition to chaos in acoustically driven flows [J]. Journal of the Acoustical Society of America, 1991, 90(4):2097-2108. [8] Peitgen H O, Jürgens H, Saupe D. Chaos and fractals: new frontiers of science [J]. Mathematical Gazette, 2004, 79(484):241–255. [9] Grassberger P. Generalized dimensions of strange attractors [J]. Physics Letters A, 1983, 97(6):227-230. [10] Maragos P, Quatieri T F, Kaiser J F. Speech nonlinearities, modulations, and energy operators[C]. International Conference on Acoustics, Speech, and Signal Processing. IEEE, 1991:421-424 vol.1. [11] Maragos P, Kaiser J F, Quatieri T F. On amplitude and frequency demodulation using energy operators [M]. IEEE Press, 1993. [12] Maragos P, Kaiser J F, Quatieri T F. Energy separation in signal modulations with application to speech analysis [J]. IEEE Transactions on Signal Processing, 1993, 41(10):3024-3051. [13] N. E. Huang, Zheng Shen, Steven R. Long … et. al. The empirical mode decomposition and the Hilbert spectrum for nonlinear and non-stationary time seri [M]. The Royal Society, 1998.","Open Access","Compendex","Compilation and indexing terms, Copyright 2019 Elsevier Inc.","Engineering Village"
"Uncovering the rich club phenomenon in an online class","20183905872618","","Huang, Tianhui (1); Chen, Bodong (2) ","(1) Fudan University, Yunnan University, China (2) University of Minnesota, United States ","","Proceedings of International Conference of the Learning Sciences, ICLS","Proc. Int. Conf. Learn. Sci., ICLS","","International Society of the Learning Sciences (ISLS)","3","2018-June","1375-1376","2018","13th International Conference of the Learning Sciences, ICLS 2018: Rethinking Learning in the Digital Age: Making the Learning Sciences Count","","3 of 3","2018","English","18149316","","9781732467224","","","13th International Conference of the Learning Sciences, ICLS 2018: Rethinking Learning in the Digital Age: Making the Learning Sciences Count","June 23, 2018 - June 27, 2018","London, United kingdom","138742","","Conference article (CA)","Social interaction is key for learning. In this study on student interaction in a social learning environment, we identified two student groups with contrasting levels of social prestige—defined as the level of discursive attention one receives in relation to one’s discursive activities. The higher-prestige group was found to form a densely connected 'rich club' less likely to interact with the lower-prestige group. Further network analysis linked this phenomenon with the timing of students’ relationship formation and weekly participation. © ISLS.","3","E-learning","Computer aided instruction - Students","Online class - Social interactions - Social learning - Student groups - Student interactions","723.5 Computer Applications",,,,,"Compendex","Compilation and indexing terms, Copyright 2019 Elsevier Inc.","Engineering Village"
"Ultra-low frequency oscillation analysis and robust fixed order control design","20182905547349","","Jiang, Chongxi (1); Zhou, Jinghao (1); Shi, Peng (1); Huang, Wei (2); Gan, Deqiang (1) ","(1) College of Electrical Engineering, Zhejiang University, Hangzhou; Zhejiang Province; 310027, China (2) Yunnan Power Grid Corporation, Kunming; Yunnan Province; 650011, China ","Gan, Deqiang(dgan@zju.edu.cn) ","International Journal of Electrical Power and Energy Systems","Int J Electr Power Energy Syst","","Elsevier Ltd","104","","269-278","January 2019","","","","2019","English","01420615","","","10.1016/j.ijepes.2018.07.010","","","","","","IEPSDC","Journal article (JA)","Yunnan Grid, a hydro-dominated system, has experienced many times ultra-low frequency oscillations (ULFO) since the grid is connected to the China Southern Grid via DC ties in 2016. The root cause of the oscillation phenomena is investigated in this work. The vector margin (VM) method, which has a closed-form stability margin expression, is utilized to analyze the phenomena, the analysis reveals that the large phase lags of hydro-power turbines at the oscillation frequency are the culprit. It is proved analytically that a hydro-dominated system model always includes a right-half-plane zero, and this zero introduces the large phase lag afore-mentioned and places a fundamental conflict between the stability and tracking performance. A frequency-domain robust fixed-order controller design method is proposed to maximize the tracking performance with specified stability margin in multiple operating points. Case studies of the four-machine two-area system and Yunnan Grid validate the introduced results. © 2018 Elsevier Ltd","31","Design","Controllers - Frequency domain analysis - Robust control - Stability criteria","Nyquist stability criterion - Parameter optimization - Performance limitations - The vector margin (VM) method - Ultra low frequencies","731 Automatic Control Principles and Applications - 732.1 Control Equipment - 921.3 Mathematical Transformations - 961 Systems Science",,"Number: 2016YFB0900605, Acronym: -, Sponsor: -; ","This work was partially supported by National Key R&D Program of China ( 2016YFB0900605 ).",,"Compendex","Compilation and indexing terms, Copyright 2019 Elsevier Inc.","Engineering Village"
"A study on information throughput of inter-vehicle communications in a unidirectional traffic stream","20091712050341","","Zhe, Wang (1); Wei, Lu (1); Wenlong, Jin (2) ","(1) Department of Automation, University of Science and Technology of China, Hefei 230027, China (2) Department of Civil and Environmental Engineering, University of California, Irvine, CA 92697, United States ","Wenlong, J.(wjin@uci.edu) ","Proceedings - 2009 WRI International Conference on Communications and Mobile Computing, CMC 2009","Proc. - WRI Int. Conf. Commun. Mob. Comput., CMC","","IEEE Computer Society","2","","396-401","2009","Proceedings - 2009 WRI International Conference on Communications and Mobile Computing, CMC 2009","","","2009","English","","","9780769535012","10.1109/CMC.2009.226","4797155","2009 WRI International Conference on Communications and Mobile Computing, CMC 2009","January 6, 2009 - January 8, 2009","Kunming, Yunnan, China","75845","","Conference article (CA)","Inter-vehicle communications (IVC) based on mobile ad hoc networks have drawn increasing research interests in recent years. In this paper, we study throughput in an IVC system along a unidirectional traffic for different traffic conditions and transmission ranges of wireless units. Here, whether a vehicle is equipped or not is random, and the probability is assumed to be the market penetration rate. We first briefly introduce the communication performance measures and our simulation platform based on network simulator 2 and traffic flow theories. We then present Monte Carlo simulation results of communication performance measures for traffic flows of two congestion levels, information source and destination at different distances, and three transmission ranges. We compare our results with those obtained through simple connectivity analysis and find that the results are consistent for low connectivity, but the throughputs by ns-2 simulations are significantly lower than the theoretical results, due to packet losses caused by signal interferences. Together with further investigations, the study could be helpful for determining and designing appropriate communication hardware and software and intelligent transportation applications. © 2009 IEEE.","30","Traffic congestion","Application programs - Computation theory - Intelligent systems - Intelligent vehicle highway systems - Mobile computing - Monte Carlo methods - Motor transportation - Simulation platform - Vehicles - Vehicular ad hoc networks","Communication hardware - Communication performance - Connectivity analysis - Intelligent transportation - Inter vehicle communications - Network simulator 2 - Traffic flow theory - Transmission ranges","721.1 Computer Theory, Includes Formal Logic, Automata Theory, Switching Theory, Programming Theory - 723 Computer Software, Data Handling and Applications - 922.2 Mathematical Statistics",,,,,"Compendex","Compilation and indexing terms, Copyright 2019 Elsevier Inc.","Engineering Village"
"TinyTPM: A novel lightweight key agreement scheme for sensor networks","20091712050477","","Tieming, Chen (1, 2); Dujuan, Yan (1); Sugang, Bai (1) ","(1) College of Software Engineering, Zhejiang University of Technology, Hangzhou 310023, China (2) State Key Laboratory of Software Development Environment, Beihang University, Beijing,100083, China ","Tieming, C.(tmchen@zjut.edu.cn) ","Proceedings - 2009 WRI International Conference on Communications and Mobile Computing, CMC 2009","Proc. - WRI Int. Conf. Commun. Mob. Comput., CMC","","IEEE Computer Society","3","","518-522","2009","Proceedings - 2009 WRI International Conference on Communications and Mobile Computing, CMC 2009","","","2009","English","","","9780769535012","10.1109/CMC.2009.104","4797307","2009 WRI International Conference on Communications and Mobile Computing, CMC 2009","January 6, 2009 - January 8, 2009","Kunming, Yunnan, China","75846","","Conference article (CA)","The security of Wireless Sensor Networks (WSN) has been widely concerned due to its special properties.This paper introduces a novel mutual learning neural network model, named Tree Parity Machine, for weight synchronization. Then a lightweight Tree Parity Machine-based key agreement scheme for sensor networks, named TinyTPM, is proposed. Using NesC programming language in TinyOS-based development environment, the design and implementation of a TinyTPM-based key agreement protocol are presented. At final, the run of such TinyTPM-based protocol is simulated with correct results. © 2009 IEEE.","10","Wireless sensor networks","Forestry - Mobile computing","Design and implementations - Development environment - Key agreement protocol - Key agreement scheme - Mutual learning - Security of wireless sensor networks - Tree parity machine","716.3 Radio Systems and Equipment",,,,,"Compendex","Compilation and indexing terms, Copyright 2019 Elsevier Inc.","Engineering Village"
"Further analysis and improvement of Yoon et al.'s hash-based user authentication scheme","20091712050470","","Wang, Bang-Ju (1, 2); Li, Shu-Hua (1); Zhang, Huan-Guo (2) ","(1) School of Science, Huazhong Agricultural University, Wuhan 430070, ubei, China (2) The Key Laboratory of Aerospace Information Security and Trust Computing, Ministry of Education, Wuhan University, Wuhan 430072, Hubei, China ","Li, S. -H.(olishuhua@mail.hzau.edu.cn) ","Proceedings - 2009 WRI International Conference on Communications and Mobile Computing, CMC 2009","Proc. - WRI Int. Conf. Commun. Mob. Comput., CMC","","IEEE Computer Society","3","","480-484","2009","Proceedings - 2009 WRI International Conference on Communications and Mobile Computing, CMC 2009","","","2009","English","","","9780769535012","10.1109/CMC.2009.271","4797300","2009 WRI International Conference on Communications and Mobile Computing, CMC 2009","January 6, 2009 - January 8, 2009","Kunming, Yunnan, China","75846","","Conference article (CA)","In 2002, Lee et al. proposed a scheme improving on Peyravian and Zunic scheme. However, Yoon et al. found that the scheme is vulnerable to a denial of service (DoS) attack and proposed a enhanced scheme on Lee et al.'s scheme. Unfortunately, Ku et al. pointed out that Yoon et al.'s scheme can not achieve backward secrecy and is vulnerable to off-line password guessing and stolen-verifier attacks. In this paper, the other security flaws of the scheme that new insider attack and replay attack are stated, and an improved hash based scheme on Yoon et al.'s scheme is proposed. The improved scheme in this paper can fix all the known security flaws of Yoon et al.'s scheme except for backward secrecy and is more secure and efficient for practical application in source constraint wireless networks. © 2009 IEEE.","11","Authentication","Denial-of-service attack - Hash functions - Mobile computing","Attack - Backward secrecy - Denial of Service - Password - Password authentication - Password guessing - Stolen verifier attack - User authentication scheme","723 Computer Software, Data Handling and Applications",,,,,"Compendex","Compilation and indexing terms, Copyright 2019 Elsevier Inc.","Engineering Village"
"A model for assured software download on mobile terminals","20091712050348","","Sabetghadam, Serwah (1); Niamanesh, Mahdi (2); Esmaeili, Javad (1) ","(1) Computer Engineering Department, University of Shahid Beheshti, Iran (2) Computer Engineering Department, Sharif University of Technology, Tehran, Iran ","Sabetghadam, S. ","Proceedings - 2009 WRI International Conference on Communications and Mobile Computing, CMC 2009","Proc. - WRI Int. Conf. Commun. Mob. Comput., CMC","","IEEE Computer Society","2","","432-436","2009","Proceedings - 2009 WRI International Conference on Communications and Mobile Computing, CMC 2009","","","2009","English","","","9780769535012","10.1109/CMC.2009.332","4797162","2009 WRI International Conference on Communications and Mobile Computing, CMC 2009","January 6, 2009 - January 8, 2009","Kunming, Yunnan, China","75845","","Conference article (CA)","Over-the-air (OTA) software download is a key enabling technology for terminal reconfigurations. With increasing the number of network protocols, variety of software products with different software providers and new software threats, it becomes important to download and install assured software on the mobile terminals. Most of the related research works on downloading assured software, focus on software validation after download, and mainly on the terminal. In this paper, a model is proposed in which an Assurance Agency is exploited. This agency is responsible for performing software examination and validations. Unlike related work, examination and validation operations are centrally performed in the network before downloading the software. Based on a cost analysis, it is shown that the overhead of using the assurance agency in downloading scenario is acceptable. © 2009 IEEE.","16","Computer terminals","Mobile computing - Network protocols","Cost analysis - Enabling technologies - Mobile terminal - Over the airs - Software downloads - Software products - Software threats - Software validation","722.2 Computer Peripheral Equipment",,,,,"Compendex","Compilation and indexing terms, Copyright 2019 Elsevier Inc.","Engineering Village"
"A slotted dielectric substrate loaded broadband Vivaldi antenna fed by SIW","20170903399343","","Ma, Chaojun (1); Shen, Dongya (1); Dong, Ming (1); Su, Jun (1) ","(1) Yunnan Eng. Lab. of CWA and Heteroge Net., Yunnan University, Kunming; 650091, China ","","ISAPE 2016 - Proceedings of the 11th International Symposium on Antennas, Propagation and EM Theory","ISAPE - Proc. Int. Symp. Antennas, Propag. EM Theory","Chinese Institute of Electronics (CIE); Chinese Institute of Electronics (CIE) Antennas Society; Chinese Institute of Electronics (CIE) Radio Propagation Society","Institute of Electrical and Electronics Engineers Inc.","","","28-30","January 25, 2017","ISAPE 2016 - Proceedings of the 11th International Symposium on Antennas, Propagation and EM Theory","","1 of 1","2016","English","","","9781509047420","10.1109/ISAPE.2016.7833916","7833916","11th International Symposium on Antennas, Propagation and EM Theory, ISAPE 2016","October 18, 2016 - October 21, 2016","Guilin, China","125945","","Conference article (CA)","A novel compact slotted dielectric substrate loaded broadband Vivaldi antenna is proposed. This antenna consists of a typical antipodal SIW Vivaldi antenna and two pieces of FR4 substrate with uneven thickness and periodic slots, two pieces of FR4 substrate is symmetrically loaded on Vivaldi antenna above and under respectively. The effects of different thickness distribution and slots on substrate were simulated. Simulated results exhibit that the antenna achieves a gain of 10.1 ± 0.7 dBi over the frequency of 27-45GHz with reflection coefficient less than -14dB. © 2016 IEEE.","7","Substrate integrated waveguides","Antenna feeders - Dielectric materials - Slot antennas","broadband - Dielectric substrates - Different thickness - FR4 substrates - Simulated results - Vivaldi antennas","708.1 Dielectric Materials - 714.3 Waveguides",,"Number: 2013FA027, Acronym: -, Sponsor: Natural Science Foundation of Yunnan Province; Number: 61501398, Acronym: NSFC, Sponsor: National Natural Science Foundation of China; Number: 2012HA005, Acronym: -, Sponsor: -; ","The paper is supported by the National Natural Science Foundation of China(61561052,61561051, 61501398) Yunnan Natural Science Key Foundation of China(2013FA027), and Yunnan High-Tech Top-Talents Recruitment Project (2012HA005).",,"Compendex","Compilation and indexing terms, Copyright 2019 Elsevier Inc.","Engineering Village"
"Visual block link analysis for image re-ranking","20101812902952","","Zhou, Wengang (1); Tian, Qi (2); Li, Houqiang (1) ","(1) University of Science and Technology of China, Hefei City, Anhui Province, China (2) University of Texas at San Antonio, One UTSA Circle, San Antonio, TX 78249, United States ","Zhou, W.(zhwg@mail.ustc.edu.cn) ","1st International Conference on Internet Multimedia Computing and Service, ICIMCS 2009","Int. Conf. Internet Multimedia Comput. Serv., ICIMCS","ACM SIGMM Beijing Chapter; National Science Foundation of China","Association for Computing Machinery (ACM)","","","10-16","2009","1st International Conference on Internet Multimedia Computing and Service, ICIMCS 2009","","","2009","English","","","9781605588407","10.1145/1734605.1734612","","1st International Conference on Internet Multimedia Computing and Service, ICIMCS 2009","November 23, 2009 - November 25, 2009","Kunming, Yunnan, China","80025","","Conference article (CA)","Currently, image retrieval is becoming a popular feature in many search engines, most of which return images solely based on the metadata of pages in which the image appears. Since the page text may be inconsistent with the image content, image re-ranking is of great necessity. In this paper, we propose a Visual Block Rank approach for image re-ranking. We consider images as visual block sets and analyze the authority of images by exploring the underlying visual block link structure via LSA (Latent Semantic Analysis). The idea of Page-Rank is leveraged to our scheme for Visual Block Ranking and then the re-ranking order of images is deduced. We validate our approach with search results returned by Google Image. Experimental results show improvement of the accuracy and efficiency of our method over the state-of-the-art VisualRank algorithm. Copyright 2009 ACM.","20","Search engines","Image analysis - Image retrieval - Semantics","Image content - Image re rankings - Latent Semantic Analysis - Link analysis - Link structure - State of the art - Visual block - VisualRank","723 Computer Software, Data Handling and Applications",,,,,"Compendex","Compilation and indexing terms, Copyright 2019 Elsevier Inc.","Engineering Village"
