Title,Accession number,Title of translation,Author,Author affiliation,Corresponding author,Source,Abbreviated source title,Sponsor,Publisher,Volume,Issue,Pages,Issue date,Monograph title,Volume title,Part number,Publication year,Language,ISSN,E-ISSN,ISBN13,DOI,Article number,Conference name,Conference date,Conference location,Conference code,CODEN,Document type,Abstract,Number of references,Main heading,Controlled/Subject terms,Uncontrolled terms,Classification code,Treatment,Funding details,Funding text,Access type,Database,Copyright,Data Provider
"Cyanobacteria bloom prevention and control and salvage disposal integrated management system","20194307585584","","Tang, Yuming (1); Liang, Hong (1); Zhao, Yi (1); Seng, Bingfeng (1) ","(1) College of Information ScienceandEngineering, Yunnan University, Kunming; 650500, China ","Liang, Hong(617817584@qq.com) ","E3S Web of Conferences","E3S Web Conf.","","EDP Sciences","118","","","October 4, 2019","2019 4th International Conference on Advances in Energy and Environment Research, ICAEER 2019","","1 of 1","2019","English","25550403","22671242","","10.1051/e3sconf/201911804033","04033","2019 4th International Conference on Advances in Energy and Environment Research, ICAEER 2019","August 16, 2019 - August 18, 2019","Shanghai, China","152654","","Conference article (CA)","Cyanobacteria are large single-cell prokaryotes that can undergo oxygen-producing photosynthesis. However, if the cyanobacteria are contaminated by nitrogen, phosphorus and other elements, cyanobacteria will cause the phenomenon of 'water bloom' in the lake, which will seriously endanger the safety of humans, animals, fish and shrimps. To help lake management units to prevent and control the outbreak of cyanobacteria, this paper designed and developed a comprehensive management system for the prevention and control of cyanobacteria blooms and salvage treatment. The system consists of four subsystems: the operational reporting subsystem, the monitoring data management system, the algae environmental protection disposal process management system, and the real-time cyanobacteria monitoring system. The three-dimensional interaction between the WEB end and the mobile patrol handheld terminal makes the system more efficient and convenient. The neighborhood image is denoised by the neighborhood averaging method, and the K-means algorithm is used for clustering training, which makes the classification of the algae pictures taken. The realization of the system effectively prevented the large-scale outbreak of cyanobacteria, providing a new idea for monitoring and processing cyanobacteria blooms. © The Authors, published by EDP Sciences, 2019.","6","Information management","Algae - Fish - K-means clustering - Lakes - Monitoring","Comprehensive managements - Cyanobacteria blooms - Data management system - Hand-held terminals - Integrated management systems - Prevention and controls - Salvage treatment - Three-dimensional interaction",,,,,,"Compendex","Compilation and indexing terms, Copyright 2019 Elsevier Inc.","Engineering Village"
"Semi-online Machine Covering on Two Hierarchical Machines with Discrete Processing Times","20184205958772","","Wu, Gangxiong (1); Li, Weidong (1, 2) ","(1) School of Mathematics and Statistics, Yunnan University, Kunming; 650504, China (2) Dianchi College of Yunnan University, Kunming; 650504, China ","Wu, Gangxiong(1317630396@qq.com) ","Communications in Computer and Information Science","Commun. Comput. Info. Sci.","","Springer Verlag","882","","1-7","2018","Theoretical Computer Science - 36th National Conference, NCTCS 2018, Proceedings","","1 of 1","2018","English","18650929","","9789811327117","10.1007/978-981-13-2712-4_1","","36th National Conference of Theoretical Computer Science, NCTCS 2018","October 13, 2018 - October 14, 2018","Shanghai, China","219089","","Conference article (CA)","In this paper, we study the semi-online machine covering problem on two hierarchical machines, whose objective is to maximize the minimum machine load. When the processing times are discrete by {1,2,22,•, 2k} with k≥, we prove that no algorithm can have a competitive ratio less than 2k and present an optimal semi-online algorithm with competitive ratio 2k. © 2018, Springer Nature Singapore Pte Ltd.","11","Online systems","Computer science - Computers","Competitive ratio - Hierarchy - Machine covering - Processing time - Semi-online","722.4 Digital Computers and Systems",,"Number: 2017ZZX235, Acronym: -, Sponsor: Natural Science Foundation of Yunnan Province; Number: -, Acronym: YNU, Sponsor: Yunnan University; Number: 11761078, Acronym: NSFC, Sponsor: National Natural Science Foundation of China; Number: 61662088, Acronym: NSFC, Sponsor: National Natural Science Foundation of China; ","Acknowledgement. The work is supported in part by the National Natural Science Foundation of China [Nos. 11761078, 61662088], the Natural Science Foundation of Education Department of Yunnan Province [No. 2017ZZX235], IRTSTYN and Program for Excellent Young Talents, Yunnan University.",,"Compendex","Compilation and indexing terms, Copyright 2019 Elsevier Inc.","Engineering Village"
"Existence and global exponential stability of anti-periodic solution for Clifford-valued inertial Cohen–Grossberg neural networks with delays","20190206353809","","Li, Yongkun (1); Xiang, Jianglian (1) ","(1) Department of Mathematics, Yunnan University Kunming, Yunnan; 650091, China ","Li, Yongkun(yklie@ynu.edu.cn) ","Neurocomputing","Neurocomputing","","Elsevier B.V.","332","","259-269","7 March 2019","","","","2019","English","09252312","18728286","","10.1016/j.neucom.2018.12.064","","","","","","NRCGEO","Journal article (JA)","In this paper, we are concerned with a class of Clifford-valued inertial Cohen-Grossberg neural networks with time-varying delays. Based on the coincidence degree theory and the Wirtinger inequality, we first obtain sufficient conditions ensuring the existence of anti-periodic solutions for this class of networks. Then, by constructing a suitable Lyapunov functional, we establish the global exponential stability of the anti-periodic solutions. Our results are completely new even if the considered neural networks degenerate into real-valued, complex-valued or quaternion-valued. Finally, we present a numerical example to show the effectiveness of our results © 2018 Elsevier B.V.","44","Neural networks","Algebra - Lyapunov functions","Anti-periodic solutions - Clifford algebra - Cohen-Grossberg neural networks - Coincidence degree theory - Complex-valued - Global exponential stability - Lyapunov functionals - Time varying- delays",,,,,,"Compendex","Compilation and indexing terms, Copyright 2019 Elsevier Inc.","Engineering Village"
"Research on web service-based virtual enterprise process model","20130415926251","","Sun, Xingping (1, 2); Kang, Hongwei (1, 2); Liang, Zhihong (1, 2); Yang, Shenglin (1); Shen, Yong (2); Duan, Qing (2) ","(1) School of Software, Yunnan University, Kunming, Yunnan, 650091, China (2) Key Laboratory for Software Engineering of Yunnan Province Republic of China, China ","Kang, H.(hwkang.yn@gmail.edu.cn) ","Proceedings of the 2012 2nd International Conference on Business Computing and Global Informatization, BCGIN 2012","Proc. Int. Conf. Bus. Comput. Global Informatization, BCGIN","Shanghai University; Shanghai University of Engineering Sciences; University of Kentucky","IEEE Computer Society","","","469-472","2012","Proceedings of the 2012 2nd International Conference on Business Computing and Global Informatization, BCGIN 2012","","","2012","English","","","9780769548548","10.1109/BCGIN.2012.128","6382569","2012 2nd International Conference on Business Computing and Global Informatization, BCGIN 2012","October 12, 2012 - October 14, 2012","Shanghai, China","94966","","Conference article (CA)","Process model refers to the research on key model of virtual enterprise dynamic behavior based on Web Service. This paper proposes WSVE process Meta-Model, and presents the algorithm of analysis and simulation based on process model. Through simulation analysis of the process model, we can determine the factors such as cost, time, and others of the process itself and various links, which builds the foundation on research based on service discovery and composite of process model. © 2012 IEEE.","7","Web services","Virtual corporation - Websites","Analysis and simulation - Key modeling - Process meta models - Process Modeling - Service discovery - Service-based - Simulation analysis - Virtual enterprise","912.2 Management",,,,,"Compendex","Compilation and indexing terms, Copyright 2019 Elsevier Inc.","Engineering Village"
"Experimental Research on the Bond-Slip Behavior of Red Mud Concrete Filled Square Steel Tubes","20183505756669","","Wu, Bin (1, 2); Tan, Zhuoying (1); Zhang, Yongdan (2); Zhao, Zhonghua (3); Liu, Chengxue (3) ","(1) School of Civil and Resource Engineering, University of Science and Technology Beijing, China (2) Department of Construction Engineering, Liaoning Provincial College of Communications, Shenyang Liaoning, China (3) Shenyang Urban Construction University, Shenyang Liaoning, China ","Wu, Bin(66084537@qq.com) ","IOP Conference Series: Materials Science and Engineering","IOP Conf. Ser. Mater. Sci. Eng.","","Institute of Physics Publishing","394","3","","August 8, 2018","2018 5th International Conference on Advanced Composite Materials and Manufacturing Engineering - 2. Engineering Materials and Manufacturing Engineering","","3 of 5","2018","English","17578981","1757899X","","10.1088/1757-899X/394/3/032016","032016","2018 5th International Conference on Advanced Composite Materials and Manufacturing Engineering, ACMME 2018","June 16, 2018 - June 17, 2018","Xishuangbanna, Yunnan, China","138696","","Conference article (CA)","In order to study the bond slip behavior of red mud concrete-filled square steel stubs, fifteen red mud concrete filled square steel tubes short column specimens were designed for the push-out test. Five parameters including replacement rate of red mud mass, concrete strength, embedment length, length diameter ratio, width to thickness ratio were regarded as variable parameters in the experiment. Through experiment, the load-slip curves of red mud concrete filled square steel tubes were obtained and analyzed.The results show that the load slip curves of red mud concrete filled square steel tubes can be classified into five stages: no slipping section, ascending section, descending section, re-ascending section and re-descending section.The bond strength increases first and then decreases with the increase of red mud substitution rate.When the substitution rate of red mud is 5%, the bond strength reaches the maximum. When the substitution rate of red mud is 20%, the bond strength is equivalent to that of normal concrete filled steel tube. © Published under licence by IOP Publishing Ltd.","9","Concretes","Bond strength (materials) - Bridge decks - Composite structures - Manufacture - Tubes (components) - Tubular steel structures","Concrete-filled square steel tube - Experimental research - Length diameter ratio - Replacement rates - Strength increase - Substitution rates - Variable parameters - Width-to-thickness ratio","401.1 Bridges - 408.2 Structural Members and Shapes - 412 Concrete - 537.1 Heat Treatment Processes - 619.1 Pipe, Piping and Pipelines - 951 Materials Science",,"Number: 20170520139, Acronym: -, Sponsor: -; Number: Lnccybky201701, Acronym: -, Sponsor: -; Number: 51574015, Acronym: NSFC, Sponsor: National Natural Science Foundation of China; Number: 20170540493, Acronym: -, Sponsor: Natural Science Foundation of Liaoning Province; ","This work was financially supported by National Natural Science Foundation of China (51574015), Liaoning Province Natural Science Foundation fund (20170540493), Liaoning province PHD startup fund (20170520139) and School-level research projects of Liaoning Provincial College of Communications (Lnccybky201701).","Open Access","Compendex","Compilation and indexing terms, Copyright 2019 Elsevier Inc.","Engineering Village"
"Influences of Process Parameters to Microstructural Evolution in Thermal Deformation of GH4169 Alloy","20183505756700","","Qian, Fang (1); Wang, Zhongtang (2) ","(1) School of Mechanical Engineering, Inner Mongolia University for Nationality, Tongliao; 028000, China (2) School of Materials Science and Engineering, Shenyang Ligong University, Shenyang; 110159, China ","Qian, Fang(janeeyie@126.com) ","IOP Conference Series: Materials Science and Engineering","IOP Conf. Ser. Mater. Sci. Eng.","","Institute of Physics Publishing","394","3","","August 8, 2018","2018 5th International Conference on Advanced Composite Materials and Manufacturing Engineering - 2. Engineering Materials and Manufacturing Engineering","","3 of 5","2018","English","17578981","1757899X","","10.1088/1757-899X/394/3/032047","032047","2018 5th International Conference on Advanced Composite Materials and Manufacturing Engineering, ACMME 2018","June 16, 2018 - June 17, 2018","Xishuangbanna, Yunnan, China","138696","","Conference article (CA)","It studied the organization form of GH4169 alloy which had been obtained with different temperatures, strain-rates, deformations and original grain sizes by the high temperature hot compression tests. Influence laws of process parameters to microstructure evolution during hot deformation were gotten. The results showed that the grain group was hybrid when the temperature below 940°C, while complete recrystallization happened above 1020°C. Uniform equiaxed grains had been gotten with the strain-rate below 0.01s-1, and temperatures between 980-1020°C. © Published under licence by IOP Publishing Ltd.","8","Strain rate","Bridge decks - Composite materials - Compression testing - Deformation - Manufacture - Microstructure","Equi-axed grains - GH4169 alloys - Grain groups - High temperature - Influence laws - Micro-structure evolutions - Process parameters - Thermal deformation","401.1 Bridges - 537.1 Heat Treatment Processes - 951 Materials Science",,"Number: 50834008, Acronym: -, Sponsor: -; ","This work was financially supported by Key Project of National Natural Science (50834008) fund.","Open Access","Compendex","Compilation and indexing terms, Copyright 2019 Elsevier Inc.","Engineering Village"
"Analysis on influential factors of water quality in key sections of Yangtze River basin in China","20183505753622","","Wang, Dong (1); Wen, Youdong (2) ","(1) Jiangxi Agricultural University, Nanchang Business School Economics Department, Jiangxi Nanchang; 330013, China (2) School of Statistics, Jiangxi University of Finance and Economics, Jiangxi Nanchang; 330013, China ","","IOP Conference Series: Materials Science and Engineering","IOP Conf. Ser. Mater. Sci. Eng.","","Institute of Physics Publishing","394","5","","August 8, 2018","2018 5th International Conference on Advanced Composite Materials and Manufacturing Engineering - 4. Environmental Materials","","5 of 5","2018","English","17578981","1757899X","","10.1088/1757-899X/394/5/052049","052049","2018 5th International Conference on Advanced Composite Materials and Manufacturing Engineering, ACMME 2018","June 16, 2018 - June 17, 2018","Xishuangbanna, Yunnan, China","138696","","Conference article (CA)","The Yangtze River Valley is the largest of China's seven major water systems, the longest water system, and the length of 6300 kilometers, and ranked third in the world. Its water quality is not only closely related to the residents' drinking water safety, but also to the ecological environment of China has an important impact. Based on the panel data and stochastic forest modeling of the key sectional water quality monitoring data of the Yangtze River basin since 2018, NH3-N (ammonia nitrogen content) has the most important effect on water quality, and its value directly determines the quality of the water quality. © 2018 Published under licence by IOP Publishing Ltd.","8","Potable water","Ammonia - Bridge decks - Composite materials - Manufacture - Rivers - Stochastic systems - Water management - Water quality - Watersheds - Waterworks","Ammonia nitrogen - Ecological environments - Forest modeling - Influential factors - Water quality monitoring - Water system - Yangtze River - Yangtze River basin","401.1 Bridges - 444 Water Resources - 444.1 Surface Water - 445.2 Water Analysis - 446 Waterworks - 537.1 Heat Treatment Processes - 804.2 Inorganic Compounds - 951 Materials Science - 961 Systems Science",,"Number: GJJ151514, Acronym: -, Sponsor: -; Number: JC162015, Acronym: -, Sponsor: -; ","This article obtains Science and technology project of Jiangxi Provincial Education Commission, Study on the Combining efficiency of agricultural science and technology with finance in Jiangxi, Grant No. GJJ151514, Humanities and Social Sciences project of Universities in Jiangxi Province, Study on Jiangxi’s Energy Efficiency and Its Spatio-temporal Variation Based on DEA-ESDA, Grant No. JC162015 funding.","Open Access","Compendex","Compilation and indexing terms, Copyright 2019 Elsevier Inc.","Engineering Village"
"Field Electron Emission from Graphite Fiber","2003427684946","","Chen, Ergang (1); Zhang, Jin (1); Yang, Zongtao (2) ","(1) Department of Physics, Yunnan University, Kunming 650091, China (2) Department of Physics, Yunnan Normal University, Kunming 650091, China ","Chen, E.(zhangjin16@163.com) ","IEEE International Conference on Plasma Science","IEEE Int Conf Plasma Sci","Plasma Science and Applications Committee of IEEE","Institute of Electrical and Electronics Engineers Inc.","","","231","2003","","","","2003","English","07309244","","","","","2003 IEEE International Conference on Plasma Science","June 2, 2003 - June 5, 2003","Jeju, Korea, Republic of","61599","85PSAO","Conference article (CA)","Usually carbon wire can not be used for obtaining remarkable field electron emission because the difficulty of sharpening its tip to a sufficient small radius of curvature to fit the electrical field. However, after a proper treatment on a graphite fiber a large number of small fragments of graphite are formed on the tip of the graphite fiber. Observed by a SEM these fragments are spheres and flakes with the size around 50nm. In this case each of these spheres and flakes can be an emission center in a field emission and some detectable emission current can be obtained with rather low applied voltage. Because there are a large number of fragments on the tip of a single graphite fiber the total emission current from the tip would be very large. Experimental results show that a single graphite fiber of 15μm diameter near 1mA emission current can be obtained with 4kV applied voltage and the stability have been measured to be leas than 10%. This would be the best achievement in the field of electron emission up to date. We expect that this achievement can be used in FE display or other display devices manufacturing near future.",,"Electron emission","Electric field effects - Graphite fibers - Scanning electron microscopy - Wire","Field electron emissions","535.2 Metal Forming - 701.1 Electricity: Basic Concepts and Phenomena - 714.1 Electron Tubes - 741.1 Light/Optics - 804 Chemical Products Generally","Theoretical (THR); Experimental (EXP)",,,,"Compendex","Compilation and indexing terms, Copyright 2019 Elsevier Inc.","Engineering Village"
"Study on Water-holding Properties of Litters in Different Types of Forests of Yuntaishan Mountain Area in Shibing County, Guizhou Province","20183505761233","","Li, Wenwen (1, 2); Li, Yujie (1, 2); Long, Mingzhong (3); Li, Xiaona (1, 2) ","(1) School of Karst Science, Guizhou Normal University, Guiyang, China (2) State Engineering Technology Institute for Karst Desertification Control, Guiyang, China (3) College of Eco-Environmental Engineering, Institute of Karst Wetland Ecology, Guizhou Minzu University, Guiyang; 550001, China ","Li, Xiaona(maidoulxn413@163.com) ","IOP Conference Series: Materials Science and Engineering","IOP Conf. Ser. Mater. Sci. Eng.","","Institute of Physics Publishing","394","2","","August 8, 2018","2018 5th International Conference on Advanced Composite Materials and Manufacturing Engineering - 1. Chemical Composed Materials and Biomaterials","","2 of 5","2018","English","17578981","1757899X","","10.1088/1757-899X/394/2/022057","022057","2018 5th International Conference on Advanced Composite Materials and Manufacturing Engineering, ACMME 2018","June 16, 2018 - June 17, 2018","Xishuangbanna, Yunnan, China","138696","","Conference article (CA)","Taking the coniferous forest, the hard leaf forest at mountain ridge and the evergreen broad-leaved forest as research objects, using field observations and indoor immersion test methods, analyzing the water holding capacity and water holding characteristics of litters. Through experimental monitoring and data analysis, compared the difference between the accumulation amount of litter, maximum water holding amount, maximum water holding rate and effective interception amount, and study on the relationship between water holding amount, water holding rate and soaking time, The results show: (1) Accumulation amount of litter: the coniferous forest 10.15t/hm2> the hard leaf forest at mountain ridge 8.73t/hm2> the evergreen broad-leaved forest 5.82t/hm2; maximum water-holding capacity: the hard leaf forest at mountain ridge 21.6t/hm2> the coniferous forest 21.41t/hm2> the evergreen broad-leaved forest 5.82t/hm2; maximum water holding rate: the evergreen broad-leaved forest 316.39% > the hard leaf forest at mountain ridge 247.73% > the coniferous forest 202.71%. (2) Effective interception amount: the coniferous forest 7.96t/hm2> the evergreen broad-leaved forest 6.41t/hm2> the hard leaf forest at mountain ridge 6.36t/hm2. (3) Litter soaking experiments show that the overall changing trend of water holding capacity, water holding rate and soaking time of the three kinds of litters are basically the same (logarithmic curve relationships); and the overall changing trend of water absorption rate and soaking time are basically the same, and it's monomial relationship. © Published under licence by IOP Publishing Ltd.","14","Forestry","Biomaterials - Bridge decks - Composite materials - Landforms - Manufacture - Testing - Vehicles - Water absorption","Coniferous forests - Evergreen broad-leaved forests - Field observations - Logarithmic curve - Maximum water holding rates - Water absorption rates - Water holding capacity - Water-holding rates","401.1 Bridges - 462.5 Biomaterials (including synthetics) - 481.1 Geology - 537.1 Heat Treatment Processes - 802.3 Chemical Operations - 951 Materials Science",,"Number: 2016YFC0502607, Acronym: -, Sponsor: -; Number: 7199, Acronym: -, Sponsor: -; Number: 2833, Acronym: -, Sponsor: -; Number: 20150318, Acronym: -, Sponsor: -; ","This research was supported by the National key R & D Plan of the Thirteenth Five-Year Plan China (2016YFC0502607), Guizhou Province Science and Technology Cooperation plan (Qian Ke He LH [2016] No. 7199), Guizhou Province Science and Technology Cooperation plan (Qian Ke He [2016] support No. 2833), National World Heritage Conservation and Development Project (20150318), Guizhou Postgraduate Education Innovation Project (Qian Jiao Yan He GZS [2016]04).","Open Access","Compendex","Compilation and indexing terms, Copyright 2019 Elsevier Inc.","Engineering Village"
"Study on the Calculation Theory of the Cable Curve for Suspension Bridge","20183505756594","","Liu, Guojun (1); Wang, Yansong (2) ","(1) School of Civil Engineering, Southwest Jiaotong University, Chengdu, China (2) School of Civil Engineering, Sichuan Agricultural University, Chengdu, China ","Wang, Yansong(1092884958@qq.com) ","IOP Conference Series: Materials Science and Engineering","IOP Conf. Ser. Mater. Sci. Eng.","","Institute of Physics Publishing","394","3","","August 8, 2018","2018 5th International Conference on Advanced Composite Materials and Manufacturing Engineering - 2. Engineering Materials and Manufacturing Engineering","","3 of 5","2018","English","17578981","1757899X","","10.1088/1757-899X/394/3/032092","032092","2018 5th International Conference on Advanced Composite Materials and Manufacturing Engineering, ACMME 2018","June 16, 2018 - June 17, 2018","Xishuangbanna, Yunnan, China","138696","","Conference article (CA)","In this paper, the main cable curve and calculation theory of self-anchored suspension bridge are studied based on the engineering background of the Egongyan Changjiang Bridge in Chongqing.Two kinds of calculation theories of the main cable curve based on different assumptions are discussed: The parabola method of cable gravity distributing uniformly along the span, and the catenary method of gravity distributing equally along the curve. © Published under licence by IOP Publishing Ltd.","6","Cables","Bridge decks - Composite materials - Manufacture - Suspension bridges","Cable curve - Calculation theories - Main cable - Self-anchored suspension bridge","401.1 Bridges - 537.1 Heat Treatment Processes - 951 Materials Science",,,,"Open Access","Compendex","Compilation and indexing terms, Copyright 2019 Elsevier Inc.","Engineering Village"
