Title,Accession number,Title of translation,Author,Author affiliation,Corresponding author,Source,Abbreviated source title,Sponsor,Publisher,Volume,Issue,Pages,Issue date,Monograph title,Volume title,Part number,Publication year,Language,ISSN,E-ISSN,ISBN,ISBN13,DOI,Article number,Conference name,Conference date,Conference location,Conference code,CODEN,Document type,Abstract,Number of references,Main heading,Controlled/Subject terms,Uncontrolled terms,Classification code,Treatment,Funding details,Funding text,Access type,Database,Copyright,Data Provider
"GPS-constrained inversion of present-day slip rates along major faults of the Sichuan-Yunnan region, China","20083511478521","","Wang, YanZhao (1); Wang, EnNing (2); Shen, ZhengKang (1); Wang, Min (3); Gan, WeiJun (1); Qiao, XueJun (4); Meng, GuoJie (3); Li, TieMing (1); Tao, Wei (1); Yang, YongLin (5); Cheng, Jia (1); Li, Peng (3) ","(1) State Key Laboratory of Earthquake Dynamics, Institute of Geology, China Earthquake Administration, Beijing 100029, China (2) School of Earth and Space Sciences, University of Science and Technology of China, Hefei 230026, China (3) Institute of Earthquake Science, China Earthquake Administration, Beijing 100036, China (4) Institute of Seismology, China Earthquake Administration, Wuhan 430071, China (5) Survey Engineering Institute, Earthquake Administration of Sichuan Province, Ya'an 625000, China ","Shen, Z.K.(zshen@ies.ac.cn) ","Science in China, Series D: Earth Sciences","Sci. China Ser. D Earth Sci.","","Springer Verlag","51","9","1267-1283","2008","","","","2008","English","10069313","18622801","","","10.1007/s11430-008-0106-4","","","","","","","Journal article (JA)","A linked-fault-element model is employed to invert for contemporary slip rates along major active faults in the Sichuan-Yunnan region (96°-108°E, 21°035°N) using the least squares method. The model is based on known fault geometry, and constrained by a GPS-derived horizontal velocity field. Our results support a model attributing the eastward extrusion of the Tibetan Plateau driven mainly by the north-northeastward indentation of the Indian plate into Tibet and the gravitational collapse of the plateau. Resisted by a relatively stable south China block, materials of the Sichuan-Yunnan region rotate clockwise around the eastern Himalayan tectonic syntaxis. During the process the Garze´-Yushu, Xianshuihe, Anninghe, Zemuhe, Daliangshan, and Xiaojiang faults, the southwest extension of the Xiaojiang fault, and the Daluo-Jinghong and Mae Chan faults constitute the northeast and east boundaries of the eastward extrusion, with their left slip rates being 0.3-14.7, 8.9-17.1, 5.1 ± 2.5, 2.8 ± 2.3, 7.1 ± 2.1, 9.4 ± 1.2, 10.1 ± 2.0, 7.3 ± 2.6, and 4.9 ± 3.0 mm/a respectively. The southwestern boundary consists of a widely distributed dextral transpressional zone other than a single fault. Right slip rates of 4.2 ± 1.3, 4.3 ± 1.1, and 8.5 ± 1.7 mm/a are detected across the Nanhua-Chuxiong-Jianshui, Wuliangshan, and Longling-Lancang faults. Crustal deformation across the Longmenshan fault is weak, with shortening rates of 1.4 ± 1.0 and 1.6 ± 1.3 mm/a across the Baoxing-Beichuan and Beichuan-Qingchuan segments. Northwest of the Longmenshan fault lies an active deformation zone (the Longriba fault) with 5.1 ± 1.2 mm/a right slip across. Relatively large slip rates are detected across a few faults within the Sichuan-Yunnan block: 4.4 ±1.3 mm/a left slip and 2.7 ±1.1 mm/a shortening across the Litang fault, and 2.7 ±2.3 mm/a right-lateral shearing and 6.7 ±2.3 mm/a shortening across the Yunongxi fault and its surrounding regions. In conclusion, we find that the Sichuan-Yunnan region is divided into more than a dozen active micro-blocks by a large number of faults with relatively slow slip rates. The eastward extrusion of the Tibetan Plateau is absorbed and adjusted in the region mainly by these faults, other than a small number of large strike-slip faults with fast slip rates. © Science in China Press and Springer-Verlag GmbH 2008.","62","Fault slips","Deformation - Extrusion - Global positioning system - Least squares approximations - Strike-slip faults - Velocity","Constrained inversions - Crustal deformations - Gravitational collapse - Horizontal velocity - Least squares methods - Linked-fault-element - Sichuan-Yunnan region - Slip rates","484.1 Earthquake Measurements and Analysis - 921.6 Numerical Methods",,"Number: 200708002, Acronym: CEA, Sponsor: China Earthquake Administration; Number: 2004CB418403, Acronym: -, Sponsor: National Basic Research Program of China (973 Program); Number: 40334042, Acronym: -, Sponsor: National Natural Science Foundation of China; Number: -, Acronym: -, Sponsor: Ministry of Science and Technology of the People's Republic of China; Number: -, Acronym: -, Sponsor: Public Library Association; Number: -, Acronym: CEA, Sponsor: China Earthquake Administration; ","Received September 1, 2007; accepted June 10, 2008 doi: 10.1007/s11430-008-0106-4 †Corresponding author (email: zshen@ies.ac.cn) Supported by the National Basic Research Program of China (Grant No. 2004CB418403), the Key Program of the National Natural Science Foundation of China (Grant No. 40334042), and the China Earthquake Administration Research Fund (Grant No. 200708002)GPS data used in this study are mainly from the Crustal Motion Observation Network of China (CMONOC) project observed in 1999, 2001, and 2004 in the Sichuan-Yunnan region. They also include data from the A-level and B-level networks deployed by the Bureau of Surveying and Mapping under the Headquarters of the General Staff of PLA[38], data observed by survey teams from the China Earthquake Administration in 2002－ 2003 during the postseismic survey of the 2001 Ms 8.1 Kunlun Mountain Pass West earthquake[39], data collected by survey teams from the China Earthquake Administration in 2002－2003 during the emergency response survey along the “north-south seismic belt”, and data observed in 2005－2006 in reoccupation of some survey mode sites under the national basic key research project, “Physical Process and Strong Earthquake Prediction along Boundaries of Active Blocks”, supported by Ministry of Science and Technology of China.",,"Compendex","Compilation and indexing terms, Copyright 2019 Elsevier Inc.","Engineering Village"
"Fluid inclusion and ore genesis of the Luziyuan distal skarn Pb-Zn-Fe (-Cu) poly-metallic deposit, West Yunnan, SW China","20190306388880","","Deng, Mingguo (1, 2); Chen, Wei (1); Wnag, Xuewu (3); Liu, Fengxiang (3); Guan, Shenjin (1); Lu, Yingxiang (2); Yu, Haijun (2); Zhao, Fa (4) ","(1) Faculty of Land Resource Engineering, Kunming University of Science and Technology, Kunming; 650093, China (2) MLR Key Laboratory of Sanjiang Metallogeny and Resources Exploration and Utilization, Yunnan Geological Survey, Kunming; 650051, China (3) Geological Team 209, Yunnan Nuclear Industry, Kunming; 650032, China (4) Yunnan Yongchang Pb-Zn Company Ltd., Baoshan; 678307, China ","","Yanshi Xuebao/Acta Petrologica Sinica","Yanshi Xuebao/Acta Petrol. Sin.","","Science Press","34","5","1239-1257","2018","","","","2018","Chinese","10000569","20958927","","","","","","","","","","Journal article (JA)","The Luziyuan Pb-Zn-Fe (-Cu) poly-metallic deposit in Zhenkang County, West Yunnan, is the only gigantic deposit recently discovered in the Baoshan block of 'Sanjiang metallogenic belt', and has unique characteristics for correlating with other similar strata-bound hydrothermal Pb-Zn deposits of the block. Ore bodies in the Luziyuan deposit occurred as stratiform-like, veined and lenticular in the interlayer fracture zone of skarn and marble in the Late Cambrian carbonate formation. The ores are mainly characterized by banded, disseminated and veined-stockwork structures. The wallrocks are marked by intense hydrothermal alteration with a complexed and prominent zonation pattern in the sequence from bottom to top: garnet-diopside-tremolite-actinolite to chlorite-epidote-actinolite-rhodonite, and to carbonate-marbleization. The ore-forming fluids have undergone a significant evolution from early to late stages. The present paper concentrates on a systematic study of fluid inclusions involving various gangue minerals and sphalerite from the early and late skarn stages, quartz-sulfide mineral and quartz-carbonate stages. CO2-bearing liquid-rich fluid inclusions and liquid inclusions are common in the early skarn stage. These inclusions contain a large amount of K+, Na+, Ca+, F-, Cl-, and a little SO2-4 in the liquid phase, and H2O- and CO2-dominant and a small amount of CH4 and N2 in the vapor phase. Their homogenization temperatures range from 233. 6 to 315. 6°C and salinities from 10. 6% to 17. 6% NaCleqv. The late skarn stage is characterized by CO2-rich and NaCl-bearing fluid inclusions, with homogenization temperature ranging from 214.9 to 388. o°C and salinity from 5. 9% to 16.4% NaCleqv. The quartz-sulfide stage is dominated by CO2-bearing fluid inclusions, whose vapor phase mainly consists of H2O, CH4, and a small amount of CO2. The homogenization temperature ranges from 150. 0 to 285. 0°C and salinity from 2. 5% to 13. 8% NaCleqv. In the quartz-carbonate stage the inclusion fluid with a single composition has homogenization temperatures of 105. 0 ∼ 187. 5°C and salinity of 0. 5% to 12. 3% NaCleqv. Fluid inclusion characteristics combined with the H-0 isotope results suggest that the Luziyuan ore-forming fluid is sourced from deep magmatic hydrothermal solution with medium-high temperature and salinity, high K and Na contents, and rich in CO2, Cl, F in the early stage, but in the quartz-sulfide stage, is characterized by medium-low temperature, low salinity, and poor in CO2 due to being mixed with meteoric water that becomes dominant in the late stage. Therefore, the change in ore-forming environment, mixing of different fluids and possible fluid boiling may be the important mechanisms for precipitation and enrichment of metallic elements in the Luziyuan deposit. In the light of ore geology, fluid inclusions and H-0 isotopes, we propose that the Luziyuan Pb-Zn-Fe (-Cu) poly-metallic deposit is a distal skarn type mineralization system which is related to the deep-hidden granite and the continental collision orogeny. © Yanshi Xuebao/Acta Petrologica Sinica. All rights reserved.","85","Ores","Binary alloys - Carbon dioxide - Carbonation - Clay alteration - Deposits - Economic geology - Iron alloys - Isotopes - Lead alloys - Lead zinc deposits - Liquids - Lutetium alloys - Metals - Mineralogy - Ore deposit geology - Quartz - Silicate minerals - Sodium chloride - Sulfur compounds - Temperature - Ternary alloys - Zinc alloys - Zinc sulfide","Continental collisions - Distal skarn - Fluid inclusion - Metallic deposits - Ore-forming fluid - West Yunnan","481.1 Geology - 482 Mineralogy - 482.2 Minerals - 545.2 Iron Alloys - 546.1 Lead and Alloys - 546.3 Zinc and Alloys - 547.2 Rare Earth Metals - 641.1 Thermodynamics - 802.2 Chemical Reactions - 804.2 Inorganic Compounds",,,,,"Compendex","Compilation and indexing terms, Copyright 2019 Elsevier Inc.","Engineering Village"
"Preliminary simulation of strong ground motion for Ludian, Yunnan earthquake of 3 August 2014, and hazard implication","20144400132491","","Zhang, Zhen-Guo (1, 2, 3); Sun, Yao-Chong (1, 2, 3); Xu, Jian-Kuan (1, 2, 3); Zhang, Wei (1, 2, 3); Chen, Xiao-Fei (1, 2, 3) ","(1) School of Earth and Space Sciences, University of Science and Technology of China, Hefei; 230026, China (2) Laboratory of Seismology and Physics of Earth's Interior, University of Science and Technology of China, Hefei; 230026, China (3) Mengcheng National Geophysical Observatory, Hefei; 230026, China ","Chen, Xiao-Fei ","Acta Geophysica Sinica","Acta Geophys. Sin.","","Science Press","57","9","3038-3041","September 1, 2014","","","","2014","Chinese","00015733","","","","10.6038/cjg20140928","","","","","","","Journal article (JA)","An Ms6.5 earthquake occurred at Lundian county, Yunnan province on August 3, 2014. With the available three-dimensional velocity model and topography data, as well as the preliminarily inverted kinematic source model (Zhang et al. 2014), we simulated the seismic wave propagation of Ludian earthquake with 3D curved grids finite-difference method, and calculated the distribution of seismic intensity for the modeling region. The simulated results reveal that the highest seismic intensity caused by this earthquake is about degree 7, mainly in Lundian County and the boundaries between Ludian County and Qiaojia and Huize County. The simulation result also implies that ground motion has large amplitudes at the mountain peaks and ridges. The numerical modeling indicates that the amplification effect of low velocity basin at the northeastern of the earthquake fault may aggravate the seismic hazard.","6","Earthquake effects","Finite difference method - Hazards - Wave propagation","Amplification effects - Earthquake fault - Seismic hazards - Seismic intensity - Simulated results - Strong ground motion - Three-dimensional velocity - Yunnan province","914.1 Accidents and Accident Prevention - 921.6 Numerical Methods",,,,,"Compendex","Compilation and indexing terms, Copyright 2019 Elsevier Inc.","Engineering Village"
"Distribution patterns of diffuse solar radiation in Yunnan Province, China","2004057834126","","Wenxian, Lin ; Enrong, Lu ; Wenfeng, Gao ; Shaoxuan, Pu ; Tao, Liu ","(1) Solar Energy Research Institute, Yunnan Teachers University, Kunming, Yunnan 650092, China ","","Energy Conversion and Management","Energy Convers. Manage.","","Elsevier Ltd","37","5","553-560","May 1996","","","","1996","English","01968904","","","","10.1016/0196-8904(95)00210-3","","","","","","ECMADL","Journal article (JA)","Yunnan Province, China, is situated in a very favorable region for solar energy utilization. Its unique 'cubic climates' and geographic features make its distribution patterns of solar radiation vary considerably. It will be very beneficial to study, in detail, the characteristics of solar radiation climates in the province. Based on the correlations and the dry wet season model of solar radiation for Yunnan developed by us, we present, in this paper, studies on the distribution patterns of diffuse solar radiation in the province.","11",,,,,,"Number: -, Acronym: -, Sponsor: Yunnan Provincial Science and Technology Department; Number: -, Acronym: -, Sponsor: Bairen Program of Yunnan Province; ","Acknowledgement-The authors are grateful to the Yunnan Provincial Committee of Science and Technology, China, for financial support of this research as part of the research program to study the solar radiation resources in Yunnan Province, China.",,"Compendex","Compilation and indexing terms, Copyright 2019 Elsevier Inc.","Engineering Village"
"The Metallogenic Age and Geodynamic Setting of the Laojiezi Pb-Ag Polymetallic Deposit, Central Yunnan Province: Evidence from Re-Os Isotope of Sulfides","20184305984184","","Jiang, Xiaojun (1); Yan, Qinggao (1); Li, Wenchang (1, 2); Li, Chao (3); Wu, Peng (1); Guan, Shenjin (1); Yu, Haijun (4); Li, Jinlong (5) ","(1) Department of Earth Sciences, Faculty of Land Resource Engineering, Kunming University of Science and Technology, Kunming; 650093, China (2) Chengdu Center, China Geological Survey, Chengdu; 610081, China (3) National Research Center for Geoanalysis, Beijing; 10037, China (4) Yunnan Geological Survey Bureau, Kunming; 650051, China (5) Science and Technology Department, Coal Geological Bureau of Yunnan Province, Kunming; 650034, China ","Li, Wenchang(lwcyndd@163.com) ","Dizhi Xuebao/Acta Geologica Sinica","Dizhi Xuebao/Acta Geol. Sinica","","Geological Society of China","92","6","1280-1296","June 15, 2018","","","","2018","Chinese","00015717","","","","","","","","","","","Journal article (JA)","The Laojiezi Pb-Ag deposit, located in the middle section of the Cenozoic Red River-Ailaoshan alkali-rich porphyry belt, is the typical alkali-rich volcanic-magmatic hydrothermal deposit in central Yunnan province. A 70-m-wide syenite porphyry and molybdenite-pyrite vein with high Cu-Mo abnormal pyritization was firstly discovered in the deep part of the deposits (3# vein of 2073 level). It is believed that obvious alkali-rich porphyry and magmatic-hydrothermal Cu-Mo superimposed mineralization occurs at depth of the deposit. This study conducted Re-Os isotopic analysis for molybdenite-pyrite samples from molybdenite-pyrite veins, pyrite-galena veins and high Cu-Mo syenite porphyry from deep adits in the Laojiezi Pb-Ag deposits. An isochron age of 33.71± 0.29Ma and a weighted average age of 33.99±0.22Ma were obtained for molybdenite, indicating that the mineralization of the Pb-Ag polymetallic deposit took place in Oligocene, which is consistent with the diagenetic age of the syenite porphyry. The initial Os value of 0.3049~1.5549 and the γOs value of 140.5~1126 suggest that the metallogenic material was derived from partial melting of the crust-mantle transition layer. The metallogenic age of the Laojiezi porphyry Pb-Ag polymetallic deposit is roughly the same as that (30~40 Ma) of regional alkali-rich porphyry and magmatic hydrothermal polymetallic deposits. It shows that, after the collision between the India plate and Eurasia plate, the change of tectonic stress field resulted in large-scale strike-slip faulting system, which induced partial melting of crust-mantle transition zone within the stable cratons, forming alkali-rich intrusive rocks and metallogenic fluids, and the fluid formed alkali-rich porphyry and magmatic-hydrothermal polymetallic deposits along the weak structures. © 2018, Science Press. All right reserved.","86","Lead alloys","Binary alloys - Copper alloys - Deposits - Geodynamics - Isotopes - Melting - Metals - Mineralogy - Molybdenum alloys - Molybdenum compounds - Osmium alloys - Osmium compounds - Plates (structural components) - Pyrites - Rhenium alloys - Rhenium compounds - Silver alloys - Silver deposits - Slip forming - Strike-slip faults - Sulfur compounds","Central Yunnan - Geodynamic setting - Hydrothermal deposits - Metallogenic fluids - Metallogenic geodynamic - Re-Os isotopes - Strike slip faulting - Tectonic stress fields","408.2 Structural Members and Shapes - 412 Concrete - 481.3 Geophysics - 482 Mineralogy - 484.1 Earthquake Measurements and Analysis - 543.3 Molybdenum and Alloys - 544.2 Copper Alloys - 546.1 Lead and Alloys - 547.1 Precious Metals - 549.3 Nonferrous Metals and Alloys excluding Alkali and Alkaline Earth Metals - 802.3 Chemical Operations",,,,,"Compendex","Compilation and indexing terms, Copyright 2019 Elsevier Inc.","Engineering Village"
"Estimation and distribution patterns of direct solar radiation in Yunnan Province, China","2004057834127","","Wenxian, Lin ; Tao, Liu ; Shaoxuan, Pu ; Wenfeng, Gao ; Enrong, Lu ","(1) Solar Energy Research Institute, Yunnan Teachers University, Kunming, Yunnan 650092, China ","","Energy Conversion and Management","Energy Convers. Manage.","","Elsevier Ltd","37","5","561-567","May 1996","","","","1996","English","01968904","","","","10.1016/0196-8904(95)00211-1","","","","","","ECMADL","Journal article (JA)","Yunnan Province, China, is situated in a very favorable region for solar energy utilization. Its unique 'cubic climates' and geographic features make its distribution patterns of solar radiation vary considerably. It will be very beneficial to study, in detail, the characteristics of solar radiation climates in the province. Based on the correlations and the dry wet season model of solar radiation for Yunnan developed by us, we present, in this paper, studies on the estimation and distribution patterns of direct solar radiation in the province.","11",,,,,,"Number: -, Acronym: -, Sponsor: Yunnan Provincial Science and Technology Department; Number: -, Acronym: -, Sponsor: Bairen Program of Yunnan Province; ","Acknowledgement-The authors are grateful to the Yunnan Provincial Committee of Science and Technology, China for financial support of this research as part of the research program to study the solar radiation resources in Yunnan Province, China.",,"Compendex","Compilation and indexing terms, Copyright 2019 Elsevier Inc.","Engineering Village"
"Study on the spring drought rule in the karst region of Yunnan and Guizhou plateau in China","20081811236471","","Miao, Qilong (1); Yuan, Shujie (1, 2); Shi, Lan (1); Gu, Xiaoping (3) ","(1) Jiangsu Key Laboratory of Meteorological Disaster, Nanjing University of Information Science and Technology, Nanjing, 210044, China (2) College of Plant Protection, Agricultural University of Hebei, Baoding, 71001, China (3) Guizhou Key Lab. of Mountounious Climate and Resources, Guiyang, 550002, China ","Miao, Q.(yuanshujie66@163.com) ","Proceedings of SPIE - The International Society for Optical Engineering","Proc SPIE Int Soc Opt Eng","State Key Lab. Multi-spectral Information Processing Technol.; Chinese Educ. Ministry Key Lab. Image Process. Intell. Control; Huazhong University of Science and Technology; The International Society for Optical Engineering (SPIE)","SPIE, P.O. Box 10, Bellingham WA, WA 98227-0010, United States","6790","","","2007","MIPPR 2007: Remote Sensing and GIS Data Processing and Applications; and Innovative Multispectral Technology and Applications","","","2007","English","0277786X","","","9780819469540","10.1117/12.746860","67903Z","MIPPR 2007: Remote Sensing and GIS Data Processing and Applications; and Innovative Multispectral Technology and Applications","November 15, 2007 - November 17, 2007","Wuhan, China","71953","PSISDG","Conference article (CA)","Using the daily precipitation data from March to May of 88 stations from 1951 to 2004 in the karst region of Yunnan and Guizhou plateau (KRYGP), the indexes of the spring drought intensity (ISDI) are calculated. The temporal series of the ISDI are analyzed by Morlet wavelet. The complex multi-time scale structure of the ISDI variation is studied. The results show that the ISDI sequence variations have the discontinuity points and apparent 22-, 3- and 2- yearly periods, with 2-yearly as the most pronounced period. The drought degree will get lighter (heavier) in extra-heavy and severe drought regions (medium and light drought ones) by 2-yearly period forecast. We also study the spring drought's spatial and temporal feature, circulation forms.","7","Drought","Data reduction - Remote sensing - Wavelet transforms - Weather satellites","Karst region - Morlet wavelet - Multi-time scale - Spring drought - Yunnan and Guizhou plateau","921.3 Mathematical Transformations - 731.1 Control Systems - 723.2 Data Processing and Image Processing - 655.2 Satellites - 444 Water Resources - 443.3 Precipitation - 443.2 Meteorological Instrumentation","Theoretical (THR)",,,,"Compendex","Compilation and indexing terms, Copyright 2019 Elsevier Inc.","Engineering Village"
