Title,Accession number,Title of translation,Author,Author affiliation,Corresponding author,Source,Abbreviated source title,Sponsor,Publisher,Volume,Issue,Pages,Issue date,Monograph title,Volume title,Part number,Publication year,Language,ISSN,E-ISSN,ISBN13,DOI,Article number,Conference name,Conference date,Conference location,Conference code,CODEN,Document type,Abstract,Number of references,Main heading,Controlled/Subject terms,Uncontrolled terms,Classification code,Treatment,Funding details,Funding text,Access type,Database,Copyright,Data Provider
"Beneficiation of ilmenite in Yunnan province","20141717625466","","Yang, Xiao Feng (1, 2); Liu, Quan Jun (2); Deng, Rong Dong (2) ","(1) School of Land and Resources, Kunming University of Science and Technology, Kunming 650093, Yunnan, China (2) Kunming Vocational and Technical College Of Industry, Anning, 650302, Yunnan, China ","Liu, Q. J.(kmliuqj@sina.com) ","Applied Mechanics and Materials","Appl. Mech. Mater.","INTIEA Information and Engineering; Scientific.Net; Trans Tech publications inc.; National Institute of Technology Rourkela; Universitatea Politehnica Din Bucuresti; et al","Trans Tech Publications Ltd, Kreuzstrasse 10, Zurich-Durnten, CH-8635, Switzerland","543-547","","3882-3885","2014","Vehicle, Mechatronics and Information Technologies II","","","2014","English","16609336","16627482","9783038350606","10.4028/www.scientific.net/AMM.543-547.3882","","International Conference on Vehicle and Mechanical Engineering and Information Technology, VMEIT 2014","February 19, 2014 - February 20, 2014","Beijing, China","104672","","Conference article (CA)","This paper studied the recovering of Fe and TiO2 minerals from a refractory ore in Yunnan province. The grade of Fe in raw ore is 27.25% and the grade of TiO2 in raw ore is 5.79%. Through technological mineralogy study, we found that the Fe was mainly in the forms of Hematite and limonite, and the Ti was mainly in the forms of ilmenite and anatase. Through the process of strong magnetic separation and shaking table separation, the minerals of Fe and Ti were recovered. Finally, we got two products. They were Fe concentrate with the grade of 44.30%, recovery of 62.65%, and Ti concentrate with the grade of 43.60%, recovery of 32.55%. © (2014) Trans Tech Publications, Switzerland.","4","Ores","Ilmenite - Information technology - Magnetic separation - Recovery - Separation","Refractory ores - Separation efficiency - Shaking tables - Technological mineralogies - Two-product - Yunnan province","482.2 Minerals - 531 Metallurgy and Metallography - 802.3 Chemical Operations - 903 Information Science",,,,,"Compendex","Compilation and indexing terms, Copyright 2019 Elsevier Inc.","Engineering Village"
"Study on the extraction of remote sensing information of land use/cover change in ChengGong, YunNan Province","20101212799760","","Yu, Bingfei (1, 2); Hu, Guangdao (1, 2); Xiao, Dunhui (1, 2) ","(1) State Key Laboratory of Geological Processes and Mineral Resources, China University of Geosciences, Wuhan, 430074, China (2) Institute of Mathematical Geology and Remote Sensing Geology, China University of Geosciences, Wuhan, 430074, China ","Yu, B.(yubingfei@163.com) ","Proceedings - 2009 International Conference on Computational Intelligence and Software Engineering, CiSE 2009","Proc. - Int. Conf. Comput. Intell. Softw. Eng., CiSE","IEEE Wuhan Section; James Madison University; Microsoft Research Asia; University of Wisconsin at La Crosse; Wuhan University","IEEE Computer Society","","","","2009","Proceedings - 2009 International Conference on Computational Intelligence and Software Engineering, CiSE 2009","","","2009","English","","","9781424445073","10.1109/CISE.2009.5365902","5365902","2009 International Conference on Computational Intelligence and Software Engineering, CiSE 2009","December 11, 2009 - December 13, 2009","Wuhan, China","79559","","Conference article (CA)","This paper uses QuickBird and IKONOS images to analyze the situation of land-use in ChengGong, YunNan province.The methods such as image differential , differential principal component, multi-band principal component transform, principal component differential and product fusion are used to analyze the difference of spectral Characteristics and extract the change result images of land use. Finally this paper gives the change types information characteristic of ChengGong . ©2009 IEEE.","4","Land use","Artificial intelligence - Remote sensing - Software engineering","Extract - IKONOS - Land use/cover change - Principal Components - Quickbird - Remote sensing information - Spectral characteristics - Yunnan province","403 Urban and Regional Planning and Development - 723.1 Computer Programming - 723.4 Artificial Intelligence",,,,,"Compendex","Compilation and indexing terms, Copyright 2019 Elsevier Inc.","Engineering Village"
"Source parameters of regional small-to-moderate earthquakes in the Yunnan-Sichuan region of China","20104613391534","","Xu, Yan (1); Herrmann, Robert B. (1); Koper, Keith D. (1) ","(1) Department of Earth and Atmospheric Sciences, Saint Louis University, 3642 Lindell Blvd, St. Louis, MO 63108, United States ","Xu, Y.(yanxush@gmail.com) ","Bulletin of the Seismological Society of America","Bull. Seismol. Soc. Am.","","Seismological Society of America","100","5 B","2518-2531","November 1, 2010","","","","2010","English","00371106","19433573","","10.1785/0120090195","","","","","","BSSAAP","Journal article (JA)","We apply a grid-search waveform inversion technique to determine moment tensors for 73 small-to-moderate earthquakes that occurred in the Yunnan-Sichuan region of China in 2003 and 2004 and were recorded by a PASSCAL deployment together with 6 small-to-moderate events recorded by the Yunnan province digital seismic network (YDSN) that occurred in 2000 to 2001. The advantage of studying these earthquakes down to an Mw3.03 is that the large number of solutions present a picture of the interaction of the four tectonic blocks in the region. We find distinct patterns in the orientation of the maximum compressive stress axes derived from the moment tensor solutions. They are compatible with the clockwise rotation of the Eastern Himalayan syntaxis, northeastward compressive motion, and the southsoutheast movement of the east Tibetan Plateau crustal material and the counterclockwise rotation at the east of the Red River fault.We also find a subtle variation in source depth for crustal sources across the region.","58","Earthquakes","Tensors","Clockwise rotation - Counter clockwise rotation - Crustal materials - Moment tensor solutions - Seismic networks - Source parameters - Waveform inversion - Yunnan province","484 Seismology - 921.1 Algebra",,,,,"Compendex","Compilation and indexing terms, Copyright 2019 Elsevier Inc.","Engineering Village"
"3D geological modeling of pulang copper deposit, Yunnan Province of China","20122515136297","","Sun, Yue (1); Wang, Gongwen (1) ","(1) State Key Laboratory of Geological Processes and Mineral Resources, China University of Geosciences, Beijing, China ","Sun, Y.(sy0136@163.com) ","Proceedings - International Conference on Communication Systems and Network Technologies, CSNT 2012","Proc. - Int. Conf. Commun. Syst. Netw. Technol., CSNT","Sergeant Infotech Private Limited","IEEE Computer Society","","","294-298","2012","Proceedings - International Conference on Communication Systems and Network Technologies, CSNT 2012","","","2012","English","","","9780769546926","10.1109/CSNT.2012.71","6200670","International Conference on Communication Systems and Network Technologies, CSNT 2012","May 11, 2012 - May 13, 2012","Rajkot, Gujrat, India","90305","","Conference article (CA)","The three-dimensional (3D) geological model can be applied to observe the geological subjects of the deposit from all aspects and the orientation as borehole as its geometry. In this paper, firstly, Discrete Smooth Interpolation (DSI) method with GOCAD software was applied to construct 3D topographic and geologic models of the Pulang Copper in Yunnan based on the elevation and borehole data; secondly, the 3D ore body model is constructed using both boreholes and cross-sections which are constrained by the 3D topographic and geologic models; finally, the copper reserve in this deposit was evaluated using regular block cells. © 2012 IEEE.","8","Geologic models","Boreholes - Copper deposits - Deposits","3-d geological models - Geological modeling - GOCAD - Ore body models - Pulang coppers - Threedimensional (3-d) - Yunnan province","481.1 Geology - 504.3 Heavy Metal Mines",,,,,"Compendex","Compilation and indexing terms, Copyright 2019 Elsevier Inc.","Engineering Village"
"Vegetation supply water index based on MODIS data Analysis of the in Yunnan in spring of 2012","20144700216397","","Wang, Jianbo (1); Bai, Jianjun (1); Li, Lele (1); Yu, Yuan (1) ","(1) College of Tourism and Environment, Shaanxi Normal University, Xi'an; 710062, China ","Wang, Jianbo ","2014 The 3rd International Conference on Agro-Geoinformatics, Agro-Geoinformatics 2014","Int. Conf. Agro-Geoinformatics, Agro-Geoinformatics","Chinese Society of Agricultural Resources and Regional Planning; et al.; Geoscience and Remote Sensing Society (GRSS); Institute of Electrical and Electronics Engineers (IEEE); Open Geospatial Consortium (OGC); State Administration of Foreign Experts Affairs of China","Institute of Electrical and Electronics Engineers Inc.","","","","September 25, 2014","","","1of1","2014","English","","","9781479941575","10.1109/Agro-Geoinformatics.2014.6910673","6910673","2014 3rd International Conference on Agro-Geoinformatics, Agro-Geoinformatics 2014","August 11, 2014 - August 14, 2014","Beijing, China","114697","","Conference article (CA)","Today, drought has become a world problem, which is affecting agriculture more and more seriously. China is a large agricultural country, so drought is nor ignored for China. Drought hazards in agriculture growing, so timely and accurate monitoring of the development of drought is necessary to reduce the harm of drought. Over the years, many scholars established a variety of drought monitoring models, aiming at better monitoring of drought. Southwest China has been the drought-prone areas and Yunnan Province is the most serious area. [Method]: In this paper, in February 2012-May period of remote sensing data obtained with moderate-resolution imaging spectrometer (MODIS) conducts dynamic monitoring of drought in Yunnan. Normalized Difference Vegetation Index (NDVI) is calculated with the first bang and the second bang of MODIS data and Negative NDVI values that are representative of the water and snow should be removed. By split window algorithm method, land surface temperature (LST) in Yunnan is retrieved with 31-band and 32-band of MODIS data, but some places in where there is much cloud are removed. Then the Normalized Difference Vegetation Index (NDVI) and Land Surface Temperature (LST) calculated Vegetation Supply Water Index (VSWI) that dynamically monitors the drought in Yunnan. this model's results are validated based on 10 cm-shallow soil moisture data measured by the meteorological stations at the 0.05 confidence level and passed the correlation test which indicates that the results calculated by the model is sensitive to changes in drought. In the soil moisture data, some data collection sites have been irrigated, so these data should be removed. So this drought index can be used to monitor drought developments and we can get real-time, accurate drought. These monitoring results as a basis, We can make timely and correct drought policy to reduce losses caused by the drought; [Conclusions] :from spring drought monitoring results can be seen that Northwest Yunnan has been in a semi- arid and arid state. In February and May, it is more serious drought, drought affecting a wide range. There are two reasons about development of drought: First, the terrain reasons, northwest, eastern and Central Yunnan are the highland area, low rainfall, dry climate, so the severe drought in these areas; Second, the climatic reason, the spring belongs to the dry season, Rainfall is relatively small and its distribution is not balance. Relative to previous years, three months and it rarely rains in March and May, so it is severe drought. In recent years, natural hazards occur frequently on the world in witch drought is most. Drought is characterized by a wide spread range, long duration and great harm. China is a large agricultural country so it be harmed when drought occurred witch hinders the development of society. So it is necessity of Real-time, dynamic and accurate monitoring of drought. Only in this way, can we minimize the damage. © 2014 IEEE.","20","Drought","Agriculture - Atmospheric temperature - Hazards - Monitoring - Radiometers - Rain - Remote sensing - Soil moisture - Soil surveys - Spectrometers - Surface measurement - Surface properties - Vegetation - Water supply","Land surface temperature - Meteorological station - Moderate resolution imaging spectrometers - MODIS - Normalized difference vegetation index - Remote sensing data - Split window algorithms - Yunnan","443.1 Atmospheric Properties - 443.3 Precipitation - 446.1 Water Supply Systems - 483.1 Soils and Soil Mechanics - 741.3 Optical Devices and Systems - 821 Agricultural Equipment and Methods; Vegetation and Pest Control - 914.1 Accidents and Accident Prevention - 943.2 Mechanical Variables Measurements - 944.7 Radiation Measuring Instruments - 951 Materials Science",,,,,"Compendex","Compilation and indexing terms, Copyright 2019 Elsevier Inc.","Engineering Village"
"The rainwater artful design of the ecological farm in fumin county of yunnan province","20131516192460","","Guan, Junduo (1); Ma, Jianwu (1); Zhang, Qian (1); Zhang, Laichen (1) ","(1) Gold Mantis School of Architecture and Urban Environment, Soochow University, Jiangsu, China ","Guan, J.(782418357@qq.com) ","Advanced Materials Research","Adv. Mater. Res.","","Trans Tech Publications, P.O. Box 1254, Clausthal-Zellerfeld, D-38670, Germany","671-674","","2802-2805","2013","Construction and Urban Planning","","","2013","English","10226680","","9783037856611","10.4028/www.scientific.net/AMR.671-674.2802","","2013 International Conference on Structures and Building Materials, ICSBM 2013","March 9, 2013 - March 10, 2013","Guizhou, China","96430","","Conference article (CA)","In nature, rainwater makes its cycle through evaporation, infiltration, surface runoff and so on. To best manage rainwater, simulating nature and split-flow design would be good ways. Based on the opinion, We take measures such as bioretention, swale, rain gardens, pond, and wetlands to split-flow manage rainwater from roofs, roads, parking and green lands in the Fumin ecological farm of Yunnan province. Through the systemic design, the green land of the farm will have the ecological multi-functions: Reduce peak flow; Purify, collect and store rainwater; and replenish groundwater. Rainwater facilities add not only their aesthetic value, but also their entertainment and educational functions. © (2013) Trans Tech Publications, Switzerland.","5","Ecology","Design - Groundwater - Urban planning - Water management","Aesthetic value - Educational function - Fumin county - Multi-functions - Rainwater management - Surface runoffs - Systemic designs - Yunnan province","403.1 Urban Planning and Development - 408 Structural Design - 444 Water Resources - 444.2 Groundwater - 446 Waterworks - 454.3 Ecology and Ecosystems",,,,,"Compendex","Compilation and indexing terms, Copyright 2019 Elsevier Inc.","Engineering Village"
"Development of dencichine plus Yunnan Baiyao band-aid","20140817359280","","Wang, Zhen (1); Yang, Jing Ya (1); Chen, Qi (1) ","(1) Shanghai Ocean University Ocean Science Research Institute, Shanghai Engineering Center for Processing and Storage of acquatic product, Shanghai, China ","Yang, J. Y.(jyyang@shou.edu.cn) ","Advanced Materials Research","Adv. Mater. Res.","","Trans Tech Publications Ltd, Kreuzstrasse 10, Zurich-Durnten, CH-8635, Switzerland","881-883","","364-367","2014","Chemical, Material and Metallurgical Engineering III","","","2014","English","10226680","","9783037859940","10.4028/www.scientific.net/AMR.881-883.364","","2013 3rd International Conference on Chemical, Metallurgical Engineering, ICCMME 2013","December 10, 2013 - December 11, 2013","Zhuhai, China","102772","","Conference article (CA)","This study aims to develop the dencichine plus Yunnan Baiyao band-aid, and test the hemostatic effect in traumatic incision of the new band-aid, the stability of dencichine was measured by HPLC beforehand. After that, several groups with different material were pasted on longitudinal incision of SD rats. Bleeding time and blood loss was determined, observing the healing of the wounds. The result was that the stability of dencichine by HPLC proved to be steady beforehand. Compared with blank control group, the other groups could shorten bleeding time (p<0.01), and reduce blood loss(p<0.01), what's important is that the Yunnan Baiyao band-aid groups were much better about the healing of the wounds than gauze groups. The results indicates that it is obvious that dencichine plus Yunnan Baiyao band-aid has a significant effect on longitudinal incision, and it helps the wound to heal. Dencichine plus Yunnan Baiyao band-aid has economic prospect in marketing appliance. © (2014) Trans Tech Publications, Switzerland.","9","Blood","Metallurgical engineering","Bleeding time - Blood loss - Dencichine - Hemostasis - Yunnan Baiyao band-aid","461.2 Biological Materials and Tissue Engineering - 531 Metallurgy and Metallography",,,,,"Compendex","Compilation and indexing terms, Copyright 2019 Elsevier Inc.","Engineering Village"
"Hyperspectral estimation model of forest soil organic matter in Northwest Yunnan Province, China","20191506747983","","Chen, Yun (1, 2, 3); Wang, Jinliang (1, 2, 3); Liu, Guangjie (1, 2, 3); Yang, Yanlin (1, 2, 3); Liu, Zhiyuan (1, 2, 3); Deng, Huan (1, 2, 3) ","(1) College of Tourism and Geographic Sciences, Yunnan Normal University, Kunming; 650500, China (2) Key Laboratory of Resources and Environmental Remote Sensing, Universities in Yunnan, Kunming; 650500, China (3) Remote Sensing Research Laboratory, Center for Geospatial Information Engineering and Technology of Yunnan Province, Kunming; 650500, China ","Wang, Jinliang(jlwang@ynnu.edu.cn) ","Forests","Forests","","MDPI AG, Postfach, Basel, CH-4005, Switzerland","10","3","","2019","","","","2019","English","","19994907","","10.3390/f10030217","217","","","","","","Journal article (JA)","Soil organic matter (SOM) is an important index to evaluate soil fertility and soil quality, while playing an important role in the terrestrial carbon cycle. The technology of hyperspectral remote sensing is an important method to estimate SOM content efficiently and accurately. This study researched the best hyperspectral estimation model for SOM content in Shangri-La forest soil. The spectral reflectance of soils with sizes of 2 mm, 1 mm, 0.50 mm, and 0.25 mm were measured indoors. After smoothing and de-noising, the reciprocal reflectance (RR), logarithmic reflectance (LR), first-derivative reflectance (FR), reciprocal first-derivative reflectance (RFR), logarithmic first-derivative reflectance (LFR), and mathematical transformations of the original spectral reflectance (REF) were carried out to analyze the relevance of spectral reflectance and SOM content and extract the characteristic bands. Finally the simple linear regression (SLR), multiple stepwise linear regression (SMLR), and partial least squares regression (PLSR) models for SOM content estimation were established. The results showed that: (1)With the decrease of soil particle size, the spectral reflectance increased. The smaller the soil particle sizes, the more obvious was the increase in spectral reflectance. (2) The sensitive bands of SOM were mainly in the 580-690 nm range (correlation coefficient (R) > 0.6, p-value (p) v 2) = 0.91, root mean square error of validation (RMSEv) = 13.41, the ratio of percent deviation (RPD) = 3.33). The results provide a basis for monitoring SOM content rapidly in the forests of Northwest Yunnan, and provide a reference for forest SOM estimation in other areas. © 2019 by the authors.","56","Soils","Biogeochemistry - Biological materials - Estimation - Forestry - Least squares approximations - Mathematical transformations - Mean square error - Organic compounds - Particle size - Particle size analysis - Reflection - Regression analysis - Remote sensing","Coefficient of determination - HyperSpectral - Hyperspectral remote sensing - Northwest Yunnan - Partial least squares regressions (PLSR) - Soil organic matters - Soil particle size - Stepwise linear regression","461.2 Biological Materials and Tissue Engineering - 481.2 Geochemistry - 483.1 Soils and Soil Mechanics - 804.1 Organic Compounds - 921 Mathematics - 922.2 Mathematical Statistics - 951 Materials Science",,"","This research was funded by the National Natural Science Foundation of P.R. China, grant number 41271230 and 41561048); the Reserve Personnel Training Program of Middle-aged Academic and Technology Leaders of Yunnan Province, grant number 2008PY056; the Program for Innovative Research Team (in Science and Technology) in the University of Yunnan Province, IRTSTYN; and the Graduate Research Innovation Foundation of Yunnan Normal University, grant number yjs2018109 and 2017058. We wish to thank Ping Wang and his team for the experimental site. We are grateful to Ningning Gao for her help in the whole experimental process. We also would like to thank Yongxiang Yao and Yuan Wang for their help in the experiment and data collection.","Open Access","Compendex","Compilation and indexing terms, Copyright 2019 Elsevier Inc.","Engineering Village"
"REE characteristics and genesis of alkaline-rich porphyry, Yunnan Province","2001206508376","","Lai, J.-Q. ; Wu, C.-J. ; Peng, S.-L. ","(1) Institute of Geology, Central South University, Changsha 410083, China ","","Journal of Central South University of Technology (English Edition)","J Cent South Univ Technol Eng Ed","","Central South University of Technology","8","1","45-49","March 2001","","","","2001","English","10059784","","","10.1007/s11771-001-0023-6","","","","","","JCSTFT","Journal article (JA)","The Yunnan Himalayan alkaline-rich porphyry occurs as a compound rockbelt and consists of calca-alkalic, alkaline and peralkaline intrusions. Its origin is in debate. The paper deals with its origin by studying rock's REE and Sr isotope. Although the rocks are different in their REE contents varying from 77.53 μg/g to 1 798.3 μg/g, they have very similar features in REE parameters. On the triangular diagram of REEs, the sample dots are concentrated on the end area of light REEs, representing a product of low-degree melting of upper mantle or lower crust materials. The initial 87Sr/86Sr values of rocks vary between 0.706 4 and 0.709 8, showing a feature of mantle-crust mixed source. Moreover, REEs show a logarithmic linear positive correlation between them. This type of correlation strongly supports the fractional-partial melting model. The result of geochemistry inversion shows that the source rock of alkaline-rich porphyry is plagioclase-bearing harzburgite and of mantle-crust mixed type. At the early state of melting, some crust components of the source rock were partially melted into intermediate-acidic magma; with the crust components consumed, the magma evolved to basic.","16",,,,,,,,,"Compendex","Compilation and indexing terms, Copyright 2019 Elsevier Inc.","Engineering Village"
"The characteristics of evolution of Theravada temple in Yunnan Province, China","20113814353879","","Tan, Gangyi (1) ","(1) School of Architecture and Urban Planning, Huazhong University of Science and Technology (HUST), Wuhan, China ","Tan, G. ","2011 International Conference on Multimedia Technology, ICMT 2011","Int. Conf. Multimedia Technol., ICMT","","IEEE Computer Society","","","1785-1790","2011","2011 International Conference on Multimedia Technology, ICMT 2011","","","2011","English","","","9781612847740","10.1109/ICMT.2011.6003261","6003261","","","","","","Conference article (CA)","Theravada temple is famous in its abundant types and distinct characteristics. The paper focuses on the development proceeding of Theravada temple in Yunnan and sum up the characteristics of evolution, which are discussed and analyzed in critical and ecological ways. Firstly, Theravada temple is homology with Theravada temple in Southeast Asian and develops in different flow. Secondly, it complies with local customs and adapts the natural and social environment. It is possible to say that Theravada architecture is the production and testimony of the Dai phylum culture circle. © 2011 IEEE.","16","Multimedia systems","Forming","Comply with local customs - Dai Nationality - Homology and different-flow - Social environment - Theravada temple - Yunnan province","723.5 Computer Applications",,,,,"Compendex","Compilation and indexing terms, Copyright 2019 Elsevier Inc.","Engineering Village"
