Title,Accession number,Title of translation,Author,Author affiliation,Corresponding author,Source,Abbreviated source title,Sponsor,Publisher,Volume,Issue,Pages,Issue date,Monograph title,Part number,Publication year,Language,ISSN,E-ISSN,ISBN,ISBN13,DOI,Article number,Conference name,Conference date,Conference location,Conference code,CODEN,Document type,Abstract,Number of references,Main heading,Controlled/Subject terms,Uncontrolled terms,Classification code,Treatment,Funding details,Funding text,Access type,Database,Copyright,Data Provider
"Analysis of resonant characteristics of Yunnan power grid under different operating modes of AC/DC hybrid systems","20191706838038","","Helin, Liu (1); Jun, Wen (1); Shiyou, Yu (1); Jiaqi, Li (1) ","(1) Flexible Power Technology Institute, School of Electrical and Electronic Engineering, North China Electric Power University, Beijing, China ","Helin, Liu(liuhelin_2011@126.com) ","Journal of Engineering","J. Eng.","","Institution of Engineering and Technology","2019","16","1484-1487","March 1, 2019","","","2019","English","","20513305","","","10.1049/joe.2018.8750","","","","","","","Conference article (CA)","Resonance or harmonic amplification occurs when the frequency of the harmonics generated by the converter station is near the inherent resonance frequency of the substation. Considering there are six DC projects in the Yunnan power grid, analysing the resonant characteristics of the grid is imperative for safety reasons. This study establishes a simulation platform of the Yunnan power grid based on the Power System Analysis Software Package and formulates the modelling principles and simulation steps. In order to successfully analyse the resonant characteristics of a substation under normal operation mode and put forward any necessary suggestions, the impedance frequency of all 500 kV substations in the power grid are scanned. This is followed by studying, the influence of different operation modes of Yunnan power grid and different operation modes of DC system of Luxi converter station on the resonant characteristics of Yunnan substation. Based on these results, effective measures for resonance suppression are proposed. © 2019 Institution of Engineering and Technology.All right reserved.","5","Electric power transmission networks","Computer software - Hybrid systems - Rectifying circuits - Resonance - Simulation platform","AC/DC hybrid system - Converter station - Effective measures - Power system analysis - Resonance frequencies - Resonance suppressions - Resonant characteristics - Yunnan power grid","706.1.1 Electric Power Transmission - 723 Computer Software, Data Handling and Applications - 921 Mathematics - 931.1 Mechanics",,,,,"Compendex","Compilation and indexing terms, Copyright 2019 Elsevier Inc.","Engineering Village"
"Metamorphism and deformation of the mengdong group-complex in Southeastern Yunnan Province and their Tectonic Implications","20170803373929","","Tan, Hongqi (1, 2); Liu, Yuping (3) ","(1) College of Earth Science, Chengdu university of technology, Chengdu; Sichuan; 610059, China (2) Institute of Multipurpose Utilization of Mineral Resources, CAGS, Chengdu; Sichuan; 610041, China (3) State Key Laboratory of Ore Deposit Geochemistry, Institute of Geochemistry, Chinese Academy of Sciences, Guiyang; 550002, China ","Liu, Yuping(liuyuping@vip.gyig.ac.cn) ","Dizhi Xuebao/Acta Geologica Sinica","Dizhi Xuebao/Acta Geol. Sinica","","Geological Society of China","91","1","15-42","January 15, 2017","","","2017","Chinese","00015717","","","","","","","","","","","Journal article (JA)","The Mengdong Group-Complex is a series of Precambrian metamorphic sedimentary and magmatic complex cropped out in the Laojunshan area,southeastern Yunnan Province. For its peculiar location, the Mengdong Group-Complex has the important scientific significance to understand the tectonics of SE Yunnan,and even of South China and Tethys. In order to probe the metamorphism and deformation characteristics,by means of microscale observation such as optical microscope, electron microscope and electron probe,etc.,the characteristics of metamorphic-deformation have been studied in details. The results show that the macro styles of the Mengdong Group-Complex contain fold bedding,syntectonic secrete crystal veins,asymmetric shear lens,decollement sub-ductile structures,and the micro structures consist of mica fish,kink,quartz rectangular bank. Microscopic structure statistics data indicate that the Mengdong Group-Complex experienced the squeezing and stressing process in the directions of NE-SW,SE-NW,E-W and S-N,of which the result is similar to macro and micro structure.Meanwhile,the temperature of garnet-biotite mineral pairs in schist is 429 in average and the pressure of the schist is 0.5GPa. The temperature of tourmaline-biotite temperature in gneiss is 546 in average,corresponding to typical assemblages of the high green schist-low amphibolites facies. The U-Pb dating of titanite and rutile mineral suggests that the major metamorphism and deformation events occurred around ca. 236Ma and 170Ma.The above evidence shows that the Mengdong Group-Complex has experienced many metamorphic-deformation, and the principal stress of metamorphic-deformation (SE-NW) controls macrostructure framework of metamorphic Group-Complex(236Ca.), but S-N and E-W may be the directions of the sub-strain matched with the principal stress and NE-SW may be another direction after main metamorphic-deformation and age is confined to 170Ma. On behalf of the Laojunshan dome of early Yanshanian extensional-shear activity. Combined with other geochronological data,the Mengdong Group-Complex had undergone successively the large-scale thrust events in early Indosinian,the extension-shearing events in later Indosinian and early Yanshannian,and the contact metamorphism in later Yanshannian. Based on the study above, it can be outlined that the dynamic background of these metamorphic-deformation events is the Indosinian event, which is controlled the main features of the Mengdong Group-Complex. Laojunshan uplift of the dome began to activate in 236Ma,in consistent with the time of Tethys closure and collision, and stretched to 170Ma,after collapse of dome. NE directions widely developed klippe and offsite rock in Indosinian Wenshan-Malipo imply that pre-Indosinian formation belongs to the Mengdong Group-Complex and should be a set of foreigner rocky Nappe from Northern Vietnam. Therefore, the above results provide evidence for the study of tectonic evolution in the west of South China. © 2017, Science Press. All right reserved.","100","Deformation","Binary alloys - Calcium compounds - Domes - Fabrics - Geochronology - Lead alloys - Mica - Microstructure - Oxide minerals - Silicate minerals - Tectonics - Titanium dioxide - Uranium alloys","Chronology - Laojunshan - Mengdong Group-Complex - Southeastern Yunnan - Temperature gauges","408.2 Structural Members and Shapes - 481.1 Geology - 482.2 Minerals - 546.1 Lead and Alloys - 547 Minor, Precious and Rare Earth Metals and Alloys - 804.2 Inorganic Compounds - 819.4 Fiber Products - 951 Materials Science",,,,,"Compendex","Compilation and indexing terms, Copyright 2019 Elsevier Inc.","Engineering Village"
"Research on the cusp-catastrophic of the stability of the red beds landslide in Western Yunnan","20112714114960","","Sun, Feng (1, 2, 3); Kong, Jiming (1, 2) ","(1) Key Laboratory of Mountain Hazards and Surface Process, Chinese Academy of Science, Chengdu 610041, China (2) Institute of Mountain Hazards and Environment, Chinese Academy of Science, Chengdu 610041, China (3) Graduate University of Chinese Academy of Sciences, Beijing 100101, China ","Sun, F.(iamsunfeng12345@sina.com) ","Advanced Materials Research","Adv. Mater. Res.","Kunming University of Science and Technology; International Association for Scientific and High Technology","Trans Tech Publications, P.O. Box 1254, Clausthal-Zellerfeld, D-38670, Germany","261-263","","1645-1649","2011","Advances in Building Materials","","2011","English","10226680","","","9783037851418","10.4028/www.scientific.net/AMR.261-263.1645","","2011 International Conference on Civil Engineering and Building Materials, CEBM 2011","July 29, 2011 - July 31, 2011","Kunming, China","85320","","Conference article (CA)","The research is for the firs floods and the post-drought in Yunnan area in 2010. The strong rainfall and the hole pressure change are the red rock landslide most essential factor, so an apex post-modulus Epost which indicates the effect of pore-water pressure on stress - strain curves transition is defined at the first. By combining with the stiffness criterion of landslide is analyzed. Consequently rainfall and other conditions changes have important effects induced landslides. It union research thinks of the elephant mountain landslide area, that red rock landslide slope body displacement and the rainfall amount relations and the slope body full water area compares and the stability of slope coefficient relations, establishes one under the strong rainfall function the red rock landslide cusp sudden change model, the quota and qualitative reveals the strong rainfall to the red rock landslide trigger action. This developed model may carry out some use full knowledge to understand the disaster mechanism and the evolutional or accumulative process of hazard factors in mountain red layer of the slope stability problem, which may mean the further to advance the technique of forecasting, it can provide important reference to the disaster prevention. © (2011) Trans Tech Publications, Switzerland.","6","Slope protection","Building materials - Civil engineering - Construction equipment - Disaster prevention - Drought - Floods - Landforms - Landslides - Pressure effects - Rain - Research - Rocks - Stability - Stress-strain curves","Developed model - Instability model - Pore-water pressures - Pressure change - Red bed - Red layer of the landslide - Rock landslide - Slope-stability problems - Stability of slopes - Sudden change - The firs drought and the post-floods - Water areas - Western yunnan","483.1 Soils and Soil Mechanics - 484.1 Earthquake Measurements and Analysis - 801 Chemistry - 901.3 Engineering Research - 961 Systems Science - 914.1 Accidents and Accident Prevention - 931 Classical Physics; Quantum Theory; Relativity - 931.1 Mechanics - 951 Materials Science - 921 Mathematics - 481.1 Geology - 443.3 Precipitation - 405.1 Construction Equipment - 409 Civil Engineering, General - 411 Bituminous Materials - 412 Concrete - 413 Insulating Materials - 414 Masonry Materials - 415 Metals, Plastics, Wood and Other Structural Materials - 421 Strength of Building Materials; Mechanical Properties",,,,,"Compendex","Compilation and indexing terms, Copyright 2019 Elsevier Inc.","Engineering Village"
"Studies on predicting distribution of guava fruit fly in Yunnan province based on the genetic neural model","20120814795924","","Ni, Yuanping (1); Liu, Xiaofei (2); Ye, Hui (2) ","(1) School of Information Engineering and Automation, Kunming University of Science and Technology, Kunming 650500, China (2) School of Life Sciences, Yunnan University, Kunming 650091, China ","Ye, H.(yehui@ynu.edu.cn) ","Advanced Materials Research","Adv. Mater. Res.","International Science and Education Researcher Association (ISER); Beijing Gireida Education Research Center; VIP-Information Conference Center","Trans Tech Publications, P.O. Box 1254, Clausthal-Zellerfeld, D-38670, Germany","459","","224-228","2012","IISME2012","","2012","English","10226680","","","9783037853566","10.4028/www.scientific.net/AMR.459.224","","2012 2nd International Conference on Industry, Information System and Material Engineering, IISME 2012","March 17, 2012 - March 18, 2012","Wuhan, China","88595","","Conference article (CA)","Based on discussing the advantages of improving genetic algorithm and analyzing the defects of back propagation neural network, we presented the genetic neural model. The simulating data proved that the genetic neural model was able to realize parallel search and could get faster searching speed during random searching optimizaiton. The model was applied to predicting distribution of guava fruit fly. The experimental results show that the model can predict distribution of the fly which is consistent with the practical distribution. The model is very useful in practice. It is worthwhile to refer the model to predicting similar insects. © (2012) Trans Tech Publications, Switzerland.","6","Forecasting","Artificial intelligence - Neural networks","Back propagation neural networks - Distribution - Fruit flies - Guava fruit fly - Neural models - Parallel search - Predicting - Searching speed - Yunnan province","723.4 Artificial Intelligence - 921 Mathematics",,,,,"Compendex","Compilation and indexing terms, Copyright 2019 Elsevier Inc.","Engineering Village"
"Engineering practical method for PMU placement of 2010 Yunnan power grid in China","20101712892027","","Yang, Yi (1); Shu, Hongchun (1); Yue, Lili (2) ","(1) Faculty of Electric Power Engineering, Kunming University of Science and Technology, Yunnan Kunming 650051, China (2) Kunming Power Supply Design Co., Ltd, Yunnan Kunming 650011, China ","Yang, Y.(yjs008@kmust.edu.cn) ","1st International Conference on Sustainable Power Generation and Supply, SUPERGEN '09","Int. Conf. Sustainable Power Gener. Supply, SUPERGEN","","IEEE Computer Society","","","","2009","1st International Conference on Sustainable Power Generation and Supply, SUPERGEN '09","","2009","English","","","","9781424449347","10.1109/SUPERGEN.2009.5348345","5348345","1st International Conference on Sustainable Power Generation and Supply, SUPERGEN '09","April 6, 2009 - April 7, 2009","Nanjing, China","79815","","Conference article (CA)","This paper proposes a pressing and viable method for power system PMU placement, which is based on the project practical view. The proposed method does not pursue the completely observation, it proposes a practical method which considers the system's main net framework and its key nodes observation. According to the concept of indirect observation, and based on the project practical view, and the MST and SA method, it deploys PMU on the main net framework and its key buses, and it also improved the state estimation with SCADA/EMS measurement and PMU measurement. Then the proposed method is validated by case studies and it is also tested in Yunnan power grid. The comparison results demonstrate that the proposed method is effective. It is propitious to the power system analysis, and it has some advanced points such as strong maneuverability and small investment, so the proposed method is practicable.","20","Phasor measurement units","Electric power transmission networks","Comparison result - Indirect observation - PMU measurements - Power system analysis - Practical method - Project practicability - Small investments - Yunnan power grid","706.1.1 Electric Power Transmission - 942.2 Electric Variables Measurements",,,,,"Compendex","Compilation and indexing terms, Copyright 2019 Elsevier Inc.","Engineering Village"
"Deep electrical resistivity structure of Sanjiang Area of west Yunnan and its significance","20173304042288","","Yu, Chang-Qing (1); Zhang, Gang (2); Wang, Xu-Ben (3, 4); Luo, Wei (3, 4); Li, De-Wei (3, 4); Cai, Xue-Lin (4); Guo, Zi-Ming (3) ","(1) Institute of Geology, Chinese Academy of Geological Sciences, Beijing; 100037, China (2) School of Environment and Resource, Southwest University of Science and Technology, Mianyang; Sichuan; 621010, China (3) Institute of Geophysics, Chengdu University of Technology, Chengdu; 610059, China (4) Key Lab of Earth Exploration & Infomation Techniques of Ministry of Education, Chengdu University of Technology, Chengdu; 610059, China ","Zhang, Gang(zg@swust.edu.cn) ","Acta Geophysica Sinica","Acta Geophys. Sin.","","Science Press","60","6","2385-2396","June 1, 2017","","","2017","Chinese","00015733","","","","10.6038/cjg20170628","","","","","","","Journal article (JA)","A 350 km long-period Magnetotelluric profile is placed along Yinjiang-Yaoan. Altogether 69 broadband magnetotelluric sounding stations and 19 long-period magnetotelluric sounding stations were laid. After pre-treatment, qualitative analysis, and two-dimensional inversion of the observed field data by several data-processing methods, the crust and upper mantle electrical resistivity model along the profile is obtained. An analysis is made on the electrical resistivity structure of the main land blocks and faults, and the resistivity model reveals that there widely exist low resistivity zones in the crust in Sanjiang area at the Southeast edge of Qinghai-Tibet Plateau, the low resistivity zones differ in burial depth and thickness from east to west, and there exist massive crust-mantle low resistivity zones in Baoshan Block and central Yunnan Block. Under Tengchong block, there is a low resistivity zone in the crust with burial depth about 13~20 km and thickness about 10~17 km, which indicates there is magma chamber. Preliminarily, the ductile shear zone of Baoshan crust-mantle is taken as the deep east boundary of extrusion of the Indochina block. © 2017, Science Press. All right reserved.","47","Electric conductivity","Data handling - Magnetotellurics","Eastern boundary - Electrical resistivity structures - Extruding blocks - Magnetotelluric souding - Sanjiang area of west Yunnan","481.3 Geophysics - 701.1 Electricity: Basic Concepts and Phenomena - 723.2 Data Processing and Image Processing",,,,,"Compendex","Compilation and indexing terms, Copyright 2019 Elsevier Inc.","Engineering Village"
"Geotechnical centrifuge modeling of super-high embankment filled by red soft soil in western yunnan province","20133616699702","","Wu, Guo Xiong (1); Zhang, Ke (1); Chen, Xiang Shou (2) ","(1) School of Civil Engineering and Architecture, ChongQingJiaoTong University, ChongQing, 400074, China (2) Chongqing Municipal design and Research Institute, Chongqing, 400012, China ","","Applied Mechanics and Materials","Appl. Mech. Mater.","","Trans Tech Publications Ltd, Kreuzstrasse 10, Zurich-Durnten, CH-8635, Switzerland","353-354","","851-855","2013","Advances in Civil and Industrial Engineering","","2013","English","16609336","16627482","","9783037857755","10.4028/www.scientific.net/AMM.353-356.851","","3rd International Conference on Civil Engineering, Architecture and Building Materials, CEABM 2013","May 24, 2013 - May 26, 2013","Jinan, China","99140","","Conference article (CA)","High and even super-high embankment filled by red soft soil are often used in road construction in the mountainous areas of Western Yunnan province, China. Due to the poor engineering properties of the red soil, a proper analysis of the stability of the embankment is necessary. This paper aims to analyze the deformation and stability of a typical super-high embankment by comparing the geotechnical centrifuge modeling and FLAC-2D results. The paper finally concludes that: 1) The red soft soil in Yunnan province can be used as fill material; 2) Flat slope and geo-grid can effectively restrain the deformation of the slope; 3) Geotechnical centrifuge modeling well reflect the real engineering performance of the embankment. © (2013) Trans Tech Pudlications, Switzerland.","7","Embankments","Centrifuges - Civil engineering - Convergence of numerical methods - Deformation - Soils","Engineering properties - Fill materials - FLAC-2D - Geotechnical centrifuges - Mountainous area - Real engineering - Western yunnan - Yunnan province","921.6 Numerical Methods - 802.1 Chemical Plants and Equipment - 483.1 Soils and Soil Mechanics - 483 Soil Mechanics and Foundations - 441 Dams and Reservoirs; Hydro Development - 422 Strength of Building Materials; Test Equipment and Methods - 421 Strength of Building Materials; Mechanical Properties - 409 Civil Engineering, General - 405 Construction Equipment and Methods; Surveying",,,,,"Compendex","Compilation and indexing terms, Copyright 2019 Elsevier Inc.","Engineering Village"
"Mineralization regularity of ion-adsorption type REE deposits on Lincang granite in Yunnan Province","20193107267135","","Lu, Lei (1, 2); Wang, Denghong (1); Wang, Chenghui (1); Zhao, Zhi (1); Feng, Wenjie (1); Xu, Xiaochun (2); Yu, Feng (3) ","(1) MLR Key Laboratory of Metallogeny and Mineral Resource Assessment, Institute of Mineral Resources, Chinese Academy of Geological Sciences, Beijing; 100037, China (2) School of Resources and Environmental Engineering, Hefei University of Technology, Hefei; 230009, China (3) School of Earth Sciences and Resources, China University of Geoscience, Beijing; 100083, China ","Wang, Denghong(wangdenghong@sina.com) ","Dizhi Xuebao/Acta Geologica Sinica","Dizhi Xuebao/Acta Geol. Sinica","","Geological Society of China","93","6","1466-1478","June 15, 2019","","","2019","Chinese","00015717","","","","10.19762/j.cnki.dizhixuebao.2019181","","","","","","","Journal article (JA)","An ion-adsorption type REE (iRee) deposit have been found on Lincang granite in Yunnan province. It's a typical iRee deposit found on highland, which can be a model to find similar deposit on the similar background. Geochemical and mineralogical studies were conducted on this iRee deposit on Linchang granite in Yunnan province, in order to reveal the transport and adsorption of rare earth elements (REE) related to the ion-adsorption type mineralization. The parent rock is porphyry biotite monzogranite. REE are contained dominantly in allanite as well as in titanite, ilmenite, monazite, xenotime, apatite and zircon. REE pattern of the parent granite bigger than 150×10-6, indicates enrichment of LREE relative to HREE and no significant Ce anomaly. Weathering crust is ranging from 2 to 30 m depth, which can be separated to humid layer, completely weathering layer and partly weathering layer, REE is rich in completely weathering layer. REE content of the weathering crust is 3~5 times to parent rock. REE pattern of weathering crust is parent rock pattern alike, part of which is showing high HREE. Land shape changed and the ore body change accordingly. REE contents showing on hillside richer than which on top and foot. REE rich in deep or shallow depends on the thickness of humid layer. The terrain high in the north and low in the south, on the contrary, REE contents showing low to high. From west to east, REE contents showing higher in the middle than in both sides, and REE in the east richer than in the west. iRee deposits are located in middle-south of Lincang granite, all showing LREE rich. This region extends across mid-subtropical monsoon climate zone and tropical Rainforest monsoon climate zone, Hilly, mountainous widespread, controlled by the secondary fault, influenced by multi-stage magmatic evolution, parent rock is biotite monzogranite. REE content is controlled by landform, rich in hillside, lower in foot of hill. © 2019, Science Press. All right reserved.","30","Weathering","Adsorption - Atmospheric thermodynamics - Biotite - Deposits - Exploratory geochemistry - Granite - Ions - Mica - Mineralogy - Ore deposits - Phosphate minerals - Rare earths - Tropics - Zircon","Ion adsorption - IRee - Magmatic evolution - REE mineralization - Subtropical monsoon climate - Tropical rain forest - Weathering crust - Yunnan province","443 Meteorology - 443.1 Atmospheric Properties - 481.2 Geochemistry - 482 Mineralogy - 802.3 Chemical Operations - 804.2 Inorganic Compounds",,,,,"Compendex","Compilation and indexing terms, Copyright 2019 Elsevier Inc.","Engineering Village"
"Study on Controlling Factors of Formation and Evolution of Earth Forest in Yuanmou Area, Yunnan, China","20181304947817","","Luo, Penghui (1); Zhang, Shitao (1) ","(1) Kunming University of Science and Technology, No. 68 Wen Chang road, Kunming, Yunnan, China ","","IOP Conference Series: Earth and Environmental Science","IOP Conf. Ser. Earth Environ. Sci.","LAMA Energy Group; LAMA Gas and Oil","Institute of Physics Publishing","95","6","","December 21, 2017","World Multidisciplinary Earth Sciences Symposium, WMESS 2017 - Session V. Atmospheric Sciences, Climatology, Glaciology, Modelling and Soft Computing in Earth Sciences, Occupational Health and Safety, Specific Sessions","6 of 6","2017","English","17551307","17551315","","","10.1088/1755-1315/95/6/062011","062011","3rd World Multidisciplinary Earth Sciences Symposium, WMESS 2017","September 11, 2017 - September 15, 2017","Prague, Czech republic","133094","","Conference article (CA)","Earth forest is a kind of unique landscape. The earth forest whose formation, development and evolution is affected by many factors. This paper deeply analyses the causes and characteristics of the formation and evolution of earth forest from four aspect of tectonic movement, composition and structure, climate and human activities. © 2017 Institute of Physics Publishing. All rights reserved.","10","Earth (planet)","Earth sciences - Forestry - Industrial hygiene - Soft computing","Controlling factors - Formation and evolutions - Human activities - Tectonic movements - Yunnan , China","461.7 Health Care - 723 Computer Software, Data Handling and Applications",,,,"Open Access","Compendex","Compilation and indexing terms, Copyright 2019 Elsevier Inc.","Engineering Village"
