Title,Accession number,Title of translation,Author,Author affiliation,Corresponding author,Source,Abbreviated source title,Sponsor,Publisher,Volume,Issue,Pages,Issue date,Monograph title,Volume title,Part number,Publication year,Language,ISSN,E-ISSN,ISBN,ISBN13,DOI,Article number,Conference name,Conference date,Conference location,Conference code,CODEN,Document type,Abstract,Number of references,Main heading,Controlled/Subject terms,Uncontrolled terms,Classification code,Treatment,Funding details,Funding text,Access type,Database,Copyright,Data Provider
"Tectonics and Paleomagnetic Rotation Pattern of Yunnan (24°N–25°N, China): Gaoligong Fault Shear Versus Megablock Drift","20182205265216","","Pellegrino, Alessandra G. (1); Zhang, Bo (2); Speranza, Fabio (3); Maniscalco, Rosanna (1); Yin, Congyuan (2); Hernandez-Moreno, Catalina (3); Winkler, Aldo (3) ","(1) Università degli Studi di Catania, Dipartimento di Scienze Biologiche, Geologiche e Ambientali, Catania, Italy (2) School of Earth and Space Science, Peking University, Beijing, China (3) Istituto Nazionale di Geofisica e Vulcanologia, Rome, Italy ","Speranza, Fabio(fabio.speranza@ingv.it) ","Tectonics","Tectonics","","Blackwell Publishing Ltd","37","5","1524-1551","May 2018","","","","2018","English","02787407","19449194","","","10.1029/2017TC004899","","","","","","","Journal article (JA)","A wealth of paleomagnetic data from Yunnan (China) showed in the past a predominant post-Cretaceous clockwise (CW) rotation pattern, mostly explained invoking huge (hundreds of kilometer wide) blocks, laterally escaping (and/or rotating) due to India-Asia collision, separated by major strike-slip shear zones. Here we report on the paleomagnetism of the outcrops close to the Gaoligong dextral shear zone. Fifty paleomagnetic sites (503 samples) were sampled at variable distances (up to ~25 km) from mylonites exposed along the fault. Eighteen Jurassic-Cretaceous red bed sites yield systematic CW rotations with respect to Eurasia that peak at maximum (176°) close to the fault, and progressively decrease moving eastward, up to be virtually annulled ~20 km east of mylonite contact. West of the fault, 15 Pliocene-Holocene sites from the Tengchong volcanic field do not rotate. Thus, our data show that Gaoligong shear zone activity yielded significant CW rotations that were likely coeval to the main Oligo-Miocene episodes of dextral fault shear. The Gaoligong zone rotation pattern conforms to a quasi-continuous crust kinematic model and shows blocks of ≤1 km size close to the fault that enlarge moving eastward. Rotation values and width of the rotated-deformed zone translate to a 230–290 km Gaoligong shear zone dextral offset. Our work shows that fault shear plays a significant role for Indochina CW rotation occurrence. However, significant rotations at distances >30 km from main faults were also documented, so that additional tectonics—whose relative relevance has not been elucidated yet—must contribute as well to the rotation pattern. ©2018. American Geophysical Union. All Rights Reserved.","179","Strike-slip faults","Geomagnetism - Kinematics - Rotation - Structural geology","Paleomagnetic data - Paleomagnetic rotations - Paleomagnetism - Rotation pattern - Shear zone - Strike-slip shear zones - Variable distances - Yunnan",,,"Number: -, Acronym: -, Sponsor: Universit&agrave; di Catania; Number: -, Acronym: NSFC, Sponsor: National Natural Science Foundation of China; Number: 41422206, Acronym: NSFC, Sponsor: National Natural Science Foundation of China; ","We are grateful to Mu for his kindness and for safely driving us in the whole Yunnan. A. P. acknowledges a PhD grant from University of Catania and B. Z. and C. Y. acknowledge funding by the National Science Foundation of China (NSFC) (41422206). R. M. acknowledges funding by the University of Catania. Publication fees were granted by "Piano per la Ricerca 2016–2018" funding awarded to R. M. Two referees provided detailed reviews of the manuscript. Many thanks to Editors Claudio Faccenna and John Geissman and Associate Editor Augusto Rapalini for carefully evaluating our work. All the data supporting this work (single ChRMs from each sample) have been uploaded in the supporting information section.",,"Compendex","Compilation and indexing terms, Copyright 2019 Elsevier Inc.","Engineering Village"
"Levels, trends and risk assessment of arsenic pollution in Yangzonghai Lake, Yunnan Province, China","20104213311781","","Wang, Zhenhua (1); He, Bin (1); Pan, Xuejun (2); Zhang, Kegang (1); Wang, Chang (1); Sun, Jing (1); Yun, Zhaojun (1); Jiang, Guibin (1) ","(1) State Key Laboratory of Environmental Chemistry and Ecotoxicology, Research Center for Eco-Environmental Sciences, Chinese Academy of Sciences, Beijing 100085, China (2) School of Environmental Science and Engineering, Kunming University of Science and Technology, Kunming 650093, China ","He, B.(bhe@rcees.ac.cn) ","Science China Chemistry","Sci. China Chem.","","Science in China Press","53","8","1809-1817","August 2010","","","","2010","English","16747291","","","","10.1007/s11426-010-4039-3","","","","","","SCCCCS","Journal article (JA)","The arsenic contamination accident in Yangzonghai Lake, Yunnan has been of wide concern. In order to investigate the arsenic distribution and concentration trends after the accident, samples including lake water, sediments, soil, aquatic organisms and crops were collected in November 2008, as well as in February, May and September 2009. The average arsenic concentrations (arithmetic average) in lake water in the four sampling events were 176.9, 147.3, 159.3, and 161.1 μg/L, while those in the sediments were 32.87, 62.41, 62.99, and 46.96 μg/g, respectively. The highest content of total arsenic in soil in the vicinity of Yangzonghai was 23.33 μg/g, which was below the limits of the relevant national standard. The total arsenic levels in most aquatic plants were in the range of 100-200 μg/g, with Vallisneria natans (Lour.) Hara having the highest concentration of ∼300 μg/g. The arsenic levels of fish and shrimps were in the range of 1.52-11.4 μg/g (dry weight). © Science China Press and Springer-Verlag Berlin Heidelberg 2010.","37","Lake pollution","Accidents - Aquatic organisms - Arsenic - Lakes - Risk assessment","Arsenic concentration - Arsenic contamination - Arsenic pollution - Concentration trends - Level - National standard - Trends - Yunnan province","453 Water Pollution - 471 Marine Science and Oceanography - 804 Chemical Products Generally - 914.1 Accidents and Accident Prevention",,"Number: GJHZ 0907, Acronym: CAS, Sponsor: Chinese Academy of Sciences; Number: 2009CB421605, Acronym: -, Sponsor: -; Number: 20677069, Acronym: NSFC, Sponsor: National Natural Science Foundation of China; ","This work was jointly supported by the National Basic Research Program of China (2009CB421605), the National Natural Science Foundation of China (20677069) and Key Project in Foreign Cooperation of Chinese Academy of Sciences (GJHZ 0907).",,"Compendex","Compilation and indexing terms, Copyright 2019 Elsevier Inc.","Engineering Village"
"The origin of pale and dark layers in Pliocene lignite deposits from Yunnan Province, Southwest China, based on coal petrological and organic geochemical analyses","20182605358619","","Liu, Bangjun (1); Zhao, Cunliang (2); Ma, Jialiang (2); Sun, Yuzhuang (2); Püttmann, Wilhelm (1) ","(1) Department of Environmental Analytical Chemistry, Institute of Atmospheric and Environmental Sciences, Goethe-University Frankfurt am Main, Frankfurt am Main, Germany (2) Key Laboratory of Resource Exploration Research of Hebei Province, Hebei University of Engineering, Handan; Hebei; 056038, China ","Püttmann, Wilhelm(puettmann@iau.uni-frankfurt.de) ","International Journal of Coal Geology","Int. J. Coal Geol.","","Elsevier B.V.","195","","172-188","1 July 2018","","","","2018","English","01665162","","","","10.1016/j.coal.2018.06.003","","","","","","IJCGDE","Journal article (JA)","A set of 39 pale lignite and dark lignite samples, obtained from a profile of the Pliocene Jinsuo lignite basin, Yunnan Province, China, were analyzed using coal petrology and biomarkers to determine whether changes in the depositional environment and/or vegetation caused the color changes ultimately observed in the lignites. A comprehensive analysis of all the data obtained revealed significant differences in the petrological and geochemical composition of the two lignite types. The pale lignites are characterized by a higher abundance of the liptinite group compared with the dark lignites. The composition of liptinites is dominated by bituminite (mineral-bituminous groundmass) and sporinite, along with a relatively low abundance of the huminite group. This indicates a higher degree of oxidation in the drier, more elevated peatland environments during deposition of the pale lignites. The low values of the tissue preservation index (TPI), vegetation index (VI), and gelification index (GI) in the pale lignites suggest a relatively high decomposition rate of plant materials under dry/aerobic conditions. In contrast, the dark lignites have a very high proportion of huminite dominated by ulminite, along with a low content of liptinite and inertinite macerals, which suggests the prevalence of wet/anaerobic conditions in the peat-forming mire. The high values of TPI, VI, and GI in the dark layers suggest better preservation of organic matter during deposition under anaerobic conditions, and more wet/humid climatic conditions, when compared with the pale lignites. With respect to the biomarker composition, the high concentrations of long-chain (C27-C31) n-alkanes in both pale and dark lignites are typical characteristics for the predominance of higher terrestrial plants. Significant concentrations of mid-chain n-alkanes (n-C21-C25) were detected preferentially in the dark lignites, suggesting that aquatic plants might also have contributed to the plant community during the formation of the dark layers. The content of diterpenoids, and the average ratio of diterpenoids to the sum of diterpenoids and triterpenoids (Di-/(Di- + Tri-terpenoids)) are higher in the pale lignites than in the dark lignites. This indicates that gymnosperms made a crucial contribution to the plant community during the formation of the pale lignites. In the dark lignites, triterpenoids are generally far more abundant than diterpenoids, which suggests that the dark layers were overwhelmingly formed by angiosperm plants. This is consistent with lower C/N ratios in the dark lignite layers (av. 40.8) compared with the pale lignite layers (av. 60.6). Higher microbial activities in the pale lignites than in the dark lignites are reflected by the higher concentration of hopanoids and 17α,21β-homohopane (22R) in the pale lignites. © 2018","137","Lignite","Analytical geochemistry - Aquatic organisms - Biomarkers - Chains - Coal deposits - Deposition - Lipids - Paraffins - Petrography - Petrology - Rocks - Vegetation","Comprehensive analysis - Depositional environment - Diterpenoids - Geochemical composition - Pliocene - Preservation of organic matters - Triterpenoids - Yunnan province","471 Marine Science and Oceanography - 481.1.2 Petrology (Before 1993, use code 482) - 503 Mines and Mining, Coal - 524 Solid Fuels - 602.1 Mechanical Drives - 801 Chemistry - 802.3 Chemical Operations - 804.1 Organic Compounds",,"Number: 201708080005, Acronym: -, Sponsor: Goethe-Universit&auml;t Frankfurt am Main; Number: -, Acronym: CSC, Sponsor: China Scholarship Council; ","Financial support for Bangjun Liu was provided by the China Scholarship Council to carry out his PhD project at Goethe-University Frankfurt am Main (No. 201708080005 ). We are grateful to the anonymous reviewer and editors whose comments significantly improved the quality of the manuscript. We thank Dr. Paul Seward for editing a draft of this manuscript.",,"Compendex","Compilation and indexing terms, Copyright 2019 Elsevier Inc.","Engineering Village"
"Retrospective forecasting test of a statistical physics model for earthquakes in Sichuan-Yunnan region","20083911603924","","Jiang, Chang Sheng (1); Wu, Zhong Liang (1, 2) ","(1) Institute of Geophysics, China Earthquake Administration, Beijing 100081, China (2) College of Earth Science, Graduate University of Chinese Academy of Sciences, Beijing 100049, China ","Wu, Z.L.(wuzhl@gucas.ac.cn) ","Science in China, Series D: Earth Sciences","Sci. China Ser. D Earth Sci.","","Springer Verlag","51","10","1401-1410","2008","","","","2008","English","10069313","18622801","","","10.1007/s11430-008-0112-6","","","","","","","Journal article (JA)","Pattern informatics (PI) model is one of the recently developed predictive models of earthquake physics based on the statistical mechanics of complex systems. In this paper, retrospective forecast test of the PI model was conducted for the earthquakes in Sichuan-Yunnan region since 1988, exploring the possibility to apply this model to the estimation of time-dependent seismic hazard in continental China. Regional earthquake catalogue down to ML3.0 from 1970 to 2007 was used. The 'target magnitude' for the forecast test was MS 5.5. Fifteen-year long 'sliding time window' was used in the PI calculation, with 'anomaly training time window' being 5 years and 'forecast time window' being 5 years, respectively. Receiver operating characteristic (ROC) test was conducted for the evaluation of the forecast result, showing that the PI forecast outperforms not only random guess but also the simple number counting approach based on the clustering hypothesis of earthquakes (the RI forecast). If the 'forecast time window' was shortened to 3 years and 1 year, respectively, the forecast capability of the PI model decreased significantly, albeit outperformed random forecast. For the one year 'forecast time window', the PI result was almost comparable to the RI result, indicating that clustering properties play a more important role at this time scale. © Science in China Press and Springer-Verlag GmbH 2008.","29","Forecasting","Earthquakes - Statistical mechanics - Statistical Physics - Testing","Clustering properties - Earthquake forecast - Earthquake physics - Predictive models - Receiver operating characteristics - Regional earthquakes - Sichuan-Yunnan region - Sliding time windows","484 Seismology - 922.2 Mathematical Statistics",,"Number: 2004CB418406, Acronym: -, Sponsor: National Basic Research Program of China (973 Program); ","Received July 4, 2007; accepted February 18, 2008 doi: 10.1007/s11430-008-0112-6 †Corresponding author (email: wuzhl@gucas.ac.cn) Supported by the National Basic Research Program of China (Grant No.2004CB418406)",,"Compendex","Compilation and indexing terms, Copyright 2019 Elsevier Inc.","Engineering Village"
"The characterization of a marine shale gas reservoir in the lower Silurian Longmaxi Formation of the northeastern Yunnan Province, China","20153701271995","","Zhang, Xu (1, 2); Liu, Chenglin (1, 2); Zhu, Yanming (3, 4); Chen, Shangbin (3, 4); Wang, Yang (3, 4); Fu, Changqing (3, 4) ","(1) Key Laboratory of Shale Oil and Gas Geological Survey, Chinese Academy of Geological Sciences, Beijing; 100081, China (2) Institute of Geomechanics, Chinese Academy of Geological Sciences, Beijing; 100081, China (3) School of Resources and Geosciences, China University of Mining and Technology, Xuzhou; 221116, China (4) Key Laboratory of Coalbed Methane Resources and Reservoir Formation Process, The Ministry of Education, China University of Mining and Technology, Xuzhou; 221116, China ","Liu, Chenglin(lclzgx@126.com) ","Journal of Natural Gas Science and Engineering","J. Nat. Gas Sci. Eng.","","Elsevier B.V.","27","","321-335","November 01, 2015","","","","2015","English","18755100","","","","10.1016/j.jngse.2015.08.070","","","","","","","Journal article (JA)","Shale gas of Longmaxi Formation, in the northeast of the Yunnan Province, has great potentialities but at a relatively immature exploration stage presently. Geological conditions and reservoir pore structure of the Longmaxi shale gas were clearly studied based on our researches. In the study area, the thickness of Longmaxi black shale gradually increases from southeast to northwest and the maximum is more than 120 m. For 46 shale samples from measured profiles, the total organic carbon (TOC) content and mineral composition of the shale gas reservoir were investigated. The TOC content increases from south to north, with an average content of 0.96% and higher TOC content in the lower segment of the Longmaxi Formation. The main minerals are clays and quartz, with an average content of 45.67% and 27.08% respectively. High pressure mercury intrusion (HPMI), low pressure nitrogen gas adsorption (N2-GA), carbon dioxide gas adsorption (CO2-GA) and scanning electron microscopy (SEM) methods were used to quantitatively and qualitatively analyse the pore structure of the shale gas reservoir. The openness and connectivity of macropores and mesopores gradually decrease from bottom to top in the Longmaxi Formation, and macropores and a few mesopores contribute to the dominant pore volume. Micropores with 0.30-0.40 nm and 0.45-0.60 nm diameters and mesopores of approximately 4 nm in diameter are strongly developed. Interparticle pores (Interp P), intercrystal pores (Interc P), intraparticle pores (Intra P) and organic matter pores (OMP) were observed. The shale porosity is in the range of 1.35-7.49%, with a mean of 3.98%. Porosity generally increases with increasing TOC and clays contents and decreases with increasing carbonate contents. More pore volume and surface area are always developed in shales with high TOC and clays contents and low carbonate contents. The micropore surface area is more developed in shales with high illite/smecnite mixed layers and kaolinite contents, whereas it is less developed in shales with high illite and chlorite contents. Therefore, the Longmaxi shale gas geological conditions are promising in the northeast of Yunnan Province. © 2015 Elsevier B.V.","51","Shale","Carbon dioxide - Gas adsorption - Gases - Geology - Kaolinite - Microporosity - Organic carbon - Pore structure - Scanning electron microscopy - Shale gas","Geological conditions - High pressure mercury - Longmaxi formation - Mineral composition - North-eastern yunnan provinces - Shale gas reservoirs - Total Organic Carbon - Yunnan province","481.1 Geology - 482.2 Minerals - 522 Gas Fuels - 802.3 Chemical Operations - 804.1 Organic Compounds - 804.2 Inorganic Compounds - 931.2 Physical Properties of Gases, Liquids and Solids",,"Number: 2012CB214702, Acronym: -, Sponsor: -; Number: 41272159, Acronym: NSFC, Sponsor: National Natural Science Foundation of China; Number: 41272155, Acronym: NSFC, Sponsor: National Natural Science Foundation of China; ","The authors sincerely thank the financial support of the Major State Basic Research Development Program of China (973 Program) ( 2012CB214702 ) and the National Natural Science Foundation of China ( 41272155 and 41272159 ). We sincerely thank the five anonymous reviewers for their careful and instructive comments. We also thank the JNGSE chief editor, David A. Wood, for the helpful suggestions that enhanced the quality of the manuscript.",,"Compendex","Compilation and indexing terms, Copyright 2019 Elsevier Inc.","Engineering Village"
"Telescoping ore targets by geochemical exploration at multiple scales in Eastern Yunnan Pt geochemical province, southwestern China","20092112091776","","Chen, YongQing (1); Huang, JingNing (1); Zhai, XiaoMing (2); Zhao, BinBin (1) ","(1) School of Earth and Mineral Resources, China University of Geosciences, Beijing 100083, China (2) College of Lake County, 19351 W. Washington St., Grayslake, IL 60030, United States ","Chen, Y.Q.(yqchen@cugb.edu.cn) ","Science in China, Series D: Earth Sciences","Sci. China Ser. D Earth Sci.","","Springer Verlag","52","5","627-637","2009","","","","2009","English","10069313","18622801","","","10.1007/s11430-009-0051-x","","","","","","","Journal article (JA)","Platinum has been one of the highly needed mineral resources in China. The geochemical exploration at two survey scales was applied in telescoping ore targets for the first time in Eastern Yunnan Pt geochemical province that was delineated using Pt data from flood plain sediments with extra-low sampling density. Our study was based on the delineations and assessments of both regional and local Pt anomalies using the Pt data by analyzing with C-OES the composite samples with two sampling densities. The composite samples were obtained by recomposing at two sampling densities the original stream sediment samples collected by the National Geochemical Mapping Project. Semi-variograms were used to quantitatively describe the variability of Pt anomalies and further analyze the factors controlling the variability. Pt resource potentials of both the regional Pt anomalies and the local Pt anomalies in the study area were estimated based on the geochemical block methods, respectively. It comes to the conclusions as follows. (1) From the regional to local Pt anomaly, the factors controlling their variability from the deep seated faults-basalts turn into the basalts-branch faults, which suggest that Semi-variograms could identify the geological factors controlling the variability of the Pt anomalies identified by the Pt data from the stream sediments with different sampling densities. (2) There exist two types of Pt anomalies in the study area. One is those displaying at sampling densities, and its average Pt concentration significantly increases with sampling density increasing. The other is getting weaker and/or disappears with sampling density increasing. This shows that TOTGEMS could gradually eliminate non-ore anomalies and keep ore anomalies. (3) The average Pt concentration of the local Pt anomaly blocks delineated using Pt data from stream sediments with sampling density of one composite per 16 km2 is twice as much as that of the regional Pt anomaly blocks delineated using Pt data from stream sediments with sampling density of one composite per 64 km2. The Pt resource amount of the local Pt anomaly blocks is 60% of the regional anomaly blocks, but the area of the former is just 35% of the latter, which suggests that the Pt resource amount is mainly concentrated in its local anomalies, and that TOTGEMS has a good exploration function that efficiently approaches ore targets. © Science in China Press and Springer-Verlag GmbH 2009.","40","Ore sampling","Basalt - Exploratory geochemistry - Geochemical surveys - Mineral exploration - Mineral resources - Ores - Sediments","Eastern Yunnan - Geochemical exploration - Geochemical mapping - Geological factors - Resource potentials - Sampling densities - Semivariograms - Southwestern China","481.1 Geology - 481.2 Geochemistry - 483 Soil Mechanics and Foundations - 501.1 Exploration and Prospecting Methods - 533.1 Ore Treatment",,"Number: 2006AA06Z113, Acronym: -, Sponsor: National High-tech Research and Development Program; Number: 40772197, Acronym: -, Sponsor: National Natural Science Foundation of China; ","Received August 5, 2008; accepted February 18, 2009 doi: 10.1007/s11430-009-0051-x †Corresponding author (email: yqchen@cugb.edu.cn) Supported by National High-Tech Research & Development Program of China (863 Program) (Grant No. 2006AA06Z113) and National Natural Science Foundation of China (Grant No. 40772197)",,"Compendex","Compilation and indexing terms, Copyright 2019 Elsevier Inc.","Engineering Village"
