Title,Accession number,Title of translation,Author,Author affiliation,Corresponding author,Source,Abbreviated source title,Sponsor,Publisher,Volume,Issue,Pages,Issue date,Monograph title,Volume title,Part number,Publication year,Language,ISSN,E-ISSN,ISBN13,DOI,Article number,Conference name,Conference date,Conference location,Conference code,CODEN,Document type,Abstract,Number of references,Main heading,Controlled/Subject terms,Uncontrolled terms,Classification code,Treatment,Funding details,Funding text,Access type,Database,Copyright,Data Provider
"Research and analysis of the achievements of philosophy in Yunnan universities based on bibliometrics","20194107504448","","Du, Xiang (1); Zhang, Guofei (2); Li, Qiong (1) ","(1) KunMing Metallurgy College, Kunming City, Yunnan Province, China (2) Southwest Forestry University, Kunming City, Yunnan Province, China ","","ACM International Conference Proceeding Series","ACM Int. Conf. Proc. Ser.","Array Processing Languages (APL); Guilin University of Technology; Wuhan University of Technology","Association for Computing Machinery","","","60-65","June 28, 2019","Proceedings of the 2019 3rd International Workshop on Education, Big Data and Information Technology, EBDIT 2019","","1 of 1","2019","English","","","9781450372053","10.1145/3352740.3352751","","3rd International Workshop on Education, Big Data and Information Technology, EBDIT 2019","June 28, 2019 - June 30, 2019","Guilin, China","151542","","Conference article (CA)","Based on the knowledge map technology and starting from the philosophy academic literature of colleges and universities in Yunnan province, this paper elaborates on the analysis of philosophy academic literature of colleges and universities in Yunnan province in terms of time series, distribution of core authors and research institutions, research hotspots and research frontiers. Thus deduces the research track of Yunnan province philosophy domain, reveals its research hot spot. © 2019 Association for Computing Machinery.","13","Time series analysis","Big data - Knowledge engineering","Bibliometrics - Citespace - Knowledge mapping - Philosophy - Scientometrics","723.2 Data Processing and Image Processing - 723.4 Artificial Intelligence - 922.2 Mathematical Statistics",,,,,"Compendex","Compilation and indexing terms, Copyright 2019 Elsevier Inc.","Engineering Village"
"Study on the protection and renewal of residential houses rooted in traditional geo-industry Take Shangyangxi Village, Dali, Yunnan, China as an example","20191606809331","","Zhang, Chen (1) ","(1) College of Architecture and Urban Planning, Shenzhen University, Shenzhen, Guangdong; 518060, China ","Zhang, Chen(daleychen@foxmail.com) ","IOP Conference Series: Earth and Environmental Science","IOP Conf. Ser. Earth Environ. Sci.","","Institute of Physics Publishing","242","5","","April 1, 2019","4th International Conference on Energy Equipment Science and Engineering - Pollution Control and Environmental Sustainability","","5 of 6","2019","English","17551307","17551315","","10.1088/1755-1315/242/5/052050","052050","2018 4th International Conference on Energy Equipment Science and Engineering, ICEESE 2018","December 28, 2018 - December 30, 2018","Xi'an, China","147102","","Conference article (CA)","The author conducted a three-week survey of the industrial structure, residence and minority culture of Shangyangxi Village in Dali, Yunnan. Focusing on the research and protection of a 'Bai' traditional building with a century-old 'three wing houses and a screen wall' style, a certain degree of commercial and residential renovation of the building was taken so as to meet the actual needs of households. As for this design, the author relied on the location of the village, the architectural characteristics and the subjective requirements of the household to complete the repair of the house and to update the function on the technical and design perspectives. This design not only provides an example for the renovation of other Bai traditional buildings, but also provides a different approach to village-renovation in the future rural planning and heritage protection. Bai dwellings should be protected according to the different characteristics of the village and adapted to the local conditions, giving the traditional buildings a new function and life. © Published under licence by IOP Publishing Ltd.","8","Architectural design","Houses - Pollution control - Rural areas - Sustainable development","Industrial structures - Local conditions - New functions - Residential house - Rural planning - Traditional buildings - Yunnan , China","402 Buildings and Towers - 402.3 Residences",,,,"Open Access","Compendex","Compilation and indexing terms, Copyright 2019 Elsevier Inc.","Engineering Village"
"Characteristics of cloud-to-ground lightning activity in hailstorms over Yunnan province","20155201719596","","Xie, Yiran (1, 2); Wu, Jian (1); Liu, Xuetao (2); Zhang, Tengfei (3); Xie, Yinjian (4); Xu, Yinjie (2); Zhao, Deming (5) ","(1) Department of Atmospheric Science, Yunnan University, Kunming; 650091, China (2) Meteorological Observatory of Yunnan Province, Kunming; 650034, China (3) Yunnan Weather Modification Center, Kunming; 650034, China (4) Jianchuan Vocational Senior High School, Jianchuan; 671300, China (5) Key Laboratory of Regional Climate-Environment for Temperate East Asia, Institute of Atmospheric Physics (IAP), Chinese Academy of Sciences (CAS), Beijing; 100029, China ","Wu, Jian(wujian@ynu.edu.cn) ","Journal of Atmospheric and Solar-Terrestrial Physics","J. Atmos. Sol.-Terr. Phys.","","Elsevier Ltd","136","","2-7","December 01, 2015","","","","2015","English","13646826","","","10.1016/j.jastp.2015.10.011","","","","","","","Journal article (JA)","The characteristics of cloud-to-ground (CG) lightning for nine hailstorms in Yunnan province of China are analyzed statistically. It is determined that the hailstorms were found to present dominant negative CG lightning flashes at any given stage. One specific hailstorm occurring on July 16, 2006, is analyzed in detail by using the data from a CG lightning location network and Doppler radar. This severe hailstorm, which exhibited strong vertical development with cloud tops reaching 15.9 km, produced hailstones as large as 15 mm and had a lifespan of 3 h and 12 min. The total CG lightning within the hailstorm showed high levels of activity with flash rates of up to 79 fl/5 min. The analysis of the storm cell's lifecycle shows similar trends between the CG lightning flash rates and radar-derived parameters. Cloud-to-ground flashes tended to initiate within the cloud region with reflectivity of more than 30 dBZ at the -10 °C isotherm height. A distinct increase in CG flash rate is shown during the rapid development stages of hailstorms. The CG lightning jump pattern appears to be an effective tool for short-term forecasting of possible occurrences of severe weather. © 2015 Elsevier Ltd.","35","Clouds","Doppler radar - Lightning - Lightning protection - Storms","Cloud-to-ground flash - Cloud-to-ground lightning - Derived parameters - Development stages - Hailstorms - Radar echoes - Short-term forecasting - Yunnan province","443 Meteorology - 716.2 Radar Systems and Equipment - 914.1 Accidents and Accident Prevention",,"Number: 2014RA002, Acronym: -, Sponsor: -; Number: K-YN2013-186, Acronym: CSPG, Sponsor: China Southern Power Grid; Number: 41305002, Acronym: NSFC, Sponsor: National Natural Science Foundation of China; Number: 41265001, Acronym: NSFC, Sponsor: National Natural Science Foundation of China; ","This work was supported by the National Natural Science Foundation of China (Grant nos. 41305002 and 41265001 ) and the Science and Technology Project of Yunnan Province (No. 2014RA002 ) and the  Science Foundation of the China Southern Power Grid (Grant no. K-YN2013-186 ). The authors thank the two anonymous reviewers for their valuable suggestions, which improved the quality of this paper.",,"Compendex","Compilation and indexing terms, Copyright 2019 Elsevier Inc.","Engineering Village"
"Statistic analysis of shear strength of the slope in Xiang-Lin Road in Yunnan Province","20063110043404","","Xia, Yuan-You (1); Jiang, Chao (1) ","(1) School of Civil Engineering and Architecture, Wuhan University of Technology, Wuhan 430070, China ","Xia, Y.-Y.(xiayy1965@mail.whut.edu.cn) ","Yantu Lixue/Rock and Soil Mechanics","Rock Soil Mech","","Academia Sinica","27","6","920-924","June 2006","","","","2006","Chinese","10007598","","","","","","","","","","Journal article (JA)","The geological conditions in Xiang-Lin Road in Yunnan Province are complex with poor rock quality, far-ranging slopes and numerous clayey gliding mass containing much reduced stones. The test data of this kind of gliding mass are analyzed by the random statistic method and random-fuzzy method. The density function of the shear strength about the gliding mass is worked out firstly. Then the shear strength of the representative slope is acquired in four different ways. At last, the comparison is made between the statistic results so as to get the best indicator.","8","Road construction","Fuzzy sets - Random processes - Rocks - Shear strength - Slope stability - Statistics","Clayey gliding mass - Far-ranging slopes - Random statistics - Random-fuzzy method - Xiang-Lin Road - Yunnan Province","922.2 Mathematical Statistics - 922.1 Probability Theory - 483.1 Soils and Soil Mechanics - 481.1 Geology - 421 Strength of Building Materials; Mechanical Properties - 406.2 Roads and Streets - 405.2 Construction Methods","Applications (APP)",,,,"Compendex","Compilation and indexing terms, Copyright 2019 Elsevier Inc.","Engineering Village"
"Analysis of the water environmental impacts of the construction of the central Yunnan water diversion project on the Qingshuihai reservoir","20112614105218","","Wang, Xiaoju (1); Ye, Liaoyuan (2) ","(1) School of Life Sciences, KWSG, Yunnan University, Kunming, China (2) Yunnan University, Deputy Secretary General, Yunnan Provincial Government, Kunming, China ","Wang, X.(wxjruth@sohu.com) ","2011 International Conference on Electric Technology and Civil Engineering, ICETCE 2011 - Proceedings","Int. Conf. Electr. Technol. Civ. Eng., ICETCE - Proc.","","IEEE Computer Society","","","6455-6457","2011","2011 International Conference on Electric Technology and Civil Engineering, ICETCE 2011 - Proceedings","","","2011","Chinese","","","9781457702907","10.1109/ICETCE.2011.5776406","5776406","","","","","","Conference article (CA)","Long-distance water diversion projects have become an important part of urban water supply planning. Meanwhile the ecological impacts of long-distance water diversion projects are attracting increasing attention. In 2007, the Qingshuihai water supply project was launched with the purpose of meeting the water demand of the new development zone in Kunming city. During the construction phase, a series of mitigation measures were adopted by the Kunming municipal government to protect the environment. This article focuses on the 4-year monitoring of the water quality of the Qingshuihai reservoir. The analysis has shown that the water quality of the reservoir is better in the dry season than the raining season when the water quality was affected primarily by polluting sources in the reservoir catchment and by the construction activities. The study has also concluded that the implementation of the environmental mitigation measures during the construction phase has played an important role in protecting the water quality of the Qingshuihai reservoir. As the construction activities are near completion, rural non-point sources, sewage and upstream flow will become the major factors affecting the water quality of the reservoir. © 2011 IEEE.","7","Reservoirs (water)","Catchments - Construction industry - Flood control - Quality control - Sewage - Water quality - Water supply - Water supply systems","Central Yunnan water Eversion - Construction activities - Construction phase - Environmental mitigation - Municipal government - Reservoir catchments - Water diversion project - Water supply projects","405 Construction Equipment and Methods; Surveying - 441.2 Reservoirs - 442.1 Flood Control - 445.2 Water Analysis - 446.1 Water Supply Systems - 452.1 Sewage - 913.3 Quality Assurance and Control",,,,,"Compendex","Compilation and indexing terms, Copyright 2019 Elsevier Inc.","Engineering Village"
"Experimental study on flotation of copper sulfides in Yunnan Province","20143618136289","","Ku, Jian Gang (1); Chen, Hui Huang (2); Liu, Wen Yuan (1) ","(1) College of Zijin Mining, Fuzhou University, Fuzhou, Fujian, 350116, China (2) College of Chemistry and Chemical Engineering, Central South University, Changsha, Hunan, 410083, China ","Ku, J. G.(kkcc22@163.com) ","Advanced Materials Research","Adv. Mater. Res.","","Trans Tech Publications Ltd","1010-1012","","1630-1635","2014","Environmental Protection and Resources Exploitation II","","","2014","English","10226680","16628985","9783038352099","10.4028/www.scientific.net/AMR.1010-1012.1630","","2nd International Conference on Advances in Energy and Environmental Science, ICAEES 2014","June 21, 2014 - June 22, 2014","Guangzhou, China","107137","","Conference article (CA)","The copper ore, which has fine-grained nature and differences in the degree of mineral dissemination, is a kind of low grade sulfide minerals. Tests indicate that not only the grinding fineness but also the combination mode of depressants is one of the most important factors to improve the concentrate grade index. Additionally, according to tests conducted with dosage of lime, the rougher flotation should be operated at a pH of 11. Furthermore, all the depressants used were effective to increase the concentrate grade. By the closed-circuit micro-flotation experiment, satisfied grade index (18.7%Cu with 81% recovery) of the final concentrate was achieved, which could provide reference in industrial applications. © (2014) Trans Tech Publications, Switzerland.","5","Flotation","Copper - Experiments - Ores","Closed circuit - Combination modes - Concentrate grade - Copper sulfides - Copper sulphides - Depressants - Modifiers - Yunnan province","502 Mines and Quarry Equipment and Operations - 504 Mines and Mining, Metal - 505 Mines and Mining, Nonmetallic - 533.1 Ore Treatment - 544.1 Copper - 901.3 Engineering Research",,,,,"Compendex","Compilation and indexing terms, Copyright 2019 Elsevier Inc.","Engineering Village"
"Research on network model of fresh agricultural products cold chain logistics in Yunnan province","20164903100494","","Tang, Xiu Ying (1); Yang, Lin Lin (1); Chen, Li Chang (1); Shi, Jie (1); Li, Yu (1); Cheng, Bin (2); Wang, Jing (2) ","(1) Faculty of Mechanical and Electrical Engineering, Yunnan Agricultural University, Kunming; Yunnan, China (2) Kunchuan Design Institute, Kunming; Yunnan, China ","","Information, Computer and Application Engineering - Proceedings of the International Conference on Information Technology and Computer Application Engineering, ITCAE 2014","Proc. Intern. Conf. Inf. Technol. Comput. Appl. Eng. ITCAE","International Frontiers of Science and Technology Research Association Hong Kong Control Engineering and Information Science Research Association","CRC Press/Balkema","","","973-976","2015","Information, Computer and Application Engineering - Proceedings of the International Conference on Information Technology and Computer Application Engineering, ITCAE 2014","","1 of 1","2015","English","","","9781138027176","","","International Conference on Information Technology and Computer Application Engineering, ITCAE 2014","August 11, 2014 - August 12, 2014","Hong Kong, China","159879","","Conference article (CA)","On the basis of thethe survey of fresh agriculture products, cold chain logistics and collection of documentation, we sum up the existing model of cold chain logistics in Yunnan province, which is domestic cold chain logistics system and abroad cold chain logistics system. After that, we proposed the integrated model which includes three types which is the regional cold logistics system, the inter-provincial cold logistics system and abroad cold logistics system. © 2015 Taylor & Francis Group, London.","2","Logistics","Agricultural products - Chains","Agriculture products - Cold chain logistics - Fresh agricultural products - Fresh agriculture produces - Integrated modeling - Logistics system - Network modeling - Yunnan province","602.1 Mechanical Drives - 821.4 Agricultural Products",,,,,"Compendex","Compilation and indexing terms, Copyright 2019 Elsevier Inc.","Engineering Village"
"Research on flotation of copper sulfide ore in Yunnan province","20141117442719","","Zhang, Tie Min (1); Fang, Jian Jun (1); Jiang, Tai Guo (1); Wang, Shan (1); Mao, Ying Bo (1) ","(1) Kunming University of Science and Technology, Kunming, 650093, China ","Fang, J. J.(ruiyuanju@126.com) ","Applied Mechanics and Materials","Appl. Mech. Mater.","","Trans Tech Publications","522-524","","1471-1475","2014","Environmental Protection and Sustainable Development","","","2014","English","16609336","16627482","9783038350224","10.4028/www.scientific.net/AMM.522-524.1471","","2013 2nd International Conference on Sustainable Energy and Environmental Engineering, ICSEEE 2013","December 28, 2013 - December 29, 2013","Shenzhen, China","102944","","Conference article (CA)","Floatation experimental research is carried out on a certain complicated ore containing mixed sulphides in Yannan province. For the characteristics of the mine and the scene of the test requirements, the use of mixed flotation-separation process has achieved a successful recovery of useful elements. Combination inhibitors can effectively achieve the separation of copper and sulfur.Under the proper process conditions, the good technical indexes were obtained. © (2014) Trans Tech Publications, Switzerland.","6","Ore treatment","Copper - Flotation - Sulfur compounds","Copper sulfide ores - Experimental research - Mixed sulphides - Process condition - Test requirements - Yunnan province","533.1 Ore Treatment - 544.1 Copper - 804.1 Organic Compounds",,,,,"Compendex","Compilation and indexing terms, Copyright 2019 Elsevier Inc.","Engineering Village"
"Ore mineralogical characteristics of the Luping lead polymetallic deposit in Heqing of Yunnan Province and their geological implications","20140217179390","","Dou, Song (1, 2); Liu, Ji-Shun (1); Guo, Yuan-Sheng (2); Yan, Jian (2) ","(1) School of Geoscience and Info-Physics, Central South University, Changsha, Hunan 410083, China (2) Yunnan Nonferrous Metals Geological Bureau, Kunming, Yunnan 650051, China ","Dou, S.(dousong@163.com) ","Acta Geoscientica Sinica","Acta Geoscientica Sin.","","Science Press, 16 Donghuangchenggen North Street, Beijing, 100717, China","34","SUPPL.1","87-94","June 2013","","","","2013","Chinese","10063021","","","10.3975/cagsb.2013.s1.13","","","","","","","Journal article (JA)","The Luping lead polymetallic deposit in Heqing is a large-size concealed deposit discovered recently in Heqing, Yunnan Province. It is located on the northern side of the Beiya superlarge gold polymetallic deposit and is a component part and a new deposit type of the porphyry-hydrothermal ore-forming system of the Beiya superlarge gold polymetallic ore field. Based on a review of local geology and a comparative study of the mineralization characteristics of the Beiya deposit, the authors held that there should exist some unsubstantial structures in the axes of Beiya syncline which could provide the channel way and space for the ore-forming fluid from the Wandongshan orthophyre mineralization system. In combination with the existence of good combinatorial anomaly of Pb-Au-Ag-Zn-Cu-As-Sb in the area, the Luping lead polymetallic deposit was eventually discovered by means of drilling. The ore bodies of the deposit are hosted in the fracture zones within limestone of Middle Triassic Beiya Formation and sandstone-mudstone interlayered bedding of Qingtianpu Formation and limestone of Middle Triassic Beiya Formation. Ores of the ore deposit mainly consist of oxidized ores and mixed ores together with minor sulfide ores. The main metal component of the ores is lead along with some accessory components such as gold, silver, iron and zinc. Based on an analysis of the mineralogical characteristics as well as the distribution and modes of occurrence of useful components in the deposit, the authors put forward the suggestion that the relevant research work should be strengthened in further development and utilization of the ore deposit.","13","Ores","Deposits - Gold - Gold deposits - Lead - Limestone - Mineralogy - Ore deposit geology - Silver - Zinc","Geological implications - Heqing - Mineralogical characteristics - Polymetallic - Yunnan","617 Turbines and Steam Turbines - 612 Engines - 547.1 Precious Metals - 546.3 Zinc and Alloys - 546.1 Lead and Alloys - 532 Metallurgical Furnaces - 505 Mines and Mining, Nonmetallic - 504 Mines and Mining, Metal - 502 Mines and Quarry Equipment and Operations - 482 Mineralogy - 414 Masonry Materials",,,,,"Compendex","Compilation and indexing terms, Copyright 2019 Elsevier Inc.","Engineering Village"
"Research on the Automatic Generation Control (AGC) coordinated control modes between provincial dispatching and regional dispatching in Yunnan power grid","20115214630859","","Xu, Dan-Li (1); Cai, Bao-Rui (2); Liu, Yan-Quan (3); Liu, Xin (3) ","(1) Graduate Workstation of North China Electric Power University, Yunnan Power Grid Corporation, Kunming, 650217, China (2) Yunnan Electric Power Dispatching Control Center, Kunming, 650011, China (3) North China Electric Power University, Baoding, 071003, China ","Xu, D.-L.(xxddll105@163.com) ","Procedia Engineering","Procedia Eng.","","Elsevier Ltd","15","","800-806","2011","2011 International Conference on Advanced in Control Engineering and Information Science, CEIS 2011","","","2011","English","18777058","","","10.1016/j.proeng.2011.08.149","","2011 International Conference on Advanced in Control Engineering and Information Science, CEIS 2011","August 18, 2011 - August 19, 2011","Dali, Yunnam, China","87786","","Conference article (CA)","With the constant expansion of Yunnan power grid, in current dispatching Automatic generation Control (AGC) mode, the use effect of small and medium-sized hydropower resources in the unified dispatching was not ideal. By building zoning control model artificially, the control targets and their coordinated relationship between main area and sub-areas are explicitly pointed out. The zoning and layered control mode of AGC between provincial dispatching and regional dispatching is put forward. Analysis and comparison are also made of the 'independent zoning and layered control mode' and 'coordinated zoning and layered control mode', and then their existing problems are pointed out. The research can provide the foundation of further study on AGC coordinated control strategies between provincial dispatching and regional dispatching, which can realize single goal and multi-objects of AGC coordinated control in the power grid. © 2011 Published by Elsevier Ltd.","8","Electric power system control","Electric load dispatching - Electric power system interconnection - Electric power transmission networks - Power control - Zoning","Automatic generation control - Co-ordinated control - Control model - Coordinated control strategy - Existing problems - Hydro-power resources - Power networks - Yunnan power grid","706.1 Electric Power Systems - 706.1.1 Electric Power Transmission - 731.3 Specific Variables Control",,,,"Open Access","Compendex","Compilation and indexing terms, Copyright 2019 Elsevier Inc.","Engineering Village"
