Title,Accession number,Title of translation,Author,Author affiliation,Corresponding author,Source,Abbreviated source title,Sponsor,Publisher,Volume,Issue,Pages,Issue date,Monograph title,Volume title,Part number,Publication year,Language,ISSN,E-ISSN,ISBN,ISBN13,DOI,Article number,Conference name,Conference date,Conference location,Conference code,CODEN,Document type,Abstract,Number of references,Main heading,Controlled/Subject terms,Uncontrolled terms,Classification code,Treatment,Funding details,Funding text,Access type,Database,Copyright,Data Provider
"Compensation for nonlinearity of valve in ABS based on BP neural network","20084011616532","","Wang, Dejun (1); Zheng, Xiaowen (1); Chu, Liang (1) ","(1) Department of Control Science and Engneering, Jilin University, Changchun 130025, China ","Wang, D.(djwang@jlu.edu.cn) ","Proceedings of the 27th Chinese Control Conference, CCC","Proc. Chin. Control. Conf., CCC","Chinese Association of Automation; Chinese Association of Automation Kunming Univ. Sci. Technol.; Technical Committee on Control Theory; Yunnan Division","IEEE Computer Society","","","571-575","2008","Proceedings of the 27th Chinese Control Conference, CCC","","","2008","Chinese","","","","9787900719706","10.1109/CHICC.2008.4605633","4605633","27th Chinese Control Conference, CCC","July 16, 2008 - July 18, 2008","Kunming, Yunnan, China","73759","","Conference article (CA)","The Department of Automotive Engineering, Jilin University, Changchun 130025, P. R. China A controller is designed based on BP neural network in this paper, which is applied to compensate the nonlinearity of electromagnetic valve of ABS, such as time-delay, etc. Thus, an intelligent controller is used to improve the quality of pressure adjustment in ABS. Data for training BP neural network is obtained from actual ABS. The cases for pressure-increase and pressure-decrease are studied, respectively. And the parameters of BP neural network are optimized. Finally, experiments including hardware in the loop are executed to verify the effectiveness of the provided design with the low adhesion road condition. And the quality of ABS is improved.","5","Neural networks","Controllers - Delay control systems","BP neural networks - Electromagnetic valves - Hard-ware-in-the-loop - Intelligent controllers - Low adhesion roads - P. r. chinas - Pressure increase","731.1 Control Systems - 732.1 Control Equipment",,,,,"Compendex","Compilation and indexing terms, Copyright 2019 Elsevier Inc.","Engineering Village"
"Illumination recognition in field environments based on Gaussian Mixture Models","20161102093059","","Chen, Ming (1); Geng, Da (1); Sun, Fengchi (1); Yuan, Jing (2) ","(1) College of Software, Nankai University, Tianjin, China (2) College of Computer and Control Engineering, Nankai University, Tianjin, China ","","2015 IEEE International Conference on Information and Automation, ICIA 2015 - In conjunction with 2015 IEEE International Conference on Automation and Logistics","IEEE Int. Conf. Inf. Autom., ICIA - conjunction IEEE Int. Conf. Autom. Logist.","CAS Shenzhen Institute of Advanced Technology; Harbin Institute of Technology Shenzhen Graduate School; HIT State Key Laboratory of Robotics and Systems; IEEE Robotics and Automation Society; Shanghai Gaitech Scientific Instruments Co., Ltd.; The Chinese University of Hong Kong","Institute of Electrical and Electronics Engineers Inc.","","","179-184","September 28, 2015","2015 IEEE International Conference on Information and Automation, ICIA 2015 - In conjunction with 2015 IEEE International Conference on Automation and Logistics","","1of1","2015","English","","","","9781467391047","10.1109/ICInfA.2015.7279281","7279281","2015 IEEE International Conference on Information and Automation, ICIA 2015 - In conjunction with 2015 IEEE International Conference on Automation and Logistics","August 8, 2015 - August 10, 2015","Yunnan, China","116345","","Conference article (CA)","Terrain classification in field environment for mobile robot is affected by weather conditions among which illumination diversification plays a major role. With the changes in feature extraction method, classification result will vary significantly in the changing environment. This paper introduces a method of illumination recognition by analyzing the illumination distribution in visual space and using Gaussian Mixture Models to describe the illumination distribution. Illumination recognition provides a way to find suitable feature set for different illumination condition. The experiment result shows the illumination recognition with GMMs is accurate and efficient, and improves the performance of terrain classification. © 2015 IEEE.","10","Classification (of information)","Automation - Gaussian distribution - Landforms","Changing environment - Classification results - Feature extraction methods - Field environments - Gaussian Mixture Model - Illumination conditions - Illumination distribution - Terrain classification","481.1 Geology - 716.1 Information Theory and Signal Processing - 731 Automatic Control Principles and Applications - 922.1 Probability Theory",,,,,"Compendex","Compilation and indexing terms, Copyright 2019 Elsevier Inc.","Engineering Village"
"Effect of ethylenediamine tetraacetic acid disodium on the corrosion of cold rolled steel in the presence of benzotriazole in hydrochloric acid","20072810696867","","Qu, Qing (1); Jiang, Shuan (1); Bai, Wei (2); Li, Lei (3) ","(1) Department of Chemistry, Yunnan University, Kunming, 650091, China (2) Department of Chemistry, Yunnan Nationalities University, Kunming, 650092, China (3) Laboratory for Conservation and Utilization of Bio-Resources, Yunnan University, Kunming, 650091, China ","Qu, Q.(quqing58@yahoo.com.cn) ","Electrochimica Acta","Electrochim Acta","","Elsevier Ltd, Langford Lane, Kidlington, Oxford, OX5 1GB, United Kingdom","52","24","6811-6820","August 1, 2007","","","","2007","English","00134686","","","","10.1016/j.electacta.2007.04.114","","","","","","ELCAAV","Journal article (JA)","The inhibition behavior of cold rolled steel in 0.1 M hydrochloric acid (HCl) by ethylenediamine tetraacetic acid disodium (EDTA) in the absence and presence of benzotriazole (BTA) was investigated with Tafel polarization curve and electrochemical impedance spectroscopy (EIS). The polarization curve results show that the single EDTA acts as an anodic type inhibitor while the combination of EDTA and BTA acts as mixed type inhibitor and mainly inhibits anodic reaction. All impedance spectra in EIS tests exhibit one capacitive loop which indicates that the corrosion reaction is controlled by charge transfer process. Inhibition efficiencies obtained from Tafel polarization, charge transfer resistance (Rt) are consistent. The corrosion of cold rolled steel in 0.1 M HCl is obviously reduced by EDTA in combination with lower concentrations of BTA. Fourier transform infrared spectroscopy (FTIR) and atomic force microscopy (AFM) were used to characterize the corrosion surface of cold rolled steel. Probable mechanisms are present to explain the experimental results. © 2007 Elsevier Ltd. All rights reserved.","42","Steel analysis","Acetic acid - Aromatic compounds - Cold rolling - Corrosion protection - Electrochemical impedance spectroscopy - Hydrochloric acid","Cold rolled steel - EDTA - Tafel polarization curves","535.1.2 Rolling Mill Practice - 539.2 Corrosion Protection - 545.3 Steel - 801 Chemistry - 804.1 Organic Compounds - 804.2 Inorganic Compounds","Theoretical (THR); Experimental (EXP)",,,,"Compendex","Compilation and indexing terms, Copyright 2019 Elsevier Inc.","Engineering Village"
"A Multiple-Tier Model Manipulation Architecture for Enterprise Decision Making","2003517785220","","Liang, Z. (1); Li, S. (2); Liao, H. (1); Kang, H. (1); Duan, Q. (1); Zhou, H. (1); Yang, H. (2) ","(1) Yunnan University, Kunming, Yunnan 650091, China (2) De Montfort University, Leicester LEI 9BH, United Kingdom ","Liang, Z.(zhliang@ynu.edu.cn) ","Proceedings - IEEE Computer Society's International Computer Software and Applications Conference","Proc IEEE Comput Soc Int Comput Software Appl Conf","IEEE Computer Society","Institute of Electrical and Electronics Engineers Computer Society","","","646-651","2003","","","","2003","English","07303157","","","","10.1109/CMPSAC.2003.1245410","","Proceedings: 27th Annual International Computer Software and Applications Conference, COMPSAC 2003","November 3, 2003 - November 6, 2003","Dallas, TX, United states","61998","PSICD2","Conference article (CA)","The usage of decision models has been given attention by decision makers for many years. How to realise public-use and reuse of model, and gain the adequate information not only limited to local departments in the wide enterprise environment is one of the most concerned issues of decision-makers. The idea of multiple-tier framework put forward by distributed system provides a helpful approach to this issue. This paper proposes a practical approach to model manipulation in a distributed decision support system based on network technology and component technology. It implements the separation among the clients, application and data level, accordingly allows the data and model source distributed storage and sharing for multi-departments. The method based on COM+ component technology makes the model distributed in the host computer all over the Internet/Intranet. Consequently, widespread models can be supplied to the client by application servers.","17","Decision support systems","Client server computer systems - Computer architecture - Computer software - Decision making - Information management - Mathematical models - World Wide Web - XML","Component technology - Model integration","722 Computer Systems and Equipment - 722.4 Digital Computers and Systems - 723 Computer Software, Data Handling and Applications - 903.2 Information Dissemination - 912.2 Management - 921 Mathematics","Theoretical (THR)",,,,"Compendex","Compilation and indexing terms, Copyright 2019 Elsevier Inc.","Engineering Village"
"Capture zone of biased proportional navigation guidance law","20161102092878","","Xu, Xingyuan (1, 2); Guo, Chenxian (3) ","(1) Information Engineering School, Henan University of Science and Technology, Luoyang Henan; 471023, China (2) China Airborne Missile Academy, Luoyang Henan; 471009, China (3) Information Engineering College, Zhongzhou University, Zhengzhou Henan; 450044, China ","","2015 IEEE International Conference on Information and Automation, ICIA 2015 - In conjunction with 2015 IEEE International Conference on Automation and Logistics","IEEE Int. Conf. Inf. Autom., ICIA - conjunction IEEE Int. Conf. Autom. Logist.","CAS Shenzhen Institute of Advanced Technology; Harbin Institute of Technology Shenzhen Graduate School; HIT State Key Laboratory of Robotics and Systems; IEEE Robotics and Automation Society; Shanghai Gaitech Scientific Instruments Co., Ltd.; The Chinese University of Hong Kong","Institute of Electrical and Electronics Engineers Inc.","","","927-930","September 28, 2015","2015 IEEE International Conference on Information and Automation, ICIA 2015 - In conjunction with 2015 IEEE International Conference on Automation and Logistics","","1of1","2015","English","","","","9781467391047","10.1109/ICInfA.2015.7279419","7279419","2015 IEEE International Conference on Information and Automation, ICIA 2015 - In conjunction with 2015 IEEE International Conference on Automation and Logistics","August 8, 2015 - August 10, 2015","Yunnan, China","116345","","Conference article (CA)","Specified impact angle can considerably increase missile's lethality in the terminal engagement. Proportional navigation guidance (PNG) law and its variants are widely known and used due to its inherent simplicity and ease of implementation. In this paper, the capture zone of biased PNG (BPNG) law will be researched in depth. The influence of the parameters in BPNG law will be discussed in detail, and the capture zone about these parameters are given. Numerical simulations are used to demonstrate the obtained results. © 2015 IEEE.","11","Electronic guidance systems","Automation - Navigation","biased PNG - Biased proportional navigation guidances - Capture zones - Guidance laws - Impact angles - Proportional navigation guidance","731 Automatic Control Principles and Applications",,,,,"Compendex","Compilation and indexing terms, Copyright 2019 Elsevier Inc.","Engineering Village"
"Identification and cadmium (II) resistance of strain YN12, Acidithiobacillus caldus","20081611208496","","Ding, Jian-Nan (1); Zhu, Ruo-Lin (1); Kang, Jian (1); Zhang, Cheng-Gui (1); Wu, Xue-Ling (1); Qiu, Guan-Zhou (1) ","(1) School of Resources Processing and Bioengineering, Central South University, Changsha 410083, China ","Ding, J.-N. ","Zhongguo Youse Jinshu Xuebao/Chinese Journal of Nonferrous Metals","Zhongguo Youse Jinshu Xuebao","","Central South University of Technology, Hunan, Changsha, 410083, China","18","2","342-348","February 2008","","","","2008","Chinese","10040609","","","","","","","","","","ZYJXFK","Journal article (JA)","A moderately thermophilic sulfur-oxidizing strain, YN12, was isolated from an acidic hot spring sample collected in Yunnan Province, southeastern China. Morphological, physiological and 16S rDNA sequence data suggest that YN12 belongs to the species, Acidithiobacillus caldus. YN12 exhibits a very high degree of resistance to cadmium (II), with an original maximum tolerated concentration (MTC) of 4.8 g/L and an ultimate MTC of 31.5 g/L after adapted by a gradually increased concentration of 3CdSO4&middot8H2O. Continuously cultured in the medium containing 210 g 3CdSO4&middot8H2O/L (equal to 31.5 g/L of Cd2+) for three generations, the strain is capable of restoring its growth and sulfur oxidation activity to an approximately normal level.","18","Bioleaching","Oxidation","Acidithiobacillus caldus - Cadmium resistance - Maximum tolerated concentration (MTC) - Strain YN12","461.8 Biotechnology - 533.1 Ore Treatment - 802.2 Chemical Reactions - 802.3 Chemical Operations","Experimental (EXP)",,,,"Compendex","Compilation and indexing terms, Copyright 2019 Elsevier Inc.","Engineering Village"
"The relationship between the super plasticity of laser welding joint of titanium alloy and hydrogen treatment","20172903944022","","Cao, Zean (1); Cheng, Donghai (1); Jiang, Xunyan (1); Hu, Dean (1); Chen, Yiping (1) ","(1) Nanchang Hang Kong University, Nanchang, China ","Cheng, Donghai(1250985008@qq.com) ","IOP Conference Series: Materials Science and Engineering","IOP Conf. Ser. Mater. Sci. Eng.","","Institute of Physics Publishing","207","1","","June 15, 2017","4th International Conference on Advanced Composite Materials and Manufacturing Engineering 2017","","1 of 1","2017","English","17578981","1757899X","","","10.1088/1757-899X/207/1/012065","012065","2017 4th International Conference on Advanced Composite Materials and Manufacturing Engineering, ACMME 2017","May 20, 2017 - May 21, 2017","Xishuangbanna, Yunnan, China","128593","","Conference article (CA)","The superplastic deformation uniformity of laser welded joint of TC4 titanium alloy is improved by hydrogen treatment. The non-uniform deformation coefficient K was introduced to quantification ally characterize the non-uniform deformation. The results show when the content of hydrogen exceeds 0.29%, the super plasticity of the titanium alloy welded plate decreases with the increase of the hydrogen content. The decrease of the shrinkage of the base material is larger than that of the weld section with the increase of hydrogen content. The K can be used to describe the non-uniform deformation of the weld and the base material during the superplastic deformation of laser welded joint of the TC4. The K value increases with increaseing hydrogen content, increaseing deformation temperature and decreaseing strain rate. The K value reaches the maximum of 0.84 with hydrogen content of 1.299%, deformation temperature of 920 °C, strain rate of 10-4S-1. © Published under licence by IOP Publishing Ltd.","8","Strain rate","Bridge decks - Composite materials - Hydrogen - Manufacture - Plasticity - Superplastic deformation - Titanium alloys - Welded steel structures - Welding - Welds","Base material - Deformation temperatures - Hydrogen contents - Hydrogen treatments - Laser welded joints - Non-uniform deformation - TC4 titanium alloy - Welded plates","401.1 Bridges - 537.1 Heat Treatment Processes - 538.2 Welding - 542.3 Titanium and Alloys - 804 Chemical Products Generally - 951 Materials Science",,,,,"Compendex","Compilation and indexing terms, Copyright 2019 Elsevier Inc.","Engineering Village"
"RMP: An element-level and graph-level combined ontology matching framework","20170503315024","","Zhang, Yiting (1); Xie, Cheng (1); Zhong, Haojian (1); Jiang, Lihong (1); Cai, Hongming (1) ","(1) Shanghai Jiao Tong University, Shanghai, China ","Cai, Hongming(hmcai@sjtu.edu.cn) ","Communications in Computer and Information Science","Commun. Comput. Info. Sci.","","Springer Verlag","675","","195-210","2016","Software Engineering and Methodology for Emerging Domains - 15th National Software Application Conference, NASAC 2016","","1 of 1","2016","English","18650929","","","9789811034817","10.1007/978-981-10-3482-4_14","","15th National Software Application Conference, NASAC 2016","November 3, 2016 - November 5, 2016","Kunming, Yunnan, China","188539","","Conference article (CA)","Ontology offers rich properties to describe knowledge in information systems. However, ontologies in knowledge-based systems usually suffer from semantic heterogeneities due to distributed developers. Ontology matching is a key solution to the heterogeneity problem in knowledge management. Though state-of-the-art ontology matching systems are able to support diverse ontology matching tasks, the semantic heterogeneity in ontology matching is still the main challenge. In this paper, we propose an element and graph combined matching framework to specifically deal with semantic heterogeneity during ontology matching. Moreover, we also develop an automated ontology matching system and evaluate the system in diverse ontology matching tasks. By using the graph indexing technique, the matching system is scalable with large ontology matching. The experimental results show that the proposed system achieves a good result in highly heterogeneous matching tasks and a comparable result in large ontology matching tasks. © Springer Nature Singapore Pte Ltd. 2016.","21","Ontology","Application programs - Indexing (of information) - Knowledge based systems - Knowledge management - Semantics","Element matching - Graph matchings - Ontology matching - Similarity propagation - Weight calculation","723 Computer Software, Data Handling and Applications - 903.1 Information Sources and Analysis - 903.3 Information Retrieval and Use",,"Number: 71171132, Acronym: NSFC, Sponsor: National Natural Science Foundation of China; Number: 61373030, Acronym: NSFC, Sponsor: National Natural Science Foundation of China; ","The paper has been supported in part by National Natural Science Foundation of China under contract number 71171132 and 61373030.",,"Compendex","Compilation and indexing terms, Copyright 2019 Elsevier Inc.","Engineering Village"
"Study on robot motion control for intelligent welding processes based on the laser tracking sensor","20172903944286","","Zhang, Bin (1); Wang, Qian (1); Tang, Chen (1); Wang, Ju (1) ","(1) China Ji Liang University, Hangzhou; 310018, China ","Zhang, Bin(zhwwbin@cjlu.edu.cn) ","IOP Conference Series: Materials Science and Engineering","IOP Conf. Ser. Mater. Sci. Eng.","","Institute of Physics Publishing","207","1","","June 15, 2017","4th International Conference on Advanced Composite Materials and Manufacturing Engineering 2017","","1 of 1","2017","English","17578981","1757899X","","","10.1088/1757-899X/207/1/012036","012036","2017 4th International Conference on Advanced Composite Materials and Manufacturing Engineering, ACMME 2017","May 20, 2017 - May 21, 2017","Xishuangbanna, Yunnan, China","128593","","Conference article (CA)","A robot motion control method is presented for intelligent welding processes of complex spatial free-form curve seams based on the laser tracking sensor. First, calculate the tip position of the welding torch according to the velocity of the torch and the seam trajectory detected by the sensor. Then, search the optimal pose of the torch under constraints using genetic algorithms. As a result, the intersection point of the weld seam and the laser plane of the sensor is within the detectable range of the sensor. Meanwhile, the angle between the axis of the welding torch and the tangent of the weld seam meets the requirements. The feasibility of the control method is proved by simulation. © Published under licence by IOP Publishing Ltd.","7","Process control","Bridge decks - Composite materials - Electric welding - Genetic algorithms - Intelligent robots - Motion control - Welds","Control methods - Free form curve - Intelligent welding - Intersection points - Laser tracking - Robot motion control - Weld seam - Welding torch","401.1 Bridges - 538.2 Welding - 538.2.1 Welding Processes - 731.3 Specific Variables Control - 731.6 Robot Applications - 951 Materials Science",,,,"Open Access","Compendex","Compilation and indexing terms, Copyright 2019 Elsevier Inc.","Engineering Village"
"Hardware and software implementation of new induced polarization detection system","20164302954372","","He, Ruihao (1); Li, Wenhao (1); Zhang, Mengxi (2); Liu, Shenghui (1); Luo, Yueyun (1); Qiu, Yong (1); Zhang, Qisheng (1) ","(1) China University of Geoscience, Beijing, China (2) Yunnan University, Yunnan, China ","","2016 3rd International Conference on Digital Information Processing, Data Mining, and Wireless Communications, DIPDMWC 2016","Int. Conf. Digit. Inf. Proc., Data Min., Wirel. Commun., DIPDMWC","","Institute of Electrical and Electronics Engineers Inc.","","","297-301","August 2, 2016","2016 3rd International Conference on Digital Information Processing, Data Mining, and Wireless Communications, DIPDMWC 2016","","1of1","2016","English","","","","9781467393799","10.1109/DIPDMWC.2016.7529406","7529406","3rd International Conference on Digital Information Processing, Data Mining, and Wireless Communications, DIPDMWC 2016","July 6, 2016 - July 8, 2016","Moscow, Russia","123190","","Conference article (CA)","Induced polarization detection system (induced polarization instrument for short) conducts prospecting and solves geological problems by the induced polarization method in electric prospecting. The induced polarization instrument includes hardware and software parts. Hardware is mainly composed of main control unit, transmitter unit and receiver unit and power supply unit. System software implemented with C programming language and completed the development of core drivers and related applications, and can realize the human-machine interaction. The schematic circuit diagram is prepared through Altium Designer software. The instrument is assembled after making PCB, and many field tests are carried out. Test data show that the instrument can properly collect potential information, and meet the design requirements. © 2016 IEEE.","12","C (programming language)","Application programs - Computer systems programming - Data handling - Data mining - Electric power systems - Electric prospecting - Hardware - Polarization - Wireless telecommunication systems","C language - Hardware and software - Hardware and software implementations - Human machine interaction - Induced polarization - Power supply unit - sending and receiving - STM32","481.4 Geophysical Prospecting - 605 Small Tools and Hardware - 706.1 Electric Power Systems - 723 Computer Software, Data Handling and Applications",,,,,"Compendex","Compilation and indexing terms, Copyright 2019 Elsevier Inc.","Engineering Village"
