Title,Accession number,Title of translation,Author,Author affiliation,Corresponding author,Source,Abbreviated source title,Sponsor,Publisher,Volume,Issue,Pages,Issue date,Monograph title,Part number,Publication year,Language,ISSN,E-ISSN,ISBN,ISBN13,DOI,Article number,Conference name,Conference date,Conference location,Conference code,CODEN,Document type,Abstract,Number of references,Main heading,Controlled/Subject terms,Uncontrolled terms,Classification code,Treatment,Funding details,Funding text,Access type,Database,Copyright,Data Provider
"Characteristics of lead and zinc polymetallic deposit and wall rock alteration zoning in LuziYuan, Yunnan","20134016818296","","Zeng, Lei (1); Deng, Ming Guo (1); Lv, Chang Liang (1); Liu, Wei (1) ","(1) Kunming university of science and technology, Kunming 650000, China ","","Advanced Materials Research","Adv. Mater. Res.","","Trans Tech Publications Ltd, Kreuzstrasse 10, Zurich-Durnten, CH-8635, Switzerland","734-737","","52-55","2013","Resources and Sustainable Development","","2013","English","10226680","","","9783037857441","10.4028/www.scientific.net/AMR.734-737.52","","2013 2nd International Conference on Energy and Environmental Protection, ICEEP 2013","April 19, 2013 - April 21, 2013","Guilin, China","99790","","Conference article (CA)","The lead and zinc polymetallic deposit in LuziYuan is an ultra-large type skarn deposit. The ore body originated from the interlayer crushed zone between the second and thrid section of stratum marble and slate (schist) interbedding of upper Cambrian series Shahechang group, the wall rock alteration is intensice in the diggings, and the alteration zoning is obvious. Through field geological investigation and data analysis, based on the petrography of alterated rocks and combined with catalog information of drilling, the wall rock alteration in the diggings of LuziYuan is divided into four alteration zones,which are in sequence: carbonate-quartz-chloritization zone; carbonate-quartz-skarn lithification zone; skarn- lead zinc ore mineralization zone; and skarn-pyritization zone. The forming of ore body is related to alterations such as skarn lithification, silicification, marmarization, magnetite, etc. © (2013) Trans Tech Publications, Switzerland.","5","Wall rock","Deposits - Lead - Ores - Petrography - Quartz - Zinc - Zinc ore treatment - Zoning","Alteration zones - Characteristics of mineralization - Geological investigation - LuziYuan - Ore mineralization - Polymetallic - Rock alterations - Yunnan","612 Engines - 546.3 Zinc and Alloys - 546.1 Lead and Alloys - 617 Turbines and Steam Turbines - 532 Metallurgical Furnaces - 481.1.2 Petrology (Before 1993, use code 482) - 403.2 Regional Planning and Development - 482.2 Minerals",,,,,"Compendex","Compilation and indexing terms, Copyright 2019 Elsevier Inc.","Engineering Village"
"Study of an evaluation index system of well-off water conservancy in Yunnan Province","20153401189630","","Chang, Chunxiao (1); Wen, Zhonghui (1); Shu, Longcang (1); Lu, Chengpeng (1); Gu, Shixiang (2); Su, Jianguang (2); He, Meng (1); Xing, Kundong (1) ","(1) College of Hydrology and Water Resources, Hohai University, Nanjing; 210098, China (2) Yunnan Institute of Water and Hydropower Engineering Investigation, Design and Research, Kunming; 650021, China ","","IAHS-AISH Proceedings and Reports","IAHS-AISH Publ.","","Copernicus GmbH","368","","366-372","2015","Remote Sensing and GIS for Hydrology and Water Resources","1of1","2015","English","01447815","","","9781907161469","10.5194/piahs-368-366-2015","","3rd Remote Sensing and Hydrology Symposium, RSHS 2014 and the 3rd International Conference of GIS/RS in Hydrology, Water Resources and Environment, ICGRHWE 2014","August 24, 2014 - August 27, 2014","Guangzhou, China","113413","IAPUEP","Conference article (CA)","To achieve good water conservancy under the well-off society before 2020, the future water conservancy planning is undergoing in Yunnan Province. In this study, by analysing the research results of domestic relevant water evaluation index systems and combining this with the water conservancy construction key of Yunnan Province, an unique evaluation index system was proposed to evaluate the welloff water conservancy level of Yunnan Province. It is composed of three levels which are the target layer, criterion layer and index layer. And the criterion layer includes six systems, namely flood control and drought relief mitigation, reasonable allocation of water resources, highly effective water utilization, water source protection and river health security, water management and securing of water development. The analytic hierarchy process (AHP) was used to determine the weight of each index. According to the present situation of water development and the related water conservancy planning in Yunnan Province, the target value of each index and evaluation standards are put forward for Yunnan Province in 2020. The results show that the evaluation results are consistent with the actual condition of water development in Yunnan Province and can be used to examine the effects of well-off water conservancy planning. Copyright © 2015 IAHS Press.","9","Water management","Analytic hierarchy process - Flood control - Geographic information systems - Hydrology - Remote sensing","Evaluation - Index systems - Water conservancy - Well-off societies - Yunnan province","442.1 Flood Control - 903.3 Information Retrieval and Use - 961 Systems Science",,,,"Open Access","Compendex","Compilation and indexing terms, Copyright 2019 Elsevier Inc.","Engineering Village"
"Study on energy consumption and energy saving emission for the low carbon economy in yunnan with uncertain factors and policy recommendations","20130816041747","","He, Qiang (1); Tan, Qian (2) ","(1) Faculty of Social Sciences of Kunming University of Science and Technology, Master, mainly engaged in the regional economy, Environmental economy research., Kunming Yunnan 650500, China (2) Doctoral student in reading of the Law School of Southeast University, Research on social security in rural areas, Nanjing Jiangsu 210000, China ","He, Q.(hh4166@sian.com) ","Advanced Materials Research","Adv. Mater. Res.","International Science and Education Researcher Association, China; Beijing Gireida Education Research Center; VIP-Information Conference Center, China","Trans Tech Publications, P.O. Box 1254, Clausthal-Zellerfeld, D-38670, Germany","648","","198-201","2013","Advanced Research on Material, Energy and Control Engineering","","2013","English","10226680","","","9783037856147","10.4028/www.scientific.net/AMR.648.198","","3rd International conference on Engineering Materials, Energy, Management and Control, MEMC 2013","January 19, 2013 - January 20, 2013","Wuhan, China","95486","","Conference article (CA)","The paper uses a large amount of data uncertainty analysis of a the Yunnan '12th Five-Year' period of low-carbon development, pointed out that economic development, eliminate backward production capacity, energy consumption and energy saving will be contradictions, and the main problem of the reality of low-carbon development in Yunnan. In 2011, Yunnan Province, to develop a low-carbon development in Yunnan Province Plan, the development of low-carbon economy will become a new impetus to the economic development of Yunnan 12th Five-Year period. © (2013) Trans Tech Publications, Switzerland.","2","Energy policy","Energy conservation - Energy utilization - Renewable energy resources - Uncertainty analysis","Carbon emissions - Data uncertainty - Economic development - Influence factors - Large amounts - Low carbon economy - Low-carbon development - Policy recommendations - Production capacity - Uncertain factors - Yunnan - Yunnan province","525 Energy Management and Conversion - 922.1 Probability Theory",,,,,"Compendex","Compilation and indexing terms, Copyright 2019 Elsevier Inc.","Engineering Village"
"Virtual water flow feature of water-rich province and the enlightenments: Case of Yunnan in China","20192807157562","","Dong, Huijuan (1, 2); Geng, Yong (1, 2); Hao, Dong (3); Yu, Yanhong (4); Chen, Y. (4) ","(1) School of Environmental Science and Engineering, Shanghai Jiao Tong University, Shanghai; 200240, China (2) Shanghai Institute of Pollution Control and Ecological Security, Shanghai; 200092, China (3) Ceramic Research Center, Saga University, Saga; 8440013, Japan (4) Yunnan Key Laboratory of Pollution Process and Management of Plateau Lake-Watershed, Yunnan Institute of Environmental Science, Kunming; 650034, China ","Dong, Huijuan(donghj@sjtu.edu.cn) ","Journal of Cleaner Production","J. Clean. Prod.","","Elsevier Ltd","235","","328-336","20 October 2019","","","2019","English","09596526","","","","10.1016/j.jclepro.2019.06.305","","","","","","JCROE8","Journal article (JA)","Many water footprint studies have been conducted on those water scarce regions to respond their water crisis, while water rich regions also face water sustainability challenges due to inadequate water management or being virtual water exporter. Therefore, this paper tries to clarify the water footprint and detail virtual water flow features of a water-rich province, namely Yunnan province in China, to pursuit for more enlightenment for water conservation of not only water scarce regions but also water abundant regions. Multi-regional input-output (MRIO) method was adopted for water footprint and virtual water flow calculation. Results showed that the total water footprint of Yunnan was 11.35 billion m3, with 7.98 billion m3 (70%) of internal water footprint, demonstrating that Yunnan was a high water self-sufficient province. Moreover, Yunnan was a net virtual water exporter with a value of 1.18 billion m3, which was not good for Yunnan but was good for water scarce provinces. As for the detailed virtual water flow trade, high water intensity Guangxi, Hunan, Xinjiang were the top three net importers of Yunnan, while low water intensity Guangdong, Shanghai and Zhejiang were the top three export provinces of Yunnan. This did not affect Yunnan, but was not a good phenomenon for water sustainability of whole China. Moreover, agricultural sector was found to be the dominant sector for both virtual water import and export, accounting for about 88% and 86%, respectively. To maintain sustainable water management of both Yunnan and China, policy insights on keeping Yunnan as a net virtual water exporter, making use of its advantage in green water, adjusting trade structure by considering provincial water intensity were proposed. © 2019 Elsevier Ltd","36","Flow of water","Commerce - Hydraulics - Sustainable development - Water conservation - Water management","Agricultural sector - Input-output - Sustainable water management - Virtual water trade - Virtual water-flow - Water footprint - Water sustainability - Yunnan","444 Water Resources - 631.1.1 Liquid Dynamics - 632.1 Hydraulics",,"Number: 2017ZX07202, Acronym: -, Sponsor: Major Science and Technology Program for Water Pollution Control and Treatment; Number: 71603165, Acronym: NSFC, Sponsor: National Natural Science Foundation of China; Number: 71690241, Acronym: NSFC, Sponsor: National Natural Science Foundation of China; Number: 71810107001, Acronym: NSFC, Sponsor: National Natural Science Foundation of China; ","This research was supported by the Major Science and Technology Program for Water Pollution Control and Treatment (2017ZX07202) of China, the Open Fund Program of Yunnan Key Laboratory, the National Natural Science Foundation of China (Grant No. 71603165, 71690241, 71810107001) and Shanghai Municipal Government grant (17XD1401800).",,"Compendex","Compilation and indexing terms, Copyright 2019 Elsevier Inc.","Engineering Village"
"Significance and characteristics of REE geochemistry in calcite in the eastern ore belt of the Baiyangping poly-metallic metallogenic province, Northwestern Yunnan Province, China","20114214432138","","Feng, Cai-Xia (1); Bi, Xian-Wu (1); Wu, Li-Yan (1); Zou, Zhi-Chao (1, 2); Tang, Yong-Yong (1, 2) ","(1) The State Key Laboratory of Ore Deposit Geochemistry/Institute of Geochemistry, Chinese Academy of Sciences, Guiyang 550002, China (2) Graduate School of Chinese Academy of Sciences, Beijing 100049, China ","Feng, C.-X.(fengcaixia@vip.gyig.ac.cn) ","Jilin Daxue Xuebao (Diqiu Kexue Ban)/Journal of Jilin University (Earth Science Edition)","Jilin Daxue Xuebao (Diqiu Kexue Ban)","","Jilin University Press","41","5","1397-1406","September 2011","","","2011","Chinese","16715888","","","","","","","","","","JDXDA8","Journal article (JA)","Calcite is a dominant gangue mineral in the eastern ore belt of Baiyangping poly-metallic metallogenic province. Geochemical characteristics of rare earth element (REE) of calcite from different ore bodies reveal that there are two types of REE distribution patterns: light rare earth element (LREE)-enriched and flat REE. The former represents that the REE behavior of calcite is that of inherited from pre-hydrothermal ore-forming hydrothermal features and the LREE was not apparently carried out during the mineralization process. The latter indicates that LREE was apparently brought out during the mineralization process; the REE content, relevant parameters and REE distribution patterns of calcite from different types of ore bodies change significantly, but they show continuous change tendency; combined with other isotope data and geological background of the mine, it is considered that ore-forming fluids were mainly hot brines and some mantle fluid participated in the ore forming process; The ore-forming conditions change from the reducing to oxidizing ones during the metallogenic process.","40","Ores","Calcite - Exploratory geochemistry - Geochemistry - Heterojunctions - Mineralogy - Ore deposits - Rare earth elements - Rare earths","Distribution patterns - Geochemical characteristic - Geological background - Light rare earth elements - Mineralization process - Northwestern Yunnan - Ore-forming process - The eastern ore belt of Baiyangping poly-metallic metallogenic province","481.2 Geochemistry - 482 Mineralogy - 547.2 Rare Earth Metals - 714.2 Semiconductor Devices and Integrated Circuits - 804.2 Inorganic Compounds",,,,,"Compendex","Compilation and indexing terms, Copyright 2019 Elsevier Inc.","Engineering Village"
"Mechanism of rock- and ore-controlling structures in the Wand-ongshan ore block of the Beiya super-large porphyry-type poly-met¬a¬llic gold deposit, Northwestern Yunnan","20162402493381","","Liu, Fei (1); Han, Runsheng (1); Wang, Lei (1); Guo, Yuxinyue (1); Wang, Mingzhi (1); Tan, Wei (1) ","(1) Southwest Geological Survey, Geological Survey Center for Non-ferrous Mineral Resources, Kunming University of Science and Technology, Kunming; Yunnan; 650093, China ","Han, Runsheng(554670042@qq.com) ","Geotectonica et Metallogenia","Geotecton. Metallog.","","Science Press","40","2","266-280","April 1, 2016","","","2016","Chinese","10011552","20959508","","","10.16539/j.ddgzyckx.2016.02.006","","","","","","","Journal article (JA)","The Beiya poly-metallic gold deposit is one of the typical Cenozoic porphyry-type deposits in the Sanjiang poly-metallic metallogenetic belt, northwestern Yunnan. In recent years, an important breakthrough has been achieved in the Beiya poly-metallic gold deposit prospecting, which made the Au reserves rank the super-large-scale class. Through precise measurement of the large scale structural sections, we identified the mechanical properties of typical rock- and ore-controlling structures and analyzed the mechanism of the structural control of porphyry emplacement and ore-formation. The main constructional compressive stress in the Beiya orefield transited from near EW-trending to near SN-trending and to near EW-trending, forming the typical folds-faults-joints rock- and ore-controlling structures system since Late Yanshanian. The basic folding structural framework formed under near EW-trending principal compressive stress during Late Yanshanian to Early Himalayan period provided favorable structural environment for the emplacement of the porphyries. The principal compressive stress turned to near SN-trending in Middle Himalayan, which was accompanied by the ultra-shallow intrusion of the quartz syenite porphyry and porphyry-type poly-metallic gold mineralization. The ore-bodies occurred in the interlayered faulted fracture zones, faults and joints which were distributed in belts type, veins type and layers type, and porphyry-type disseminated ore-bodies were formed in the porphyry, some skarn-type gold-rich ore-bodies were formed in the contact zones of porphyry and surrounding rock. The ore bodies are hosted in the interlayered faulted fracture zones, faults, and joints, occurring as banded, vein-type, and strata-form ores. Disseminated ores are located inside of the porphyry while the skarn-type ores are found in the contacts. During Late Himalayan, the nearly EW-trending compression resulted in the destruction of ore-bodies and porphyry, and to the subsequent uplift and denudation. The oxidizing-leaching-type ore-bodies were formed mainly in this period. © 2016, Science Press. All right reserved.",,"Gold deposits","Compressive stress - Deposits - Fracture - Metals - Mineralogy - Ores - Rocks - Structural dynamics - Wall rock","Controlling mechanism - Metallic gold - Mineralization - Northwest Yunnan - Ore-controlling structures","408 Structural Design - 482 Mineralogy - 482.2 Minerals - 504.3 Heavy Metal Mines - 951 Materials Science",,,,,"Compendex","Compilation and indexing terms, Copyright 2019 Elsevier Inc.","Engineering Village"
"Comparative Analysis of Volatile Flavor Compounds of Fresh Truffles and Dried Truffles in Yunnan","20191706819463","","Feng, Tao (1); Shui, Meng-Zhu (1); Song, Shi-Qing (1); Yu, Yue-Xian (2); Sun, Min (1); Xu, Zhi-Min (3) ","(1) School of Perfume and Aroma Technology, Shanghai Institute of Technology, Shanghai; 201418, China (2) unnan Nanhua Miyilu Natural Food Development Co., Ltd., Nanhua; Yunnan; 675200, China (3) Department of Food Science, Louisiana State University, Baton Rouge; 70802, United States ","","Jingxi Huagong/Fine Chemicals","Jingxi Huagong","","Fine Chemicals","36","2","262-270","February 15, 2019","","","2019","Chinese","10035214","","","","10.13550/j.jxhg.20180513","","","","","","JIHUFJ","Journal article (JA)","Volatile compounds of fresh-picked truffles and vacuum freeze-drying truffles in Yunnan were extracted by headspace solid-phase microextraction (HS-SPME). Volatile components and sulfur aroma compounds were identified by gas chromatography-mass spectrometry (GC-MS) and gas chromatography-flame photometric detector (GC-FPD). The results showed that 30 and 83 volatile flavor compounds, 8 and 19 sulfur aroma compounds were detected in fresh-picked truffles and vacuum freeze-drying truffles, respectively. 1-Octen-3-ol, p-cresyl methyl ether, 3-methyl butyraldehyde, diallyl disulfide and dimethyl sulfide were higher in fresh truffles. p-Cresyl methyl ether, hexanoic acid, d-limonene, dimethyl sulfone, allyl methyl trisulfide were higher in dry truffles. The results of gas chromatography-olfactory (GC-O) combined with aroma activity value (OAV) indicated that diallyl disulfide, dimethyl sulfide, 1-octen-3-one and 3-methyl butyraldehyde had larger contribution to the aroma of fresh truffles. In dried truffles, bis(2-methyl-3-furyl)disulfide, γ-nonalactone, hexanoic acid, 1-octen-3-one had greater contribution to the aroma. © 2019, Editorial Office of FINE CHEMICALS. All right reserved.","29","Gas chromatography","Drug products - Ethers - Extraction - Flavor compounds - Flavors - Gases - Low temperature drying - Mass spectrometry - Odors - Photometry - Saturated fatty acids - Sulfur compounds - Volatile organic compounds","Comparative analysis - Flame photometric detectors - Gas chromatography-mass spectrometries (GC-MS) - Headspace solid phase microextraction - Vacuum-freeze drying - Volatile components - Volatile flavor compounds - Yunnan truffle","801 Chemistry - 802.3 Chemical Operations - 804.1 Organic Compounds - 822.3 Food Products - 941.4 Optical Variables Measurements",,"Number: 17ZR142600, Acronym: -, Sponsor: Natural Science Foundation of Shanghai; Number: 31771942, Acronym: NSFC, Sponsor: National Natural Science Foundation of China; ","National Natural Science Foundation of China (31771942); Shanghai Municipal Natural Science Foundation (17ZR142600); Shanghai Municipal Local Capacity Building Project (16090503800).",,"Compendex","Compilation and indexing terms, Copyright 2019 Elsevier Inc.","Engineering Village"
"Ore-field structural system and its ore-controlling processes of the Beiya porphyry gold polymetallic deposit in northwestern Yunnan, China","20175104556815","","Liu, Fei (1); Wang, Lei (1); Han, Runsheng (1); Guo, Yuxinyue (1, 2); Wang, Mingzhi (1); Tan, Wei (1) ","(1) Southwest of Geological Survey, Geological Survey Center for Non-ferrous Mineral Resources, Kunming University of Science and Technology, Kunming; 650093, China (2) Yunnan Metallurgical Resources Company Limited, Kunming; 650000, China ","Wang, Lei(120901163@qq.com) ","Earth Science Frontiers","Earth Sci. Front.","","Science Frontiers editorial department","24","6","208-224","November 1, 2017","","","2017","Chinese","10052321","","","","10.13745/j.esf.yx.2016-12-1","","","","","","","Journal article (JA)","The Beiya porphyry gold polymetallic deposit, located in northwestern Yunnan, China and formed during the Cenozoic structure-magma-mineralization events, is one of the typical Cenozoic porphyry deposits in the Sanjiang polymetallic metallogenic belt. Well developed structures in the Beiya gold polymetallic ore-field composed a typical folds-faults-joints rock-and ore-controlling structural system and controlled the formation of the so called “five in one” deposits which constituted two metallogenic systems. I-Porphyry metallogenic system: (1) the porphyry type Cu-Au-(Fe) deposit that controlled by faults, joints and explosion breccia pipes in porphyry; (2) the skarn type Au-Fe-(Cu) deposit that controlled by the contact zone structure between country rock and porphyry; (3) the hydrothermal vein type Au-Fe deposit that controlled by interlayer fracture zone, faults and joints in country rock; (4) the low-medium temperature hydrothermal type Pb polymetallic deposit that controlled by the boundary between Qingtianbao formation sand-mudstone and Beiya formation limestone and interlayer fracture zone in Beiya formation. II-Oxidation leaching metallogenic system: (5) the oxidized-leached-enriched type Au deposit that controlled by karst caves and unconformities. Through the analysis of geometry, kinematics and mechanical property of the typical rock-and ore-controlling structures, this paper dissects ore-field structural system and discusses its ore-controlling processes. Since the Late Yanshanian-Early Himalaya, affected by the continuous collision of the Indian and Eurasian plates, the main constructional compressive stress has experienced the transition sequentially from the nearly EW-to nearly SN-to NW-and to nearly EW-trending in the Beiya ore-field, and formed the SN, EW and NE structure belts which belong to the Jinshajiang-Chenghai SN structure belt of the Sanjiang-Central Yunnan meridional structural system, the Tangdan-Heqing-Lanping EW structure belt of the Yunnan latitudinal structural system and the Lijiang NE structure belt, respectively. It is believed that the EW structure belt was the dominant structural system which controlled the large-scale porphyry metallogenic system in the middle Himalaya. The early SN structure belt, formed in the early Himalaya, provided a favorable structural setting for porphyry emplacement and gold polymetallic mineralization. In contrast, the later SN structure belt was the dominant structural system that controlled the oxidation leaching metallogenic system in the Late Himalaya, which largely destroyed the deposits and/or led to transformation and enrichment. © 2017, Editorial Office of Earth Science Frontiers. All right reserved.","11","Process control","Binary alloys - Deposits - Fracture - Gold alloys - Gold deposits - Iron alloys - Iron deposits - Leaching - Lime - Metals - Mineralogy - Ore analysis - Ores - Oxidation - Rocks","Metallogenic system - Northwestern Yunnan - Ore-controlling structures - Polymetallic - Structural systems","482 Mineralogy - 545.1 Iron - 545.2 Iron Alloys - 547.1 Precious Metals - 801 Chemistry - 802.2 Chemical Reactions - 802.3 Chemical Operations - 804.2 Inorganic Compounds - 951 Materials Science",,,,,"Compendex","Compilation and indexing terms, Copyright 2019 Elsevier Inc.","Engineering Village"
