Title,Accession number,Title of translation,Author,Author affiliation,Corresponding author,Source,Abbreviated source title,Sponsor,Publisher,Volume,Issue,Pages,Issue date,Monograph title,Part number,Publication year,Language,ISSN,E-ISSN,ISBN13,DOI,Article number,Conference name,Conference date,Conference location,Conference code,CODEN,Document type,Abstract,Number of references,Main heading,Controlled/Subject terms,Uncontrolled terms,Classification code,Funding details,Funding text,Access type,Database,Copyright,Data Provider
"Synthesis of amorphous SiO2 nanowires by one-step low temperature hydrothermal process","20194307584447","","Zhu, Yan (1); He, Yin (1); Li, Zhenhua (1); Zhang, Jifan (1); Shen, Tao (1); Chen, Yiqi (1); Yang, Dequan (1, 2); Sacher, Edward (3) ","(1) Faculty of Materials Science and Engineering, Kunming University of Science and Technology, 253 Xuefu Rd, Kunming, Yunnan; 650093, China (2) Solmont Technology Wuxi Co. Ltd., 228 Linghu Blvd. Xinwu District, Wuxi, JIANGSU; 214135, China (3) Regroupement Québécois de Matériaux de Pointe, Département of Engineering Physics, Polytechnique Montréal, Case Postale 6079 succursale Centre-Ville, Montréal; QC; H3C 3A7, Canada ","Li, Zhenhua(lzhkust@sina.com) ","Materials Research Express","Mater. Res. Express","","Institute of Physics Publishing","6","11","","September 25, 2019","","","2019","English","","20531591","","10.1088/2053-1591/ab44da","115202","","","","","","Journal article (JA)","A novel procedure for the growth of amorphous SiO2 nanowires by a one-step hydrothermal process directly using commercial silicate glass in cheap aqueous ammonium hydroxide without any other catalyst is reported. The effect of concentration of aqueous ammonium hydroxide and reaction time on synthesized product was investigated. It was found that SiO2 nanowires with high aspect ratio can be synthesized using silicate glass at 170 C in 2.5 mol l-1 aqueous ammonium hydroxide for 7 h. Scanning electron microscopy, high resolution transmission electron microscopy and x-ray diffraction results showed that the products were amorphous SiO2 nanowires with diameters of 20∼100 nm and lengths of several tens of micrometers. X-ray photoelectron spectroscopy (XPS) indicated that the SiO2 nanowires retained small amounts of MgO and CaO from the silicate glass. The result of photoluminescence (PL) spectra of the nanowires exhibited a strong, sharp photoluminescence (PL) emission peak, centered at 426 nm. Based on the results, the OH-assisted hydrolysis of the glass has been proposed as the growth mechanism of the SiO2 nanowires. © 2019 IOP Publishing Ltd.","27","High resolution transmission electron microscopy","Ammonium hydroxide - Aspect ratio - Glass - Hydrothermal synthesis - Magnesia - Nanowires - Photoluminescence - Scanning electron microscopy - Silica - Silicates - Temperature - X ray photoelectron spectroscopy","Amorphous nanowires - Growth mechanisms - High aspect ratio - Hydrothermal process - Low temperatures - Photoluminescence emission - Photoluminescence spectrum - SiO2","641.1 Thermodynamics - 741.1 Light/Optics - 741.3 Optical Devices and Systems - 761 Nanotechnology - 802.2 Chemical Reactions - 804 Chemical Products Generally - 804.2 Inorganic Compounds - 812.3 Glass - 933 Solid State Physics",,,,"Compendex","Compilation and indexing terms, Copyright 2019 Elsevier Inc.","Engineering Village"
"Ag decorated ZnO nanocrystallines synthesized by a low-temperature solvothermal method and their application for high response H2 gas sensor","20194307571820","","Li, Zeyang (1); Zhang, Guanglian (1); Gao, Waiqiong (1); Zhao, Rongjun (1); Wang, Yude (1, 2) ","(1) School of Materials Science and Engineering, Yunnan University, Kunming; 650091, China (2) Key Lab of Quantum Information of Yunnan Province, Yunnan University, Kunming; 650091, China ","Wang, Yude(ydwang@ynu.edu.cn) ","Journal of Materials Science: Materials in Electronics","J Mater Sci Mater Electron","","Springer New York LLC","30","20","18959-18969","October 1, 2019","","","2019","English","09574522","1573482X","","10.1007/s10854-019-02253-5","","","","","","","Journal article (JA)","Different ratios (0, 1 and 3 mol%) of Ag decorated ZnO nanocrystallines are prepared via a simple low-temperature solvothermal method. The characterization results show that the as-prepared products are composed of numerous small nanocrystallines with irregular shapes. XPS analysis reveals the adsorbed oxygen on the surface of ZnO, which can react with the detected gas molecules and improve the sensor response. The gas-sensing properties of the sensors made from the Ag-decorated ZnO nanocrystallines are tested for hydrogen detection at 260 °C. The results show that the sensor made from 1 mol% Ag-decorated ZnO nanocrystallines exhibits excellent gas-sensing properties, demonstrating a high gas response of 59.35 toward 3000 ppm hydrogen, a fast response time (5 s) and recovery time (6 s) (with 1000 ppm hydrogen), good repeatability and stability. The improved hydrogen sensing properties can be attributed to the catalytic effect of Ag nanoparticles, which offer more active sites for the reaction and facilitate the adsorption and desorption of hydrogen on the surface of ZnO nanocrystallines. © 2019, Springer Science+Business Media, LLC, part of Springer Nature.","37","Silver nanoparticles","Chemical detection - Chemical sensors - Gas detectors - Gases - Hydrogen - II-VI semiconductors - Nanocrystals - Temperature - Zinc oxide","Adsorption and desorptions - Catalytic effects - Fast response time - Gas sensing properties - Hydrogen detection - Hydrogen sensing properties - Nano-crystallines - Solvothermal method","641.1 Thermodynamics - 761 Nanotechnology - 801 Chemistry - 804 Chemical Products Generally - 804.2 Inorganic Compounds - 914.1 Accidents and Accident Prevention","Number: 201810673026, Acronym: -, Sponsor: -; Number: -, Acronym: -, Sponsor: Guangdong Innovative and Entrepreneurial Research Team Program; ","This work was supported by the Yunnan Provincial Training Programs of Innovation and Entrepreneurship for Undergraduates (No. 201810673026) and Program for Innovative Research Team (in Science and Technology) in University of Yunnan Province. Springer Nature remains neutral with regard to jurisdictional claims in published maps and institutional affiliations.",,"Compendex","Compilation and indexing terms, Copyright 2019 Elsevier Inc.","Engineering Village"
"Migration rules of the deposited naphthalene particles in urban gas line pipes: A case study of Kunming, Yunnan","20194207561111","","Wu, Xiaonan (1); Li, Qian (1); Gou, Jiayuan (1); Hu, Meilin (2); Li, Zhao (2); Liao, Hong (3) ","(1) School of Civil Engineering and Architecture, Southwest Petroleum University, Chengdu; Sichuan; 610500, China (2) PetroChina Kunlun Gas Co., Ltd. - Yunnan, Kunming; Yunnan; 650200, China (3) Sales Company, Shunan Division of PetroChina Southwest Oil & Gasfield Company, Luzhou; Sichuan; 646000, China ","","Natural Gas Industry","Natur. Gas Ind.","","Natural Gas Industry Journal Agency","39","8","104-112","August 25, 2019","","","2019","Chinese","10000976","","","10.3787/j.issn.1000-0976.2019.08.013","","","","","","TIGOE3","Journal article (JA)","The manufactured gases containing such impurities as naphthalene particles had been long used as urban gas, but they have been recently replaced by natural gas. The deposited naphthalene particles migrating along with the current gas flow will inevitably result in pipe blockage or damage to devices. In order to study the migration law of the deposited naphthalene particles in gas line pipes, we took the urban gas pipeline in Kunming as an example, adopted the RSM turbulence model and the DPM model of the Fluent software to simulate and analyze the migration law of the deposited naphthalene particles in horizontal straight pipes, horizontal bend pipes and tee pipes. And the influence of the deposited naphthalene particle size, inlet velocity, temperature and pressure on the migration of deposited naphthalene particles under different pipe diameters, curvature ratios and pipe diameter ratios were analyzed respectively. The results show that: (1) The migration rates of deposited naphthalene particles in the above three types of pipes are negatively correlated with the size of the deposited naphthalene particles, and are positively correlated with pressure and inlet velocity; (2) With the increase of temperature, the migration rate of naphthalene particles in the above three types of pipes decreases first and then increases; (3) The migration rate of naphthalene particles deposited in gas line pipes is most affected by the inlet velocity of gas flow, then by temperature and least by pressure. (4) The migration rate of naphthalene particles is positively correlated with the ratio of horizontal straight pipe diameter and tee pipe diameter, and negatively correlated with the ratio of horizontal bend pipe diameter. In conclusion, this study is of great significance in guaranteeing the safe operation of urban gas transportation and distribution system. © 2019, Natural Gas Industry Journal Agency. All right reserved.","17","Naphthalene","Flow of gases - Gases - Inlet flow - Manufacture - Natural gas - Particle size - Particle size analysis - Piping systems - Turbulence models - Two phase flow - Urban transportation","Displacement - Gas lines - Gas solid two phase flow - Influence factor - Migration rates","432 Highway Transportation - 433 Railroad Transportation - 522 Gas Fuels - 537.1 Heat Treatment Processes - 619.1 Pipe, Piping and Pipelines - 631.1 Fluid Flow, General - 631.1.2 Gas Dynamics - 804.1 Organic Compounds - 951 Materials Science",,,,"Compendex","Compilation and indexing terms, Copyright 2019 Elsevier Inc.","Engineering Village"
"Efficient imine synthesis from oxidative coupling of alcohols and amines under air atmosphere catalysed by Zn-doped Al2O3 supported Au nanoparticles","20193107246728","","Wu, Shipeng (1); Sun, Weixiao (1); Chen, Junjie (1); Zhao, Jinghan (1); Cao, Qiue (1, 2); Fang, Wenhao (1); Zhao, Q. (1) ","(1) School of Chemical Science and Technology, Key Laboratory of Medicinal Chemistry for Natural Resource – Ministry of Education, Functional Molecules Analysis and Biotransformation Key Laboratory of Universities in Yunnan Province, Yunnan University, 2 North Cuihu Road, Kunming; 650091, China (2) National Demonstration Center for Experimental Chemistry and Chemical Engineering Education, Yunnan University, China ","Fang, Wenhao(wenhao.fang@ynu.edu.cn) ","Journal of Catalysis","J. Catal.","","Academic Press Inc.","377","","110-121","September 2019","","","2019","English","00219517","10902694","","10.1016/j.jcat.2019.07.027","","","","","","JCTLA5","Journal article (JA)","Direct oxidative coupling of alcohols and amines is regarded as an effective and green approach for imine synthesis under mild conditions. In this work, Zn-doped γ-Al2O3 supported Au nanoparticles was demonstrated as highly active and selective heterogeneous catalyst for a series of imine productions with good to excellent yields, from alcohols and amines via direct oxidative coupling under air atmosphere without extra base additives. Various physicochemical techniques, including ICP-MS, XRD, N2 physisorption, TEM, XPS and CO2-/NH3-TPD, were used to study the properties of the catalysts. Well-dispersed Au0 nanoparticles with a mean size of ca. 2.9 nm were found highly effective in activating alcohols in the presence of reactive amines. The amount of Zn2+ dopant and the calcination temperature of support during catalyst preparation showed crucial impact on tuning the intrinsic activity for oxidation of benzyl alcohol to benzaldehyde (i.e., the rate-determining step for the model reaction), which was disclosed to be related with the active surface oxygen species and the acidic-basic property of support. The 0.4% Au/Zn0.02Al2O3 catalyst calcined at 400 °C exhibited the highest TOF (39.1 h−1) at 60 °C based on a >99% yield to benzylideneaniline among all the ever-reported Au-based catalysts. Moreover, this catalyst could afford 98% yield to benzylideneaniline at only 30 °C and work effectively for the gram-scale synthesis. It also showed considerable stability after five consecutive recycling. © 2019 Elsevier Inc.","60","Catalyst supports","Additives - Alumina - Aluminum oxide - Amines - Calcination - Catalysis - Gold - Gold nanoparticles - Nanoparticles - Physicochemical properties - Synthesis (chemical) - Zinc compounds","Au nanoparticle - Calcination temperature - Heterogeneous catalyst - Imine - Oxidative couplings - Physicochemical techniques - Rate determining step - Surface oxygen","547.1 Precious Metals - 761 Nanotechnology - 802.2 Chemical Reactions - 802.3 Chemical Operations - 803 Chemical Agents and Basic Industrial Chemicals - 804.1 Organic Compounds - 804.2 Inorganic Compounds - 933 Solid State Physics","Number: C6176102, Acronym: -, Sponsor: China National Funds for Distinguished Young Scientists; Number: 2018185, Acronym: -, Sponsor: -; Number: -, Acronym: NCET, Sponsor: Program for New Century Excellent Talents in University; Number: -, Acronym: -, Sponsor: Guangdong Innovative and Entrepreneurial Research Team Program; Number: 21763031, Acronym: NSFC, Sponsor: National Natural Science Foundation of China; ","This work was supported by Natural Science Foundation of China ( 21603187 , 21763031 ), National Special Funds of China ( C6176102 ), Program for Excellent Young Talents of Yunnan University, Postgraduate Foundation of Yunnan University ( 2018185 ), and Program for Innovative Research Team (in Science and Technology) in University of Yunnan Province . Authors sincerely thank Mr. G.-H. Zhu from Advanced Analysis and Measurement Center (YNU) for ICP-MS analysis. Appendix A",,"Compendex","Compilation and indexing terms, Copyright 2019 Elsevier Inc.","Engineering Village"
"Reliability assessment and optimization of double random vibration systems based on PDEM","20191106642154","","Wang, X.J. (1, 2); Yang, S.Z. (1, 2); Wang, X. (1); Xiang, M.J. (1); Long, S.Q. (1); Dong, Y.Q. (1); Zhou, X.F. (1) ","(1) Yunnan University, Kunming; 650500, China (2) Guangxi Key Laboratory of Disaster Prevention and Engineering Safety, Guangxi University, Nanning; 530004, China ","","IOP Conference Series: Materials Science and Engineering","IOP Conf. Ser. Mater. Sci. Eng.","Incheon Disaster Prevention Research Center (IDPRC); Incheon National University","Institute of Physics Publishing","473","1","","February 26, 2019","2018 5th International Conference on Advanced Materials, Mechanics and Structural Engineering","1 of 1","2019","English","17578981","1757899X","","10.1088/1757-899X/473/1/012003","012003","2018 5th International Conference on Advanced Materials, Mechanics and Structural Engineering, AMMSE 2018","October 19, 2018 - October 21, 2018","Seoul, Korea, Republic of","145844","","Conference article (CA)","The dynamic responses analysis method of structure with random parameters under stochastic seismic loads is proposed. The generalized probability density evolution equation for compound stochastic process is solved by the finite difference method. Then, for the first passage criterion, the dynamic reliability is analysed by establishing the one-dimensional integral in safe domain and the absorbing boundary condition. A new optimization method is coming up combining improved genetic algorithm and PDEM. Taking the parameters optimization of a three-story floor-shear frame structure with TMD under random seismic loads as an example, the correctness of the proposed method is verified by comparing interlayer displacement response and dynamic reliability. © 2019 Institute of Physics Publishing. All Rights Reserved.","9","Dynamics","Finite difference method - Genetic algorithms - Random processes - Reliability - Seismology - Stochastic systems - Structural design","Absorbing boundary condition - Double random vibration systems - Interlayer displacements - Parameters optimization - Probability density evolution equation - Reliability assessments - Shear frame structures - Stochastic seismic loads","408.1 Structural Design, General - 484.1 Earthquake Measurements and Analysis - 921.6 Numerical Methods - 922.1 Probability Theory - 961 Systems Science",,,"Open Access","Compendex","Compilation and indexing terms, Copyright 2019 Elsevier Inc.","Engineering Village"
"The magmatic-hydrothermal-mineralized center of bairong-bairongxi porphyry cu-mo district at the gangdese belt, southern tibet","20193507375725","","Zou, Xinyu (1, 2, 3); Qin, Kezhang (1, 2, 3); Guangming, U. (1, 2, 3); Zhang, Xiping (4); Zhao, Junxing (1, 3); Zhang, Peipei (5); Zhang, Man (1, 3); Zhang, Jinshu (6) ","(1) Key Laboratory of Mineral Resources, Institute of Geology and Geophysics, Chinese Academy of Sciences, Beijing; 100029, China (2) University of Ch Inese Academy of Sciences, Beijing; 100049, China (3) Institutions of Earth Science, Chinese Academy of Sciences, Beijing; 100029, China (4) China Copper Co., Ltd., Beijing; 100082, China (5) Yunnan Copper Co., Ltd., Kunming; 650000, China (6) Tibet University, Lassa; 850000, China ","","Yanshi Xuebao/Acta Petrologica Sinica","Yanshi Xuebao/Acta Petrol. Sin.","","Science Press","35","7","2026-2044","2019","","","2019","Chinese","10000569","20958927","","10.18654/1000-0569/2019.07.06","","","","","","","Journal article (JA)","The Bairong-Bairongxi porphyry Cu-Mo district is located in the middle part of Gangdese porphyry copper belt in southern Tibet, China. It has sparse mineralization, complicated magmatic intrusions, no central alteration zonation and no typical ore-related porphyry. Therefore, 'where is the magmatic-hydrothermal-mineralized center of Bairong-Bairongxi∗ is becoming the key of further studies. To address this issue, based on detailed geological survey and drills records, combined with the observation of microscope, zircon U-Pb dating and molybdenite Re-()s dating analysis, we concluded the following points: (1 ) The Bairong-Bairongxi is not two separated ore districts but belongs to an united porphyry mineralization system; (2) The magmatic sequences include biotite monzonitic granite, monzonitic granite porphyry ( 13. 9 ±0. 2Ma) , granodiorite porphyry ( 13. 8 ±0. 2Ma) , dacite porphyry ( 12. 6 ±0. 4Ma) and lamprophyre (11. 1 ±0. 2Ma); (3) The Re-Os age of molybdenite is from 13. 35 ±0. 19Ma to 13. 82 ±0. 20Ma; (4) The magmatic-hydrothermal-mineralized center is in its central regions; (5) Most of drillings are located in the argillic alteration zone but deep drillings revealed medium-high temperature veinlets, indicating the alteration has its origin in the deep. As mentioned above, Bairong-Bairongxi is in the top of a Cu-Mo porphyry system with clear magmatic-hydrothermal-mineralized center, and has great potential in Cu-Mo mineralization in the deep. This work gives an overview picture of Bairong-Bairongxi porphyry Cu-Mo district and is helpful for further exploration and studies. © 2019 Science Press. All rights reserved.","59","Uranium alloys","Binary alloys - Clay alteration - Copper alloys - Copper deposits - Geochronology - Granite - Infill drilling - Lead alloys - Mica - Mineralogy - Molybdenum alloys - Molybdenum compounds - Ore analysis - Ores - Osmium alloys - Rhenium alloys - Zircon","Argillic alteration zone - Brong-bairongxi porphyry cu-mo district - Hydrothermal alterations - Magmatic intrusions - Medium-High temperatures - Molybdenite re-os ages - Zircon U-Pb age - Zircon U-Pb dating","481.1 Geology - 482 Mineralogy - 511.1 Oil Field Production Operations - 543.3 Molybdenum and Alloys - 544.1 Copper - 544.2 Copper Alloys - 546.1 Lead and Alloys - 547 Minor, Precious and Rare Earth Metals and Alloys - 547.1 Precious Metals - 549.3 Nonferrous Metals and Alloys excluding Alkali and Alkaline Earth Metals - 801 Chemistry",,,,"Compendex","Compilation and indexing terms, Copyright 2019 Elsevier Inc.","Engineering Village"
"A high performance direct carbon solid oxide fuel cell – A green pathway for brown coal utilization","20191806847392","","Wu, Hao (1); Xiao, Jie (1, 2); Zeng, Xiaoyuan (1, 2); Li, Xue (1, 2); Yang, Jing (2); Zou, Yuling (2); Liu, Sudongfang (2); Dong, Peng (1, 2); Zhang, Yingjie (1, 2); Liu, Jiang (3) ","(1) National and Local Joint Engineering Laboratory for Lithium-ion Batteries and Materials Preparation Technology, Key Laboratory of Advanced Battery Materials of Yunnan Province, Faculty of Materials Science and Engineering, Kunming University of Science and Technology, Kunming; 650093, China (2) Faculty of Metallurgical and Energy Engineering, Kunming University of Science and Technology, Kunming; 650093, China (3) Guangzhou Key Laboratory for Surface Chemistry of Energy Materials, New Energy Research Institute, School of Environment and Energy, South China University of Technology, Guangzhou; 510006, China ","Xiao, Jie(jiexiao@kmust.edu.cn) ","Applied Energy","Appl. Energy","","Elsevier Ltd","248","","679-687","15 August 2019","","","2019","English","03062619","","","10.1016/j.apenergy.2019.04.104","","","","","","APENDX","Journal article (JA)","Direct carbon solid oxide fuel cells (DC-SOFCs)are promising, all-solid-state, highly efficient and environment-friendly power generating devices fueled by solid carbons. In addition, utilization of real-world coal as fuel for DC-SOFC is an attractive topic, however, they still yield poor performance due to negative effect of impurities in coal. In order to utilize brown coal to generate electricity efficiently and environmentally, here we report a high-performance direct carbon solid oxide fuel cell that enables a green pathway for brown coal utilization. The cell consists of nano Al2O3 doped yttria-stabilized zirconia (YSZ)electrolyte supports and Ag-Gd0.1Ce0.9O2-δ as symmetrical composite catalyst electrodes. Fueled with raw brown coal and brown coal char at 850 °C separately, the cells can achieve maximum power densities of 211.4 and 221 mW cm−2, respectively. Furthermore, a stable discharging voltage and platform with the fuel utilization of 61.5% are demonstrated when brown coal char fueled DC-SOFC is operated under a constant current of 0.1 A. © 2019 Elsevier Ltd","44","Solid oxide fuel cells (SOFC)","Alumina - Aluminum oxide - Cerium compounds - Direct carbon fuel cells (DCFC) - Electrolytes - Fuel cells - Gadolinium compounds - Lignite - Nuclear fuels - Silver compounds - Yttria stabilized zirconia - Yttrium oxide - Zirconia","Coal utilization - Composite catalysts - Direct carbons - Environment friendly - Generate electricity - Maximum power density - Power generating devices - Yttria-stabilized zirconias (YSZ)","524 Solid Fuels - 702 Electric Batteries and Fuel Cells - 702.2 Fuel Cells - 803 Chemical Agents and Basic Industrial Chemicals - 804 Chemical Products Generally - 804.2 Inorganic Compounds","Number: -, Acronym: -, Sponsor: Analysis and Testing Foundation of Kunming University of Science and Technology; Number: 51764029, Acronym: -, Sponsor: National Natural Science Foundation of China; Number: KKZ3201652004, Acronym: -, Sponsor: -; Number: 2017FB085, Acronym: -, Sponsor: Applied Basic Research Foundation of Yunnan Province; Number: 2014ZT05N200, Acronym: -, Sponsor: Guangdong Innovative and Entrepreneurial Research Team Program; ","This work was supported by the National Science Foundation of China (NSFC, Grant No. 51604132 , No. 51764029 and No. 91745203 ), the Applied Basic Research Plan of Yunnan Province (No. 2015FD007 , No. 2017FD091 and No. 2017FB085 ), the Scientific Research Start-up Fund of Kunming University of Science and Technology of Introducing Talents (No. KKZ3201652004 ), the Analysis and Testing Foundation of Kunming University of Science and Technology and the Guangdong Innovative and Entrepreneurial Research Team Program (No. 2014ZT05N200 ), and the NSFC-Guangdong Joint Fund (No. U1601207 ).",,"Compendex","Compilation and indexing terms, Copyright 2019 Elsevier Inc.","Engineering Village"
