Title,Accession number,Title of translation,Author,Author affiliation,Corresponding author,Source,Abbreviated source title,Publisher,Volume,Issue,Pages,Issue date,Monograph title,Part number,Publication year,Language,ISSN,E-ISSN,ISBN13,DOI,Article number,Conference name,Conference date,Conference location,Conference code,CODEN,Document type,Abstract,Number of references,Main heading,Controlled/Subject terms,Uncontrolled terms,Classification code,Funding details,Funding text,Access type,Database,Copyright,Data Provider
"Energy transfer rules and damage characteristics analysis of layered mortar specimen under low-velocity impact","20194107515517","","Yang, Yang (1, 2); Li, Xianglong (2); Li, Kegang (2); Chen, Yun (3); Wang, Jianguo (3) ","(1) College of Water Conservancy, Yunnan Agricultural University, Kunming; 650201, China (2) Faculty of Land Resources Engineering, Kunming University of Science and Technology, Kunming; 650093, China (3) College of Civil and Architectural Engineering, Yunnan Agricultural University, Kunming; 650201, China ","Wang, Jianguo(wangjg0831@163.com) ","IOP Conference Series: Earth and Environmental Science","IOP Conf. Ser. Earth Environ. Sci.","Institute of Physics Publishing","340","5","","September 18, 2019","2019 International Conference on Civil and Hydraulic Engineering - Construction and Building Materials","5 of 5","2019","English","17551307","17551315","","10.1088/1755-1315/304/5/052068","052068","2019 5th International Conference on Hydraulic and Civil Engineering, ICHCE 2019","May 10, 2019 - May 12, 2019","Nanjing, China","152100","","Conference article (CA)","The energy transfer rule and failure pattern of layered mortar specimen are helpful to analyze the seismic performance of layered structure. Split Hopkinson pressure bar equipment was used for one-dimensional impact tests of specimens with double fissures under low-velocity. Experimental results show that when the impact speed is lower than 5.26m/s, the energy consumption of the layered mortar specimens with a parallel fracture spacing of 18mm increases with the increase of the impact velocity. When the speed is increased from 5.26m/s to 6.04m/s, the energy consumption increases first and then decreases, and the impact velocity corresponding to the maximum value is determined by the physical and mechanical properties of the layered fracture of the specimen and the impact strength of the material. Within the low speed range of 3.38m/s∼5.26m/s, damage variable presented an increase weak power function relationship with the increasing impact speed, meeting d = -10014.08e-v/032 + 0.83, and the damage value of the specimen was about 0.72. The results of this study provide a reference for the analysis of the dynamic characteristics of laminated cement mortar material in construction engineering. © Published under licence by IOP Publishing Ltd.","13","Mortar","Energy transfer - Energy utilization - Fluid mechanics - Impact strength - Mechanical testing - Shore protection - Velocity","Characteristics analysis - Construction engineering - Dynamic characteristics - Layered Structures - Low velocity impact - Physical and mechanical properties - Seismic Performance - Split Hopkinson pressure bars","407.1 Maritime Structures - 414.3 Mortar (Before 1993, use code 412) - 525.3 Energy Utilization - 931.1 Mechanics - 943.2 Mechanical Variables Measurements",,,,"Compendex","Compilation and indexing terms, Copyright 2019 Elsevier Inc.","Engineering Village"
"Electrocatalysts for electrooxidation of direct alcohol fuel cell: chemistry and applications","20193707427672","","Siwal, S.S. (1); Thakur, S. (2, 3); Zhang, Q.B. (1, 4); Thakur, V.K. (5, 6) ","(1) Key Laboratory of Ionic Liquids Metallurgy, Faculty of Metallurgical and Energy Engineering, Kunming University of Science and Technology, Kunming; 650093, China (2) Institute of Materials Science of Kaunas University of Technology, Barsausko 59, Kaunas; LT-51423, Lithuania (3) School of Chemistry, Shoolini University, Solan; Himachal Pradesh; 173212, India (4) State Key Laboratory of Complex Nonferrous Metal Resources Cleaning Utilization in Yunnan Province, Kunming; 650093, China (5) Enhanced Composites and Structures Center, School of Aerospace, Transport and Manufacturing, Cranfield University, Bedfordshire; MK43 0AL, United Kingdom (6) Department of Mechanical Engineering, School of Engineering, Shiv Nadar University, Uttar Pradesh; 201314, India ","Thakur, V.K.(vijay.kumar@cranfield.ac.uk) ","Materials Today Chemistry","Mater. Today Chem.","Elsevier Ltd","14","","","December 2019","","","2019","English","","24685194","","10.1016/j.mtchem.2019.06.004","100182","","","","","","Journal article (JA)","In the present scenario, civilization wholly depends on energy generation and storage for better technological progress and extension in several scientific applications. Owing to limited conventional energy sources and high energy requirement, absolute, cost-effective, and eco-friendly substitute roots of energy are of the principal interest. In this direction, direct alcohol fuel cell is becoming more familiar and promising because of its straightforward configuration system, weight, and elevated power generation efficiency. Indeed, recent years have seen extensive research on the preparation and properties of the fuel cell system. The literature review presented in this article provides comprehensive information on electrooxidation of alcohol developed on different type of electrocatalyst. The integration of a range of nanomaterials is depicted to comprehend the effect of different properties such as a well-ordered porous structure, exemplary high specific surface areas, electronic conductivity, tremendous convenience to active sites, and improved mass transport for electrooxidation of fuel cell. In this article, we have presented a detailed review of fuel cells and defined the main perspective, rationale and motivation, research tasks, and objectives of study as well as the delimitation of the study. © 2019 Elsevier Ltd","215","Direct alcohol fuel cells (DAFC)","Alcohol fuels - Cost effectiveness - Electrocatalysts - Electrooxidation - Nanostructured materials","Anode catalysts - Comprehensive information - Conventional energy sources - Electrooxidation of alcohols - High energy requirements - High specific surface area - Methanol Oxidation - Power generation efficiency","523 Liquid Fuels - 702.2 Fuel Cells - 761 Nanotechnology - 801.4.1 Electrochemistry - 803 Chemical Agents and Basic Industrial Chemicals - 911.2 Industrial Economics","Number: 2017PY269SQ, Acronym: -, Sponsor: Candidate Talents Training Fund of Yunnan Province; Number: 2018HB007, Acronym: -, Sponsor: Candidate Talents Training Fund of Yunnan Province; Number: 21962008, Acronym: NSFC, Sponsor: National Natural Science Foundation of China; Number: 51464028, Acronym: NSFC, Sponsor: National Natural Science Foundation of China; ","The authors gratefully acknowledge the financial support of the National Natural Science Foundation of China (21962008, 51464028), Candidate Talents Training Fund of Yunnan Province (2017PY269SQ, 2018HB007), and Yunnan Ten Thousand Talents Plan Young & Elite Talents Project (YNWR-QNBJ-2018-346).",,"Compendex","Compilation and indexing terms, Copyright 2019 Elsevier Inc.","Engineering Village"
"Recovery of collided RFID tags with frequency drift on physical layer","20194107519386","","Li, Junzhi (1); Wu, Haifeng (1); Zeng, Yu (1) ","(1) School of Electrical and Information Technology, Yunnan Minzu University, Kunmming 650500, China ","","IEEE/CAA Journal of Automatica Sinica","IEEE CAA J. Autom. Sin.","Institute of Electrical and Electronics Engineers Inc.","","","","2019","","","2019","English","23299266","23299274","","10.1109/JAS.2019.1911720","","","","","","","Article in Press","In a passive ultra-high frequency &#x0028 UHF &#x0029 radio frequency identification &#x0028 RFID &#x0029 system, the recovery of collided tag signals on a physical layer can enhance identification efficiency.However,frequency drift is very common in UHF RFID systems, and will have an influence on the recovery on the physical layer. To address the problem of recovery with the frequency drift, this paper adopts a Radial Basis Function &#x0028 RBF &#x0029 network to separate the collision signals, and decode the signals via FM0 to recovery collided RFID tags. Numerical results show that the method in this paper has better performance of symbol error rate &#x0028 SER &#x0029 and separation efficiency compared to conventional methods when frequency drift occurs. IEEE",,"Radio frequency identification (RFID)","Network layers - Numerical methods - Radial basis function networks - Recovery - Signal reconstruction","Conventional methods - Frequency drifts - Numerical results - Physical layers - Radial basis functions - Separation efficiency - Symbol error rate (SER) - Ultra-high frequency","716.1 Information Theory and Signal Processing - 716.3 Radio Systems and Equipment - 723 Computer Software, Data Handling and Applications - 921.6 Numerical Methods",,,,"Compendex","Compilation and indexing terms, Copyright 2019 Elsevier Inc.","Engineering Village"
"The Riemann problem for the Suliciu relaxation system with the double-coefficient Coulomb-like friction terms","20192907189229","","Zhang, Yanyan (1); Zhang, Yu (2) ","(1) College of Mathematics and Statistics, Xinyang Normal University, Xinyang; 464000, China (2) Department of Mathematics, Yunnan Normal University, Kunming; 650091, China ","Zhang, Yu(yuzhang13120@126.com) ","International Journal of Non-Linear Mechanics","Int J Non Linear Mech","Elsevier Ltd","116","","200-210","November 2019","","","2019","English","00207462","","","10.1016/j.ijnonlinmec.2019.07.004","","","","","","IJNMAG","Journal article (JA)","We solve the Riemann problem for the Suliciu relaxation system with the Coulomb-like friction terms containing two constant friction coefficients. The exact Riemann solutions involving delta shock waves and contact discontinuities are obtained constructively. Via deriving the generalized Rankine–Hugoniot relations of delta shock waves in detail, all of the position, propagation speed and strength of the delta shock wave are given concretely under a suitable entropy condition. Based on this, we clearly analyze the influence of the Coulomb-like friction terms on the Riemann solutions of the Suliciu relaxation system. © 2019 Elsevier Ltd","27","Shock waves","Friction - Partial differential equations","Constant-friction coefficient - Contact discontinuities - Delta shock waves - Entropy conditions - Friction term - Hugoniot relation - Relaxation systems - Riemann problem","921.2 Calculus - 931 Classical Physics; Quantum Theory; Relativity","Number: (11501488), Acronym: NSFC, Sponsor: National Natural Science Foundation of China; Number: -, Acronym: XYNU, Sponsor: Xinyang Normal University; ","Supported by National Natural Science Foundation of China(11501488), Yunnan Applied Basic Research Projects(2018FD015), Scientific Research Foundation Project of Yunnan Education Department(2018JS150) and Nan Hu Young Scholar Supporting Program of XYNU.",,"Compendex","Compilation and indexing terms, Copyright 2019 Elsevier Inc.","Engineering Village"
"Novel Histidine Kinase Gene HisK2301 from Rhodosporidium kratochvilovae Contributes to Cold Adaption by Promoting Biosynthesis of Polyunsaturated Fatty Acids and Glycerol","20190206368092","","He, Jing (1, 2); Cui, Zhicheng (1); Ji, Xiuling (1); Luo, Yiyong (1); Wei, Yunlin (1); Zhang, Qi (1) ","(1) Faculty of Life Science and Technology, Kunming University of Science and Technology, Kunming, Yunnan; 650500, China (2) Genetic Diagnosis Center, Yunnan Provincial Key Laboratory for Birth Defects and Genetic Diseases, First People's Hospital of Yunnan Province, Kunming, Yunnan; 650032, China ","Zhang, Qi(qzhang37@gmail.com) ","Journal of Agricultural and Food Chemistry","J. Agric. Food Chem.","American Chemical Society","67","2","653-660","January 16, 2019","","","2019","English","00218561","15205118","","10.1021/acs.jafc.8b04859","","","","","","JAFCAU","Journal article (JA)","Hybrid histidine kinase (HHKs) are widespread in fungi, but their roles in the regulation of fungal adaptation to environmental stresses remain largely unclear. To elucidate this, we cloned HisK2301 from Rhodosporidium kratochvilovae strain YM25235, characterized HisK2301 as a novel HHK, and further investigated the role of HisK2301 by overexpressing it in YM25235. Our results revealed that HisK2301 can promote adaptation of YM25235 to cold, osmotic, and salt stresses. During cold stress, HisK2301 significantly enhanced the biosynthesis of polyunsaturated fatty acids (PUFA) and intracellular glycerol. HisK2301 also augmented the expression levels of Δ12/Δ15 fatty acid desaturase (RKD12) and glycerol-3-phosphate dehydrogenase1 (GPD1), which are responsible for PUFA and glycerol biosynthesis, respectively. To conclude, our findings give the first insight into the defense and mechanisms of HisK2301 in fungi against cold stress and suggest the potential use of the novel cold-adapted HHK HisK2301 in industrial processes, such as large-scale production of PUFA. © 2018 American Chemical Society.","54","Polyunsaturated fatty acids","Amino acids - Biochemistry - Biosynthesis - Cloning - Environmental regulations - Enzymes - Fungi - Glycerol","cold adaptation - Environmental stress - Glycerol biosynthesis - Histidine kinase - Industrial processs - Intracellular glycerol - Large scale productions - Rhodosporidium kratochvilovae",,"Number: D-201643, Acronym: -, Sponsor: -; Number: 31160016, Acronym: NSFC, Sponsor: National Natural Science Foundation of China; ","*Phone: 86-871-65920751. E-mail: qzhang37@gmail.com. ORCID Qi Zhang: 0000-0002-3914-2992 Author Contributions #J.H. and Z.C. contributed equally to this work. Funding This study was supported by grants from the National Natural Science Foundation of China (Grants 31660454 and 31160016) and by a grant from the Project of Medical Academic Leader of Yunnan Province (Grant D-201643). Notes The authors declare no competing financial interest.",,"Compendex","Compilation and indexing terms, Copyright 2019 Elsevier Inc.","Engineering Village"
"Study on the characteristics of evaporation–atomization–combustion of biodiesel","20184706106505","","Shen, Yicheng (1, 2); Li, Fashe (1, 2); Liu, Zuowen (1, 2); Wang, Huage (1, 2); Shen, Jiaxu (1, 2) ","(1) State Key Laboratory of Complex Nonferrous Metal Resources Cleaning Utilization in Yunnan Province, Kunming; 650093, China (2) Faculty of Metallurgical and Energy Engineering, Kunming University of Science and Technology, Kunming; 650093, China ","Li, Fashe(asanli@foxmail.com) ","Journal of the Energy Institute","J. Energy Inst.","Elsevier B.V.","92","5","1458-1467","October 2019","","","2019","English","17439671","17460220","","10.1016/j.joei.2018.08.005","","","","","","","Journal article (JA)","A great deal of research is being carried out on renewable diesel fuels. The number of raw materials (especially waste, animal, and vegetable oils), production technologies, and additives of biodiesel is increasing. In our work, a evaporation–atomization–combustion system consisting of a biomass liquid fuel was designed to produce a laminar premixed flame for studying the combustion–emission characteristics of biodiesel. The combustion characteristics of biodiesel including flame height, flame front area, flame speed, and OH total signal intensity were studied by planar laser-induced fluorescence of OH (OH-PLIF). The emission characteristics of biodiesel (CO, CO2, and NO) were studied with a flue gas analyzer. The experimental results showed that the flame height, flame front area, flame speed, and the OH total signal intensity changed with the equivalence ratio (Φ). The relationship between the OH radical intensity and the emission of CO/CO2 was obtained from the OH-PLIF average signal intensity. The [CO]/[CO2] ratio decreased with the OH-PLIF average signal intensity. Finally, we obtained the relationship between the OH-PLIF average signal intensity and the NO emissions. © 2018 Energy Institute","23","Waste incineration","Atomization - Biodiesel - Carbon dioxide - Evaporation - Free radicals - Nobelium","Combustion characteristics - Combustion flames - Emission characteristics - Laminar premixed - Laminar premixed flames - OH-PLIF - Planar laser induced fluorescence - [CO]/[CO2]","452.4 Industrial Wastes Treatment and Disposal - 523 Liquid Fuels - 622.1 Radioactive Materials, General - 802.3 Chemical Operations - 804.2 Inorganic Compounds","Number: 51766007, Acronym: -, Sponsor: National Natural Science Foundation of China-Yunnan Joint Fund; ","This work was supported by the National Natural Science Fund of China [Grant number: 51766007 ].",,"Compendex","Compilation and indexing terms, Copyright 2019 Elsevier Inc.","Engineering Village"
"Fabrication and interaction mechanism of Ni-encapsulated ZrO2-toughened Al2O3 powders reinforced high manganese steel composites","20193007220799","","Ru, Juanjian (1); He, Han (2); Jiang, Y. (2); Zhou, Rong (2); Hua, Y. (1, 3) ","(1) Faculty of Metallurgical and Energy Engineering, Kunming University of Science and Technology, Kunming; 650093, China (2) Faculty of Material Science and Engineering, Kunming University of Science and Technology, Kunming; Yunnan Province; 650093, China (3) State Key Lab of Complex Nonferrous Metal Resources Clean Utilization, Kunming; 650093, China ","Ru, Juanjian(rujuanjian@kmust.edu.cn) ","Advanced Powder Technology","Adv Powder Technol","Elsevier B.V.","30","10","2160-2168","October 2019","","","2019","English","09218831","15685527","","10.1016/j.apt.2019.06.031","","","","","","APTEEE","Journal article (JA)","In order to solve the cast-infiltration difficulty and low interface bonding strength of ZrO2-toughened Al2O3 (ZTA) powders reinforced high manganese steel (HMS) matrix composite, uniform and continuous Ni-encapsulated ZTA powders (ZTAp@Ni) as reinforced phase are fabricated by electroless deposition assisted with ionic liquid additive. The effects of Ethaline concentration, temperature, ZTA concentration and deposition times on the morphology of ZTAp@Ni have been investigated. Experimental results show that the thickness of Ni coating is about 7–10 μm, and there is no casting crack or shrink on the composite, so compact bonding between ceramic and matrix is obtained. In addition, the impact abrasive wear resistance testing demonstrates that the performance of ZTAp@Ni reinforced HMS composite is superior to that of matrix. On the basis of experimental analysis, a schematic illustration of the cast-infiltration process is put forward. It implies that Ni-encapsulated ZTA can be wetted with molten HMS matrix to form a ZTA/Al2NiO4-Al2MnO4/Fe interface layer through Ni diffusion and reactive wetting. The interdiffusion of Ni and other elements at ZTA interface layer can reinforce the interfacial bonding strength to form an interface layer between metal and hard phases. © 2019 The Society of Powder Technology Japan","25","Nickel steel","Additives - Alumina - Aluminum alloys - Aluminum oxide - Deposition - Diffusion bonding - Electroless plating - Fabrication - Ionic liquids - Ionic strength - Manganese steel - Powder metals - Reinforcement - Wear resistance - Wetting - Zircaloy - Zirconia","Experimental analysis - High manganese steel - Infiltration process - Interaction mechanisms - Interface bonding strength - Interface layer - Interfacial bonding strength - Ionic liquid additives","539.3.2 Electroless Plating - 541.2 Aluminum Alloys - 801.4 Physical Chemistry - 802.3 Chemical Operations - 803 Chemical Agents and Basic Industrial Chemicals - 804 Chemical Products Generally - 804.2 Inorganic Compounds - 931.2 Physical Properties of Gases, Liquids and Solids - 951 Materials Science","Number: 51604136, Acronym: NSFC, Sponsor: National Natural Science Foundation of China; ","The authors acknowledge the financial support of the National Natural Science Foundation of China (Project Nos. 51604136 , 51571103 ). Appendix A",,"Compendex","Compilation and indexing terms, Copyright 2019 Elsevier Inc.","Engineering Village"
"A process partitioning technique for constructing decentralized web service compositions","20193207297600","","Xue, Gang (1); Liu, Di (1); Liu, Junsong (1); Yao, Shaowen (1) ","(1) School of Software, Yunnan University, Kunming, China ","Liu, Di(dliu@ynu.edu.cn) ","Software - Practice and Experience","Software Pract Exper","John Wiley and Sons Ltd, Southern Gate, Chichester, West Sussex, PO19 8SQ, United Kingdom","49","10","1550-1570","October 1, 2019","","","2019","English","00380644","1097024X","","10.1002/spe.2735","","","","","","SPEXBL","Journal article (JA)","Web service compositions have been widely applied in different applications. A service composition is usually implemented in either a centralized or decentralized manner. Compared with the centralized service composition, the decentralized composition has no central control component, and components interact with each other directly, thereby achieving better performance. Process partitioning is a technique to divide a process into multiple parts and has been shown that it can be successfully applied to decentralizing process-driven service compositions. This paper proposes a new process partitioning technique for constructing decentralized service compositions. The proposed technique, which is based on typed digraphs and a graph transformation technique, is used for exploring available process partitioning solutions. For applications, this paper discusses the topology and interaction features about the partitioning solutions and summarizes a ranking method for them. Three experiments are conducted to evaluate the proposed methods in this paper. Experimental results show that the proposed methods can be applied in constructing decentralized service compositions effectively. In addition, the results also show that the decentralized compositions can have lower average response times and higher throughputs than the corresponding centralized compositions in the experiments. © 2019 John Wiley & Sons, Ltd.","31","Web services","Graph theory - Quality of service - Websites","Central control - Decentralized compositions - Graph transformation techniques - Interaction features - Partitioning techniques - Ranking methods - Service compositions - Web service composition","921.4 Combinatorial Mathematics, Includes Graph Theory, Set Theory","Number: 2015SE101, Acronym: -, Sponsor: -; ","This work is supported by the Open Foundation of Key Laboratory in Software Engineering of Yunnan Province under Grant 2015SE101.",,"Compendex","Compilation and indexing terms, Copyright 2019 Elsevier Inc.","Engineering Village"
