Title,Accession number,Author,Author affiliation,Corresponding author,Source,Abbreviated source title,Sponsor,Publisher,Volume,Issue,Pages,Issue date,Monograph title,Part number,Publication year,Language,ISSN,E-ISSN,ISBN13,DOI,Article number,Conference name,Conference date,Conference location,Conference code,CODEN,Document type,Abstract,Number of references,Main heading,Controlled/Subject terms,Uncontrolled terms,Classification code,Funding details,Funding text,Access type,Database,Copyright,Data Provider
"Influence of red loam particles, fertilizer concentration and irrigation method on clogging of different irrigation emitters","20184506039289","Yu, Yang (1); Xu, Wenqi (1); Song, Shiyu (1); Yang, Haolin (1); Zhang, Yijie (1) ","(1) College of Mechanical and Electrical Engineering, Yunnan Agricultural University, Kunming; 650201, China ","","Nongye Gongcheng Xuebao/Transactions of the Chinese Society of Agricultural Engineering","Nongye Gongcheng Xuebao","","Chinese Society of Agricultural Engineering","34","15","92-99","August 1, 2018","","","2018","Chinese","10026819","","","10.11975/j.issn.1002-6819.2018.15.012","","","","","","NGOXEO","Journal article (JA)","It is important to study the factor of clogging of emitter, which is the prerequisite for drip fertigation technology to be used and promoted in Yunnan red loam. In this paper, we chose three different irrigation emitter types (drip irrigation belt embedded with inner patch, 2-hole flow adjustable emitter and 8-hole flow adjustable emitter) as study subject under the water quality condition combined with three fertilization concentrations (0, 0.6 and 1.2 g/L) and three sediment particles size range were applied on root area infiltration irrigation and surface drip irrigation. The irrigation experiment of 5 min each time was conducted under working pressure of 20 kPa for three days. The difference in weight of the flowerpots before and after irrigation was the amount of water irrigated. After the experiment, the irrigation amount of emitters was recorded. If the relative flow rate of emitter was below 75%, the test stopped and then recorded effective irrigation times. The results showed that there was a very significant interaction between the soil particle size and emitter types, fertilizer concentration and emitter types, irrigation types and emitter types (P0.05). The bigger Yunnan red loam particle size, the easier clogging was made on flow adjustable emitter. Such as 2-hole flow adjustable emitter on surface drip irrigation,when the application rate of fertilizer was 0 g/L, the effective irrigation times of muddy water with three different particles size range were 11, 8 and 5, respectively. As for drip irrigation belt embedded with inner patch, Yunnan red loam particle size ranging 0.0385 - 0.074 mm was the easiest to cause clogging and the particle size ranging 0 - 0.0385 mm was the least to cause clogging. The fertilization has a significant influence on the clogging of the emitter. When the fertilizer concentration was less than 0.6 g/L, the large impact of fertilizer application on emitter was most obvious. When the fertilizer concentration was more than 0.6 g/L, the number of effective irrigation times did not have obvious change. However, the trend of the relative flow rate of the emitter increased, indicating that the blockage of the emitter increased. The irrigation type was an important factor affecting the clogging of emitter and it had different effects on different emitter. For 8-hole flow adjustable emitter, the anti-blocking performance of the surface drip irrigation was better than the root area infiltration irrigation. Under the surface drip irrigation, when the application rate of fertilizer was 0, the total effective irrigation times with three different particle sizes were four times more than root area infiltration irrigation. When the application rate of fertilizer was 1.2 g/L, the total effective irrigation times with 3 different particle sizes were 18 times and the root area infiltration irrigation were 15 times. For 2-hole flow adjustable emitter and drip irrigation belt embedded with inner patch, two different irrigation types did not have abviously different for effective irrigation times. Under the condition of fertilizing in muddy water, the performance of different emitter on clogging was different. The most clogged emitter was 8-hole flow adjustable emitter, followed by 2-hole flow adjustable emitter and the last was drip irrigation belt embedded with inner patch. This paper provides a theoretical basis for the application and familiarization of drip fertigation technology in Yunnan red loam. © 2018, Editorial Department of the Transactions of the Chinese Society of Agricultural Engineering. All right reserved.","30","Infiltration","Fertilizers - Irrigation - Particle size - Water quality","Blocking performance - Clogging - Different particle sizes - Emitters - Fertigations - Fertilizer applications - Sediment particles - Surface drip irrigations","445.2 Water Analysis - 804 Chemical Products Generally - 821.3 Agricultural Methods",,,,"Compendex","Compilation and indexing terms, Copyright 2019 Elsevier Inc.","Engineering Village"
"Synthesis and Characterization of the Guanidine Salt Based on 1,1,2,2-Tetranitraminoethane (TNAE)","20184305994049","Zhu, Chao (1, 2); Song, Panqi (1); Qiu, Lili (1); Liu, Yang (1); Xu, Zhibin (1); Meng, Zihui (1) ","(1) School of chemistry and Chemical Engineering, Beijing Institute of Technology, Beijing; 100081, China (2) School of Chemical Engineering, Yunnan Open University, Kunming; 650223, China ","Qiu, Lili(qiulili@bit.edu.cn) ","Propellants, Explosives, Pyrotechnics","Propellants Explos Pyrotech","","Wiley-VCH Verlag","43","12","1296-1301","December 2018","","","2018","English","07213115","15214087","","10.1002/prep.201800147","","","","","","PEPYD5","Journal article (JA)","A novel method has been successfully developed to synthesize the guanidine salt of 1,1,2,2-tetranitraminoethane (TNAE). By the use of IR, 1H and 13C NMR spectroscopy, the structure of the guanidine salt of TNAE was thoroughly characterized. In addition to the thermal stability investigated by TG-DSC, the kinetic parameters of this kind of material including activation energy and the pro-exponential factor were also calculated by Kissinger equation. The measurements of impact and friction sensitivity were carried out respectively. According to the theoretical performance calculations, the guanidine salt of TNAE exhibited the excellent detonation pressures and velocities. The solubility analysis for guanidine salt of TNAE by HPLC was performed at different temperatures, revealing the solubility increased with the increasing of temperature. And its solubility was proved to be the best in water among all the experimented solvents, ethyl acetate, dichloromethane and acetone followed up. With the great potential in practical application, the guanidine salt of TNAE is of significant value being employed as environmentally friendly gas generant, insensitive explosive and solid propellant. © 2018 Wiley-VCH Verlag GmbH & Co. KGaA, Weinheim","28","Activation energy","Acetone - Dichloromethane - Explosives - Nuclear magnetic resonance spectroscopy - Solid propellants - Solubility","1,1,2,2-tetranitraminoethane - 13C NMR spectroscopy - Apparent activation energy - Friction sensitivities - Insensitive explosives - Safety performance - Synthesis and characterizations - Theoretical performance",,"Number: NSAF U1730244, Acronym: -, Sponsor: -; ","The authors gratefully acknowledge the support of the National Natural Science Fund Project (NSAF U1730244).",,"Compendex","Compilation and indexing terms, Copyright 2019 Elsevier Inc.","Engineering Village"
"Comparative study of AZO and ITO thin film sputtered at different temperatures and their application in Cu2ZnSnS4 solar cells","20183705800747","Lu, Yilei (1); Wang, Shurong (1, 2); Yang, Min (1); Xu, Xin (1); Li, Qi (1) ","(1) Key Laboratory of Rural Energy Engineering in Yunnan Province, Yunnan Normal University, Juxian street no. 768, Kunming; 650500, China (2) Yunnan Key Lab of Opto-electronic Information Technology, Yunnan Normal University, Kunming; 650500, China ","Wang, Shurong(shrw88@aliyun.com) ","Journal of Materials Science: Materials in Electronics","J Mater Sci Mater Electron","","Springer New York LLC","29","20","17525-17532","October 1, 2018","","","2018","English","09574522","1573482X","","10.1007/s10854-018-9853-y","","","","","","","Journal article (JA)","Indium tin oxide (ITO) and Al-doped ZnO (AZO) are the most common materials for transparent conducting films used as a front contact layer on solar cells. In this study, AZO and ITO thin films were deposited by sputtering under different temperatures in order to study the difference between two kinds of thin films in crystal structure, morphology, optical and electrical properties. In the same time, CZTS solar cells were also fabricated using AZO or ITO thin films as the window layers, and the obtained highest efficiencies of 3.66% and 5.12% are based on AZO and ITO window layers with different sputtering temperatures, respectively. © 2018, Springer Science+Business Media, LLC, part of Springer Nature.","25","Thin films","Aluminum compounds - Conductive films - Copper compounds - Crystal structure - II-VI semiconductors - Oxide films - Solar cells - Tin oxides - Zinc oxide","Common materials - Comparative studies - Contact layers - Czts solar cells - Indium tin oxide - Optical and electrical properties - Sputtering temperature - Transparent conducting films",,"Number: 05300205020516009, Acronym: -, Sponsor: -; Number: 2011DFA62380, Acronym: -, Sponsor: -; Number: 61167003, Acronym: -, Sponsor: National Natural Science Foundation of China; ","Acknowledgements This work was supported by Collaborate Innovation Center of Research and Development of Renewable Energy in the Southwest Area (Grant No. 05300205020516009) and the National Natural Science Foundation of China (Grant No. 61167003), also by key project of National and International Scientific and Technological cooperation (Grant No. 2011DFA62380).",,"Compendex","Compilation and indexing terms, Copyright 2019 Elsevier Inc.","Engineering Village"
"Successful synthesis of interconnected Co0.85Se nanosheets with high pore volume and its electrochemical performance in supercapacitors","20184305976534","Chen, Xiaobo (1); Mao, Kechun (1); Yang, Chengxin (1); Ni, Jingjin (1); Zhuang, Guoce (1); Huang, Haitao (1); Wang, Xiaohua (1); Yang, Peizhi (2) ","(1) School of New Energy and Electronic Engineering, Yancheng Teachers University, Yancheng; 224051, China (2) Key Laboratory of Education Ministry for Advance Technique and Preparation of Renewable Energy Materials, Institute of Solar Energy, Yunnan Normal University, Kunming; 650500, China ","Chen, Xiaobo(chenxbok@126.com) ","Journal of Materials Science: Materials in Electronics","J Mater Sci Mater Electron","","Springer New York LLC","29","24","20564-20572","December 1, 2018","","","2018","English","09574522","1573482X","","10.1007/s10854-018-0191-x","","","","","","","Journal article (JA)","Interconnected Co0.85Se nanosheets have been prepared by a facile hydrothermal method via tuning reaction time to control the chemical constitution and the morphology. The nanosheets morphology of Co0.85Se offers sufficient electron transfer and short ion diffusion pathway, which can favor the fast transfer of electrolyte ions. The Co0.85Se electrode exhibits specific capacitance of 980 F g− 1 at 10 A g− 1 with high cycling life stability (8.3% loss after 5000 cycles) and good conductivity. The assembled Co0.85Se//AC asymmetric supercapacitor (ASC) device exhibits a high energy density of 46.2 Wh kg− 1 at a power density of 807.4 W kg− 1 and still maintained 29.3 Wh kg− 1 at a power density of 15981.8 W kg− 1 with excellent cycling performance (90.01% capacitance retention over 5000 cycles). The impressive results indicate that such unique interconnected Co0.85Se nanosheets are promising electrode materials for high-performance supercapacitors. © 2018, Springer Science+Business Media, LLC, part of Springer Nature.","46","Selenium compounds","Capacitance - Electrodes - Electrolytes - Nanosheets - Supercapacitor","Asymmetric supercapacitor - Capacitance retention - Chemical constitution - Cycling performance - Electrochemical performance - High energy densities - Hydrothermal methods - Specific capacitance",,"Number: 17KJB140029, Acronym: -, Sponsor: Natural Science Research of Jiangsu Higher Education Institutions of China; Number: 2017FA024, Acronym: -, Sponsor: Applied Basic Research Foundation of Yunnan Province; Number: 11747001, Acronym: -, Sponsor: National Natural Science Foundation of China; ","Acknowledgements This work was supported by the National Natural Science Foundation of China (Grant No. 11747001), The Natural Science Foundation of the Jiangsu Higher Education Institutions of China (Grant No. 17KJB140029) and the Key Applied Basic Research Program of Yunnan Province (Grant No. 2017FA024).",,"Compendex","Compilation and indexing terms, Copyright 2019 Elsevier Inc.","Engineering Village"
"Evaluation of oil-immersed bushing damp state based on frequency-domain dielectric spectroscopy","20190806518492","Zhou, Lijun (1); Liu, Weidi (1); Wang, Dongyang (1); Pan, Gang (1); Li, Huize (1); Xu, Xiaowei (2) ","(1) School of Electrical Engineering, Southwest Jiaotong University, Chengdu; 610031, China (2) Electric Power Research Institute, Yunnan Power Grid Co., Ltd., Kunming; 650217, China ","Zhou, Lijun(zhoulijun@swjtu.cn) ","Dianli Zidonghua Shebei/Electric Power Automation Equipment","Dianli Zidonghua Shebei Electr. Power Autom. Equip.","","Electric Power Automation Equipment Press","38","11","134-140","November 10, 2018","","","2018","Chinese","10066047","","","10.16081/j.issn.1006-6047.2018.11.020","","","","","","DZSHFK","Journal article (JA)","In order to quantitatively evaluate the damp state of oil-immersed bushing main insulation, the Cole-Cole double relaxation model considering DC conductivity is built. By testing 72.5 kV oil-immersed bushing model with 0.53%, 1.78%, 2.97%, 1.78% and 5.03% moisture contents prepared in the laboratory, the corresponding frequency-domain dielectric spectroscopy is obtained. The frequency-domain dielectric spectroscopy is fitted and parsed by the Cole-Cole double relaxation model, then the characteristic parameters representing the moisture content of oil-immersed bushing insulation are extracted and the assessment formula is fitted. Considering the influence of temperature on the field testing results, the oil-immersed bushing damp state assessment method suitable for the field is proposed. Results of case analysis verify the effectiveness of the proposed method. © 2018, Electric Power Automation Equipment Press. All right reserved.","24","Frequency domain analysis","Bushings - Dielectric spectroscopy - Insulation - Moisture - Moisture determination - Power transformers","Bushing insulation - Cole-Cole models - Dc conductivity - Field testing - Frequency domains - Quantitative assessments - Relaxation models - State assessment","413 Insulating Materials - 704.1 Electric Components - 706.2 Electric Power Lines and Equipment - 921.3 Mathematical Transformations - 942.2 Electric Variables Measurements - 944.2 Moisture Measurements","Number: 51877183, Acronym: -, Sponsor: National Natural Science Foundation of China; ","Project supported by the National Natural Science Foundation of China(51877183)",,"Compendex","Compilation and indexing terms, Copyright 2019 Elsevier Inc.","Engineering Village"
"The relationship between Pacific SSTA and Autumn Extreme Precipitation Events of China","20185206316281","Chen, Jin-Ming (1, 2); Gu, Shi-Xiang (1); Jiang, Ru-Cheng (1); Lu, Gui-Hua (2); Wu, Zhi-Yong (2); Du, Xuan-Xuan (1) ","(1) Yunnan Institute of Water and Hydorpower Engineering Investigation, Design and Research, Kunming; 650021, China (2) College of Hydrology and Water Resource, Hohai University, Nanjing; 210098, China ","","MATEC Web of Conferences","MATEC Web Conf.","","EDP Sciences","246","","","December 7, 2018","2018 International Symposium on Water System Operations, ISWSO 2018","1 of 1","2018","English","","2261236X","","10.1051/matecconf/201824602056","02056","1st International Symposium on Water System Operations, ISWSO 2018","October 16, 2018 - October 20, 2018","Beijing, China","143365","","Conference article (CA)","Based on 610 Meteorological stations daily precipitation datasets in China and NCEP/NCAR reanalysis datasets and NOAA reconstruct sea surface temperature from 1960~2009, the spatial and temporal coupling relationships between the Pacific SSTA and extreme precipitation events (EPE) are analyzed by using Singular Value of Decomposition method. Moreover, possible effect mechanism of Pacific SSTA for EPE is also discussed, the results are as follows: They are remarkable relations between equator middle-east Pacific ocean (EMEPO) SSTA and EPE. In anomaly cold years of EMEPO, compel 500hPa height field to show reverse PNA teleconnection pattern, intensity of west Pacific ocean subtropical high boost down. Meanwhile North Africa subtropical high become weeker compared with the mean. The trough over East Asia is abnormally weaker, and zonal circulation prevails over Asia, which is useful for the northward motion of southwestern water vapor. Meanwhile, the 500hPa geopotential height become weeker in New Siberian, leading to development and eastward motion of westerly trough. It is useful for the southward motion of stronger cold air, which is beneficial to the interaction between cold and warm air in Huang-Huai Basin, benefit the occurrence of EPE. However, wester China influenced by western vapor transportation, and vapor divergence in these areas, not benefit the occurrence of EPE. The opposite is true with positive SSTA in EMEPO. © The Authors, published by EDP Sciences, 2018.","25","Oceanography","Atmospheric temperature - Precipitation (meteorology) - Surface waters - Tropics - Waterworks","Daily precipitations - Decomposition methods - Extreme precipitation events - Geo-potential heights - Meteorological station - Sea surface temperature (SST) - Teleconnection patterns - Vapor transportation","443 Meteorology - 444.1 Surface Water - 446 Waterworks - 471.1 Oceanography, General","Number: 2015IC013, Acronym: -, Sponsor: Applied Basic Research Key Project of Yunnan; Number: 2017FA022, Acronym: -, Sponsor: Applied Basic Research Key Project of Yunnan; Number: 2017TD025, Acronym: -, Sponsor: -; ","The study is financially supported by the Key Program of Yunnan Applied Basic Research Projects (No. 2017FA022 ), the Academician Workstation Project (No. 2015IC013) and Scientific Research and Technical Innovation Team Construction of Yunnan Province (No. 2017TD025).","Open Access","Compendex","Compilation and indexing terms, Copyright 2019 Elsevier Inc.","Engineering Village"
"Visual Characteristics of Older Drivers in Road Intersections Situation Based on Driving Simulation","20185006236425","Guo, Feng-Xiang (1); Shi, Chen-Guang (1); Li, Ming-Yuan (1); Zhang, Sheng (1); Chen, Ping (1) ","(1) Faculty of Transportation Engineering, Kunming University of Science and Technology, Kunming; Yunnan; 650500, China ","","Zhongguo Gonglu Xuebao/China Journal of Highway and Transport","Zongguo Gonglu Xuebao","","Xi'an Highway University","31","9","150-158 and 219","September 1, 2018","","","2018","Chinese","10017372","","","","","","","","","ZGXUFN","Journal article (JA)","Drivers obtain traffic information mainly through visual search behavior, in order to analyze the visual characteristics of the older drivers in road intersections, five intersections virtual scene was established, driving simulation experiments were carried, the eye movement data of 21 older drivers and 17 middle-aged and young drivers were collected. Using the dynamic clustering method, drivers' gaze areas divided into five. On this basis, the gaze characteristics, scanning characteristics, gaze transition probability and stable distribution probability were analyzed, when drivers enter the intersections. Based on the gray relation matrix, the visual factors that affect the gaze transition were analyzed. The results show that older drivers are relatively poor in the gaze area of non-running directions, there is a big difference in the duration of the gaze, the saccade size and speed between the two groups of drivers, the saccade size and speed of older drivers is lower than middle-aged and young drivers obviously. The visual stable distribution have significant difference that older drivers' gaze points are distributed in the front of the vehicle is 80.7%,and 11.4% higher than that of the middle-aged and young drivers. It shows that the flexibility of gaze shift model of older drivers is lower than that in middle-aged and young drivers. © 2018, Editorial Department of China Journal of Highway and Transport. All right reserved.","25","Traffic control","Eye movements - Highway engineering - Probability distributions - Roads and streets","Driving simulation - Gaze characteristic - Older drivers - Traffic Engineering - Visual characteristic","406.2 Roads and Streets - 922.1 Probability Theory",,,,"Compendex","Compilation and indexing terms, Copyright 2019 Elsevier Inc.","Engineering Village"
"Dispersive liquid-liquid microextraction followed by magnetic solid-phase extraction for determination of four parabens in beverage samples by ultra-performance liquid chromatography tandem mass spectrometry","20174204282740","Yin, Qinhong (1, 2, 3); Zhu, Yanqin (1, 2, 4); Yang, Yaling (1) ","(1) Faculty of Life Science and Technology, Kunming University of Science and Technology, Kunming; Yunnan; 650500, China (2) Faculty of Environmental Science and Engineering, Kunming University of Science and Technology, Kunming; Yunnan; 650500, China (3) Kunming Jida Pharmaceutical Co., Ltd., Kunming; Yunnan; 650106, China (4) Research Center for Analysis and Measurement, Kunming University of Science and Technology, Kunming; 650093, China ","Yang, Yaling(ygs2013@yeah.net) ","Food Analytical Methods","Food Anal. Methods.","","Springer New York LLC","11","3","797-807","March 2018","","","2018","English","19369751","1936976X","","10.1007/s12161-017-1051-7","","","","","","","Journal article (JA)","In this study, a two-step extraction technique was developed for extraction and preconcentration of parabens from beverage samples using ionic liquid dispersive liquid- liquid microextraction (IL-DLLME) and magnetic solidphase extraction (MSPE). In this IL-DLLME followed by MSPE method, ionic liquid (IL, 1-octyl-3- methylimidazolium hexafluorophosphate) formed hydrophobic microdroplets in beverage samples as an extractant of parabens; after the IL-DLLME process was completed, graphene modified Fe3O4nanoparticles (Fe3O4@G) were placed to adsorb and isolate IL from the sample solution. After the supernatant was carefully moved, acetonitrile was added to elute the IL containing parabens from Fe3O4@G. The experimental variables affecting the extraction procedure have been systematically studied. Under optimal conditions, the detection limits were less than 1.53 ng/mL and the linear detection ranges were 2-500 ng/mL (R2≥ 0.998) for these analytes. The recoveries for spiked samples were 58.8-89.2% and satisfactory precision (RSD ≤ 4.8%) were obtained. © Springer Science+Business Media, LLC 2017.","32","Liquid chromatography","Beverages - Drug products - Ionic liquids - Iron oxides - Magnetism - Magnetite - Mass spectrometry - Parabens - Phase separation - Solvent extraction","Beverage samples - Dispersive liquid-liquid microextraction - Extraction procedure - Linear detection ranges - Magnetic solid-phase extractions - Magnetic solidphase extraction (MSPE) - Ultra performance liquid chromatography - UPLC-MS/MS","701.2 Magnetism: Basic Concepts and Phenomena - 801 Chemistry - 802.3 Chemical Operations - 804 Chemical Products Generally - 804.2 Inorganic Compounds - 822.3 Food Products","Number: 2016P2013118006, Acronym: -, Sponsor: Analysis and Testing Foundation of Kunming University of Science and Technology; Number: -, Acronym: -, Sponsor: Analysis and Testing Foundation of Kunming University of Science and Technology; Number: 2016P2013118006, Acronym: -, Sponsor: Analysis and Testing Foundation of Kunming University of Science and Technology; ","Acknowledgments This research was supported by the Analysis and Testing Foundation of Kunming University of Science and Technology and funded by the Analysis Test Foundation of Kunming University of Science and Technology (no. 2016P2013118006).",,"Compendex","Compilation and indexing terms, Copyright 2019 Elsevier Inc.","Engineering Village"
