Title,Accession number,Title of translation,Author,Author affiliation,Corresponding author,Source,Abbreviated source title,Sponsor,Publisher,Volume,Issue,Pages,Issue date,Monograph title,Part number,Publication year,Language,ISSN,E-ISSN,ISBN13,DOI,Article number,Conference name,Conference date,Conference location,Conference code,CODEN,Document type,Abstract,Number of references,Main heading,Controlled/Subject terms,Uncontrolled terms,Classification code,Funding details,Funding text,Access type,Database,Copyright,Data Provider
"The influence of 2D nanomaterials on electron transfer across molecular thin films","20191506770321","","Kong, Na (1); Zhang, Shuang (1, 2); Liu, Jing (1); Wang, Jianmei (1); Liu, Zhen (1); Wang, Hongbin (2); Liu, Jingquan (3); Yang, Wenrong (1) ","(1) School of Life and Environment Science, Deakin University, Geelong; VIC; 3216, Australia (2) Key Laboratory of Resource Clean Conversion in Ethnic Regions, Education Department of Yunnan, Yunnan Minzu University, Kunming; 650500, China (3) College of Materials Science and Engineering, Institute for Graphene Applied Technology Innovation, Qingdao University, Qingdao; 266071, China ","Yang, Wenrong(wenrong.yang@deakin.edu.au) ","Molecular Systems Design and Engineering","Mol. Syst. Des. Eng.","","Royal Society of Chemistry","4","2","431-436","April 2019","","","2019","English","","20589689","","10.1039/c9me00008a","","","","","","","Journal article (JA)","Here we report the design and formation of electron transfer pathways across self-assembled monolayers (SAMs) after attachment of BN-NH2 and MoS2 nanosheets through hydrophobic interaction. The gold electrodes were firstly passivated with methyl group terminated alkanethiols with different carbon chain lengths (n = 4, 6, 8 and 11), followed by the attachment of 2D nanomaterials including boron nitride and MoS2 nanosheets via hydrophobic interaction. We identified the significant influence of 2D nanomaterials on electron transfer across SAM-modified gold electrodes. © 2019 The Royal Society of Chemistry.","34","Hydrophobicity","Electrodes - Electron transitions - Gold - III-V semiconductors - Layered semiconductors - Molybdenum compounds - Nanosheets - Nanostructured materials","Alkanethiols - Carbon-chain length - Electron transfer - Electron transfer pathways - Gold electrodes - Hydrophobic interactions - Methyl group - Molecular thin film","547.1 Precious Metals - 761 Nanotechnology - 931.2 Physical Properties of Gases, Liquids and Solids - 933 Solid State Physics","Number: DP130101714, Acronym: ARC, Sponsor: Australian Research Council; ","The authors acknowledge the Australian Research Council (DP130101714) and Deakin University for the financial support of this work. We also acknowledge Dr. Si Qin (Institute for Frontier Materials of Deakin University) for preparing the 2D nanomaterials.",,"Compendex","Compilation and indexing terms, Copyright 2019 Elsevier Inc.","Engineering Village"
"Phase transformation mechanism in activation of high-alumina fly ash with Na2CO3","20191306683203","","Zhou, Baocheng (1, 2, 3); Zhou, Junwen (1, 2, 3); Hu, Tu (1, 2, 3); Yang, Li (1, 2, 3); Lin, Guo (1, 2, 3); Zhang, Libo (1, 2, 3) ","(1) Yunnan Provincial Key Laboratory of Intensification Metallurgy, Kunming University of Science and Technology, Kunming, Yunnan; 650093, China (2) State Key Laboratory of Complex Nonferrous Metal Resources Clean Utilization, Kunming University of Science and Technology, Kunming, Yunnan; 650093, China (3) Faculty of Metallurgical and Energy Engineering, Kunming University of Science and Technology, Kunming, Yunnan; 650093, China ","Hu, Tu(hutu1219@126.com) ","Materials Research Express","Mater. Res. Express","","Institute of Physics Publishing","6","1","","January 2019","","","2019","English","","20531591","","10.1088/2053-1591/aae3a8","015502","","","","","","Journal article (JA)","In this study, the phase transformation mechanism of a high-alumina fly ash (HAFA)-Na2CO3 mixture was investigated by temperature- and time-programmed heating in a muffle furnace. The temperature range was 600 °C-1000 °C, and the time interval was 20-120 min. The mass loss behaviour of the HAFA-Na2CO3 mixture was investigated by a thermogravimetric analysis method using argon at a heating rate of 10 °C min-1. It was found that HAFA without any added flux showed no loss or gain of any element or material under the experimental conditions. The results also showed that HAFA hardly contained any volatile water, carbon, sulphur, or other components. The decomposition of Na2CO3 occurred at 844 °C, and the HAFA-Na2CO3 mixture began to react at 600 °C, indicating that the reaction of HAFA with Na2CO3 started before the decomposition of Na2CO3. The phase transformation of the HAFA-Na2CO3 mixture at different temperatures for 60 min or at 900 °C for different times was investigated by x-ray diffraction. Each reaction required different temperature conditions, and at a specific temperature, the length of the heating time affected the progress of the reaction. © 2018 IOP Publishing Ltd.","19","Sodium compounds","Activated alumina - Aluminum oxide - Chemical activation - Fly ash - Mixtures - Phase transitions - Sodium Carbonate - Thermogravimetric analysis","Experimental conditions - Heating time - High-alumina fly ash - Muffle furnaces - Phase transformation mechanisms - Temperature conditions - Temperature range - Time interval","801 Chemistry - 801.4 Physical Chemistry - 803 Chemical Agents and Basic Industrial Chemicals - 804 Chemical Products Generally","Number: 2017YFB0603101, Acronym: -, Sponsor: National Key Clinical Specialty Discipline Construction Program of China; Number: 51764034, Acronym: -, Sponsor: National Natural Science Foundation of China; ","The authors are grateful for the financial support provided by the National Key R&D Program of China (No. 2017YFB0603101), the National Natural Science Foundation of China (No. 51764034) and the National Natural Science Foundation of China (No. 51504113).",,"Compendex","Compilation and indexing terms, Copyright 2019 Elsevier Inc.","Engineering Village"
"Integrated production of aromatic amines, aromatic hydrocarbon and N-heterocyclic bio-char from catalytic pyrolysis of biomass impregnated with ammonia sources over Zn/HZSM-5 catalyst","20191606800082","","Zheng, Yunwu (1, 2); Wang, Zhen (1); Liu, Can (1); Tao, Lei (2); Huang, Yuanbo (1); Zheng, Zhifeng (1) ","(1) University Key Laboratory for Biomass Chemical Refinery & Synthesis, Engineering Laboratory for Highly-Efficient Utilization of Biomass, College of Materials Science and Engineering, Southwest Forestry University, Kunming; Yunnan Province; 650224, China (2) Key Laboratory of Bio-based Material Science & Technology, Ministry of Education, College of Materials Science and Engineering, Northeast Forestry University, Harbin; 150040, China ","Zheng, Yunwu(zyw85114@163.com) ","Journal of the Energy Institute","J. Energy Inst.","","Elsevier B.V.","","","","2019","","","2019","English","17439671","17460220","","10.1016/j.joei.2019.03.007","","","","","","","Article in Press","By introducing exogenous nitrogen during biomass pyrolysis under nitrogen-rich conditions, high-value nitrogen-containing products, i.e., nitrogen-rich char and oil may be produced. Based on the cogeneration of high-value nitrogen products from biomass, biomass nitrogen-enriched pyrolysis was performed in a fixed bed with different sources and contents of ammonia. The yields, composition and characteristics of the products were investigated. Moreover, the formation mechanism of N-containing species was explored in depth for the pyrolysis and catalytic pyrolysis with HZSM-5 and Zn/HZSM-5 catalysts via elemental analysis, XPS, FTIR and BET. The results showed that ammonia impregnation could promote a Maillard reaction, reduce the content of small aldehydes and ketones, and produce a nitrogen-enriched bio-oil. The contents of N-containing species and phenolic substances in the pyrolysis oil of biomass impregnated with 10% urea reached 15.66% and 56.69%, respectively. Moreover, the nitrogen on the coke surface after pretreatment was mainly composed of C[dbnd]N, C[sbnd]N and N[sbnd]COO functional groups. The bio-char generated abundant pyridinic-N, pyrrolic-N, quaternary-N, and pyridone-N oxides. The presence of urea introduced many alkaline N-containing functional groups on the surface of the bio-char and promoted the transformation of nitrogen from amides and imides to heterocyclic nitrogen with higher thermal stability. Furthermore, Zn was an excellent catalyst for the Maillard reaction, and the Zn/HZSM-5 catalyst had a higher selectivity for aromatic hydrocarbons (96.98% for biomass and 86.48% for urea/biomass) and N-containing heterocyclic compounds, such as indoles (6.16% for biomass and 13.51% for urea/biomass). Additionally, the coke content decreased, and the catalyst deactivation decreased. © 2019 Energy Institute","59","Aromatic hydrocarbons","Amides - Amines - Ammonia - Aromatization - Biomass - Catalyst deactivation - Catalyst selectivity - Coke - Glycosylation - Impregnation - Ketones - Metabolism - Mineral oils - Pyrolysis - Urea","Ammonia source - Bio chars - Catalytic pyrolysis - Catalytic pyrolysis of biomass - Formation mechanism - Heterocyclic compound - Heterocyclic nitrogen - Integrated production","461.9 Biology - 513.3 Petroleum Products - 524 Solid Fuels - 802.2 Chemical Reactions - 803 Chemical Agents and Basic Industrial Chemicals - 804 Chemical Products Generally","Number: 2018JS325, Acronym: -, Sponsor: Yunnan Provincial Department of Education; Number: 2018FB071, Acronym: -, Sponsor: Applied Basic Research Foundation of Yunnan Province; Number: 2018ZG004, Acronym: -, Sponsor: Science and Technology Planning Project of Guangdong Province; Number: 31670599, Acronym: -, Sponsor: National Natural Science Foundation of China; ","This work was partially supported by the Yunnan Provincial Department of Education Project Foundation (Award No. 2018JS325 ); the Applied Basic Research Programs of Science and Technology Department of Yunnan Province (Award No. 2018FB071 ); National Natural Science Foundation of China (Award No.: 31670599 ) and the science and technology planning project of Yunnan Province (Award No. 2018ZG004 ). Appendix A",,"Compendex","Compilation and indexing terms, Copyright 2019 Elsevier Inc.","Engineering Village"
"Re-caching behaviour of rodents improves seed dispersal effectiveness: Evidence from seedling establishment","20191806859094","","Wang, Zhenyu (1, 2, 3); Wang, Bo (1); Yi, Xianfeng (2); Yan, Chuan (3); Zhang, Zhibin (3); Cao, Lin (1, 3, 4) ","(1) Center for Integrative Conservation, Xishuangbanna Tropical Botanical Garden, Chinese Academy of Sciences, Mengla; Yunnan; 666303, China (2) College of Life Sciences, Jiangxi Normal University, Nanchang; 330022, China (3) State Key Laboratory of Integrated Management of Pest Insects and Rodents in Agriculture, Institute of Zoology, Chinese Academy of Sciences (CAS), Beijing; 100101, China (4) Institute of Ecology and Geobotany, School of Ecology and Environmental Science, Yunnan University, Kunming; 650091, China ","Cao, Lin(caolin@xtbg.org.cn) ","Forest Ecology and Management","For. Ecol. Manage.","","Elsevier B.V.","444","","207-213","15 July 2019","","","2019","English","03781127","","","10.1016/j.foreco.2019.04.044","","","","","","FECMDW","Journal article (JA)","Long-distance seed dispersal is disproportionately important for recruitment, range expansion and gene flow in plant populations. The re-caching of seeds by rodents is considered a mechanism of long-distance seed dispersal. The effect of re-caching on dispersal distance is well studied. However, how re-caching by rodents affects seedling establishment remains unclear. To assess the role of re-caching by rodents on seedling establishment, we tracked a large number of seeds and investigated the seed dispersal and seedling establishment of two large-seeded tree species (Scleropyrum wallichianum and Garcinia xanthochymus) in a tropical forest. We found that rodents scatter hoarded 48.9–71.3% of the released seeds, and a total of 23.8–36.6% of the initial caches of both species experienced re-caching up to 2 or 3 times. Re-caching was correlated with farther dispersal and a higher probability of seedling establishment for both species. In addition, re-caching contributed to medium and long-distance seed dispersal, with 17.2% and 18.5% of seedlings located >50 m from parent trees for G. xanthochymus and S. wallichianum, respectively, and 3.4% of seedlings of G. xanthochymus located >100 m from parent trees. Our results suggested that re-caching by rodents can promote seed dispersal effectiveness and contribute to effective long-distance seed dispersal. © 2019 Elsevier B.V.","41","Seed","Forestry - Mammals - Plant expansion","Long distance seed dispersals - Long-distance dispersals - Plant population - Range expansion - Rodents - Seed dispersal - Seedling establishment - Tropical forest","821.4 Agricultural Products","Number: 31770570, Acronym: NSFC, Sponsor: National Natural Science Foundation of China; Number: 31872236, Acronym: NSFC, Sponsor: National Natural Science Foundation of China; ","We are grateful to the Xishuangbanna Station of Tropical Rainforest Ecosystem Studies for field work support. We are also grateful to Dr. Zhishu Xiao for valuable suggestions regarding the experimental design. Lastly, we thank Liangyi Li, Congyou Luo and Jinfa Dao for additional help with the field work. This work was supported by grants from the National Natural Science Foundation China (grant nos. 31872236 and 31770570) and the CAS "Light of West China" Program.",,"Compendex","Compilation and indexing terms, Copyright 2019 Elsevier Inc.","Engineering Village"
"Experimental research on two-dimensional acoustic emission source locating without knowing the velocity profile","20192106960659","","Wu, Shunchuan (1, 2); Zhang, Guang (1); Zhang, Shihuai (1); Guo, Pei (1); Chu, Chaoqun (1) ","(1) Key Laboratory of Ministry of Education for Efficient Mining and Safety of Metal Mine, University of Science and Technology Beijing, Beijing; 100083, China (2) Faculty of Land Resources Engineering, Kunming University of Science and Technology, Kunming; Yunnan; 650093, China ","Zhang, Guang(zhangguang09@163.com) ","Yanshilixue Yu Gongcheng Xuebao/Chinese Journal of Rock Mechanics and Engineering","Yanshilixue Yu Gongcheng Xuebao","","Academia Sinica","38","1","28-39","January 1, 2019","","","2019","Chinese","10006915","","","10.13722/j.cnki.jrme.2018.0575","","","","","","YLGXF5","Journal article (JA)","Aiming at the problem of source locating in rock engineering, the two-dimensional acoustic emission source locating algorithm without knowing the velocity profile by T. Kundu was modified. The shape of sensor cluster was extended from isosceles right triangle to arbitrary triangle for the generalization of the sensor layout. The modified locating algorithm was verified by a series of tests on a granite plate with three typical sensor layouts (isosceles right triangle, common right triangle and equilateral triangle). The results indicate that time delay of similar waveform between the adjacent sensors can be obtained accurately by means of cross-correlation technique. The located sources are close to the actual source. For each synthetic source, the mean square deviation of six repeated tests is very small. The better points ratios of 3 typical sensor layouts are 82.6%, 84.0% and 71.0% respectively, which verified the applicability and accuracy of the source locating algorithm in the discontinuous materials like rock. © 2019, Science Press. All right reserved.","23","Location","Acoustic emissions - Granite - Rock mechanics","Acoustic emission sources - Cross correlation techniques - Cross correlations - Equilateral triangles - Experimental research - Locating accuracy - Mean square deviation - Two-dimensional source","483.1 Soils and Soil Mechanics - 751.2 Acoustic Properties of Materials","Number: 51774020, Acronym: NSFC, Sponsor: National Natural Science Foundation of China; ","Supported by the National Natural Science Foundation of China(Grant No. 51774020).",,"Compendex","Compilation and indexing terms, Copyright 2019 Elsevier Inc.","Engineering Village"
"Reliability analysis of a rock slope based on plastic limit analysis theory with multiple failure modes","20190806539520","","Li, Ze (1); Hu, Zheng (1); Zhang, Xiaoyan (1); Du, Shigui (2); Guo, Yakun (3); Wang, Junxing (4) ","(1) Faculty of Civil Engineering and Mechanics, Kunming University of Science and Technology, Kunming; Yunnan; 650500, China (2) Key Laboratory of Rock Mechanics and Geohazards of Zhejiang Province, Shaoxing; Zhejiang; 312000, China (3) Faculty of Engineering and Informatics, University of Bradford, Bradford; BD7 1DP, United Kingdom (4) School of Water Resources and Hydropower Engineering, Wuhan University, Wuhan; Hubei; 430072, China ","Zhang, Xiaoyan(zhangxiaoyan@kmust.edu.cn) ","Computers and Geotechnics","Comput. Geotech.","","Elsevier Ltd","110","","132-147","June 2019","","","2019","English","0266352X","18737633","","10.1016/j.compgeo.2019.02.021","","","","","","CGEOEU","Journal article (JA)","Due to the randomness and variability of parameters, reliability analysis of rock slopes generally contains multiple failure modes. This reliability problem cannot be effectively treated by traditional methods, such as limit equilibrium method (LEM) and finite element method (FEM). A numerical method for performing reliability analysis of rock slope is proposed by combining the plastic limit analysis theory, rigid finite element discretization, mathematical programming theory and Monte Carlo method. The rock slope is discretized into rock blocks and interfaces using rigid finite elements to establish static admissible stress fields and kinematically admissible velocity fields for the rock slope. Additionally, stochastic programming models for performing reliability analysis of rock slopes are established according to the lower and upper bound theorems by setting the shear strength parameters of the interfaces to random variables. A numerical solution strategy is then proposed for stochastic programming models based on the Monte Carlo method at the same time. Finally, an estimation method for the failure probability of element is proposed based on the velocity fields. The proposed method is validated, and it has high precision and efficiency. © 2019 Elsevier Ltd","36","Reliability analysis","Failure (mechanical) - Finite element method - Mathematical programming - Monte Carlo methods - Numerical methods - Reliability - Reliability theory - Rocks - Shear strength - Stochastic models - Stochastic programming - Stochastic systems - Velocity","Failure Probability - Finite-element discretization - Kinematically admissible velocity fields - Limit equilibrium methods - Numerical solution strategies - Plastic limit analysis - Rock slope - Stochastic programming model","921.6 Numerical Methods - 922.1 Probability Theory - 922.2 Mathematical Statistics - 961 Systems Science","Number: 41427802, Acronym: NSFC, Sponsor: National Natural Science Foundation of China; Number: 51564026, Acronym: NSFC, Sponsor: National Natural Science Foundation of China; ","This work is supported by the National Natural Science Foundation of China (grant No. 51564026, 41427802) and the Key Laboratory of Rock Mechanics and Geohazards of Zhejiang Province (grant No. ZJRM-2018-Z-02). Comments made by Reviewers have greatly improved the quality of the paper.",,"Compendex","Compilation and indexing terms, Copyright 2019 Elsevier Inc.","Engineering Village"
"Cyclopenta[: Hi] aceanthrylene-based dopant-free hole-transport material for organic-inorganic hybrid and all-inorganic perovskite solar cells","20191106618726","","Zhang, Dongyang (1); Xu, Peng (1); Wu, Tai (1); Ou, Yangmei (1); Yang, Xiutao (1); Sun, Anxin (1); Cui, Bo (1); Sun, Hanwen (1); Hua, Yong (1) ","(1) Yunnan Key Laboratory for Micro/Nano Materials and Technology, School of Materials Science and Engineering, Yunnan University, Kunming, Yunnan; 650091, China ","Hua, Yong ","Journal of Materials Chemistry A","J. Mater. Chem. A","","Royal Society of Chemistry","7","10","5221-5226","2019","","","2019","English","20507488","20507496","","10.1039/c8ta12139g","","","","","","JMCAET","Journal article (JA)","Hole-transport materials (HTMs) play an important role in the most highly performing perovskite solar cells (PSCs). In this work, for the first time, an efficient cyclopenta[hi]aceanthrylene-based dopant-free D-A-D type hole transport material (HTM) YN3 is developed for application in organic-inorganic hybrid and all-inorganic perovskite solar cells (PSCs) with high performance. The (FAPbI3)0.85(MAPbBr3)0.15 and CsPbI2Br PSCs devices based on YN3 as a dopant-free HTM render very impressive PCEs of 18.84% and 12.05%, respectively. The obtained PCE values of YN3-based PSCs outperform most dopant-free HTMs based on small organic molecules reported so far. More encouragingly, the YN3-based PSCs without encapsulation display good long-term stability. © 2019 The Royal Society of Chemistry.","56","organic-inorganic materials","Bromine compounds - Hole mobility - Lead compounds - Perovskite - Perovskite solar cells - Solar cells","D types - Dopant-free - Hole transport materials - Long term stability - Organic-inorganic hybrid - Small organic molecules","482.2 Minerals - 702.3 Solar Cells - 712.1 Semiconducting Materials","Number: KC1710160, Acronym: -, Sponsor: -; Number: KL180015, Acronym: -, Sponsor: -; ","This work was nancially supported by the High-Level Talents Foundation of Yunnan University (KL180015) and the Science and Engineering Foundation of Yunnan University (KC1710160).",,"Compendex","Compilation and indexing terms, Copyright 2019 Elsevier Inc.","Engineering Village"
"Frequency Safety Assessment of Power System Based on Multi-layer Extreme Learning Machine","20191106643583","","Wen, Yunfeng (1); Zhao, Rongzhen (2); Xiao, Youqiang (3); Liu, Zhenbin (4) ","(1) School of Electrical and Information Engineering, Hunan University, Changsha; 410000, China (2) School of Electrical Engineering, Chongqing University, Chongqing; 400044, China (3) Yunnan Power Grid Planning and Construction Research Center, Kunming; 650011, China (4) China Construction Seventh Engineering Division Co. Ltd., Shenzhen; 518116, China ","Wen, Yunfeng(yunfeng.8681@163.com) ","Dianli Xitong Zidonghua/Automation of Electric Power Systems","Dianli Xitong Zidonghue","","Automation of Electric Power Systems Press","43","1","133-140","January 10, 2019","","","2019","Chinese","10001026","","","10.7500/AEPS20180629012","","","","","","DXZIE9","Journal article (JA)","The random, intermittent and weak inertia characteristics of renewable energy generation have led to a prominent problem in the frequency safety of high-rate renewable energy power systems. The use of time-domain simulation for frequency safety assessment has the disadvantages of large amount of calculation and long time. It is difficult to meet the rapid assessment requirement of frequency safety under the 'combined explosion' of multiple complex uncertainties. In order to realize online analysis and prediction of frequency safety, a method based on multi-layer extreme learning machine (ML-ELM) is applied. The non-linear mapping relationship between the input layer and the hidden layer is built by the deep structure theory and in the layer-wise unsupervised training, automatic encoder algorithms and regularization coefficients are introduced to optimize the weight matrix between the input layer and the hidden layer, so that the ML-ELM can effectively represent complex functions and improve predictive accuracy and generalization ability. Case studies of the IEEE RTS-79 system demonstrate the rapidity, high accuracy and well generalization ability of the proposed method. © 2019 Automation of Electric Power Systems Press.","24","Time domain analysis","Big data - Explosions - Knowledge acquisition - Learning systems - Renewable energy resources","Extreme learning machine - Generalization ability - Low inertia system - Prediction of frequency - Regularization coefficients - Renewable energy generation - Renewable energy power - Time-domain simulations","525.1 Energy Resources and Renewable Energy Issues - 723.2 Data Processing and Image Processing - 723.4 Artificial Intelligence - 921 Mathematics","Number: 51707017, Acronym: -, Sponsor: National Natural Science Foundation of China; ","This work is supported by National Natural Science Foundation of China (No. 51707017), Chongqing Research Program of Basic Research and Frontier Technology (No. cstc2017jcyjAX0422) and Fundamental Research Funds for the Central Universities.",,"Compendex","Compilation and indexing terms, Copyright 2019 Elsevier Inc.","Engineering Village"
