Title,Accession number,Author,Author affiliation,Corresponding author,Source,Abbreviated source title,Sponsor,Publisher,Volume,Issue,Pages,Issue date,Monograph title,Part number,Publication year,Language,ISSN,E-ISSN,ISBN13,DOI,Article number,Conference name,Conference date,Conference location,Conference code,CODEN,Document type,Abstract,Number of references,Main heading,Controlled/Subject terms,Uncontrolled terms,Classification code,Funding details,Funding text,Access type,Database,Copyright,Data Provider
"Achieving ultra-high efficiency by tuning hole transport and carrier balance in fluorescent blue organic light-emitting diode with extremely simple structure","20183605765790","Li, Wanshu (1); Zhang, Xiaowen (1); Zhang, Yan (1); Xu, Kai (1); Xu, Jiwen (1); Wang, Hua (1); Li, Haiou (2); Guo, Jie (3); Mo, Jinghui (3); Yang, Peizhi (3) ","(1) School of Materials Science and Engineering & Guangxi Key Laboratory of Information Materials, Guilin University of Electronic Technology, Guilin; 541004, China (2) Guangxi Key Laboratory of Precision Navigation Technology and Application, Guilin University of Electronic Technology, Guilin; 541004, China (3) School of Physics and Electronic Information, Key Laboratory of Renewable Energy Advanced Materials and Manufacturing Technology (Ministry of Education), Yunnan Normal University, Kunming; 650500, China ","Zhang, Xiaowen(zhang-xiaowen@163.com) ","Synthetic Metals","Synth Met","","Elsevier Ltd","245","","111-115","November 2018","","","2018","English","03796779","","","10.1016/j.synthmet.2018.08.016","","","","","","SYMEDZ","Journal article (JA)","Ultra-high efficiency in fluorescent blue organic light-emitting diode (OLED) with extremely simple structure is demonstrated by tuning hole transport and carrier balance. Using 2-methyl-9,10-bis(naphthalen-2-yl)anthracene doped with 3 wt% 1-4-di-[4-(N,N-diphenyl)amino]styryl-benzene ([MADN: 3 wt%DSA-Ph]) as hole transport and emissive layer, the OLED gives sky-blue emission with 1931 Commission Internationale d'Eclairage color coordinates of (0.159, 0.281), luminous efficiency of 14.7 cd/A, power efficiency of 13.0 lm/W and external quantum efficiency of 10.0%. The efficiencies have been enhanced by 54.7% (11.4%), 49.4% (11.1%) and 38.9% (5.3%), respectively, in comparison with the counterpart having hole transport layer of NPB (MADN). Current versus voltage characteristics and impedance spectroscopy analysis of hole only cells elucidate that [MADN: 3 wt%DSA-Ph] shows reduced hole mobility as a result of trapping or scattering effect of DSA-Ph. Efficient hole injection and appropriate hole transport favorably tune holes entering into the emissive layer and improve carrier balance. Extra-fluorescent emission generated by triplet-triplet annihilation and broad emission zone by integrating hole transport and emission as a single layer are also responsible for ultra-high device efficiency. © 2018 Elsevier B.V.","34","Hole mobility","Charge injection - Efficiency - Fluorescence - Organic light emitting diodes (OLED) - Quantum chemistry","Blue organic light emitting diodes - Commission Internationale d'Eclairage - External quantum efficiency - Fluorescent blue - Hole transports - Impedance spectroscopy - Triplet-triplet annihilation - Voltage characteristics","712.1 Semiconducting Materials - 714.2 Semiconductor Devices and Integrated Circuits - 741.1 Light/Optics - 801.4 Physical Chemistry - 913.1 Production Engineering","Number: 2016GXNSFAA380131, Acronym: -, Sponsor: Natural Science Foundation of Guangxi Province; Number: 2016GXNSFDA380021, Acronym: -, Sponsor: Natural Science Foundation of Guangxi Province; Number: 61474031, Acronym: NSFC, Sponsor: National Natural Science Foundation of China; Number: 61565003, Acronym: NSFC, Sponsor: National Natural Science Foundation of China; ","Authors acknowledge the financialsupport by the National Natural Science Foundation of China ( 61565003 , 61474031 ) and Guangxi Natural Science Foundation ( 2016GXNSFAA380131 , 2016GXNSFDA380021 ).",,"Compendex","Compilation and indexing terms, Copyright 2019 Elsevier Inc.","Engineering Village"
"Engineering nanoporous Ag/Pd core/shell interfaces with ultrathin Pt doping for efficient hydrogen evolution reaction over a wide pH range","20183105625214","Yang, C. (1, 3); Lei, H. (1); Zhou, W.Z. (2); Zeng, J.R. (1); Zhang, Q.B. (1, 2); Hua, Y.X. (1, 2); Xu, C.Y. (1, 2) ","(1) Key Laboratory of Ionic Liquids Metallurgy, Faculty of Metallurgical and Energy Engineering, Kunming University of Science and Technology, Kunming; 650093, China (2) State Key Laboratory of Complex Nonferrous Metal Resources Cleaning Utilization in Yunnan Province, Kunming; 650093, China (3) Shenzhen Geim Graphene Center (SGC), Tsinghua-Berkeley Shenzhen Institute (TBSI), Tsinghua University, Shenzhen; 518055, China ","Zhang, Q.B.(qibozhang@kmust.edu.cn) ","Journal of Materials Chemistry A","J. Mater. Chem. A","","Royal Society of Chemistry","6","29","14281-14290","2018","","","2018","English","20507488","20507496","","10.1039/c8ta04059a","","","","","","JMCAET","Journal article (JA)","The rational design and fabrication of highly efficient and durable all-pH catalysts for sustainable electrochemical hydrogen production are of critical importance to building renewable energy systems for the future. By employing an in situ electrochemical alloying/dealloying generated nanoporous Ag (NPA) as the supporting substrate, we propose a facile galvanic replacement reaction (GRR) synthesis route in a deep eutectic solvent (Ethaline), combined with an electrochemical activation process to fabricate monolithic 3D nanoporous Ag/Pd core/shell hybrids with ultrathin (sub 1 nm) amorphous Pt-rich skin (Pt-Pd@NPA), showing excellent hydrogen evolution reaction (HER) catalytic performance and durability over a wide pH range. The optimized Pt-Pd@NPA requires low overpotentials of -28.1, -34.8, and -23.8 mV to drive a catalytic current density of -10 mA cm-2 with small Tafel slopes of 31.2, 32.2, and 32.5 mV dec-1 in acidic (0.5 M H2SO4), neutral (1.0 M PBS), and alkaline (1.0 M KOH) media, respectively, which outperforms most previously reported noble-metal-based HER electrocatalysts. Impressively, this hybrid catalyst is capable of steadily delivering a fairly large current density of 1000 mA cm-2 in highly acidic media (0.5-7.0 M H2SO4), promising its practical use in advanced water-splitting devices. The superior HER performance is ascribed to the 3D interconnected nanoporous architectures and synergies between the Ag-Pd skeletons and active Pt. Theoretical calculations confirm that the electronic structure of the Ag-Pd hybrids is optimized by the incorporation of Pt, which results in optimal hydrogen adsorption free energy on the surface and leads to significantly enhanced HER activity and durability. Our work offers a new idea for the design and fabrication of advanced high-performance electrocatalysts for the HER over a wide range of pH values. © 2018 The Royal Society of Chemistry.","82","Platinum alloys","Alkalinity - Binary alloys - Durability - Electrocatalysts - Electronic structure - Free energy - Gas adsorption - Hydrogen production - Palladium alloys - pH - Platinum - Potassium hydroxide - Precious metals - Renewable energy resources - Silver alloys - Structural design - Substitution reactions","Catalytic performance - Deep eutectic solvents - Electrochemical activation - Galvanic replacement reactions - Hydrogen evolution reactions - Large current density - Renewable energy systems - Theoretical calculations","408.1 Structural Design, General - 522 Gas Fuels - 525.1 Energy Resources and Renewable Energy Issues - 547.1 Precious Metals - 641.1 Thermodynamics - 801.1 Chemistry, General - 802.2 Chemical Reactions - 802.3 Chemical Operations - 803 Chemical Agents and Basic Industrial Chemicals - 804.2 Inorganic Compounds","Number: 2017PY269SQ, Acronym: -, Sponsor: Candidate Talents Training Fund of Yunnan Province; Number: CNMRCUTS1601, Acronym: -, Sponsor: -; Number: 51464028, Acronym: NSFC, Sponsor: National Natural Science Foundation of China; Number: 51204080, Acronym: NSFC, Sponsor: National Natural Science Foundation of China; Number: 2014FB125, Acronym: -, Sponsor: Applied Basic Research Foundation of Yunnan Province; ","The authors gratefully acknowledge the nancial support of the National Natural Science Foundation of China (51464028 and 51204080), Candidate Talents Training Fund of Yunnan Province (2017PY269SQ), the Application Foundation Research of Yunnan Province (2014FB125), and the Independent Research Funds for the State Key Laboratory (CNMRCUTS1601).",,"Compendex","Compilation and indexing terms, Copyright 2019 Elsevier Inc.","Engineering Village"
"A detailed thermal performance analysis on the supercritical carbon dioxide gas heater under coupled heating condition","20185006238831","Li, Zhouhang (1, 2); Zhang, Yiqiang (2); Tang, Guoli (1); Wu, Yuxin (1); Yue, Guangxi (1) ","(1) Department of Energy and Power Engineering, Tsinghua University, Beijing; 100084, China (2) Faculty of Metallurgical and Energy Engineering, Kunming University of Science and Technology, Yunnan; 650093, China ","Li, Zhouhang ","ACRA 2018 - 9th Asian Conference on Refrigeration and Air-Conditioning","ACRA - Asian Conf. Refrig. Air-Cond.","et al.; Hitachi Appliances, Inc.; Honeywell Japan Inc.; Johnson Controls; Mitsubishi Electric Corporation; Mitsubishi Heavy Industries Thermal Systems, Ltd.","Asian Conference on Refrigeration and Air Conditioning (ACRA)","","","","2018","ACRA 2018 - 9th Asian Conference on Refrigeration and Air-Conditioning","1 of 1","2018","English","","","","","","9th Asian Conference on Refrigeration and Air-Conditioning, ACRA 2018","June 10, 2018 - June 13, 2018","Sapporo, Hokkaido, Japan","142070","","Conference article (CA)","Supercritical carbon dioxide (CO2) Rankine cycle is an emerging way to efficiently utilize low-grade waste heat. The gas heater, one of the key components of the cycle, is typically heated in a fluid-to-fluid coupled way during the cycle utilization. Performance of gas heater under this thermal boundary condition is still unclear since most existing studies on supercritical heating were conducted at uniform heat flux condition. In this work a modified shear-stress transport model, with the incorporation of a variable turbulent Prandtl formulation, was employed to study performance of supercritical CO2 gas heater under coupled heating. Effects of source fluid operating parameters and buoyancy forces were analyzed. Results show that a nearly uniform thermal field was achieved by increasing the mass flux of source fluid, while increasing the inlet temperature of source fluid was ineffective to that end. Under heavy influence of buoyancy local deterioration still occurred under coupled heating, though much weaker than that reported in cases at uniform heat flux. Finally, various Nusselt correlations were evaluated under coupled heating conditions. among which the Dang & Hihara Correlation showed the best performance. © ACRA 2018 - 9th Asian Conference on Refrigeration and Air-Conditioning. All rights reserved.","13","Supercritical fluid extraction","Air conditioning - Buoyancy - Carbon dioxide - Deterioration - Gas heating - Gases - Heat flux - Heat transfer - Rankine cycle - Refrigeration - Shear stress - Waste heat","Buoyancy effect - Gas heaters - Low-grade waste heat - Shear-stress transport - Supercritical carbon dioxides - Supercritical CO2 - Thermal boundary conditions - Thermal performance analysis","522 Gas Fuels - 525.4 Energy Losses (industrial and residential) - 641.1 Thermodynamics - 641.2 Heat Transfer - 643.3 Air Conditioning - 644.1 Refrigeration Methods - 802.3 Chemical Operations - 804.2 Inorganic Compounds - 931.2 Physical Properties of Gases, Liquids and Solids - 951 Materials Science",,,,"Compendex","Compilation and indexing terms, Copyright 2019 Elsevier Inc.","Engineering Village"
"Research of automatic monitoring and control strategy of photovoltaic power generation system","20185106251804","Liu, Yali (1) ","(1) Yuxi Normal University, Yuxi, Yunnan; 653100, China ","Liu, Yali(6s6br@vip.net.ru) ","Proceedings - 2018 International Conference on Virtual Reality and Intelligent Systems, ICVRIS 2018","Proc. - Int. Conf. Virtual Real. Intell. Syst., ICVRIS","Central South University of Forestry and Technology; Hunan Institute of Engineering; Spatial Information Technology Institute; The Cooperative Innovation Center of Wind Power Equipment and Energy Conversion","Institute of Electrical and Electronics Engineers Inc.","","","343-347","November 9, 2018","Proceedings - 2018 International Conference on Virtual Reality and Intelligent Systems, ICVRIS 2018","1 of 1","2018","English","","","9781538680315","10.1109/ICVRIS.2018.00090","8531417","2018 International Conference on Virtual Reality and Intelligent Systems, ICVRIS 2018","August 10, 2018 - August 11, 2018","Changsha, China","142450","","Conference article (CA)","This paper introduces the design and realization of automatic detection and control system in solar photovoltaic power. It adopts ZigBee technology to solve PV module monitoring and mainly studies its communication network. Through ZigBee network and based on multi-hop distribution network, the data acquisition node initially verifies networking scheme. Then, by modeling analysis of the inverter, this paper puts forward double-loop control strategy of grid-connected current. This control strategy ensures inverter output current is stable sine wave in high quality and provides important assurance for photovoltaic grid-connected power. Finally, it is proved that it is effective to eliminate power network voltage on interconnected system dynamic performance and also effective to reduce total harmonic distortion in grid-connected current, through simulation analysis. © 2018 IEEE.","8","Quality control","Data acquisition - Electric inverters - Electric network analysis - Electric power system control - Electric power transmission networks - Intelligent systems - Photovoltaic cells - Power control - Solar energy - Solar power generation - Virtual reality - Zigbee","Data acquisition nodes - Double-loop control strategy - Monitoring and control - Photovoltaic power generation - Photovoltaic power generation systems - Solar photovoltaic power - System dynamic performance - Total harmonic distortion (THD)","615.2 Solar Power - 657.1 Solar Energy and Phenomena - 703.1.1 Electric Network Analysis - 706.1 Electric Power Systems - 706.1.1 Electric Power Transmission - 722.3 Data Communication, Equipment and Techniques - 723 Computer Software, Data Handling and Applications - 731.2 Control System Applications - 731.3 Specific Variables Control - 913.3 Quality Assurance and Control",,,,"Compendex","Compilation and indexing terms, Copyright 2019 Elsevier Inc.","Engineering Village"
"Excellent thermal stability and thermoelectric properties of Pnma-phase SnSe in middle temperature aerobic environment","20184906201394","Tang, Yu (1); Li, Decong (1, 2); Chen, Zhong (1); Deng, Shuping (1); Sun, Luqi (1); Liu, Wenting (1); Shen, Lanxian (1); Deng, Shukang (1) ","(1) Educ. Ministry Key Laboratory of Renewable Energy Advanced Materials and Manufacturing Technology, Yunnan Normal University, Kunming; 650500, China (2) Photoelectric Engineering College, Yunnan Open University, Kunming; 650500, China ","Deng, Shukang(skdeng@126.com) ","Chinese Physics B","Chin. Phys.","","Institute of Physics Publishing","27","11","","2018","","","2018","English","16741056","20583834","","10.1088/1674-1056/27/11/118105","118105","","","","","","Journal article (JA)","SnSe is considered to be a promising thermoelectric material due to a high ZT value and abundant and non-toxic composition elements. However, the thermal stability is an important issue for commercial application. In particular, thermoelectric materials are in the high temperature for a long time due to the working condition. The present work investigates the thermal stability and oxidation resistance of single crystal SnSe thermoelectric materials. The scanning electron microscopy (SEM) and transmission electron microscopy (TEM) results show that the internal of SnSe crystal is not easily oxidized, while the x-ray photoelectron spectroscopy (XPS) results indicate that the surface of SnSe is slight oxidized to SnO2. Even if the surface is oxidized, the SnSe crystal still exhibits stable thermoelectric properties. Meanwhile, the crystallization quality of SnSe samples can be improved after the appropriate heat treatment in the air, which is in favor of the carrier mobility and can improve the electrical conduction properties of SnSe. Moreover, the decrease of defect density after heat treatment can further improve the Seebeck coefficient and electrical transport properties of SnSe. The density functional theory (DFT) calculation verifies the important role of defect on the electrical conductivity and electron configuration. In summary, appropriate temperature annealing is an effective way to improve the transmission properties of SnSe single crystal thermoelectric materials. © 2018 Chinese Physical Society and IOP Publishing Ltd.","54","Selenium compounds","Annealing - Density functional theory - Heat treatment - High resolution transmission electron microscopy - Layered semiconductors - Oxidation - Oxidation resistance - Scanning electron microscopy - Single crystals - Stability - Thermodynamic stability - Thermoelectric equipment - Thermoelectricity - Transmission electron microscopy - Transport properties - X ray photoelectron spectroscopy","Commercial applications - Electrical conduction properties - Electrical conductivity - Electrical transport properties - Electron configuration - SnSe - Thermo-Electric materials - Thermoelectric properties","537.1 Heat Treatment Processes - 615.4 Thermoelectric Energy - 641.1 Thermodynamics - 701.1 Electricity: Basic Concepts and Phenomena - 741.3 Optical Devices and Systems - 802.2 Chemical Reactions - 931 Classical Physics; Quantum Theory; Relativity - 933.1 Crystalline Solids","Number: 61864012, Acronym: NSFC, Sponsor: National Natural Science Foundation of China; ","∗Project supported by the National Natural Science Foundation of China (Grant No. 61864012). †Corresponding author. E-mail: skdeng@126.com",,"Compendex","Compilation and indexing terms, Copyright 2019 Elsevier Inc.","Engineering Village"
"Improving DC surface flashover property in SF6 by short time fluorination of model spacers","20182905557121","He, S. (1); Li, C.Y. (2); Lin, C.J. (2); He, J.L. (2) ","(1) Electric Power Research Institute, Yunnan Electric Power Grid Co. Ltd., Kunming, Yunnan; 650217, China (2) State Key Lab of Power Systems, Department of Electrical Engineering, Tsinghua University, Beijing, China ","","Proceedings of the IEEE International Conference on Properties and Applications of Dielectric Materials","Proc IEEE Int Conf Prop Appl Dielectr Mater","EPE; et al.; Hengtong Submarine; ISTCW; Original; ZTT","Institute of Electrical and Electronics Engineers Inc.","2018-May","","1110-1113","June 29, 2018","ICPADM 2018 - 12th International Conference on the Properties and Applications of Dielectric Materials","1 of 1","2018","English","","","9781538657881","10.1109/ICPADM.2018.8401240","","12th International Conference on the Properties and Applications of Dielectric Materials, ICPADM 2018","May 20, 2018 - May 24, 2018","Xi'an, China","137647","PPAMF7","Conference article (CA)","Surface charge accumulation of high voltage direct current (HVDC) spacers can influence the surface flashover voltage and affects the reliability of the insulation systems. The cone type model spacer was manufactured based on the industrial 550 kV spacer as the prototype. The model spacers were fluorinated and tested in case of AC, DC and polarity reversal test. Experimental results of model spacers, including regular spacers and fluorinated spacers are provided. The effect of surface charges on triggering the surface flashover was discussed. The results show that the surface flashover voltage increases for the fluorinated spacer under application of both AC and DC stresses. In addition, the surface breakdown voltage of fluorinated spacers increases up to 250 kV level, compared with that of the regular spacer whose surface breakdown voltage remains at only 230 kV level. © 2018 IEEE.","5","Dielectric materials","Electric breakdown - Flashover - HVDC power transmission","Ac and dc - Cone type - High voltage direct current - Insulation system - Polarity reversal - Surface breakdown - Surface charge accumulations - Surface flashover","701.1 Electricity: Basic Concepts and Phenomena - 706.1.1 Electric Power Transmission - 708.1 Dielectric Materials","Number: 2014CB239502, Acronym: -, Sponsor: -; Number: YNKJXM20160146, Acronym: CSPG, Sponsor: China Southern Power Grid; Number: 51377113, Acronym: NSFC, Sponsor: National Natural Science Foundation of China; ","This work was supported in part by the National Basic Research Program of China (973 Project) under grant 2014CB239502, and the National Natural Science Foundation of China (No. 51377113) and the China Southern Power Grid Co. Technology Project (YNKJXM20160146).",,"Compendex","Compilation and indexing terms, Copyright 2019 Elsevier Inc.","Engineering Village"
"Research Progress of Gas-sensing Material for BTEX Detection","20184806135442","Chen, Mingpeng (1); Zhang, Yumin (1); Zhang, Jin (1); Liu, Qingju (1) ","(1) Yunnan Key Laboratory for Micro/Nano Materials & Technology, School of Materials Science and Engineering, Yunnan University, Kunming; 650091, China ","Liu, Qingju(qjliu@ynu.edu.cn) ","Cailiao Daobao/Materials Review","Cailiao Daobao/Mater. Rev.","","Cailiao Daobaoshe/ Materials Review","32","7","2278-2287","July 10, 2018","","","2018","Chinese","1005023X","","","10.11896/j.issn.1005-023X.2018.13.019","","","","","","","Journal article (JA)","Metal oxide semiconductor sensor has attracted an increasing number of attention and applied to the detection of hazardous gases because of small size, low cost and convenient usage and so on. The sensing material is the core of the gas sensor. In this paper, research progress of oxide semiconductor BTEX gas sensors in recent years are reviewed. The microstructure, loading/doping modification, gas-sensing performance, gas-sensing mechanism and main problems of sensing material in recent years are analysed. Furthermore, the prospect of BTEX gas sensor is discussed. © 2018, Materials Review Magazine. All right reserved.","69","Gases","Chemical detection - Chemical sensors - Gas detectors - Gas sensing electrodes - Metallic compounds - Metals - Microstructure - MOS devices - Oxide semiconductors - Sensors","BTEX - Gas sensing - Gas sensing material - Gas sensing mechanism - Metal oxides - Metal-oxide semiconductor sensors - Modification - Sensing material","714.2 Semiconductor Devices and Integrated Circuits - 801 Chemistry - 914.1 Accidents and Accident Prevention - 951 Materials Science",,,,"Compendex","Compilation and indexing terms, Copyright 2019 Elsevier Inc.","Engineering Village"
