Title,Accession number,Author,Author affiliation,Corresponding author,Source,Abbreviated source title,Sponsor,Publisher,Volume,Issue,Pages,Issue date,Monograph title,Part number,Publication year,Language,ISSN,E-ISSN,ISBN13,DOI,Article number,Conference name,Conference date,Conference location,Conference code,CODEN,Document type,Abstract,Number of references,Main heading,Controlled/Subject terms,Uncontrolled terms,Classification code,Funding details,Funding text,Access type,Database,Copyright,Data Provider
"A two-dimensional Cd II coordination polymer based on naphthalenediimide: Synthesis, crystal structure and photochromic properties","20180304646608","Liu, Jian-Jun (1); Dong, Ying (1); Chen, Li-Zhen (1); Wang, Ling (1); Xia, Shu-Biao (1); Huang, Chang-Cang (2) ","(1) Center for Yunnan-Guizhou Plateau Chemical Functional Materials and Pollution Control, Qujing Normal University, Qujing; 655011, China (2) College of Chemistry, Fuzhou University, Fuzhou; 350108, China ","Liu, Jian-Jun(jianjun_liu@mail.qjnu.edu.cn) ","Acta Crystallographica Section C: Structural Chemistry","Acta crystallogr., C Struct. Chem.","","Wiley-Blackwell","74","","94-99","2018","","","2018","English","","20532296","","10.1107/S2053229617017958","","","","","","ACSCGG","Journal article (JA)","Naphthalenediimides, a class of organic dyes with an expanded π-electron-deficient plane, have attracted considerable interest because of their photoinduced electron transfer from neutral organic moieties to stable anionic radicals. This makes them excellent candidates for organic linkers in the construction of photochromic coordination polymers. Such a photochromic two-dimensional coordination polymer has been prepared using N,N′-bis(pyridin-4-ylmethyl)naphthalene-1,8:4,5-bis(dicarboximide) (DPMNI). In crystallization tubes, upon slow diffusion of an MeOH solution of cadmium perchlorate into a CHCl 3 solution of DPMNI, the complex poly[[bis[μ 2 -2,7-bis(pyridin-4-ylmethyl)benzo[imn][3,8]phenanthroline-1,3,6,8(2H,7H)-tetrone-κ 2 N:N′]bis(perchlorato-κO)cadmium(II)] chloroform tetrasolvate], {[Cd(C 26 H 16 N 4 O 4) 2 (ClO 4) 2 ]·4CHCl 3 } n, (I), was obtained. The asymmetric unit contains one Cd 2+ cation, two DPMNI ligands, two coordinated ClO 4 - anions and four CHCl 3 solvent molecules. Each Cd 2+ cation is interconnected by four DPMNI linkers to generate a neutral two-dimensional naphthalenediimide coordination network with all the ClO 4 - anions above or below this plane. Strong interlaminar anion-π interactions between the coordinated ClO 4 - anions and the imide rings of an adjacent layer lead to a three-dimensional supramolecular structure. Compound (I) exhibits reversible photochromic behaviour and photocontrolled tunable luminescence properties, which may originate from the photoinduced electron-transfer generation of radicals in the DPMNI ligand. © International Union of Crystallography 2018.","49","Cadmium compounds","Chlorine compounds - Crystal structure - Electron transitions - Free radical reactions - Inorganic compounds - Ligands - Luminescence - Naphthalene - Negative ions - Organic polymers - Photochromism - Positive ions","Coordination networks - Coordination Polymers - naphthalenediimide - Photo-induced electron transfer - Photochromic behaviour - Photochromic properties - Supramolecular structure - Tunable luminescences","741.1 Light/Optics - 801.4 Physical Chemistry - 802.2 Chemical Reactions - 804.1 Organic Compounds - 804.2 Inorganic Compounds - 815.1.1 Organic Polymers - 933.1.1 Crystal Lattice","Number: 51764048, Acronym: NSFC, Sponsor: National Natural Science Foundation of China; ","For this research was provided by: National Natural Science Foundation of China (award No. 51764048); Application Basis Research Project of Yunnan Province Science and Technology Department (award No. 2017FD144).",,"Compendex","Compilation and indexing terms, Copyright 2019 Elsevier Inc.","Engineering Village"
"Lignin-based grinding wheels with aluminum oxide: Synthesis and characterization","20180604756524","Liang, Jiankun (1, 2); Zhang, Jun (2); Du, Guanben (1, 2); Feng, Shang (2); Xi, Xuedong (2); Lei, Hong (2) ","(1) College of Wood Science and Technology, Beijing Forestry University, Beijing; 100089, China (2) Yunnan Key Laboratory of Wood Adhesives and Glued products, Southwest Forestry University, Kunming; 650224, China ","Du, Guanben(dgb203@163.com) ","BioResources","BioResour.","","North Carolina State University","13","1","1388-1400","February 1, 2018","","","2018","English","","19302126","","10.15376/biores.13.1.1388-1400","","","","","","","Journal article (JA)","By using renewable inexpensive plant-derived materials such as lignin and furfuryl alcohol, a new bio-based, easily-prepared, and industrially suitable thermosetting grinding wheel named lignin-furanic grinding wheel (LFG) was prepared and characterized. Cross-linking between lignin and furfuryl alcohol under acidic conditions was established by carbon-13 nuclear magnetic resonance (13C-NMR) and electrospray ionization mass spectrometry (ESI-MS). In addition, as the results of thermomechanical analysis (TMA) and thermogravimetric analysis (TGA) suggested, the lignin-furanic resin exhibited high resistance to heat, and the glass transition temperature (Tg) as high as 170 °C. The new lignin-based grinding wheel presented no pores or cracks in the surface and it had a high hardness and compression resistance compared to the commercial phenolic grinding wheel (PG). Moreover, it exhibited high abrasiveness, and the cutting time for a metal tube was shorter than that of PG.","27","Thermogravimetric analysis","Alumina - Aluminum oxide - Characterization - Electrodeposition - Electrospray ionization - Glass transition - Grinding (machining) - Grinding wheels - Heat resistance - Lignin - Mass spectrometry - Metal cutting - Nuclear magnetic resonance - Resins - Wheels","Abrasiveness - Acidic conditions - Compression resistance - Electrospray ionization mass spectrometry - Furfuryl alcohol - Renewable materials - Synthesis and characterizations - Thermomechanical analysis","539.3.1 Electroplating - 601.2 Machine Components - 604.1 Metal Cutting - 604.2 Machining Operations - 801 Chemistry - 802.3 Chemical Operations - 804.2 Inorganic Compounds - 811.3 Cellulose, Lignin and Derivatives - 815.1.1 Organic Polymers - 951 Materials Science","Number: 2014IA017, Acronym: -, Sponsor: -; Number: 31660176, Acronym: NSFC, Sponsor: National Natural Science Foundation of China; ","The authors would like to thank the Yunnan Province International Cooperation Project of China (2014IA017) and the National Natural Science Foundation of China (No. 31660176) for support.","Open Access","Compendex","Compilation and indexing terms, Copyright 2019 Elsevier Inc.","Engineering Village"
"Supply chain partner selection under cloud computing environment: An improved approach based on BWM and VIKOR","20190906565496","Liu, Sen (1); Hu, Yanan (1); Zhang, Yingying (1) ","(1) School of Logistics, Yunnan University of Finance and Economics, Kunming; 650221, China ","Liu, Sen(liusencool@163.com) ","Mathematical Problems in Engineering","Math. Probl. Eng.","","Hindawi Limited, 410 Park Avenue, 15th Floor, 287 pmb, New York, NY 10022, United States","2018","","","2018","","","2018","English","1024123X","15635147","","10.1155/2018/7012827","7012827","","","","","","Journal article (JA)","The wide application of cloud computing technology makes supply chain partner share information effectively and increase corporate profits. However, in cloud computing environment, the evaluation process of supply chain partner selection is dynamic and fuzzy, and its evaluation index is uncertain. To solve these problems, this paper proposes a new method combed with rough number, best-worst multicriteria decision-making method (BWM), and compromise ranking method (VIKOR). Firstly, Rough number is used to integrate data from different evaluation matrix. Secondly, rough number improves a new method, BWM, to get RBWM criteria weight methods. Thirdly, the rough numbers are introduced into VIKOR and combined with RBWM to evaluate and sort the supply chain partners. Finally, an example is given to demonstrate the rationality and feasibility of the method. Copyright © 2018 Sen Liu et al.","85","Supply chains","Behavioral research - Cloud computing - Decision making","Cloud computing environments - Cloud computing technologies - Corporate profits - Criteria weights - Evaluation matrices - Multi-criteria decision making methods - Ranking methods - Supply chain partners","722.4 Digital Computers and Systems - 912 Industrial Engineering and Management - 912.2 Management - 913 Production Planning and Control; Manufacturing - 971 Social Sciences","Number: 2015FD028, Acronym: -, Sponsor: Applied Basic Research Foundation of Yunnan Province; Number: 61762088, Acronym: NSFC, Sponsor: National Natural Science Foundation of China; Number: 71502159, Acronym: NSFC, Sponsor: National Natural Science Foundation of China; Number: 71862035, Acronym: NSFC, Sponsor: National Natural Science Foundation of China; ","The work described in this paper is supported by the National Natural Science Foundation Council of China under Projects nos. 71862035, 71502159, and 61762088 and the Applied Basic Research Science Foundation of Yunnan Provincial Department of Science and Technology in China under Project no. 2015FD028.","Open Access","Compendex","Compilation and indexing terms, Copyright 2019 Elsevier Inc.","Engineering Village"
"The presence of a single-nucleotide mismatch in linker increases the fluorescence of guanine-enhanced DNA-templated Ag nanoclusters and their application for highly sensitive detection of cyanide","20185106270381","Peng, Jun (1, 2); Ling, Jian (1); Wen, Qiu-Lin (1); Li, Yu (1); Cao, Qiu-E. (1); Huang, Zhang-Jie (1); Ding, Zhong-Tao (1) ","(1) Functional Molecules Analysis and Biotransformation Key Laboratory of Universities in Yunnan Province, School of Chemical Science and Technology, Yunnan University, Kunming; 650091, China (2) Hunan Province Geological Testing Institute, Changsha; 410007, China ","Ling, Jian(lingjian@ynu.edu.cn) ","RSC Advances","RSC Adv.","","Royal Society of Chemistry","8","72","41464-41471","2018","","","2018","English","","20462069","","10.1039/C8RA07986B","","","","","","RSCACL","Journal article (JA)","Fluorescence of DNA-templated silver nanoclusters can be enhanced by more than 100-fold by placing the nanoclusters in proximity to guanine-rich DNA sequences after hybridization. We found that the fluorescence of the guanine-enhanced silver nanoclusters is not increased with the guanine-rich DNA sequence closer to the silver nanoclusters. By studying the different numbers of mismatches in the linker sequences, we found that the presence of a single-nucleotide mismatch in the linker increases fluorescence more than the complementary nucleotide. Further study indicated the mismatch position of the linker sequence also affects the fluorescence of the hybridized DNA-Ag NCs. The evidence reported here indicated that the mismatch of the linker sequence affects the fluorescence enhancement of guanine-enhanced silver nanoclusters. We also found that DNA-Ag NCs is an excellent fluorescence sensor for cyanide, as cyanide effectively quenches the fluorescence of NCs at a very low concentration with high selectivity. Cyanide in the range from 0.10 μM to 0.35 μM could be linearly detected, with a detection limit of 25.6 nM. © The Royal Society of Chemistry.","65","DNA sequences","Cyanides - DNA - Fluorescence - Nanoclusters - Nucleotides - Positive ions - Silver - Silver compounds","Complementary nucleotides - Fluorescence enhancement - Fluorescence sensors - High selectivity - Highly sensitive detections - Low concentrations - Silver nanoclusters - Single nucleotides","461.2 Biological Materials and Tissue Engineering - 461.9 Biology - 547.1 Precious Metals - 741.1 Light/Optics - 761 Nanotechnology - 804.2 Inorganic Compounds - 933 Solid State Physics","Number: 51421061, Acronym: NSFC, Sponsor: National Natural Science Foundation of China; Number: 51503134, Acronym: NSFC, Sponsor: National Natural Science Foundation of China; Number: 51702282, Acronym: NSFC, Sponsor: National Natural Science Foundation of China; ","We gratefully acknowledge the National Natural Science Foundation of China (NSFC 51503134, 51421061, 51702282), the State Key Laboratory of Polymer Materials Engineering (Grant No. SKLPME 2017-3-02) for the financial support.","Open Access","Compendex","Compilation and indexing terms, Copyright 2019 Elsevier Inc.","Engineering Village"
"Design of a precision agriculture leakage seeding system based on wireless sensors","20182205257576","Zheng, Jiaxin (1); Yang, Wencai (1) ","(1) Faculty of Mechanical and Electrical Engineering, Yunnan Agricultural University, Kunming, Yunnan Province, China ","Yang, Wencai(yangwencai2005@126.com) ","International Journal of Online Engineering","Int. J. Online Eng.","","Kassel University Press GmbH, Diagonale 10, Kassel, 34127, Germany","14","5","184-197","2018","","","2018","English","18681646","18612121","","10.3991/ijoe.v14i05.8653","","","","","","","Journal article (JA)","In light of the agricultural development in China, more attention has been paid to the studies about precision agriculture. The environmental factors such as temperature-humidity and soil humidity are the key influencing factors on crop growth, therefore, how to rapidly and accurately acquire the environmental information of crop growth and learn about their real-time growing environment is of vital importance. The wireless sensor networks (WSN) can make real-time environmental information acquisition as well as communication and processing of network environmental data. Based on this, the RSSI range-based positioning method was optimized in this paper in order to greatly improve its precision. To be specific, in this study, the particle swarm optimization (PSO) algorithm was firstly applied in the hybrid mutation strategy to make more accurate node positioning and significantly improve the evolutionary performance by enlarging the hunting zone; besides, through the use of WSN, the influencing parameters on crop growth such as soil humidity, and temperaturehumidity etc. would be monitored; finally, to realize the precise location and derive the unseeded nodes, GPS was applied for accurate positioning, and the intelligence algorithm was adopted to determine the coordinate position of unknown nodes. At last, the actual field test indicates that the designed monitoring system in this paper satisfies the requirements for precise measurement, playing a positive role in promoting the development of precision agriculture. © 2018 Kassel University Press GmbH.","20","Precision agriculture","Crops - Particle swarm optimization (PSO) - Seed - Sensor nodes - Wireless sensor networks - Zigbee","Agricultural development - Environmental information - Influencing parameters - Intelligence algorithms - Key influencing factors - Particle swarm optimization algorithm - Unseeded system - ZigBee technology","722 Computer Systems and Equipment - 722.3 Data Communication, Equipment and Techniques - 723 Computer Software, Data Handling and Applications - 821.4 Agricultural Products",,,"Open Access","Compendex","Compilation and indexing terms, Copyright 2019 Elsevier Inc.","Engineering Village"
"Efficient cascade multiple heterojunction organic solar cells with inverted structure","20181304964131","Guo, Tingting (1); Li, Mingtao (2); Qiao, Zhenfang (1, 3); Yu, Leiming (1); Zhao, Jianhong (1); Feng, Nianjun (1, 3); Shi, Peiguang (1, 3); Wang, Xiaoyan (1); Pu, Xiaoyun (3); Wang, Hai (1) ","(1) Key Laboratory of Yunnan Provincial Higher Education Institutions for Organic Optoelectronic Materials and Devices, Department of Physics, Kunming University, Kunming; 650214, China (2) Key Laboratory of Materials Physics, Anhui Key Laboratory of Nanomaterials and Nanotechnology, Institute of Solid State Physics, Chinese Academy of Sciences, Hefei; 230031, China (3) College of Physical Science and Technology, Yunnan University, Kunming; 650091, China ","Li, Mingtao(mtli@issp.ac.cn) ","Superlattices and Microstructures","Superlattices Microstruct","","Academic Press","117","","215-219","May 2018","","","2018","English","07496036","10963677","","10.1016/j.spmi.2018.03.015","","","","","","SUMIEK","Journal article (JA)","In this work, we demonstrate an efficient cascade multiple heterojunction organic solar cell with inverted structure. By using two donor materials, poly(3-hexylthiosphene) (P3HT) and titanyl phthalocyanine (TiOPc), as well as two acceptor materials, [6,6]-phenyl C61butyric acid methyl ester (PCBM) and C60, the cascade multiple heterojunctions of P3HT:PCBM/TiOPc:C60/C60have been constructed. Applying the optimized inverted configuration of FTO/Zinc Tin Oxide (ZTO)/C60(30 nm)/TiOPc:C60(1:1.5, 25 nm)/P3HT:PCBM (1:0.8, 100 nm)/MoO3(4 nm)/Ag, the considerably enhanced open circuit voltage (VOC) and short circuit current (JSC) can be harvested together, and the power conversion efficiency (PCE) is three times higher than that of the control cell with conventional structure. The significant improvements of the inverted cell are mostly due to the broadened spectral absorption and high efficient multi-interface exciton dissociation in the cascade multiple heterojunctions, indicating that the optimized cascade heterojunctions match the inverted structure well. © 2018 Elsevier Ltd","26","Heterojunctions","Butyric acid - Open circuit voltage - Organic solar cells - Silver compounds - Solar cells - Tin oxides","Conventional structures - Exciton dissociation - Heterojunction structures - Inverted structure - Power conversion efficiencies - Spectral absorptions - Titanyl phthalocyanines - [6 ,6]-phenyl-C61-butyric acid methyl esters","702.3 Solar Cells - 714.2 Semiconductor Devices and Integrated Circuits - 804.1 Organic Compounds - 804.2 Inorganic Compounds","Number: 2017FH001-007, Acronym: -, Sponsor: -; Number: YNG2017006, Acronym: -, Sponsor: -; Number: 51572262, Acronym: NSFC, Sponsor: National Natural Science Foundation of China; Number: 11564023, Acronym: NSFC, Sponsor: National Natural Science Foundation of China; ","This work was supported by the Natural Science Foundation of China (No. 11564023 and 51572262 ), Yunnan local university Joint special funds for basic research 2017FH001-007 , Yunnan Province Foreign Expert project ( YNG2017006 ) and Candidates of the Young and Middle Aged Academic Leaders of Yunnan Province and program for IRTSTYN.",,"Compendex","Compilation and indexing terms, Copyright 2019 Elsevier Inc.","Engineering Village"
"Effects of crystal structure transformation on cooperative up-conversion luminescence in the Tb3+-Yb3+co-doped oxyfluoride glass-ceramics","20174304311576","Li, Zhencai (1); Zhou, Dacheng (1, 2); Yang, Yong (1, 2); Ren, Peng (1); Zhu, Rui (1); Han, Tao (3); Qiu, Jianbei (1, 2) ","(1) Faculty of Material Science and Engineering, Kunming University of Science and Technology, Kunming; 650093, China (2) Key Lab. of Advanced Materials of Yunnan Province, Kunming; 650093, China (3) Chongqing Engineering Research Center for Optoelectronic Materials and Devices, Research Institute for New Materials Technology, Chongqing University of Arts and Sciences, Chongqing; 402160, China ","Qiu, Jianbei(qiu@kmust.edu.cn) ","Journal of Alloys and Compounds","J Alloys Compd","","Elsevier Ltd","731","","1044-1052","January 15, 2018","","","2018","English","09258388","","","10.1016/j.jallcom.2017.10.055","","","","","","JALCEU","Journal article (JA)","In this study, Tb3+-Yb3+co-doped transparent oxyfluoride glass-ceramics were prepared respectively from melt-quenched glass samples with the molar compositions of 45SiO2-15Al2O3-12Na2CO3-21BaF2-(7-x)LaF3-xYF3(x = 0, 1, 3, 6 and 7). It was found that the crystal structure of the annealed glass-ceramics strongly depended on the ratio of YF3/LaF3. X-ray diffraction (XRD) and transmission electron microscopy (TEM) results revealed that the crystal structure transformed from cubic Ba2LaF7phase to cubic intermediate phase and finally to cubic BaYF5phase, the BaYF5nanocrystal was determined as cubic structure instead of the reported tetragonal structure for the first time via a Rietveld refinement method with TOPAS. In the process of crystal structure transformation, the local symmetry around Tb3+ions was infected by different types of irregularly arranged interstitial F- ions, which further affected the effective phonon energy around Tb3+ions. The high effective phonon energy around Tb3+ions in the intermediate phase could strongly enhance the up-conversion (UC) luminescence intensity, and thus improved the UC luminescence efficiency. © 2017 Elsevier B.V.","48","Crystal symmetry","Alumina - Aluminum oxide - Barium compounds - Glass ceramics - High resolution transmission electron microscopy - Ions - Lanthanum compounds - Luminescence - Phonons - Rietveld refinement - Sodium Carbonate - Sodium compounds - Transmission electron microscopy - Uranium compounds - X ray diffraction","Crystal structure transformation - Intermediate phase - Local symmetry - Phonon energies - Up conversion","741.1 Light/Optics - 741.3 Optical Devices and Systems - 801 Chemistry - 804.2 Inorganic Compounds - 933.1.1 Crystal Lattice","Number: 2016FA021, Acronym: -, Sponsor: -; Number: 11774138, Acronym: NSFC, Sponsor: National Natural Science Foundation of China; Number: 61565009, Acronym: NSFC, Sponsor: National Natural Science Foundation of China; Number: 11664022, Acronym: NSFC, Sponsor: National Natural Science Foundation of China; ","This work was supported by the National Natural Science Foundation of China (No. 61565009 , 11664022 , 11774138 ), Society Development Foundation of Yunnan Province ( 2016FA021 ).",,"Compendex","Compilation and indexing terms, Copyright 2019 Elsevier Inc.","Engineering Village"
